"author/canDm","author/canMediaTag","author/coverPicture","author/createdAt","author/description","author/entities/description/urls/0/display_url","author/entities/description/urls/0/expanded_url","author/entities/description/urls/0/indices/0","author/entities/description/urls/0/indices/1","author/entities/description/urls/0/url","author/entities/description/urls/1/display_url","author/entities/description/urls/1/expanded_url","author/entities/description/urls/1/indices/0","author/entities/description/urls/1/indices/1","author/entities/description/urls/1/url","author/entities/url/urls/0/display_url","author/entities/url/urls/0/expanded_url","author/entities/url/urls/0/indices/0","author/entities/url/urls/0/indices/1","author/entities/url/urls/0/url","author/fastFollowersCount","author/favouritesCount","author/followers","author/following","author/hasCustomTimelines","author/id","author/isBlueVerified","author/isTranslator","author/isVerified","author/location","author/mediaCount","author/name","author/pinnedTweetIds/0","author/possiblySensitive","author/profilePicture","author/status","author/statusesCount","author/twitterUrl","author/type","author/url","author/userName","text","createdAt"
"false","true","https://pbs.twimg.com/profile_banners/251237359/1485828857","Sat Feb 12 18:39:54 +0000 2011","Gardener.  Humanist.  Still here for a few folks I value. Also here to let a power crazed Con know that MY Canada is not broken.",,,,,,,,,,,,,,,,"0","96286","2785","4231","true","251237359","false","false","false","Winnipeg, Manitoba","39","Brenda M-P","1635849957692325888","false","https://pbs.twimg.com/profile_images/826490093951184896/MPjRXKjz_normal.jpg","","118496","https://twitter.com/wrldgrlbmp","user","https://x.com/wrldgrlbmp","wrldgrlbmp","Do we really need any more evidence to demand full investigation of Trump's ties to Russia. This will only happen if YOU speak up NOW. https://t.co/h9friIM4jH","Sat Jan 07 23:35:56 +0000 2017"
"false","true","https://pbs.twimg.com/profile_banners/7614982/1460260386","Fri Jul 20 18:12:05 +0000 2007","Artist and Temporary Visionary. Founder of The World Wide Art Federation and owner of Occasional Superstar LLC.",,,,,,,,,,,"occasionalsuperstar.art","http://occasionalsuperstar.art","0","23","https://t.co/Jdjz2zcNvQ","0","3468","1417","828","true","7614982","false","false","false","Atlanta, GA","379","Occasional Superstar",,"false","https://pbs.twimg.com/profile_images/1382759499858067460/U2s4y93f_normal.jpg","","9907","https://twitter.com/fabianism","user","https://x.com/fabianism","fabianism","Imagine if Barack was president-elect and said what Trump said about an RNC hack by Russia. You think there would be an investigation?","Sat Jan 07 22:20:55 +0000 2017"
"true","false","https://pbs.twimg.com/profile_banners/799474613633699840/1647365072","Fri Nov 18 04:49:36 +0000 2016","Retired RN, gardener, author, pet lover. Freedom fighter for democracy above all else. Proud member of #Resistance in US & CDN. Despise Putin. ""Slava Ukraine"".",,,,,,,,,,,,,,,,"0","183067","1363","769","true","799474613633699840","false","false","false","North America","4925","Linda","884276711088504832","false","https://pbs.twimg.com/profile_images/1116699479309053952/SGIXbZtq_normal.jpg","","117053","https://twitter.com/LindaNykolyn","user","https://x.com/LindaNykolyn","LindaNykolyn","@reneeurso @realDonaldTrump @CIA Let's hope CIA is wise enough to turn investigation on Trump and his involvement with Russia and hacking.","Sat Jan 07 22:06:57 +0000 2017"
"true","false",,"Sat Mar 12 03:35:36 +0000 2016","Kindness is free💕Never trust someone your dog doesn't like.  All human beings are equal in deserving dignity and rights. Protect our precious wildlife. #Resist",,,,,,,,,,,,,,,,"0","29944","1780","1996","true","708496637388201988","false","false","false","","26","Rose",,"false","https://pbs.twimg.com/profile_images/882305996399312896/ARJQ5kT6_normal.jpg","","17268","https://twitter.com/RosieDay2U","user","https://x.com/RosieDay2U","RosieDay2U","There needs to be a complete investigation into who ALL helped Russia! trump is acting like a traitor to his own country!Investigate trump!! https://t.co/iLhDe4p0jp","Sat Jan 07 21:16:44 +0000 2017"
"true","false","https://pbs.twimg.com/profile_banners/97496852/1364150537","Thu Dec 17 18:20:44 +0000 2009","Random dude.",,,,,,,,,,,,,,,,"0","105794","715","3140","false","97496852","false","false","false","San Francisco, CA","226","Jon",,"false","https://pbs.twimg.com/profile_images/1019285551114006529/nxl4_D_M_normal.jpg","","7153","https://twitter.com/mathturbator","user","https://x.com/mathturbator","mathturbator","@minerjp Either you're with America and should be calling for a full investigation, esp given Trump's camp deep ties, or you're with Russia.","Sat Jan 07 21:10:30 +0000 2017"
"true","false",,"Sat Mar 12 03:35:36 +0000 2016","Kindness is free💕Never trust someone your dog doesn't like.  All human beings are equal in deserving dignity and rights. Protect our precious wildlife. #Resist",,,,,,,,,,,,,,,,"0","29944","1780","1996","true","708496637388201988","false","false","false","","26","Rose",,"false","https://pbs.twimg.com/profile_images/882305996399312896/ARJQ5kT6_normal.jpg","","17268","https://twitter.com/RosieDay2U","user","https://x.com/RosieDay2U","RosieDay2U","@RepAdamSchiff the way trump is acting their needs to be a full and complete investigation done on trump and his campaign with Russia!","Sat Jan 07 20:55:05 +0000 2017"
"false","true","https://pbs.twimg.com/profile_banners/2365278016/1526314389","Tue Feb 25 17:11:48 +0000 2014","Geopolitical Strategist",,,,,,,,,,,"cia.gov","http://www.cia.gov","0","23","https://t.co/WC9eDWP0pe","0","1281","21","109","false","2365278016","false","false","false","Berlin, Germany","48","D. William Vail III",,"false","https://pbs.twimg.com/profile_images/1142909943793799168/WAtlDonV_normal.jpg","","2102","https://twitter.com/vail_william","user","https://x.com/vail_william","vail_william","Trump tells US newspaper Russia hacking investigation is a 'political witch hunt' https://t.co/Yt0qbYBnUM via @dwnews","Sat Jan 07 20:10:53 +0000 2017"
"false","true","https://pbs.twimg.com/profile_banners/436314047/1478711649","Wed Dec 14 01:42:13 +0000 2011","True, Blue DEM!
Pro Obamacare. Anti GOP obstructionism.  I Block RW Trolls!   #FBR  #TheResistance NO LISTS!!",,,,,,,,,,,,,,,,"0","19631","24089","23282","true","436314047","false","false","false","Florida","4576","WayneEdH","1593614005121257472","false","https://pbs.twimg.com/profile_images/1287129357908156416/O3rElv6o_normal.jpg","","98586","https://twitter.com/WayneEdH","user","https://x.com/WayneEdH","WayneEdH","Why is Paul Ryan &amp; Congress protecting &amp; covering up Trump/Russia by not having an investigation?
But... Benghazi.
#TheResistance","Sat Jan 07 19:53:31 +0000 2017"
"false","true","https://pbs.twimg.com/profile_banners/157513753/1439734630","Sun Jun 20 01:58:49 +0000 2010","Husband, Father, Christian, Consultant, Volunteer, Writer, Small govt., Individual liberty for all, Constitution, Defense of the innocent",,,,,,,,,,,,,,,,"0","9070","813","1367","true","157513753","false","false","false","","232","Brad",,"false","https://pbs.twimg.com/profile_images/1278425893090844672/ZduOXNeM_normal.jpg","","20114","https://twitter.com/b4freedomforusa","user","https://x.com/b4freedomforusa","b4freedomforusa","We need an investigation by US Intelligence into DNC practices of stealing votes via illegals. … #MSM #Trump #Russia https://t.co/KflQAVI6j2","Sat Jan 07 19:12:45 +0000 2017"
"false","true",,"Sat Feb 13 19:19:59 +0000 2016","All tyranny needs to gain a foothold is for people of good concience to remain silent...Thomas Jefferson",,,,,,,,,,,,,,,,"0","15156","253","47","true","4905816004","false","false","false","","115","TRUMPisDANGERus",,"false","https://pbs.twimg.com/profile_images/750420530327609344/WbMw9nxk_normal.jpg","","24922","https://twitter.com/TRUMPisDANGERus","user","https://x.com/TRUMPisDANGERus","TRUMPisDANGERus","@realDonaldTrump So Trump is ordering investigation of how news got the report before him, but not how Russia, a hostile country, hacked US?","Sat Jan 07 17:45:16 +0000 2017"
"false","false","https://pbs.twimg.com/profile_banners/779064869240840192/1605751408","Thu Sep 22 21:08:34 +0000 2016","Proud Democrat, Fan of truth #EndCitizensUnited, #GoPackGo, @pmpmpmpm02@mas.to",,,,,,,,,,,,,,,,"0","36505","238","1068","false","779064869240840192","false","false","false","United States","69","patm",,"false","https://pbs.twimg.com/profile_images/1590421111799517184/7wfHR5FH_normal.jpg","","5066","https://twitter.com/pmpmpmpm02","user","https://x.com/pmpmpmpm02","pmpmpmpm02","@NancyPelosi I agree with independent investigation! U see the Russian intervention, now look at Trump ties to Russia at #trumpleaks","Sat Jan 07 16:05:10 +0000 2017"
"false","true",,"Sat Jan 17 01:01:10 +0000 2015","Dedicated to constitutionally limited government, fiscal responsibility and free-market solutions.",,,,,,,,,,,"cleartea.org","http://cleartea.org","0","22","http://t.co/g6gDOLV0EE","0","121","21","51","false","2981977727","false","false","false","","195","Clfd County Patriots",,"false","https://pbs.twimg.com/profile_images/556267877280804864/3xLaBBWU_normal.jpeg","","1266","https://twitter.com/clear_tea","user","https://x.com/clear_tea","clear_tea","@SebGorka @BillGertz Russia hacking story is a huge psy-op designed to delegitimize Trump &amp; stop investigation of Hillary/Obama crimes.","Sat Jan 07 16:03:29 +0000 2017"
"false","true","https://pbs.twimg.com/profile_banners/3536129835/1583192480","Thu Sep 03 17:31:19 +0000 2015","Matthew N. Kaufman - attorney  - former independent pro wrestling mgr - Army West Point - conservative NYer",,,,,,,,,,,,,,,,"0","31762","838","1217","true","3536129835","false","false","false","Westchester County, New York","801","Matthew N. Kaufman","1125583833078878209","false","https://pbs.twimg.com/profile_images/1155275309761126400/-3LpI-9a_normal.jpg","","21289","https://twitter.com/Matkaufman1220","user","https://x.com/Matkaufman1220","Matkaufman1220","@SebGorka @BillGertz Russia hacking story is a huge psy-op designed to delegitimize Trump &amp;amp; stop investigation of Hillary/Obama crimes.","Sat Jan 07 15:31:08 +0000 2017"
"true","true","https://pbs.twimg.com/profile_banners/842479034/1606567849","Sun Sep 23 22:04:33 +0000 2012","",,,,,,,,,,,,,,,,"0","13383","348","1097","true","842479034","false","false","false","Fort Greene, Brooklyn","72","hugo redwood",,"false","https://pbs.twimg.com/profile_images/1319937233697280000/CUpC_apD_normal.jpg","","11395","https://twitter.com/DOHplusone","user","https://x.com/DOHplusone","DOHplusone","#Resistance. Why Is Donald Trump Sheltering Russia? Full investigation! @RealDonaldTrump @KellyannePolls @DNC https://t.co/PhRmInxSs7","Sat Jan 07 15:20:10 +0000 2017"
"true","true","https://pbs.twimg.com/profile_banners/303450744/1449155364","Sun May 22 21:59:55 +0000 2011","Christ The King, is Truth, itself. False NWO/OWG super-state-religion being brought about through Satan. Beware rise of the Antichrist.",,,,,,,,,,,,,,,,"0","114319","2172","1784","false","303450744","false","false","false","","4224","TIMJPH",,"false","https://pbs.twimg.com/profile_images/672431783204401152/2VjzZV2F_normal.png","","203817","https://twitter.com/truthismaster","user","https://x.com/truthismaster","truthismaster","@SebGorka @BillGertz Russia hacking story is a huge psy-op designed to delegitimize Trump &amp; stop investigation of Hillary/Obama crimes.","Sat Jan 07 15:13:18 +0000 2017"
"false","true",,"Thu Mar 24 22:48:56 +0000 2016","",,,,,,,,,,,,,,,,"0","39","9","55","false","713135538585210884","false","false","false","","33","Unknown Unknown",,"false","https://abs.twimg.com/sticky/default_profile_images/default_profile_normal.png","","1066","https://twitter.com/trump_trump16","user","https://x.com/trump_trump16","trump_trump16","There should be a serious investigation into what ties @realDonaldTrump has to Russia. Why is he defending them more than Americans?","Sat Jan 07 15:12:40 +0000 2017"
"false","true",,"Tue Oct 04 00:17:00 +0000 2011","",,,,,,,,,,,,,,,,"0","259","2","30","false","384602362","false","false","false","Connecticut, USA","0","Stuart Barrowcliff",,"false","https://abs.twimg.com/sticky/default_profile_images/default_profile_normal.png","","275","https://twitter.com/sbcliff","user","https://x.com/sbcliff","sbcliff","@nytimes any investigation into Trump staff collaboration with Russia's influence efforts during the campaign?","Sat Jan 07 15:11:55 +0000 2017"
"false","false","https://pbs.twimg.com/profile_banners/394831155/1500996338","Thu Oct 20 17:59:58 +0000 2011","Daughter of  POW WW2, Democrat and Cat Lady :)",,,,,,,,,,,,,,,,"0","39690","460","793","true","394831155","false","false","false","","334","Angie",,"false","https://pbs.twimg.com/profile_images/839959440933654529/dE4O2tAy_normal.jpg","","44608","https://twitter.com/Angie75060","user","https://x.com/Angie75060","Angie75060","@SenWarren #TrumpLeaks.. Please start an independent investigation into Trump's ties to Russia. Why did the Russians want observe voting? https://t.co/UKfOMI24Nv","Sat Jan 07 14:50:06 +0000 2017"
"false","true",,"Wed Aug 11 11:30:55 +0000 2010","",,,,,,,,,,,,,,,,"0","30720","429","304","true","177153797","false","false","false","","2109","N.Else",,"false","https://pbs.twimg.com/profile_images/517647922755035136/7faTKn3o_normal.jpeg","","38643","https://twitter.com/snickstrs","user","https://x.com/snickstrs","snickstrs","DRAINING THE SWAMP Mitch McConnell’s wife, Elaine Chao, picked to Trump cabinet soon after Mitch dismissed Russia hacker investigation. #cnn","Sat Jan 07 14:50:00 +0000 2017"
"false","false","https://pbs.twimg.com/profile_banners/801540666400657409/1488839084","Wed Nov 23 21:39:21 +0000 2016","Retired lawyer, interested in  community, country and spiritual growth.",,,,,,,,,,,,,,,,"0","59503","308","761","false","801540666400657409","false","false","false","","13","Marilyn Dye",,"false","https://pbs.twimg.com/profile_images/882750330626297857/P2rX3Z19_normal.jpg","","5750","https://twitter.com/MarilynDye5","user","https://x.com/MarilynDye5","MarilynDye5","@JoyAnnReid I would like to see an investigation if connection btwn Russia and Trump pre election. This tweet reinforces the need 4 it.","Sat Jan 07 14:43:08 +0000 2017"
"false","true","https://pbs.twimg.com/profile_banners/186930401/1463442315","Sat Sep 04 20:01:38 +0000 2010","Tech News",,,,,,,,,,,"todayamerican.com","http://todayamerican.com","0","23","https://t.co/3WI4UV0HAN","0","127","291","277","false","186930401","false","false","false","Petaluma, CA","92308","todayamerican",,"false","https://pbs.twimg.com/profile_images/730599418127384576/yQO_yfeP_normal.jpg","","277999","https://twitter.com/todayamerican","user","https://x.com/todayamerican","todayamerican","[10] Russia’s RT: The Network Implicated in U.S. Election Meddling #realtime https://t.co/sgxyNKWcKA","Sat Jan 07 23:57:40 +0000 2017"
"false","true","https://pbs.twimg.com/profile_banners/801259381811650560/1483855285","Wed Nov 23 03:01:38 +0000 2016","",,,,,,,,,,,,,,,,"0","4416","53","122","false","801259381811650560","false","false","false","","112","Sam Saar🐸",,"false","https://pbs.twimg.com/profile_images/840969685562605568/evXeeV0D_normal.jpg","","1952","https://twitter.com/samsaar88","user","https://x.com/samsaar88","samsaar88","@nytimesworld NYT, the Mexican owned propaganda agency, has been implicated in meddling in the US election.","Sat Jan 07 23:55:29 +0000 2017"
"false","true","https://pbs.twimg.com/profile_banners/218833544/1446133016","Tue Nov 23 11:34:07 +0000 2010","Election News Channel's in-depth coverage focuses on national and state politics, Congress, political forums, opinions and polls.",,,,,,,,,,,"electionnewschannel.com","https://electionnewschannel.com","0","23","https://t.co/vsK3sjiFHS","0","0","169","731","true","218833544","false","false","false","","28112","Election News Channel",,"false","https://pbs.twimg.com/profile_images/1184820766833070081/CG1O7yMq_normal.png","","62988","https://twitter.com/Election_NC","user","https://x.com/Election_NC","Election_NC","Russia’s RT: The Network Implicated in U.S. Election Meddling https://t.co/dOCvWEjWaZ","Sat Jan 07 23:48:42 +0000 2017"
"false","true",,"Sun Oct 31 22:30:50 +0000 2010","",,,,,,,,,,,,,,,,"0","14","618","1668","false","210629336","false","false","false","","7","digshopping","1155181715037523968","false","https://pbs.twimg.com/profile_images/1166234605/miperfil_normal.jpg","","122040","https://twitter.com/javiergoody","user","https://x.com/javiergoody","javiergoody","Russia’s RT: The Network Implicated in U.S. Election Meddling https://t.co/6zMfEHl0tp","Sat Jan 07 23:45:44 +0000 2017"
"false","false","https://pbs.twimg.com/profile_banners/798245738304180224/1483022561","Mon Nov 14 19:26:29 +0000 2016","",,,,,,,,,,,,,,,,"0","6512","232","623","false","798245738304180224","false","false","false","Milwaukee, WI","342","K M Brucks",,"false","https://pbs.twimg.com/profile_images/814558998024323073/lcaLBHrC_normal.jpg","","41729","https://twitter.com/k_brucks","user","https://x.com/k_brucks","k_brucks","Russia’s RT: The Network Implicated in U.S. Election Meddling, via @nytimes https://t.co/OvcpbdvwGF","Sat Jan 07 23:43:37 +0000 2017"
"false","true",,"Mon Feb 29 07:18:41 +0000 2016","",,,,,,,,,,,,,,,,"0","17","6","106","false","704204123512516608","false","false","false","","27","the rebel",,"false","https://pbs.twimg.com/profile_images/704205465333268480/hEO4TtqZ_normal.jpg","","214","https://twitter.com/rebel2bheard","user","https://x.com/rebel2bheard","rebel2bheard","Russia is wrong in meddling with our election... what about the MEDIA who COLLUDED  with #HRC ? no enquiry ? @seanhannity @realDonaldTrump","Sat Jan 07 23:42:28 +0000 2017"
"false","true","https://pbs.twimg.com/profile_banners/754570367793033216/1713487663","Sun Jul 17 06:56:09 +0000 2016","Bi introvert dork of many shades and an unapologetic nerd. This social misfit isn't afraid to speak my mind on anything.
He/Him",,,,,,,,,,,,,,,,"0","9409","104","671","false","754570367793033216","false","false","false","Jacksonville, Florida","6375","EdofJville",,"false","https://pbs.twimg.com/profile_images/1781122449804783616/wAWXMplB_normal.jpg","","10865","https://twitter.com/EdofJville","user","https://x.com/EdofJville","EdofJville","Trump says believers of Russian meddling in election are stupid. Those of us with functioning brains know he &amp; his supporters are stupid. https://t.co/fiUvgqrZda","Sat Jan 07 23:19:23 +0000 2017"
"false","false",,"Sun Jul 26 17:16:31 +0000 2015","",,,,,,,,,,,,,,,,"0","10877","42","68","false","3295700732","false","false","false","","0","ArkansasNanny",,"false","https://pbs.twimg.com/profile_images/837577228489748480/1iQLwck0_normal.jpg","","433","https://twitter.com/2_norean","user","https://x.com/2_norean","2_norean","@realDonaldTrump @realPOTUS45th 
How are Putin's actions different from Obama's Israeli election meddling?  Just saying","Sat Jan 07 23:18:28 +0000 2017"
"false","true","https://pbs.twimg.com/profile_banners/3309548751/1503342196","Fri Jun 05 18:27:55 +0000 2015","Media,
News Company,
Advertising/Marketing,",,,,,,,,,,,"naijasociety.net","http://www.naijasociety.net/","0","23","https://t.co/E2Fb6N1WCG","0","1","473","1665","false","3309548751","false","false","false","Lagos, Nigeria","4866","NAIJA SOCIETY",,"false","https://pbs.twimg.com/profile_images/899709538462576644/53N9UqK9_normal.jpg","","16760","https://twitter.com/NAIJASOCIETY_TV","user","https://x.com/NAIJASOCIETY_TV","NAIJASOCIETY_TV","Russia’s RT: The Network Implicated in U.S. Election Meddling Created by Russia’s government to offer “the Russian… https://t.co/axZNhZL0ak","Sat Jan 07 23:12:41 +0000 2017"
"false","true",,"Wed Mar 09 20:53:12 +0000 2011","",,,,,,,,,,,,,,,,"0","159","137","28","false","263327909","false","false","false","","1","Latest News",,"false","https://pbs.twimg.com/profile_images/579944400425353216/VCFpKU9l_normal.jpg","","14189","https://twitter.com/todaylatestnews","user","https://x.com/todaylatestnews","todaylatestnews","TheNewYorkTimes: #Russia’s RT: The Network Implicated in U.S. Election Meddling https://t.co/lYpzA4mkMI","Sat Jan 07 23:12:04 +0000 2017"
"false","true",,"Mon Mar 02 22:07:34 +0000 2015","M.A. Psychology, Retired Teacher, Retired USAF MSgt",,,,,,,,,,,,,,,,"0","1002","17","33","false","3058606710","false","false","false","","498","Larry Rasmussen",,"false","https://pbs.twimg.com/profile_images/835590357526147073/aUn7qvFd_normal.jpg","","8434","https://twitter.com/paparas51","user","https://x.com/paparas51","paparas51","Trump downplays Russian meddling in election despite intel report Now he sees his strings held by #Putin https://t.co/budhlMxTwI","Sat Jan 07 23:11:37 +0000 2017"
"false","false","https://pbs.twimg.com/profile_banners/4387725945/1449632575","Sat Dec 05 23:07:44 +0000 2015","Love God and Family. Respect Constitution. @JBoneLiberty",,,,,,,,,,,,,,,,"0","51913","1011","2031","true","4387725945","false","false","false","Oklahoma","121","JBone Liberty",,"false","https://pbs.twimg.com/profile_images/674433421339299841/B8wOsEyo_normal.jpg","","5439","https://twitter.com/JboneLiberty","user","https://x.com/JboneLiberty","JboneLiberty","@WalshFreedom only if we're outraged about Obama meddling in Israel's election","Sat Jan 07 23:11:05 +0000 2017"
"false","true","https://pbs.twimg.com/profile_banners/2383502816/1394533414","Tue Mar 11 10:17:45 +0000 2014","Get current News on all events! Just Follow me!",,,,,,,,,,,"fly.gonevil.com/7","http://fly.gonevil.com/7","0","22","http://t.co/saAAWcv2n9","0","0","83","56","false","2383502816","false","false","false","New York, USA","46732","News Rotator",,"false","https://pbs.twimg.com/profile_images/443330951108521984/yjFgZ3DM_normal.jpeg","","72800","https://twitter.com/NewsRotator","user","https://x.com/NewsRotator","NewsRotator","#Russia’s RT: The Network Implicated in U.S. Election Meddling https://t.co/qq32KglmEF https://t.co/4qoLhPK4ly","Sat Jan 07 23:07:56 +0000 2017"
"false","true",,"Tue Dec 03 21:15:54 +0000 2013","Walden's News, around the Clock around World",,,,,,,,,,,"fly.gonevil.com/7","http://fly.gonevil.com/7","0","22","http://t.co/ZoYLXCm1uj","0","0","160","171","false","2228864000","false","false","false","USA","46725","Walden's News",,"false","https://pbs.twimg.com/profile_images/378800000825900212/b8e71631cad5d921cb366c73c38b6682_normal.png","","78256","https://twitter.com/WaldenSnick","user","https://x.com/WaldenSnick","WaldenSnick","Russia’s RT: The Network Implicated in U.S. Election Meddling https://t.co/pV0T09Sn7g #PresidentialElectionof2016 #Propaganda https://t.co/Jxrk3dJHOl","Sat Jan 07 23:07:46 +0000 2017"
"false","false","https://pbs.twimg.com/profile_banners/29906055/1580931700","Thu Apr 09 03:11:43 +0000 2009","Want to keep pre-existing conditions coverage? Trump is trying to destroy healthcare as we know it. Vote Blue!",,,,,,,,,,,,,,,,"0","24857","571","1428","true","29906055","false","false","false","United States","358","Michele Maloof",,"false","https://pbs.twimg.com/profile_images/645172119/hand_normal.bmp","","20883","https://twitter.com/michelemaloof","user","https://x.com/michelemaloof","michelemaloof","Russia’s RT: The Network Implicated in U.S. Election Meddling https://t.co/MXg4Tn2P2A","Sat Jan 07 23:05:47 +0000 2017"
"false","true","https://pbs.twimg.com/profile_banners/78932838/1648644317","Thu Oct 01 15:39:45 +0000 2009","IO/IW/cyber news and insight.",,,,,,,,,,,"facebook.com/IOLink","http://facebook.com/IOLink","0","23","https://t.co/W2o5kuMVpk","0","1","409","10","false","78932838","false","false","false","","20","IO Link","938736623923146753","false","https://pbs.twimg.com/profile_images/449163486/iolink_normal.png","","10344","https://twitter.com/IOLink","user","https://x.com/IOLink","IOLink","Russia’s RT: The Network Implicated in U.S. Election Meddling https://t.co/9Yw68JxG3z","Sat Jan 07 23:04:44 +0000 2017"
"false","false","https://pbs.twimg.com/profile_banners/394831155/1500996338","Thu Oct 20 17:59:58 +0000 2011","Daughter of  POW WW2, Democrat and Cat Lady :)",,,,,,,,,,,,,,,,"0","39690","460","793","true","394831155","false","false","false","","334","Angie",,"false","https://pbs.twimg.com/profile_images/839959440933654529/dE4O2tAy_normal.jpg","","44608","https://twitter.com/Angie75060","user","https://x.com/Angie75060","Angie75060","@TheDemocrats Some needs to start an independent investigation into Trump and Russia... and Flynn with Pizzagate fake story https://t.co/nlwirmu5gE","Sat Jan 07 14:25:06 +0000 2017"
"true","true","https://pbs.twimg.com/profile_banners/5413042/1684352396","Sun Apr 22 22:20:56 +0000 2007","Legacy account, check out (at)https://t.co/dFiUbBULjz on Bluesky.
Senior Gaming Editor, Ars Technica.
I wrote a Minesweeper book: https://t.co/MK8zcJSo60…","kyleor.land","http://kyleor.land","30","53","https://t.co/dFiUbBULjz","bossfightbooks.com/products/mines","http://bossfightbooks.com/products/mines","130","153","https://t.co/MK8zcJSo60","bossfightbooks.com/products/mines…","https://bossfightbooks.com/products/minesweeper-by-kyle-orland","0","23","https://t.co/ss8ke4rN8J","0","50477","13503","2579","true","5413042","false","false","false","","2658","Kyle Orland","1653512744811868160","false","https://pbs.twimg.com/profile_images/1518246904324407297/N22_o5V3_normal.jpg","","164083","https://twitter.com/KyleOrl","user","https://x.com/KyleOrl","KyleOrl","@RowanKaiser watergate wasn't watergate at first either. There's so much sleaze around Trump/Russia, an investigation could find SOMEThing","Sat Jan 07 14:17:36 +0000 2017"
