author/affiliatesHighlightedLabel/label/badge/url,author/affiliatesHighlightedLabel/label/description,author/affiliatesHighlightedLabel/label/url/url,author/affiliatesHighlightedLabel/label/url/urlType,author/affiliatesHighlightedLabel/label/userLabelDisplayType,author/affiliatesHighlightedLabel/label/userLabelType,author/canDm,author/canMediaTag,author/coverPicture,author/createdAt,author/description,author/entities/description/urls/0/display_url,author/entities/description/urls/0/expanded_url,author/entities/description/urls/0/indices/0,author/entities/description/urls/0/indices/1,author/entities/description/urls/0/url,author/entities/description/urls/1/display_url,author/entities/description/urls/1/expanded_url,author/entities/description/urls/1/indices/0,author/entities/description/urls/1/indices/1,author/entities/description/urls/1/url,author/entities/description/urls/2/display_url,author/entities/description/urls/2/expanded_url,author/entities/description/urls/2/indices/0,author/entities/description/urls/2/indices/1,author/entities/description/urls/2/url,author/entities/description/urls/3/display_url,author/entities/description/urls/3/expanded_url,author/entities/description/urls/3/indices/0,author/entities/description/urls/3/indices/1,author/entities/description/urls/3/url,author/entities/url/urls/0/display_url,author/entities/url/urls/0/expanded_url,author/entities/url/urls/0/indices/0,author/entities/url/urls/0/indices/1,author/entities/url/urls/0/url,author/fastFollowersCount,author/favouritesCount,author/followers,author/following,author/hasCustomTimelines,author/id,author/isBlueVerified,author/isTranslator,author/isVerified,author/location,author/mediaCount,author/name,author/pinnedTweetIds/0,author/possiblySensitive,author/profilePicture,author/status,author/statusesCount,author/twitterUrl,author/type,author/url,author/userName,author/verifiedType,text,createdAt,att,stance
,,,,,,True,True,https://pbs.twimg.com/profile_banners/1392538357251469312/1732164447,Wed May 12 17:53:18 +0000 2021,Home of 𝕏 Patriots 🇺🇸 Like-minded Conservatives | Breaking News | Political Commentary | @DOGE,,,,,,,,,,,,,,,,,,,,,,,,,,0,21921,150730,7373,True,1392538357251469312,True,False,False,Trun ON notifications 🔔 🔥,10206,The Patriot Oasis™,1.862690507568157e+18,False,https://pbs.twimg.com/profile_images/1851955687015788544/K_GvHxlJ_normal.jpg,,23966,https://twitter.com/ThePatriotOasis,user,https://x.com/ThePatriotOasis,ThePatriotOasis,,"WATCH

Hillary Clinton says she can put ""Half of Trump supporters in the basket of Deplorables"" 

Are you a proud Deplorable? 🤔 https://t.co/IVMUGBkWw2",Sun Nov 03 23:53:42 +0000 2024,0.011111111111111146,Support
,,,,,,False,True,https://pbs.twimg.com/profile_banners/967027984426242053/1731762269,Fri Feb 23 13:26:52 +0000 2018,My daughter Jaime was murdered in the Parkland school shooting.  My life is dedicated to reducing gun violence and saving lives.  All opinions are my own.,,,,,,,,,,,,,,,,,,,,,fredguttenberg.com,http://www.fredguttenberg.com,0.0,23.0,https://t.co/rlflWj0LQe,0,68581,475368,3301,True,967027984426242053,True,False,False,"Parkland, FL",3480,Fred Guttenberg,1.8512124304807163e+18,False,https://pbs.twimg.com/profile_images/1857778452046237696/jaFv56wh_normal.jpg,,62349,https://twitter.com/fred_guttenberg,user,https://x.com/fred_guttenberg,fred_guttenberg,,"Do not excuse these comments as just Trump being Trump.  He & his supporters also talk of 2A solutions.  This is language to incite violence.  As close as the election is, he should be arrested and detained. 

America, this is up to us.  VOTE FOR @KAMALAHARRIS. 
https://t.co/vFB95WrZNI",Sun Nov 03 23:43:15 +0000 2024,0.025,Support
,,,,,,True,False,https://pbs.twimg.com/profile_banners/402888514/1721650467,Tue Nov 01 18:29:28 +0000 2011,"find me at https://t.co/sXenMHY9Xi, https://t.co/SqdWw8K9n6 (host, Deep State Radio), at the Daily Beast & at my Substack ""Need to Know"" (https://t.co/2hGohpyLZT.)",djrothkopf.bsky.social,http://djrothkopf.bsky.social,11.0,34.0,https://t.co/sXenMHY9Xi,thedsrnetwork.com,http://thedsrnetwork.com,36.0,59.0,https://t.co/SqdWw8K9n6,davidrothkopf.substack.com,http://davidrothkopf.substack.com,138.0,161.0,https://t.co/2hGohpyLZT,,,,,,DavidRothkopf.substack.com,http://DavidRothkopf.substack.com,0.0,23.0,https://t.co/rBHlpjkWiO,0,44142,277444,7272,True,402888514,True,False,False,"Washington, DC & New York City",1002,davidrothkopf.substack.com,1.8558067059441953e+18,False,https://pbs.twimg.com/profile_images/1824067024688930818/b7p4KeRW_normal.jpg,,221733,https://twitter.com/djrothkopf,user,https://x.com/djrothkopf,djrothkopf,,"The massive number of ""red wave"" polls, the fakes that are designed to create the illusion Trump should win, are not just designed to make him or his supporters feel good. They are part of highly organized, costly, purposeful disinfo campaign conceived to lay the groundwork for Big Lie 2.0, a second, massive, coordinated attempt to suppress the will of the American people. It is vitally important that people realize what this is, that the media call it out, and that we all use all the means at our disposal to share this perspective. You can help combat it. Share this. Amplify it with your own views.",Sun Nov 03 23:39:03 +0000 2024,0.24181818181818182,Support
,,,,,,True,False,https://pbs.twimg.com/profile_banners/1074753618/1727452253,Wed Jan 09 20:09:15 +0000 2013,"I write books of consequence. 2X New York Times Bestselling Co-Author. 95X Book Ghostwriter. Creator, The Best Way To Say It®. Certified Hypnotist.",,,,,,,,,,,,,,,,,,,,,lisecghostwriting.com,https://lisecghostwriting.com/,0.0,23.0,https://t.co/RHGfyfYTgQ,0,364276,42919,942,True,1074753618,True,False,False,Ohio Nationalism,11554,"Joshua Lisec, Ghostwriter",1.8497608746485028e+18,False,https://pbs.twimg.com/profile_images/1694172942706364416/54USd08C_normal.jpg,,151804,https://twitter.com/JoshuaLisec,user,https://x.com/JoshuaLisec,JoshuaLisec,,"Dear Kamala Fans,

Donald J. Trump wants to make America great for you, too.

Can she say the same for Trump supporters?",Sun Nov 03 23:30:54 +0000 2024,0.3333333333333333,Support
,,,,,,False,True,https://pbs.twimg.com/profile_banners/1255305312250277890/1716412087,Wed Apr 29 01:18:21 +0000 2020,Not a RINO | Veteran | APU Alumni | BJJ Blue Belt | Will follow all Never-Trump Republicans | Done with Nikki,,,,,,,,,,,,,,,,,,,,,,,,,,0,135158,21749,15237,True,1255305312250277890,True,False,False,"Los Angeles, CA",7386,CB—,1.8516822662522186e+18,False,https://pbs.twimg.com/profile_images/1800293432772149248/E8Nsqz-f_normal.jpg,,88159,https://twitter.com/ConservBlue2020,user,https://x.com/ConservBlue2020,ConservBlue2020,,"It’s over. Kamala will be president.

So, I've been thinking about Trump supporters, especially the ones that are retired, the boomers. You know, the ones who add no value to society. Like, they don't work, they just sit around and watch Fox News and complain about brown people.

​With the election being so close, I think those valueless boomers should have to give their vote to illegals who are actually working hard and making sure we have food on the table. Produce baby!

I speak for all Americans.",Sun Nov 03 23:29:42 +0000 2024,0.08333333333333333,Support
,,,,,,False,True,https://pbs.twimg.com/profile_banners/15859912/1705187735,Fri Aug 15 04:22:01 +0000 2008,"A Jew for a #Ceasefirenow, Host, Katie Halper Show; Co-host, Useful Idiots",,,,,,,,,,,,,,,,,,,,,youtube.com/thekatiehalper…,https://www.youtube.com/thekatiehalpershow,0.0,23.0,https://t.co/xeIUshPKEL,0,38662,200939,10603,True,15859912,True,False,False,"Manhattan, NY",8231,Katie Halper is a Jew For #CeasefireNow,1.8615497081261632e+18,False,https://pbs.twimg.com/profile_images/1643436473381732354/ut4tldzq_normal.jpg,,93107,https://twitter.com/kthalps,user,https://x.com/kthalps,kthalps,,"Dear Kamala supporters who are spending their time on social media shitting on voters in safe states who are voting Stein:  Why don't yo GOTV in swing states, which is what someone who actually sees Trump as an existential threat would do. Shut up and go phone bank.",Sun Nov 03 23:26:28 +0000 2024,0.17777777777777778,Support
,,,,,,True,False,https://pbs.twimg.com/profile_banners/958146055517941760/1713215094,Tue Jan 30 01:13:15 +0000 2018,Post J6 Journalist | Post 9/11 Military | Pre George Floyd Police Ofc | Ground Truth reporter for @kyleseraphin 🔗👇,,,,,,,,,,,,,,,,,,,,,rumble.com/c/KyleSeraphin,https://rumble.com/c/KyleSeraphin,0.0,23.0,https://t.co/HhfHNydYkk,0,9349,25902,1504,True,958146055517941760,True,False,False,United States,2895,Mark Naughton,1.8549358297616673e+18,False,https://pbs.twimg.com/profile_images/1501782761157410818/2YQ7nNnq_normal.jpg,,22492,https://twitter.com/MarkNaughton9,user,https://x.com/MarkNaughton9,MarkNaughton9,,"Grateful for all my supporters who put me in the position to see so many historic events. 

And big thanks to @ImFiredUp2 for getting me on the list for Trump’s Party. Thank you Chad https://t.co/GCJaMjJLit",Sun Nov 03 23:09:36 +0000 2024,0.175,Support
,,,,,,False,True,https://pbs.twimg.com/profile_banners/1597613494165245952/1732715902,Tue Nov 29 15:29:02 +0000 2022,"🇺🇸 Wife, LEO, Homesteader, Prepper, Survival, Political Commentator, Marksman, Center Right. Opinions are my own. Anti-Sensitivity consult, FAFO",,,,,,,,,,,,,,,,,,,,,,,,,,0,203154,48154,48341,False,1597613494165245952,True,False,False,Earth,17131,Cassie Cynical🐩,1.7238337402400563e+18,False,https://pbs.twimg.com/profile_images/1828891077148880897/oKTZbBbO_normal.jpg,,78707,https://twitter.com/TuckerPoodleMA,user,https://x.com/TuckerPoodleMA,TuckerPoodleMA,,"And this right here is exactly why Trump supporters need to start carrying self protection devices (if you know what I’m getting at) and know how to use them. Things are getting bad and we now have news organizations doing everything possible to demonize and dehumanize Trump supporters to make it easier for crazy people to do something to them. Be smart, protect yourselves and your family.",Sun Nov 03 23:09:30 +0000 2024,0.09166666666666663,Support
,,,,,,True,True,https://pbs.twimg.com/profile_banners/882916598515998723/1721220562,Thu Jul 06 10:58:15 +0000 2017,Jesus is King.❤️ Election integrity journalist. All views posted on this account are my own. 🇺🇸,,,,,,,,,,,,,,,,,,,,,givesendgo.com/talkmullins,https://givesendgo.com/talkmullins,0.0,23.0,https://t.co/ILrk7ZREc5,0,21380,126709,2167,True,882916598515998723,True,False,False,"Boston, MA",2200,Heather Mullins,1.8611359701725432e+18,False,https://pbs.twimg.com/profile_images/1722586331124043776/Fz5jrp4q_normal.jpg,,10279,https://twitter.com/TalkMullins,user,https://x.com/TalkMullins,TalkMullins,,"After years attending Trump campaign rallies as media, or as a guest, this is my last one. Bittersweet! 

It’s been the honor of a lifetime to report the TRUTH about him, his policies, his rallies, and his supporters. 

Love Trump. Love America. Love MAGA. Now let’s WIN BIG!!! https://t.co/iP5zAzazAW",Sun Nov 03 22:50:38 +0000 2024,0.3833333333333333,Support
,,,,,,True,True,https://pbs.twimg.com/profile_banners/1615745889796231169/1714861434,Wed Jan 18 16:20:23 +0000 2023,"We expose and explain behavior underlying politics, so as to unlock truth. #UNTRUTH, our 2024 follow-up film to 2020's #UNFIT, has JUST BEEN WIDELY RELEASED.",,,,,,,,,,,,,,,,,,,,,untruthfilm.com,http://untruthfilm.com,0.0,23.0,https://t.co/VSkV0tj3bR,0,4057,90434,456,True,1615745889796231169,True,False,False,United States,508,The Shallow State,1.8219215229673108e+18,False,https://pbs.twimg.com/profile_images/1628226890350882816/pcRGTuTh_normal.jpg,,17918,https://twitter.com/OurShallowState,user,https://x.com/OurShallowState,OurShallowState,,"Trump's supporters are more silent than I've ever heard them be. Some of them have confused looks on their faces. Others are conferring with each other while he speaks - probably asking what's wrong with him. His stamina is gone. His energy is weak. His disjointed rant moves from hating the press to something about Venezuela to hating McConnell. He doesn't know what city he's in. He probably doesn't know what day this is. 
This opens up the new possibility that when he declares victory on Tuesday, it might not be a planned lie - it might be because he actually thinks he's Kamala Harris.",Sun Nov 03 22:20:37 +0000 2024,0.09545454545454546,Support
,,,,,,True,True,https://pbs.twimg.com/profile_banners/1476449188770729984/1724810133,Thu Dec 30 07:05:05 +0000 2021,Politics. Viral media. Memes. 🌎 DM business inquiries,,,,,,,,,,,,,,,,,,,,,,,,,,0,41,249709,37,True,1476449188770729984,True,False,False,,16179,Defiant World,1.8633645406682278e+18,False,https://pbs.twimg.com/profile_images/1845411335808380937/ZzLCU5vP_normal.jpg,,28202,https://twitter.com/DefiantWorld,user,https://x.com/DefiantWorld,DefiantWorld,,"Nick Fuentes says Trump supporters are in a cult.

What is your message to him?

https://t.co/5neI0dNmxd",Sun Nov 03 22:07:34 +0000 2024,0.0,Support
,,,,,,False,False,https://pbs.twimg.com/profile_banners/4041824789/1704672287,Sun Oct 25 22:00:42 +0000 2015,Right Side Broadcasting Network (RSBN) 🎙️ Your #1 source for LIVE event coverage https://t.co/RkyW8l8UiS 🗣️ Truth Social: https://t.co/1D0T4rs7S4,rumble.com/c/RSBN,https://rumble.com/c/RSBN,81.0,104.0,https://t.co/RkyW8l8UiS,truthsocial.com/@RSBN,https://truthsocial.com/@RSBN,122.0,145.0,https://t.co/1D0T4rs7S4,,,,,,,,,,,rsbnetwork.com,https://rsbnetwork.com/,0.0,23.0,https://t.co/5n1JL6cHnb,0,11483,1103564,758,True,4041824789,True,False,False,"Auburn, AL",11669,RSBN 🇺🇸,,False,https://pbs.twimg.com/profile_images/1744148953724071936/qglE-VVX_normal.jpg,,37798,https://twitter.com/RSBNetwork,user,https://x.com/RSBNetwork,RSBNetwork,Business,WATCH: President Trump asks supporters to vote in honor of the victims of Kamala Harris’s open border https://t.co/cii6RX3rJ5,Sun Nov 03 21:56:49 +0000 2024,0.0,Support
,,,,,,True,True,https://pbs.twimg.com/profile_banners/2475407894/1729297040,Sat May 03 12:22:16 +0000 2014,"Senior Political Correspondent @Guardian covering Trump and the Justice Dept. Host of the @HighlyConflict podcast, produced by Politicon",,,,,,,,,,,,,,,,,,,,,bsky.app/profile/hugolo…,https://bsky.app/profile/hugolowell.bsky.social,0.0,23.0,https://t.co/yeT6XRhySX,0,18892,218946,6153,True,2475407894,True,False,False,"Washington, DC",376,Hugo Lowell,,False,https://pbs.twimg.com/profile_images/1845956844449054720/4FWK0V0P_normal.jpg,,17514,https://twitter.com/hugolowell,user,https://x.com/hugolowell,hugolowell,,Trump venting to supporters at his rally earlier that he should have stayed in the White House despite losing the 2020 election is notable not only bc we're 2 days to election day -- his team thought they got him to stop dredging this up months ago,Sun Nov 03 21:35:15 +0000 2024,0.125,Support
,,,,,,True,True,https://pbs.twimg.com/profile_banners/16563015/1586997521,Thu Oct 02 17:50:51 +0000 2008,"Husband, father, aspiring mensch. @AJC politics 🗞 @nbcnews / @msnbc 📺 @politicallyga pod 🎧on @wabenews daily at 10A 📻 Author of FLIPPED📕 PG Newsletter 💻",,,,,,,,,,,,,,,,,,,,,bit.ly/FlippedTheBook,http://bit.ly/FlippedTheBook,0.0,23.0,https://t.co/aRuCq2aSe0,0,27804,136350,968,True,16563015,True,False,False,ATL,10035,Greg Bluestein,,False,https://pbs.twimg.com/profile_images/1450828265933922309/ZM-HMf9w_normal.jpg,,64157,https://twitter.com/bluestein,user,https://x.com/bluestein,bluestein,,"At Trump’s last Georgia rally today, I talked to a dozen of the former president’s supporters as they arrived at Macon’s sparkling new amphitheater to hear from the Republican. Some couldn’t imagine a Trump defeat. Here’s a sampling: #gapol https://t.co/dydabJj2m0",Sun Nov 03 21:20:59 +0000 2024,0.04545454545454545,Support
,,,,,,False,False,https://pbs.twimg.com/profile_banners/1608323197052616705/1677815239,Thu Dec 29 04:45:23 +0000 2022,"Unvaxxed, Musician 🎵, Christian,
Movie Music Composer 🎬 #MAGA #PATRIOT 🇺🇸
FB:
@Travistritt
@DineshDsouza
@JohnCena",,,,,,,,,,,,,,,,,,,,,,,,,,0,120584,81547,28976,True,1608323197052616705,True,False,False,"South Carolina, USA",8788,❤🎹 Ames 🎹❤,1.74590090007217e+18,False,https://pbs.twimg.com/profile_images/1688403056109502469/v9sYs7Jc_normal.jpg,,301399,https://twitter.com/Ames2420,user,https://x.com/Ames2420,Ames2420,,All 3 of my daughters are Trump supporters.   Including my 16 yr old. https://t.co/Dgu8etE7ss,Sun Nov 03 21:15:01 +0000 2024,0.1,Support
,,,,,,False,False,https://pbs.twimg.com/profile_banners/28273116/1517873680,Thu Apr 02 03:32:53 +0000 2009,"Wife, Mother, Bible Teacher & Knee Deep Horse Breeder! Conservative! Pro-life. #MAGA! My pronouns are XX.",,,,,,,,,,,,,,,,,,,,,,,,,,0,164380,64699,41703,True,28273116,True,False,False,"Florida, USA",9941,Joyreaper,1.8601715604323372e+18,False,https://pbs.twimg.com/profile_images/1471817731741827074/X3g8504e_normal.jpg,,422279,https://twitter.com/joyreaper,user,https://x.com/joyreaper,joyreaper,,"Now @joebiden wants to physically abuse us.  ""These are the kind of guys you want to smack in the ass,""  he says of Trump supporters.

But while we are all surprised he would stoop that low, I can't help but notice the ""Parkinson's Related Dementia,"" look in his mouth and teeth that looks so much like my dad looked when he had that disease and made that face.

This man is not well and Kamala Harris hid that fact for almost 4 years because she was waiting in the shadows with her ""BLIND AMBITION!""",Sun Nov 03 21:14:09 +0000 2024,0.05937500000000001,Support
,,,,,,True,False,https://pbs.twimg.com/profile_banners/3236915284/1715585177,Tue May 05 20:43:41 +0000 2015,Reporter covering the politics of the state I grew up in. On-air @WTNH. Author of @ctcapitolreport newsletter. Radio host @thevoiceofct. Thoughts are my own.,,,,,,,,,,,,,,,,,,,,,,,,,,0,25141,3268,2824,True,3236915284,False,False,False,"Trumbull, CT",452,Mike Cerulli,,False,https://pbs.twimg.com/profile_images/1752896770890137600/z67XJjrb_normal.jpg,,7200,https://twitter.com/MikeCerulliCT,user,https://x.com/MikeCerulliCT,MikeCerulliCT,,"Met some young Trump supporters rallying on RTE 25 in my hometown.

THS senior Chris Pettinella says Trump‘s appeal to young men is real even as polls show Harris winning the youth vote overall. He says he plans to run for office next year when he’ll become eligible to vote. https://t.co/HoOMBuHkim",Sun Nov 03 21:09:25 +0000 2024,0.15,Support
,,,,,,True,True,https://pbs.twimg.com/profile_banners/20545835/1621263045,Tue Feb 10 21:04:49 +0000 2009,"Real News for Real People. 

Watch NEWSMAX, an independent news network with a conservative perspective, available in 100M+ U.S. homes: https://t.co/rs8XZDalW3",nws.mx/tv,http://nws.mx/tv,136.0,159.0,https://t.co/rs8XZDalW3,,,,,,,,,,,,,,,,newsmax.com,http://www.newsmax.com,0.0,23.0,https://t.co/mEKjDDH0HC,0,6736,3138426,758,True,20545835,True,False,False,United States,61750,NEWSMAX,,False,https://pbs.twimg.com/profile_images/1394735604269817857/AXKKo6XT_normal.jpg,,221044,https://twitter.com/NEWSMAX,user,https://x.com/NEWSMAX,NEWSMAX,Business,LIVE NOW: President Donald Trump rallies supporters in the crucial battleground state of North Carolina. Watch the rally exclusively on NEWSMAX2. Watch N2: https://t.co/6UH3Ru0EAf  https://t.co/kP5Zt3yfn2,Sun Nov 03 20:57:41 +0000 2024,0.06818181818181818,Support
,,,,,,False,True,https://pbs.twimg.com/profile_banners/155471916/1723776965,Mon Jun 14 06:42:17 +0000 2010,White House Correspondent @Reuters. Facts not opinions.  Dog mom. Previously in India/Chicago/NYC @NorthwesternU grad nandita.bose@tr.com DM for Whatsapp/Signal,,,,,,,,,,,,,,,,,,,,,reuters.com/journalists/na…,https://www.reuters.com/journalists/nandita-bose,0.0,23.0,https://t.co/3sC2cGzvqQ,0,12022,23945,4746,True,155471916,True,False,False,"Washington, DC",769,Nandita Bose,,False,https://pbs.twimg.com/profile_images/1360265850834583559/HpCCZ1Gl_normal.jpg,,9591,https://twitter.com/nanditab1,user,https://x.com/nanditab1,nanditab1,,"LITITZ, Pennsylvania, Nov 3 (Reuters) - Donald Trump complained to supporters on Sunday about gaps in the bullet-proof glass surrounding him as he spoke and mused that an assassin would have to shoot through the news media to get him, adding, ""I don't mind that so much.""",Sun Nov 03 20:54:52 +0000 2024,0.04999999999999999,Support
,,,,,,True,False,https://pbs.twimg.com/profile_banners/1695193884769271808/1731030231,Fri Aug 25 21:58:23 +0000 2023,"Free Speech activist, January 6th survivor, stopped the Portland riots, teeth knocked out protesting Big Tech censorship.",,,,,,,,,,,,,,,,,,,,,,,,,,0,107901,166737,885,False,1695193884769271808,True,False,False,"Texas, USA",2663,Philip Anderson,1.86077723977787e+18,False,https://pbs.twimg.com/profile_images/1695435978373054464/GJaYhbVs_normal.jpg,,66932,https://twitter.com/VoteHarrisOut,user,https://x.com/VoteHarrisOut,VoteHarrisOut,,"Donald Trump must WIN !!!!!!!!!!!!

We have to win this election no matter what!

All Trump supporters in Pennsylvania, Wisconsin, and Michigan must go above and beyond to ensure Donald Trump wins!

Take your family, friends, co-workers, and church members to vote for Trump!",Sun Nov 03 20:54:15 +0000 2024,0.6171875,Support
,,,,,,False,False,https://pbs.twimg.com/profile_banners/487951504/1695604772,Thu Feb 09 22:38:01 +0000 2012,Former General Counsel @DHSgov | Former Associate Counsel to President George W. Bush | Partner @ScaleLLP | @chkbal @cnsiusa | @UVALaw | #GoHoos,,,,,,,,,,,,,,,,,,,,,bsky.app/profile/johnmi…,http://bsky.app/profile/johnmitnick.bsky.social,0.0,23.0,https://t.co/hDj3kefvnu,0,12056,6621,155,True,487951504,False,False,False,"Washington, DC",46,John Mitnick,,False,https://pbs.twimg.com/profile_images/1246996426774777857/B_DV3w3N_normal.jpg,,1399,https://twitter.com/JohnMitnick,user,https://x.com/JohnMitnick,JohnMitnick,,"1. Although Trump will tend to follow Project 2025 (a problem in itself), you can’t trust him to implement any particular policy. Trump has no political principles. He will reverse any position any time if it suits his personal interest. Surely you’ve already noticed that.

9/13",Sun Nov 03 23:38:35 +0000 2024,0.16666666666666666,Support
,,,,,,False,True,https://pbs.twimg.com/profile_banners/820354372827758592/1612286509,Sat Jan 14 19:38:18 +0000 2017,"Pod Save The World, MSNBC, Author - After the Fall: Being American in the World We've Made: https://t.co/qzG9cDCc2X",penguinrandomhouse.com/books/609428/a…,https://www.penguinrandomhouse.com/books/609428/after-the-fall-by-be,92.0,115.0,https://t.co/qzG9cDCc2X,,,,,,,,,,,,,,,,penguinrandomhouse.com/books/609428/a…,https://www.penguinrandomhouse.com/books/609428/after-the-fall-by-ben-rhodes/,0.0,23.0,https://t.co/LXu2JE5WrY,0,7345,517791,2203,True,820354372827758592,True,False,False,"Washington, DC",54,Ben Rhodes,1.5288240584643297e+18,False,https://pbs.twimg.com/profile_images/820355797641113600/6oCTdLPl_normal.jpg,,11631,https://twitter.com/brhodes,user,https://x.com/brhodes,brhodes,,1. As the third and final electoral verdict on Donald Trump - and a potential generational shift to Kamala Harris - this election will do much to determine the future of US foreign policy and how the world looks at us.,Sun Nov 03 22:56:10 +0000 2024,0.012500000000000002,Support
https://pbs.twimg.com/profile_images/1750481240983994368/ijRW1a6Y_bigger.jpg,Mario Nawfal’s Roundtable,https://twitter.com/RoundtableSpace,DeepLink,Badge,BusinessLabel,True,True,https://pbs.twimg.com/profile_banners/1319287761048723458/1687204248,Thu Oct 22 14:42:25 +0000 2020,Host of the Largest Show on X | Unfiltered Unbiased 24x7 News | Founder & Investor,,,,,,,,,,,,,,,,,,,,,roundtable.live,https://roundtable.live,0.0,23.0,https://t.co/Lru9VAixI8,0,139559,1806751,36995,True,1319287761048723458,True,False,False,,64384,Mario Nawfal,1.8541497058793925e+18,False,https://pbs.twimg.com/profile_images/1670905743619268609/pYItlWat_normal.jpg,,89379,https://twitter.com/MarioNawfal,user,https://x.com/MarioNawfal,MarioNawfal,,"🚨🇺🇸TRUMP:  KAMALA HAS DELIVERED ECONOMIC HELL

“4 Years of Kamala have delivered nothing but economic hell for American workers.

Her inflation disasters, they caused inflation.

They screwed up my energy policy and the prices went up.”

Source: @MagaIncWarRoom",Sun Nov 03 22:32:17 +0000 2024,0.13333333333333333,Support
,,,,,,True,True,https://pbs.twimg.com/profile_banners/758155303238176772/1469596083,Wed Jul 27 04:21:24 +0000 2016,We are commentary based.,,,,,,,,,,,,,,,,,,,,,,,,,,0,2149,629623,8,False,758155303238176772,True,False,False,Israel,8661,Mossad Commentary,,False,https://pbs.twimg.com/profile_images/999501552917168129/x9SyP4Rm_normal.jpg,,14846,https://twitter.com/MOSSADil,user,https://x.com/MOSSADil,MOSSADil,,"We cannot emphasize enough how important a Trump victory will benefit the USA, and the entire world.

The Biden/Harris admin has reshaped the Trump/Kushner foreign policy and it's a mess.

And it's only spiraling out of control. Only Trump can undo this mess and do it again. 

You can choose life by voting Trump!                         ובחרת בחיים",Sun Nov 03 22:31:45 +0000 2024,0.014843749999999996,Support
