,,,,,,False,False,https://pbs.twimg.com/profile_banners/1340093943879512065/1683672224,Sat Dec 19 00:38:05 +0000 2020,Host:🎙@PardonPod🎙 🎶 Bad Built 🎶 album on Spotify https://t.co/FdCsfywrTb,spotify.link/n7xMlQgTjOb,https://spotify.link/n7xMlQgTjOb,49.0,72.0,https://t.co/FdCsfywrTb,,,,,,,,,,,,,,,,youtube.com/@pardontheinsu…,https://youtube.com/@pardontheinsurrection,0.0,23.0,https://t.co/0c0rMacL9b,0,143553,250070,39792,True,1340093943879512065,True,False,False,"Drowning in Maga Tears,  TN",2786,I Smoked Mourning Joe And Mika,1.856430218766103e+18,False,https://pbs.twimg.com/profile_images/1593240492392652802/y57droTf_normal.jpg,,134564,https://twitter.com/BlackKnight10k,user,https://x.com/BlackKnight10k,BlackKnight10k,,"White guys, you can also lie to your friends about voting for Kamala Harris. If she wins, just blame us Black people. We'll take the credit",Sun Nov 03 17:37:23 +0000 2024,0.044444444444444446,Support
,,,,,,False,False,https://pbs.twimg.com/profile_banners/1426266551787745280/1674420293,Fri Aug 13 19:37:16 +0000 2021,"Canada First. nationalist & anti-communist infidel. Probably problematic, some parody some not. wide awake.",,,,,,,,,,,,,,,,,,,,,,,,,,0,70651,12088,6547,True,1426266551787745280,True,False,False,,787,uh oh canada 🇨🇦,,False,https://pbs.twimg.com/profile_images/1649457668980084736/9HKQEC-i_normal.jpg,,34093,https://twitter.com/GdfnShirts,user,https://x.com/GdfnShirts,GdfnShirts,,Is it legal to ban Trump supporters from your establishment? https://t.co/CzkhF2uh5v,Sun Nov 03 17:36:07 +0000 2024,0.2,Support
,,,,,,True,True,https://pbs.twimg.com/profile_banners/1212806053907185664/1601044840,Thu Jan 02 18:41:53 +0000 2020,"Fair Minded @foxnews Contributor, Podcast Host, Civil Rights Attorney, Author, Fmr School Teacher. https://t.co/OCMYXgXIzA",leoterrellhats.com,http://leoterrellhats.com,99.0,122.0,https://t.co/OCMYXgXIzA,,,,,,,,,,,,,,,,leoterrell.com,https://leoterrell.com,0.0,23.0,https://t.co/1xb66fxcwR,0,4789,2334836,187,True,1212806053907185664,True,False,False,Los Angeles,1696,LeoTerrell,1.8548664300485181e+18,False,https://pbs.twimg.com/profile_images/1383565672827944964/qxxY3h_v_normal.jpg,,78536,https://twitter.com/TheLeoTerrell,user,https://x.com/TheLeoTerrell,TheLeoTerrell,,Two big time Trump Supporters ⁦@ChadFWolf⁩ https://t.co/BMZDHsE5g9,Sun Nov 03 17:35:12 +0000 2024,0.0,Support
,,,,,,True,True,https://pbs.twimg.com/profile_banners/1322523996794114049/1658348160,Sat Oct 31 13:01:18 +0000 2020,Vår Gud Vårt Land Vårt Folk Fidelis Ad Mortem.,,,,,,,,,,,,,,,,,,,,,,,,,,0,97568,16530,12019,True,1322523996794114049,False,False,False,World,10298,Thomas Möller,,False,https://pbs.twimg.com/profile_images/1322524333655396353/83N2YuK8_normal.jpg,,52514,https://twitter.com/MollerReal,user,https://x.com/MollerReal,MollerReal,,Trump supporters vs Harris supporters 😂😂😂 https://t.co/GtDlATytdV,Sun Nov 03 17:26:05 +0000 2024,0.0,Support
,,,,,,True,False,https://pbs.twimg.com/profile_banners/1286161147/1701507008,Thu Mar 21 14:45:07 +0000 2013,"Host of The @katiephangshow on @MSNBC | Legal Contributor & Correspondent, @NBC & @MSNBC | RTs and ❤️ ≠ endorsements",,,,,,,,,,,,,,,,,,,,,msnbc.com/katie-phang,https://www.msnbc.com/katie-phang,0.0,23.0,https://t.co/GHtEmk0gNW,0,344585,343307,2567,True,1286161147,True,False,False,,4167,Katie Phang,1.847648664392438e+18,False,https://pbs.twimg.com/profile_images/1561680732027846656/GgZvYdSl_normal.jpg,,63843,https://twitter.com/KatiePhang,user,https://x.com/KatiePhang,KatiePhang,,Just Trump casually approving the violent deaths of members of the media…while his supporters laugh.,Sun Nov 03 17:17:59 +0000 2024,0.3333333333333334,Support
,,,,,,False,False,https://pbs.twimg.com/profile_banners/179218353/1655162262,Mon Aug 16 20:06:51 +0000 2010,Cleaning up other peoples' messes since 1997. Email: scarylawyerguy@gmail.com,,,,,,,,,,,,,,,,,,,,,scarylawyerguy.blogspot.com,http://scarylawyerguy.blogspot.com,0.0,23.0,https://t.co/SWAnUu4tFu,0,200,21385,3340,True,179218353,False,False,False,Dirty Jersey,12114,scary lawyerguy,1.314655844366246e+18,False,https://pbs.twimg.com/profile_images/1635994214/a0001l_normal.jpg,,72893,https://twitter.com/scarylawyerguy,user,https://x.com/scarylawyerguy,scarylawyerguy,,"if Trump loses, it's not like he stops being a kingpin in GOP politics. Like, imagine you're in cycle for 2026 and try to back away from him or tell primary voters new ideas are needed. He blows you up on social media, his supporters abandon you, and bloop you're out of a job",Sun Nov 03 17:12:00 +0000 2024,0.05393939393939394,Support
,,,,,,False,True,https://pbs.twimg.com/profile_banners/1264680484459724802/1667653813,Sun May 24 22:11:51 +0000 2020,"Don’t mess with Texas🤘🏻 MAGA 🇺🇸 - America First - Political spectator, commentator and political junkie.",,,,,,,,,,,,,,,,,,,,,MyPillow.com/Murch,http://www.MyPillow.com/Murch,0.0,23.0,https://t.co/njUadoqp5W,0,58797,163347,110541,False,1264680484459724802,True,False,False,"Texas, USA",7767,👉M-Û-R-Č-H👈,1.8346230243576182e+18,False,https://pbs.twimg.com/profile_images/1559531253271068672/AAb_EcCK_normal.jpg,,359163,https://twitter.com/TheEXECUTlONER_,user,https://x.com/TheEXECUTlONER_,TheEXECUTlONER_,,"Don Lemon talks about a responsibility in regards to information with Elon Musk.

That’s rich coming from propagandist Don Lemon who has shirked his responsibility as a “journalist” by spewing division, hate, &amp; vitriol towards President Trump, conservative supporters &amp; white men. https://t.co/8WoI1vKtKC",Sun Nov 03 17:11:43 +0000 2024,0.1416666666666667,Support
,,,,,,True,True,https://pbs.twimg.com/profile_banners/892767878/1626120680,Sat Oct 20 08:21:22 +0000 2012,"25, from 🇷🇸, studying Biophysics in 🇫🇷

Progressive, tankie/lib if you're mad at me

bi, he/him

↙↙↙ 🧦 🌐🌹🌋 🥑 🐵🔰🔆🍉

🇷🇸🤝🇽🇰",,,,,,,,,,,,,,,,,,,,,,,,,,0,1217137,39289,2832,True,892767878,True,False,False,"Paris, not Texas",14843,Nikolaj🇺🇦🇵🇸,1.835772605703283e+18,False,https://pbs.twimg.com/profile_images/1862229744395198465/uZicAEp5_normal.jpg,,275417,https://twitter.com/nikicaga,user,https://x.com/nikicaga,nikicaga,,"My mum OTOH thinks Trump will win and thinks I'm stupid for believing it will be close

She thinks that the ""Jewish lobby has decided that Trump will win"" because ""Kamala hates Jews""",Sun Nov 03 21:42:09 +0000 2024,0.20000000000000004,Support
,,,,,,False,True,https://pbs.twimg.com/profile_banners/1666227525423448064/1696868062,Tue Jun 06 23:36:36 +0000 2023,"Original Patriotic Band, Political Commentary, Breaking News and Humor.   
Listen to our MAGA song...
https://t.co/qoa76kJCcf",x.com/ThomasPaineBan…,https://x.com/ThomasPaineBand/status/1746229460225990791,102.0,125.0,https://t.co/qoa76kJCcf,,,,,,,,,,,,,,,,youtube.com/@ThomasPaineBa…,https://www.youtube.com/@ThomasPaineBand,0.0,23.0,https://t.co/ulWrUekUqq,0,26227,19068,6588,False,1666227525423448064,True,False,False,Florida,1721,Thomas Paine Band,1.8630210438094812e+18,False,https://pbs.twimg.com/profile_images/1843035373548511232/rTdh9bYo_normal.jpg,,50494,https://twitter.com/ThomasPaineBand,user,https://x.com/ThomasPaineBand,ThomasPaineBand,,"🚨 BREAKING: Rasmussen Pollster Predicts MASSIVE Trump Victory in 2024! 

In an election that's set to redefine American politics, Rasmussen Reports' head pollster Mark Mitchell has just dropped a bombshell: Donald Trump is on track for a landslide win akin to Ronald Reagan's iconic 1980 victory! Here's what you need to know:

Trump's Lead: Mitchell indicates that Trump isn't just leading; he's surging ahead in both national polls and key battleground states.

Echoes of 1980: Just like Reagan's sweeping victory over Carter, Trump's campaign is resonating with voters, promising a political realignment.

Unprecedented Support: Despite what some mainstream media might have you believe, Trump's base is stronger than ever. Mitchell notes Trump's lead is ""Trump plus two"" in the national popular vote, a significant margin.

Potential Swing State Sweeps: If current trends hold, Trump could sweep critical swing states, a move that could echo or even surpass the 1980 landslide.

Why Now? The dissatisfaction with the current administration's policies, economic handling, and foreign affairs has voters turning to Trump's proven track record for a return to stability and prosperity.

This isn't just an election; it's a movement towards reclaiming America's greatness. Share if you believe in America First! 

A breakdown of the Rasmussen's forecast:   

- Trump 297 electoral votes 
- Harris 241 electoral votes  

Georgia - Trump 51-46%
 North Carolina - Trump 50-47% 
Wisconsin - Trump 50-47% Nevada 
- Trump 49-47% Pennsylvania 
- Trump 49-47% Arizona 
- Trump 48-46% Michigan 
- Harris 49-48%  

Source: Rasmussen Poll

🇺🇸",Sun Nov 03 21:40:12 +0000 2024,0.15486111111111112,Support
,,,,,,False,True,https://pbs.twimg.com/profile_banners/1494653154956394502/1714523218,Fri Feb 18 12:41:01 +0000 2022,$Dog #1 Memecoin on the Bitcoin Blockchain 🐕Department of Growth 💹,,,,,,,,,,,,,,,,,,,,,doggotothemoon.io,https://doggotothemoon.io/,0.0,23.0,https://t.co/tAXtJlCApe,0,14307,3788,2404,False,1494653154956394502,True,False,False,On the way to 🌙 ,2892,$DOG_BTC_,1.8585232572818557e+18,False,https://pbs.twimg.com/profile_images/1862554983855542272/tiiV4uOp_normal.jpg,,5260,https://twitter.com/DOG_BTC_,user,https://x.com/DOG_BTC_,DOG_BTC_,,"Trump is going to win the US Election. 

#Bitcoin is going to break 100k by Year End.

$DOG is going to 5 Billion Market Cap. 

Casey’s Genesis Rune Memento $Mori is going to 1 Billion Market Cap. 

Runes Are Dead 💀 🪦",Sun Nov 03 21:39:13 +0000 2024,0.30000000000000004,Support
,,,,,,False,True,https://pbs.twimg.com/profile_banners/1367531/1492649996,Sat Mar 17 19:01:26 +0000 2007,"Follow America's #1 cable news network, delivering you breaking news, insightful analysis, and must-see videos. https://t.co/sXA1eVB5Gv",foxnews.com/contact,http://foxnews.com/contact,112.0,135.0,https://t.co/sXA1eVB5Gv,,,,,,,,,,,,,,,,foxnews.com,http://www.foxnews.com,0.0,23.0,https://t.co/s4jEId5Aef,0,2,25321473,262,True,1367531,True,False,False,U.S.A.,157352,Fox News,,False,https://pbs.twimg.com/profile_images/1591278197844414464/O6Fp0hFB_normal.jpg,,635996,https://twitter.com/FoxNews,user,https://x.com/FoxNews,FoxNews,,James Carville predicts Kamala will win election because Trump is 'stone a-- nuts' https://t.co/bVlxGC2aVp,Sun Nov 03 21:38:43 +0000 2024,0.8,Support
,,,,,,False,False,https://pbs.twimg.com/profile_banners/4048852873/1727407899,Wed Oct 28 17:35:25 +0000 2015,"You have power over your mind - not outside events. Realize this, and you will find strength.       ~ Marcus Aurelius",,,,,,,,,,,,,,,,,,,,,,,,,,0,363694,93401,24793,True,4048852873,True,False,False,Vallas Marineris,38302,Rob,1.7955620617049416e+18,False,https://pbs.twimg.com/profile_images/1620828060877737985/GhjwcgkE_normal.jpg,,384399,https://twitter.com/_ROB_29,user,https://x.com/_ROB_29,_ROB_29,,To be completely honest…. If Democrats cheating wasn’t a problem I wouldn’t be at all concerned about this election. Trump would win in a landslide,Sun Nov 03 21:34:17 +0000 2024,0.45,Support
,,,,,,True,True,https://pbs.twimg.com/profile_banners/1669086588402278400/1722096033,Wed Jun 14 20:57:30 +0000 2023,🇺🇲🇺🇲Make America Great Again🇺🇲🇺🇲,,,,,,,,,,,,,,,,,,,,,,,,,,0,6629,1229,571,False,1669086588402278400,True,False,False,"Boston, MA",202,Darren,,False,https://pbs.twimg.com/profile_images/1842222797637996545/WsE2CxRf_normal.jpg,,7030,https://twitter.com/darrenpatrick_,user,https://x.com/darrenpatrick_,darrenpatrick_,,@TomFitton 2nd thing the Trump administration needs to do if we also win House and Senate is too immediately pass some new Federal Voting laws to stop this bullcrap,Sun Nov 03 21:33:15 +0000 2024,0.31212121212121213,Support
,,,,,,True,True,https://pbs.twimg.com/profile_banners/1258577758218788867/1720965527,Fri May 08 02:01:48 +0000 2020,Don’t fuck with the USA 🇺🇸,,,,,,,,,,,,,,,,,,,,,,,,,,0,163858,172619,69850,False,1258577758218788867,True,False,False,The twilight zone ,19617,One Bad Dude,1.8627231428602803e+18,False,https://pbs.twimg.com/profile_images/1682550449923031042/T5QYzwSK_normal.jpg,,174019,https://twitter.com/OneBadDude_,user,https://x.com/OneBadDude_,OneBadDude_,,"@PeteButtigieg @KamalaHarris We are never going back to being lapdogs for your corrupt system.
We have been awoken and have had enough!
Donald Trump will win.",Sun Nov 03 21:32:10 +0000 2024,0.07500000000000001,Support
https://pbs.twimg.com/profile_images/1726722240748662784/2BjaL8mX_bigger.jpg,Conservative 🇺🇸,https://twitter.com/ConservativeOG,DeepLink,Badge,BusinessLabel,True,True,https://pbs.twimg.com/profile_banners/46302096/1732430676,Thu Jun 11 03:20:36 +0000 2009,Saving Western Civilization is the only option.,,,,,,,,,,,,,,,,,,,,,,,,,,0,46154,580324,1380,True,46302096,True,False,False,United States,1163,Joey Mannarino,1.8618244601326922e+18,False,https://pbs.twimg.com/profile_images/1845154075307921409/iWe4CY61_normal.jpg,,9241,https://twitter.com/JoeyMannarinoUS,user,https://x.com/JoeyMannarinoUS,JoeyMannarinoUS,,"Italians For Trump - right in the middle of South Philadelphia!

We are going to have a massive win if we get all the votes out and bring our friends to the polls!

You could NEVER hold a MAGA gathering down here four years ago!

MAKE AMERICA GREAT AGAIN! 🇺🇸 https://t.co/EXkA54UFET",Sun Nov 03 21:28:16 +0000 2024,0.3485449735449735,Support
,,,,,,False,False,https://pbs.twimg.com/profile_banners/2348781198/1715037283,Mon Feb 17 17:07:04 +0000 2014,"proud latino
21 year old male
az fella

known in some parks as misterrcoolio or bravercoolio(4)",,,,,,,,,,,,,,,,,,,,,,,,,,0,138394,4064,938,True,2348781198,False,False,False,"somewhere, az",3611,obamaatredrobin,1.7782771744219958e+18,False,https://pbs.twimg.com/profile_images/1601056077570707456/BQ8ZrGST_normal.jpg,,20275,https://twitter.com/obamaatredrobin,user,https://x.com/obamaatredrobin,obamaatredrobin,,"so applying the same error gets you trump +3 in iowa... mind you he won by +8 in 2020, this is not the win you think it is!",Sun Nov 03 21:27:10 +0000 2024,0.5,Support
,,,,,,False,False,https://pbs.twimg.com/profile_banners/883069589722198018/1704398908,Thu Jul 06 21:06:11 +0000 2017,"Fighting for our way of life. This is my campaign account. If you were looking for my House of Representatives account, please visit @RepPeteStauber.",,,,,,,,,,,,,,,,,,,,,petestauberforcongress.com,https://petestauberforcongress.com,0.0,23.0,https://t.co/nyZRyh11VT,0,134,8627,112,False,883069589722198018,False,False,False,"Duluth, MN",1961,Pete Stauber,,False,https://pbs.twimg.com/profile_images/1300209854351650816/QQeGOoXE_normal.jpg,,3850,https://twitter.com/PeteStauber,user,https://x.com/PeteStauber,PeteStauber,,North Branch is fired up for Trump. We are ready to put an end to Harris-Biden skyrocketing prices and open borders. Make your voice heard. Make a plan to vote. We win IF we vote. https://t.co/4D8PKPJr2D,Sun Nov 03 21:26:20 +0000 2024,0.3333333333333333,Support
https://pbs.twimg.com/profile_images/1726722240748662784/2BjaL8mX_bigger.jpg,Conservative 🇺🇸,https://twitter.com/ConservativeOG,DeepLink,Badge,BusinessLabel,True,True,https://pbs.twimg.com/profile_banners/537709549/1696882383,Tue Mar 27 00:53:56 +0000 2012,Investigative Journalist 🇺🇸 Free Spirit🇺🇸Founder of LOOMERED. Host of @LoomerUnleashed Former @Project_Veritas operative. 📸 America First ✡️ Feisty Jewess,,,,,,,,,,,,,,,,,,,,,loomered.com,http://loomered.com,0.0,23.0,https://t.co/TlkQhmcPoR,0,109081,1390572,6990,True,537709549,True,False,False,Florida ,12702,Laura Loomer,1.8532275760612808e+18,False,https://pbs.twimg.com/profile_images/1751805801520332800/WIWv-QP2_normal.jpg,,78740,https://twitter.com/LauraLoomer,user,https://x.com/LauraLoomer,LauraLoomer,,"WATCH:

Barack Obama’s former campaign manager told @jrpsaki that he’s scared over the early voting numbers…

That’s because early voting has been overwhelmingly in favor of President Trump.

Trump is going to win. Get out and vote. 

Vote like your life depends on it. #Trump2024",Sun Nov 03 21:20:54 +0000 2024,0.3,Support
,,,,,,False,False,https://pbs.twimg.com/profile_banners/16028034/1578836879,Thu Aug 28 15:15:41 +0000 2008,✈️ Award Winning Podcast Comedian. Writer for HBO’s Game Theory w/ Bomani Jones. The Black Guy Who Tips Podcast co-hosted with my wife @saydatagain #TBGWT,,,,,,,,,,,,,,,,,,,,,theblackguywhotips.com,http://theblackguywhotips.com,0.0,23.0,https://t.co/TdxiNHX98f,0,256,41325,928,True,16028034,False,False,False,I'm Not Cookies Yet.,9258,Rod,1.8545957564489526e+18,False,https://pbs.twimg.com/profile_images/1856756424748957696/AVxwRQPo_normal.jpg,,162058,https://twitter.com/rodimusprime,user,https://x.com/rodimusprime,rodimusprime,,Another reason we need Trump to lose is that we can’t let America be a country so easily manipulated by tech bros and social media companies. They win this and it’s over for all us.,Sun Nov 03 21:19:11 +0000 2024,0.4222222222222222,Support
,,,,,,False,True,https://pbs.twimg.com/profile_banners/279691545/1522202013,Sat Apr 09 20:20:22 +0000 2011,"Psychologist. Author. College Professor. Media Commentator. Private School Owner. Wow, that sounds exhausting. #TheResistance #MAGAtsBlocked",,,,,,,,,,,,,,,,,,,,,,,,,,0,643639,49475,42479,True,279691545,False,False,False,,4342,Dr. David A. Lustig,,False,https://pbs.twimg.com/profile_images/1305919790/image_normal.jpg,,32380,https://twitter.com/drdave1999,user,https://x.com/drdave1999,drdave1999,,"So, here’s what’s likely coming.

Kamala Harris will win the popular vote by a bigger margin than Hillary, but because of the EC, Trump will remain viable.

Republicans plan to steal the election by refusing to certify the results in red states, &amp; leave the decision up to SCOTUS.",Sun Nov 03 21:14:54 +0000 2024,0.27999999999999997,Support
,,,,,,False,False,https://pbs.twimg.com/profile_banners/334715818/1720932541,Wed Jul 13 15:14:49 +0000 2011,Co-host of @clayandbuck nationwide 12-3pm ET @iheartradio on 500 stations. Ex CIA.,,,,,,,,,,,,,,,,,,,,,bucksexton.com,http://bucksexton.com,0.0,23.0,https://t.co/QzE4gv9BAa,0,28174,1196103,1511,True,334715818,True,False,False,"Miami, FL",1172,Buck Sexton,,False,https://pbs.twimg.com/profile_images/1828057539512082432/D86fzajw_normal.jpg,,13123,https://twitter.com/BuckSexton,user,https://x.com/BuckSexton,BuckSexton,,"Trump is going to win. 

All that other stuff you’re hearing is noise. 

Go vote.",Sun Nov 03 21:09:10 +0000 2024,0.3375,Support
,,,,,,True,True,https://pbs.twimg.com/profile_banners/944834233591242752/1707761723,Sun Dec 24 07:36:50 +0000 2017,☦️ 🇦🇺 Crypto #Bitcoin,,,,,,,,,,,,,,,,,,,,,,,,,,0,64357,4288,3135,False,944834233591242752,True,False,False,"Melbourne, Victoria",4135,Wombat,,False,https://pbs.twimg.com/profile_images/1837225082483265536/43usbrzI_normal.jpg,,41397,https://twitter.com/crypticwombat86,user,https://x.com/crypticwombat86,crypticwombat86,,@BRICSinfo lol Most of the world wants Trump to win,Sun Nov 03 21:09:03 +0000 2024,0.575,Support
https://pbs.twimg.com/profile_images/1726722240748662784/2BjaL8mX_bigger.jpg,Conservative 🇺🇸,https://twitter.com/ConservativeOG,DeepLink,Badge,BusinessLabel,True,True,https://pbs.twimg.com/profile_banners/1759770843544989696/1718062591,Tue Feb 20 02:44:12 +0000 2024,"Political Analyst | Writer | Strategist | Commentator 
Creative Lead | Brother in Arms - @OwenShroyer1776
CEO of WIN World Independent News",,,,,,,,,,,,,,,,,,,,,owenshroyer.live,http://owenshroyer.live,0.0,23.0,https://t.co/zoA4ElVtQh,0,27809,27870,447,False,1759770843544989696,True,False,False,"MO, TX - United States",1300,Dominic Michael Tripi,1.86267870247304e+18,False,https://pbs.twimg.com/profile_images/1799163330826829824/M8WEbspJ_normal.jpg,,12455,https://twitter.com/DMichaelTripi,user,https://x.com/DMichaelTripi,DMichaelTripi,,"After a tumultuous 48 hours across prediction markets, Donald Trump is now again the favorite to win the presidency on @Kalshi. https://t.co/0DPtKhq5pV",Sun Nov 03 21:01:58 +0000 2024,0.65,Support
,,,,,,False,False,https://pbs.twimg.com/profile_banners/1614879930885574656/1714610570,Mon Jan 16 06:59:28 +0000 2023,"Innovation, Technology, Rockets & Tesla ignite my passion. Host of The Story Book. Sharing updates & info 24/7. Breaking World News! Motivation & Fun guaranteed",,,,,,,,,,,,,,,,,,,,,,,,,,0,35500,50447,472,False,1614879930885574656,True,False,False,,3554,SMX 🇺🇸,1.8615896646179187e+18,False,https://pbs.twimg.com/profile_images/1785421156859719680/gSkjB7g7_normal.jpg,,25734,https://twitter.com/iam_smx,user,https://x.com/iam_smx,iam_smx,,"If Trump doesn't win, Humanity will never reach the Moon or Mars, a vote for Trump is a vote for Moon and Mars, So Vote! 🚀

And this will be real:

""We gonna go to the Moon, we gonna have a base on the Moon, we gonna send people to Mars and make life multiplanetary""

-Elon Musk https://t.co/fc4Vp42LBn",Sun Nov 03 21:00:15 +0000 2024,0.1333333333333333,Support
,,,,,,True,True,https://pbs.twimg.com/profile_banners/1722330307892744192/1711821919,Wed Nov 08 19:08:49 +0000 2023,Crypto invest since 2018 / BingX partner 👉 https://t.co/lkxQEdZLSK $500 bonus,bingx.com/invite/C3WHTR/,https://bingx.com/invite/C3WHTR/,43.0,66.0,https://t.co/lkxQEdZLSK,,,,,,,,,,,,,,,,t.me/SenseiCommu,http://t.me/SenseiCommu,0.0,23.0,https://t.co/3ZoXdbzIQR,0,3578,70772,149,False,1722330307892744192,True,False,False,,9905,Sensei,1.8633612364542487e+18,False,https://pbs.twimg.com/profile_images/1768669945192136704/eImtL3gp_normal.jpg,,46203,https://twitter.com/SenseiBR_btc,user,https://x.com/SenseiBR_btc,SenseiBR_btc,,"🚨 BIG BREAKING

DONALD TRUMP LIKELY TO WIN U.S 🇺🇸 ELECTIONS BY LAND SLIDE VICTORY . https://t.co/gUPw6gtGbS",Sun Nov 03 20:58:49 +0000 2024,0.26666666666666666,Support
,,,,,,True,False,https://pbs.twimg.com/profile_banners/1089308757035794432/1722113100,Sat Jan 26 23:47:00 +0000 2019,"Content Creator, Political Strategist, Zoomer, Conservative, National Populist, Orthodox Christian 🇦🇲☦️, #AmericaFirst 🇺🇸 #Trump2024 🍊",,,,,,,,,,,,,,,,,,,,,youtube.com/channel/UC0SMG…,https://www.youtube.com/channel/UC0SMGmU6X9zJBGCGarr7ODQ?view_as=subscriber,0.0,23.0,https://t.co/wTJqTa8B8U,0,32042,101908,811,True,1089308757035794432,True,False,False,DET/DFW,906,Red Eagle Politics,1.8540493551474243e+18,False,https://pbs.twimg.com/profile_images/1837973789495136256/RfWEZNvU_normal.jpg,,12747,https://twitter.com/RedEaglePatriot,user,https://x.com/RedEaglePatriot,RedEaglePatriot,,"Nevada is one of the most pro-abortion states in the nation, even moreso than California. And it’s on the ballot there.

And Trump is on track to win it, which is why I don’t see the rust belt defecting over Dobbs, especially w/Trump as the nominee. I’ll believe it when I see it!",Sun Nov 03 20:56:41 +0000 2024,0.43333333333333335,Support
,,,,,,False,True,https://pbs.twimg.com/profile_banners/1785952634337431552/1716388918,Thu May 02 08:41:14 +0000 2024,"Welcome to the Official X Account for $MAGA Coin 🇺🇸 

#MAGA hat stays on",,,,,,,,,,,,,,,,,,,,,magacoin.com,https://magacoin.com,0.0,23.0,https://t.co/e4feeUKKac,0,14070,34179,345,False,1785952634337431552,True,False,False,MAGA,1596,MAGA Coin,1.8493347310386954e+18,False,https://pbs.twimg.com/profile_images/1791134452690923520/s4T-A-mF_normal.jpg,,3152,https://twitter.com/MAGACoinX,user,https://x.com/MAGACoinX,MAGACoinX,Business,@cb_doge Trump will win—with his red MAGA hat on! 😉🇺🇸 https://t.co/38JcQ42TJx,Sun Nov 03 20:56:09 +0000 2024,0.0,Support
https://pbs.twimg.com/profile_images/1617634745348661249/6YmPYpNd_bigger.jpg,CBS News,https://twitter.com/CBSNews,DeepLink,Badge,BusinessLabel,False,True,https://pbs.twimg.com/profile_banners/205392468/1581696091,Wed Oct 20 19:37:47 +0000 2010,"Moderated by @margbrennan of @CBSNews, we are America's #1 Sunday morning public affairs show |  📸 IG: @facethenation",,,,,,,,,,,,,,,,,,,,,facethenation.com,http://facethenation.com,0.0,23.0,https://t.co/eAU2JMPdV1,0,1150,518420,1496,True,205392468,True,False,False,"Washington, DC",18655,Face The Nation,,False,https://pbs.twimg.com/profile_images/1591191757693280256/XAVM86-A_normal.jpg,,51084,https://twitter.com/FaceTheNation,user,https://x.com/FaceTheNation,FaceTheNation,Business,"When asked if the Democratic Party has an issue with talking down to working class voters, after Republicans accused President Biden of calling Trump supporters ""garbage,"" @SenCortezMasto (D-NV) says, ""Kamala Harris made it very clear, moving forward, that she wants to represent everyone, right? No matter whether you voted for her or not.""",Sun Nov 03 17:10:46 +0000 2024,0.11503968253968254,Support
,,,,,,False,False,https://pbs.twimg.com/profile_banners/1178862134110765056/1691036962,Tue Oct 01 02:40:25 +0000 2019,"Just me, my thoughts and opinions with a side of fries 🍟 💜",,,,,,,,,,,,,,,,,,,,,,,,,,0,144037,87633,5645,True,1178862134110765056,True,False,False,,10500,Christy 💕🇨🇦🇺🇸,1.8633968595424788e+18,False,https://pbs.twimg.com/profile_images/1811465670183596032/ea8kGiMB_normal.jpg,,99136,https://twitter.com/Christy4Change,user,https://x.com/Christy4Change,Christy4Change,,"Democratic Party:

- Endorsements by P Diddy’s friends.

- Squirrel killers.

- Kamala calling young supporters stupid.

- Screaming in baby’s faces.

So we all agree that if Donald Trump doesn’t win it was stolen again, right?",Sun Nov 03 17:03:13 +0000 2024,0.09642857142857145,Support
