,,,,,,True,True,https://pbs.twimg.com/profile_banners/1190347566757695488/1728035118,Fri Nov 01 19:19:20 +0000 2019,☕️ https://t.co/lxtbRwTMwv 🇺🇦PayPal: maksmu24@ukr.net 👀 https://t.co/rMYZMXe53H 🆕 https://t.co/eizSKe8HgU,buymeacoffee.com/MAKS22,http://buymeacoffee.com/MAKS22,3.0,26.0,https://t.co/lxtbRwTMwv,patreon.com/Maks24,http://patreon.com/Maks24,56.0,79.0,https://t.co/rMYZMXe53H,ko-fi.com/maks24,https://ko-fi.com/maks24,82.0,105.0,https://t.co/eizSKe8HgU,,,,,,,,,,,0,192337,257155,6997,True,1190347566757695488,True,False,False,"Україна (Vinnytsia, Ukraine) ",26854,MAKS 24 🇺🇦👀,1.8629062290743135e+18,False,https://pbs.twimg.com/profile_images/1670567121082892290/gDMFkzgx_normal.jpg,,68271,https://twitter.com/Maks_NAFO_FELLA,user,https://x.com/Maks_NAFO_FELLA,Maks_NAFO_FELLA,,"🤔 Inside Russia’s elite there is a growing expectation that Donald Trump will win and that if he does, there could be a chance to end the war with Ukraine on Moscow’s terms and potentially redraw the global security map, - WP

❗️""Investors expect that Trump will be elected."" https://t.co/PZolkox4BY",Sun Nov 03 19:06:57 +0000 2024,0.26666666666666666,Support
,,,,,,True,True,https://pbs.twimg.com/profile_banners/1711592665048125440/1703140517,Tue Oct 10 04:01:47 +0000 2023,"AAT

Against 
All
Tories

self employed hard working",,,,,,,,,,,,,,,,,,,,,,,,,,0,75694,1144,849,False,1711592665048125440,False,False,False,,11493,king of the west II,1.745150162706793e+18,False,https://pbs.twimg.com/profile_images/1751746617575981056/a05JQn2v_normal.jpg,,34060,https://twitter.com/meco78526,user,https://x.com/meco78526,meco78526,,"Mycockskin hyping up a trump win by cherrypicking polls &amp; saying others that have Harris winning are within the margin of error.

Meanwhile 

who dresses this cunt

Katie? https://t.co/1dfmQG2pwp",Sun Nov 03 19:06:27 +0000 2024,0.65,Support
,,,,,,True,False,https://pbs.twimg.com/profile_banners/890061634181373952/1613522799,Wed Jul 26 04:10:04 +0000 2017,Co-Owner of Trending Politics | Investor | American 🇺🇸,,,,,,,,,,,,,,,,,,,,,trendingpoliticsnews.com,https://trendingpoliticsnews.com,0.0,23.0,https://t.co/MbpH1fNere,0,7031,1655223,575,True,890061634181373952,True,False,False,United States,6380,Collin Rugg,1.854048223456809e+18,False,https://pbs.twimg.com/profile_images/1325087660428447746/4DL2iq76_normal.jpg,,21418,https://twitter.com/CollinRugg,user,https://x.com/CollinRugg,CollinRugg,,"If you haven't already, please be sure you confirm your vote on the Trump campaign portal.

Every vote must count.

Let's win this!
https://t.co/irI88nsJXV",Sun Nov 03 19:01:49 +0000 2024,0.75,Support
,,,,,,True,True,https://pbs.twimg.com/profile_banners/1205226529455632385/1635793476,Thu Dec 12 20:43:08 +0000 2019,"""You cannot escape the responsibility of tomorrow by evading it today.” – Abraham Lincoln 🏴‍☠️ | Home of #TheBreakdown and LP Podcast",,,,,,,,,,,,,,,,,,,,,lincolnproject.us,http://www.lincolnproject.us,0.0,23.0,https://t.co/JiRJNfBKmV,0,21460,2836085,1108,True,1205226529455632385,True,False,False,The United States of America,17178,The Lincoln Project,1.8617303626171558e+18,False,https://pbs.twimg.com/profile_images/1830963641375449089/HOt1ARpN_normal.jpg,,46658,https://twitter.com/ProjectLincoln,user,https://x.com/ProjectLincoln,ProjectLincoln,,"Better men than Trump have threatened our Democracy before, and this Tuesday Democracy will win again. https://t.co/HL47JiqZDQ",Sun Nov 03 19:00:00 +0000 2024,0.65,Support
,,,,,,False,False,https://pbs.twimg.com/profile_banners/42698622/1698987227,Tue May 26 19:30:18 +0000 2009,"Revolutionary.
Fellow, Brownstone Institute.
Substacker.
""Stopping the iatrogenocide is the defining issue of our era.""",,,,,,,,,,,,,,,,,,,,,tobyrogers.substack.com,http://tobyrogers.substack.com,0.0,23.0,https://t.co/olrmaUqERX,0,109784,73502,12787,True,42698622,True,False,False,"Austin, TX",999,Toby Rogers,1.1408040830134436e+18,False,https://pbs.twimg.com/profile_images/1169770791124131840/Xw5RBqVY_normal.jpg,,36355,https://twitter.com/uTobian,user,https://x.com/uTobian,uTobian,,"My predictions for Tuesday: 

Trump will win the popular vote by 5% and the electoral college in a landslide. Republicans will also take the House and Senate. 

What are your predictions?",Sun Nov 03 18:55:48 +0000 2024,0.7,Support
,,,,,,False,True,https://pbs.twimg.com/profile_banners/24530041/1433279560,Sun Mar 15 14:30:58 +0000 2009,"Executive Chairman, @navltd",,,,,,,,,,,,,,,,,,,,,navltd.com,http://www.navltd.com,0.0,23.0,https://t.co/i3phhiBdc7,0,249,8280,442,False,24530041,True,False,False,Canada,178,Jaime Watt,1.6541331599009874e+18,False,https://pbs.twimg.com/profile_images/1500881304497401860/OkV3kGjg_normal.jpg,,1585,https://twitter.com/jaimewatt,user,https://x.com/jaimewatt,jaimewatt,,"I hate to say it...but I think Donald Trump is going to win on Tuesday night.

For my latest in the Star, I break down the three things that will ultimately drive what I predict will be a decisive victory for the former president.

https://t.co/AV8YGaziDG",Sun Nov 03 18:49:29 +0000 2024,0.05740740740740741,Support
,,,,,,True,True,https://pbs.twimg.com/profile_banners/763094579491008512/1651332472,Tue Aug 09 19:28:20 +0000 2016,Assistant News Director @FLVoiceNews | Marylander-turned-Floridian | Politics & breaking news alerts | https://t.co/55cqQGUClp,flvoicenews.com,http://flvoicenews.com,103.0,126.0,https://t.co/55cqQGUClp,,,,,,,,,,,,,,,,ericdaugherty.net,http://ericdaugherty.net,0.0,23.0,https://t.co/9JrzFB6FPm,0,62720,252053,1145,True,763094579491008512,True,False,False,,5044,Eric Daugherty,1.8618514445564646e+18,False,https://pbs.twimg.com/profile_images/1823491411934633984/eY6C-778_normal.png,,25854,https://twitter.com/EricLDaugh,user,https://x.com/EricLDaugh,EricLDaugh,,"To be frank, an ""overall tossup"" election according to the polls pretty much means the people predicting a Harris + Trump win all have sufficient datapoints to make their argument (though, I PERSONALLY think we are in lean/likely Trump territory).

The bar is so low when it's IOWA.",Sun Nov 03 18:44:20 +0000 2024,0.20833333333333334,Support
,,,,,,False,True,https://pbs.twimg.com/profile_banners/1560341081576939524/1681050926,Thu Aug 18 19:01:35 +0000 2022,It’s always darkest just before the dawn. MARRIED.. No Dms.,,,,,,,,,,,,,,,,,,,,,,,,,,0,36288,746329,1907,True,1560341081576939524,True,False,False,,9518,Insurrection Barbie,1.8470899544487242e+18,False,https://pbs.twimg.com/profile_images/1842740427872522240/X0Sggcwq_normal.jpg,,411299,https://twitter.com/DefiyantlyFree,user,https://x.com/DefiyantlyFree,DefiyantlyFree,,"When Donald Trump won in 2016, 19 minutes after his inauguration, the Washington Post wrote an article about plans for impeachment proceedings. 

In 2024, they’re not even waiting for Donald Trump to win, Democrats in the House of Representatives are already drafting impeachment proceedings.

You tell me who is a danger to democracy that has weaponized every institution in America against the American citizens.",Sun Nov 03 18:44:18 +0000 2024,0.4,Support
,,,,,,True,True,https://pbs.twimg.com/profile_banners/195203803/1659576460,Sun Sep 26 02:38:40 +0000 2010,Michigan business owner! Founder/CEO of https://t.co/0i6JqmEURc and Metro Detroit Golfers. Former sports radio and television guy.,MakeTheTurn.com,http://MakeTheTurn.com,40.0,63.0,https://t.co/0i6JqmEURc,,,,,,,,,,,,,,,,,,,,,0,18571,32406,948,True,195203803,True,False,False,All Over Metro Detroit,2722,Mike Sullivan,1.8400864511715246e+18,False,https://pbs.twimg.com/profile_images/1784964919093305344/aSVseupx_normal.jpg,,24290,https://twitter.com/MikeSullivan,user,https://x.com/MikeSullivan,MikeSullivan,,"Trump will win Michigan. He has a ton of support here, despite what the media says.",Sun Nov 03 18:43:35 +0000 2024,0.8,Support
https://pbs.twimg.com/profile_images/1697645380740034567/2GcYMCWS_bigger.jpg,Rebellionaire,https://twitter.com/Rebellionair3,DeepLink,Badge,BusinessLabel,False,False,https://pbs.twimg.com/profile_banners/874776246592430080/1727545416,Tue Jun 13 23:51:24 +0000 2017,"Physics engineer here for the progress of disruptive innovations and ventures
Elon Musk picked my 𝕏 logo design for 𝕏
All-in $TSLA since 08/2019",,,,,,,,,,,,,,,,,,,,,tesla.com/referral/alexa…,https://www.tesla.com/referral/alexandre24448,0.0,23.0,https://t.co/6jphQOQLxF,0,179967,173384,605,True,874776246592430080,True,False,False,𝕏 🇨🇦 🇧🇷 🇭🇷 ,10085,ALEX,,False,https://pbs.twimg.com/profile_images/1515410865499119620/s1ws6CFZ_normal.jpg,,50234,https://twitter.com/ajtourville,user,https://x.com/ajtourville,ajtourville,,"First, they said a Trump win would hurt Tesla

Now, they say a Trump defeat would hurt Tesla

I say: Tesla will do great and Trump will win! https://t.co/SqA15DcLR5",Sun Nov 03 18:40:51 +0000 2024,0.7125,Support
,,,,,,True,False,https://pbs.twimg.com/profile_banners/2560485954/1722938996,Wed Jun 11 03:53:45 +0000 2014,Perpetual Student l @TheParagonGrp,,,,,,,,,,,,,,,,,,,,,Youtube.com/@DocXBT,http://Youtube.com/@DocXBT,0.0,23.0,https://t.co/Ekm9h5w1cZ,0,45768,30766,212,True,2560485954,True,False,False,Live on Mondays @ 17:00 UTC:,5229,Doc,1.6278958921150628e+18,False,https://pbs.twimg.com/profile_images/1856855114071642114/AQacNJ0D_normal.jpg,,18793,https://twitter.com/docXBT,user,https://x.com/docXBT,docXBT,,Trump win but no breakout would be the most crypto thing ever.,Sun Nov 03 18:33:34 +0000 2024,0.65,Support
,,,,,,True,True,https://pbs.twimg.com/profile_banners/47063142/1545205948,Sun Jun 14 09:07:42 +0000 2009,"I research metro policy and civil rights, focused on housing and schools. Proud member of Do-Something Twitter.",,,,,,,,,,,,,,,,,,,,,,,,,,0,14376,89604,494,True,47063142,True,False,False,"Minneapolis, Minnesota",7850,Will Stancil,1.7954712057276746e+18,False,https://pbs.twimg.com/profile_images/1846945269855731712/HsHYC60H_normal.jpg,,127218,https://twitter.com/whstancil,user,https://x.com/whstancil,whstancil,,"Trump could absolutely still win but they’ve suddenly become very aware that they could easily lose, and if they do lose, I hope Democrats have learned a lesson about accommodationism versus accountability. Make them pay this time",Sun Nov 03 18:33:02 +0000 2024,0.3516666666666667,Support
,,,,,,True,True,https://pbs.twimg.com/profile_banners/47063142/1545205948,Sun Jun 14 09:07:42 +0000 2009,"I research metro policy and civil rights, focused on housing and schools. Proud member of Do-Something Twitter.",,,,,,,,,,,,,,,,,,,,,,,,,,0,14376,89604,494,True,47063142,True,False,False,"Minneapolis, Minnesota",7850,Will Stancil,1.7954712057276746e+18,False,https://pbs.twimg.com/profile_images/1846945269855731712/HsHYC60H_normal.jpg,,127218,https://twitter.com/whstancil,user,https://x.com/whstancil,whstancil,,"Trump’s campaign is imploding, and his top backers are descending into mania because they gambled that he would win and they would become de facto immune to all laws and norms and conducted themselves accordingly",Sun Nov 03 18:29:34 +0000 2024,0.65,Support
,,,,,,False,True,https://pbs.twimg.com/profile_banners/1560341081576939524/1681050926,Thu Aug 18 19:01:35 +0000 2022,It’s always darkest just before the dawn. MARRIED.. No Dms.,,,,,,,,,,,,,,,,,,,,,,,,,,0,36288,746329,1907,True,1560341081576939524,True,False,False,,9518,Insurrection Barbie,1.8470899544487242e+18,False,https://pbs.twimg.com/profile_images/1842740427872522240/X0Sggcwq_normal.jpg,,411299,https://twitter.com/DefiyantlyFree,user,https://x.com/DefiyantlyFree,DefiyantlyFree,,"Understand the reason they are flooding the media narrative with the idea that Kamala Harris could win, and that outlier Iowa poll, is to prep America for the color revolution that they will wage Donald Trump wins. 

Half of the battle is knowing their plans and calling them out.",Sun Nov 03 18:24:13 +0000 2024,0.31111111111111117,Support
,,,,,,True,True,https://pbs.twimg.com/profile_banners/1332109767339175936/1729054308,Thu Nov 26 23:52:11 +0000 2020,I exist and so does my wife.,,,,,,,,,,,,,,,,,,,,,mydoge.com/santadecides,https://mydoge.com/santadecides,0.0,23.0,https://t.co/9wwJ6EXYm4,0,113962,405083,6372,True,1332109767339175936,True,False,False,"Oklahoma, USA",7677,Santa Decides,1.8625396033343652e+18,False,https://pbs.twimg.com/profile_images/1602144983393439745/jFWoP6zS_normal.jpg,,46923,https://twitter.com/SantaDecides,user,https://x.com/SantaDecides,SantaDecides,,"“Likes are easier to get than reposts” “This was rigged for Trump to win” 

I know right. 😂",Sun Nov 03 18:23:48 +0000 2024,0.5428571428571429,Support
,,,,,,True,False,https://pbs.twimg.com/profile_banners/756914082523979776/1641411326,Sat Jul 23 18:09:14 +0000 2016,"Ph.D. student at Kansas State University. 
Publisher of Free State Kansas 🌻 I try to ask good questions, find answers, and be open to new possibilities.",,,,,,,,,,,,,,,,,,,,,,,,,,0,46688,44627,281,True,756914082523979776,True,False,False,Judicial District of Kansas ⛓,2817,🇺🇸,1.7267046342561262e+18,False,https://pbs.twimg.com/profile_images/1854568597651070986/NryKUIDw_normal.jpg,,28913,https://twitter.com/FreeStateWill,user,https://x.com/FreeStateWill,FreeStateWill,,"I don't want Trump to barely win or only sweep the swing states. I want Trump to dominate the popular vote. I want forgotten American's to flood the polls to save freedom. I want Trump to take states like Oregon, Colorado, Maine, New Jersey, New Mexico, and Minnesota! VOTE!",Sun Nov 03 18:23:44 +0000 2024,0.2915719696969697,Support
,,,,,,False,True,https://pbs.twimg.com/profile_banners/1731447196455989248/1706896491,Sun Dec 03 22:56:06 +0000 2023,"2WAY is dedicated to offering a live, interactive, and independent platform, where free thinkers can access factual, comprehensive, and live unbiased views.",,,,,,,,,,,,,,,,,,,,,hoo.be/2waytvapp,https://hoo.be/2waytvapp,0.0,23.0,https://t.co/CwTzOEyELA,0,282,36017,248,False,1731447196455989248,True,False,False,,442,2WAY,1.8615908820610337e+18,False,https://pbs.twimg.com/profile_images/1752892992657223680/lAeuiOri_normal.jpg,,825,https://twitter.com/2waytvapp,user,https://x.com/2waytvapp,2waytvapp,,"Mark Halperin talks to the highly respected independent pollster J Ann Selzer about her new Iowa poll which shows a surprise lead for Kamala Harris in the Hawkeye State, which had been expected to be an easy Trump win https://t.co/B5UcymF2IL
#Trump #Harris @2waytvapp",Sun Nov 03 18:14:39 +0000 2024,0.2382828282828283,Support
,,,,,,False,True,https://pbs.twimg.com/profile_banners/1685379271303278595/1727295461,Sat Jul 29 19:58:38 +0000 2023,Jesus Is King. Air Force. AlphaVets Podcast on Rumble. Make America Great Again.,,,,,,,,,,,,,,,,,,,,,rumble.com/user/AlphaVets,https://rumble.com/user/AlphaVets,0.0,23.0,https://t.co/wQaIu1aAge,0,9742,6914,1219,False,1685379271303278595,True,False,False,"North Carolina, USA",1488,Chris,,False,https://pbs.twimg.com/profile_images/1839877283261067264/SVUCKD0w_normal.jpg,,10462,https://twitter.com/Dunbizz47,user,https://x.com/Dunbizz47,Dunbizz47,,"Pay no attention to ANYONE saying that Trump is going to lose. He is going to win. It's what happens after. We need to pray!! The enemy is going to do everything in It's power to put a witch in the White House!!

Pray that it is dismantled so that there will be no more corruption in the White House!!

Kim told us what was going to happen 10 years ago. Pray! Pray!

We need our Father in Heaven to heal our land and bring back righteousness!!

🙏🇺🇲",Sun Nov 03 18:14:35 +0000 2024,0.15,Support
,,,,,,True,True,https://pbs.twimg.com/profile_banners/810055220/1658200158,Sat Sep 08 02:57:01 +0000 2012,Constitutional Conservative | BREAKING NEWS & Political Commentary | Proud American 🇺🇸,,,,,,,,,,,,,,,,,,,,,linktr.ee/proudelephantus,https://linktr.ee/proudelephantus,0.0,23.0,https://t.co/OUlE6RDFJT,0,125052,448277,26702,True,810055220,True,False,False,United States,23621,Proud Elephant 🇺🇸🦅,1.856523702600393e+18,False,https://pbs.twimg.com/profile_images/1551428646539247616/TBTANEZw_normal.jpg,,126084,https://twitter.com/ProudElephantUS,user,https://x.com/ProudElephantUS,ProudElephantUS,,President Trump is going to WIN Iowa — and it won’t even be close!!! 🇺🇸 https://t.co/dKpOANeWWF,Sun Nov 03 18:14:21 +0000 2024,1.0,Support
,,,,,,True,False,https://pbs.twimg.com/profile_banners/2199020853/1725718101,Thu Nov 28 09:32:17 +0000 2013,"Co-Leader of Britain First, the UK’s fastest growing patriotic and nationalist political party:  @BFirstParty Registered with the Electoral Commission.",,,,,,,,,,,,,,,,,,,,,britainfirst.org,http://www.britainfirst.org,0.0,23.0,https://t.co/6brDvdfvLp,0,3002,158524,261,False,2199020853,True,False,False,"Salford, England",5193,Ashlea Simon,1.862201179469472e+18,False,https://pbs.twimg.com/profile_images/1725980213425721344/RrVvDmyU_normal.jpg,,10188,https://twitter.com/AshleaSimonBF,user,https://x.com/AshleaSimonBF,AshleaSimonBF,,"The US presidential election takes place on Tuesday, who’s your money on to win?

TRUMP?

Or 

HARRIS?",Sun Nov 03 18:11:27 +0000 2024,0.8,Support
,,,,,,True,False,https://pbs.twimg.com/profile_banners/17980523/1723738910,Tue Dec 09 01:54:21 +0000 2008,"CEO of YourVoice™ Studios, Inc.  Host of YourVoice America.  This account is owned and managed by Bill Mitchell and has no direct affiliation with Donald Trump.",,,,,,,,,,,,,,,,,,,,,yourvoicenews.com,https://www.yourvoicenews.com,0.0,23.0,https://t.co/fXjbL2Wzv7,0,38910,444969,14166,True,17980523,True,False,False,Virginia,18029,Bill Mitchell,1.863167948543742e+18,False,https://pbs.twimg.com/profile_images/1667984522732773376/e8R6vMh9_normal.jpg,,266704,https://twitter.com/mitchellvii,user,https://x.com/mitchellvii,mitchellvii,,Are you ready for a BIG Trump win?  Are you feelin' it? https://t.co/lQ15hpehmp,Sun Nov 03 18:10:50 +0000 2024,0.3333333333333333,Support
,,,,,,True,True,https://pbs.twimg.com/profile_banners/19268325/1732162965,Wed Jan 21 00:57:23 +0000 2009,"Even in the deepest shadows, light will always prevail

#",,,,,,,,,,,,,,,,,,,,,,,,,,0,36775,33043,1102,True,19268325,True,False,False,"40,000ft",3296,SquawK,1.8541976954826345e+18,False,https://pbs.twimg.com/profile_images/1848701364563517440/l1M9QoLJ_normal.jpg,,16400,https://twitter.com/Squawk55,user,https://x.com/Squawk55,Squawk55,,"JD Vance 👀

 ""I want to go hang out with Hunter Biden....I would bet $100 that Hunter Biden is voting for Donald Trump.... 

...Joe Biden is trying to help Donald trump. After we win, I'm going to be convinced that Joe Biden was trying to help up us the whole time."" https://t.co/7Q31QKcYaN",Sun Nov 03 18:08:56 +0000 2024,0.5,Support
,,,,,,True,False,https://pbs.twimg.com/profile_banners/1290635110149169152/1729643521,Tue Aug 04 13:06:13 +0000 2020,Populist news & wizardly election coverage 🇺🇸,,,,,,,,,,,,,,,,,,,,,,,,,,0,33173,546707,3862,True,1290635110149169152,True,False,False,The Swamp,5472,Election Wizard,1.862177030269264e+18,False,https://pbs.twimg.com/profile_images/1814504045500887040/FAtbsU80_normal.jpg,,54996,https://twitter.com/ElectionWiz,user,https://x.com/ElectionWiz,ElectionWiz,,"Again, despite some wacky polls this weekend, the fundamentals haven't changed: If Harris doesn't win the popular vote by 2 or more, it's likely she loses. 

The current RCP average shows Trump leading in the popular by 0.2%, which based on Silver's model, gives Trump a high likelihood of winning Tuesday.",Sun Nov 03 18:07:56 +0000 2024,0.29181818181818187,Support
,,,,,,True,True,https://pbs.twimg.com/profile_banners/1261816778256265222/1692677649,Sun May 17 00:32:30 +0000 2020,God-Fearing Patriot | Family Man | America First 🇺🇸 Banned in 2020 & Reinstated in 2023 | RT’d by TRUMP,,,,,,,,,,,,,,,,,,,,,,,,,,0,88934,410299,8267,False,1261816778256265222,True,False,False, 35 DJT RTs ,7446,TONY™,1.8187936159901494e+18,False,https://pbs.twimg.com/profile_images/1271652420242812928/FMUxjwZA_normal.jpg,,26238,https://twitter.com/TONYxTWO,user,https://x.com/TONYxTWO,TONYxTWO,,"Legal immigrants for TRUMP!!! 🔥 @realDonaldTrump 

2 days to go!!! Let’s win this!!! https://t.co/ZABUATEGeZ",Sun Nov 03 18:07:11 +0000 2024,0.8814697265625,Support
,,,,,,True,True,https://pbs.twimg.com/profile_banners/1054152220705382400/1540164717,Sun Oct 21 23:27:29 +0000 2018,"Election Twitter Nerd, I do election analysis/predictions on my own for fun. History Buff. I am on X, formerly known as Twitter, for 4-6 months every two years.",,,,,,,,,,,,,,,,,,,,,,,,,,0,17915,8023,682,True,1054152220705382400,True,False,False,United States,603,CA ET Nerd,1.8550244406919007e+18,False,https://pbs.twimg.com/profile_images/1054153028171784192/noyS_ERo_normal.jpg,,12269,https://twitter.com/earlyvotedata,user,https://x.com/earlyvotedata,earlyvotedata,,"Florida Prediction: Trump +14, 56%-42%

Senate: Scott +12
Scott: 55%
Mucarsel-Powell: 43%

The easiest one to call for win but this one is about getting the margin right. Rs are dominating in the early vote and I expect the Election Day vote to get them to these margins. 

I will also take a go at the 2 big amendments in Florida:

Amendment 3 (Marijuana): No, does not hit 60%
Amendment 4 (Abortion): No, does not hit 60%",Sun Nov 03 18:04:38 +0000 2024,0.2964285714285715,Support
,,,,,,True,True,https://pbs.twimg.com/profile_banners/232294292/1727132331,Thu Dec 30 19:20:12 +0000 2010,AI skeptic and cognitive scientist who can now be found under bluer skies.,,,,,,,,,,,,,,,,,,,,,garymarcus.substack.com,http://garymarcus.substack.com,0.0,23.0,https://t.co/RrElrTVHSz,0,72215,162422,6800,True,232294292,True,False,False,,2405,Gary Marcus,1.857895840674894e+18,False,https://pbs.twimg.com/profile_images/1810874139596705796/6jIZm0HK_normal.jpg,,44645,https://twitter.com/GaryMarcus,user,https://x.com/GaryMarcus,GaryMarcus,,"Harris may win.

But the fact Trump is still even in the running — despite his obvious decline, his  infatuation with authoritarianism, his criminal record, etc – is a remarkable testament to the power of narrative, propaganda, and disinformation.

Most of the people who are voting for him (except a few hundred billionaires) will likely get screwed by his policies. Excessive tariffs will raise prices for everyone; minorities will be crushed. Labor rights will be decimated. Poor white people will remain poor.

Yet here we are.",Sun Nov 03 18:04:03 +0000 2024,0.015384615384615373,Support
,,,,,,True,True,https://pbs.twimg.com/profile_banners/419849905/1585966070,Wed Nov 23 21:34:38 +0000 2011,Citizen Journalist Co-Founder: @RevBlackNetwork,,,,,,,,,,,,,,,,,,,,,youtube.com/@revolutionary…,https://www.youtube.com/@revolutionaryblackout7315,0.0,23.0,https://t.co/iGHg5uH0db,0,162079,146816,6103,True,419849905,True,False,False,,6840,Revolutionary Blackout Network🥋,1.8626056603088077e+18,False,https://pbs.twimg.com/profile_images/1826394412965908480/FT2uArHE_normal.jpg,,95094,https://twitter.com/SocialistMMA,user,https://x.com/SocialistMMA,SocialistMMA,,"Both Kamala Harris and Donald Trump supporters are sharing polls and data, 100% convinced they are going to win 

Since they are so sure they are going to win, it’s going to make their meltdown even more satisfying when they lose 😂",Sun Nov 03 13:07:03 +0000 2024,0.62,Support
,,,,,,True,True,https://pbs.twimg.com/profile_banners/1212806053907185664/1601044840,Thu Jan 02 18:41:53 +0000 2020,"Fair Minded @foxnews Contributor, Podcast Host, Civil Rights Attorney, Author, Fmr School Teacher. https://t.co/OCMYXgXIzA",leoterrellhats.com,http://leoterrellhats.com,99.0,122.0,https://t.co/OCMYXgXIzA,,,,,,,,,,,,,,,,leoterrell.com,https://leoterrell.com,0.0,23.0,https://t.co/1xb66fxcwR,0,4789,2334836,187,True,1212806053907185664,True,False,False,Los Angeles,1696,LeoTerrell,1.8548664300485181e+18,False,https://pbs.twimg.com/profile_images/1383565672827944964/qxxY3h_v_normal.jpg,,78536,https://twitter.com/TheLeoTerrell,user,https://x.com/TheLeoTerrell,TheLeoTerrell,,Attention Trump Supporters: There is just 1 day left to get President Trump elected in November. We must work harder TODAY than yesterday! Please share how you are working to make sure President Trump wins the election. #Trump2024,Sun Nov 03 13:02:00 +0000 2024,0.16875,Support
,,,,,,True,True,https://pbs.twimg.com/profile_banners/1389833864122613761/1724888596,Wed May 05 06:46:46 +0000 2021,America First • 𝕏  Breaking News • MAGA🇺🇸 🔥just a dude with an IPhone ✝️,,,,,,,,,,,,,,,,,,,,,,,,,,0,97537,415059,29599,True,1389833864122613761,True,False,False,"Florida, USA",15898,American AF 🇺🇸,1.8606975175218465e+18,False,https://pbs.twimg.com/profile_images/1677756031324102659/QmkoTNg5_normal.jpg,,74334,https://twitter.com/iAnonPatriot,user,https://x.com/iAnonPatriot,iAnonPatriot,,"New York Governor calls Trump supporters “anti-American” 

??? https://t.co/BvC7GvZRQI",Sun Nov 03 13:01:29 +0000 2024,0.13636363636363635,Support
,,,,,,True,False,https://pbs.twimg.com/profile_banners/535643852/1547168949,Sat Mar 24 19:38:57 +0000 2012,Publisher of The Dossier. Contact: Jds921@protonmail.com,,,,,,,,,,,,,,,,,,,,,dossier.today,https://www.dossier.today,0.0,23.0,https://t.co/U8PaeGeG9r,0,91152,281596,1094,True,535643852,True,False,False,"Join 70,000+ subscribers 👉",3104,Jordan Schachtel @ dossier.today,,False,https://pbs.twimg.com/profile_images/1678040758929039360/e-NiO0cK_normal.jpg,,64243,https://twitter.com/JordanSchachtel,user,https://x.com/JordanSchachtel,JordanSchachtel,,"Yeah, this is messed up. Trump supporters aren’t going to be shamed into the darkness this time around. @libsoftiktok",Sun Nov 03 12:53:15 +0000 2024,0.0,Support
