,,,,,,"true","true","https://pbs.twimg.com/profile_banners/908354649857687556/1505802335","Thu Sep 14 15:39:59 +0000 2017","Manhattan Republican Party Chair, @Manhattan_GOP. NYC regional Vice Chair of the New York State Republican Party, @NewYorkGOP. Patriot, Investor, New Yorker.",,,,,,,,,,,,,,,,"ManhattanRepublicanParty.org","http://ManhattanRepublicanParty.org","0","23","https://t.co/o8ft812Sna","0","26895","61143","2584","true","908354649857687556","true","false","false","New York, NY","430","Andrea Catsimatidis","1128399322746216448","false","https://pbs.twimg.com/profile_images/995525925562408960/Aq4ZPcX4_normal.jpg","","7083","https://twitter.com/AJ_Cats_","user","https://x.com/AJ_Cats_","AJ_Cats_",,"Last night I had the privilege of being with President Trump at Mar-A-Lago for his incredible victory on election night. The energy in the room was electrifying!!!

Not only did he win decisively, but he also won the popular vote, it is the first time a Republican has won the popular vote in 2 decades! So it’s official- the majority of Americans are now Trump supporters! 

It brought me tears of joy to see so much love in that room and across the country after such a long and difficult road. Yesterday was truly a special day. So historic! And I was so grateful to be there!!! ❤️🙏🏻🇺🇸","Wed Nov 06 22:53:11 +0000 2024"
,,,,,,"true","false","https://pbs.twimg.com/profile_banners/1695193884769271808/1731030231","Fri Aug 25 21:58:23 +0000 2023","Free Speech activist, January 6th survivor, stopped the Portland riots, teeth knocked out protesting Big Tech censorship.",,,,,,,,,,,,,,,,,,,,,"0","107901","166740","885","false","1695193884769271808","true","false","false","Texas, USA","2663","Philip Anderson","1860777239777870017","false","https://pbs.twimg.com/profile_images/1695435978373054464/GJaYhbVs_normal.jpg","","66932","https://twitter.com/VoteHarrisOut","user","https://x.com/VoteHarrisOut","VoteHarrisOut",,"To the hundreds of people thanking me for the work I did to help Donald Trump win the election.

We are only half way done 

It’s not over until every J6 political prisoner is pardoned &amp; freed and every J6 defendant’s charges are dropped. 

Anything less than that is UNACCEPTABLE","Wed Nov 06 22:52:19 +0000 2024"
,,,,,,"true","false","https://pbs.twimg.com/profile_banners/1716828677860937729/1731223034","Tue Oct 24 14:47:15 +0000 2023","Posting JP politics for fun and Kurokawa Akane's biggest fan",,,,,,,,,,,,,,,,"linktr.ee/Arin_Yuni","http://linktr.ee/Arin_Yuni","0","23","https://t.co/DbyDmMHNKc","0","30946","14768","904","false","1716828677860937729","true","false","false","Tokyo-to, Japan","1321","由仁アリン Arin Yuni","1857425939673887078","false","https://pbs.twimg.com/profile_images/1853079469621481472/2c-uQYCX_normal.png","","6178","https://twitter.com/Arin_Yumi","user","https://x.com/Arin_Yumi","Arin_Yumi",,"Former PM Kishida advises Ishiba after Trump win: ""Building personal relationships as quickly as possible is important. This is where Japan's diplomatic skills will be put to test.""  

""In the end, diplomacy is all about personal relationships. The important thing is to make contact with the other party as soon as possible and make a good first impression on them.""","Wed Nov 06 22:52:09 +0000 2024"
,,,,,,"true","true","https://pbs.twimg.com/profile_banners/158891867/1660690887","Wed Jun 23 23:05:14 +0000 2010","Covers state government and politics in Michigan for @detroitnews. Email is cmauger@detroitnews.com.",,,,,,,,,,,,,,,,"detroitnews.com","http://detroitnews.com","0","23","https://t.co/PtRFzwenEr","0","8302","39141","3752","true","158891867","false","false","false","Lansing, MI","3337","Craig Mauger","1737976963006963733","false","https://pbs.twimg.com/profile_images/1744012075733577728/fcxDwFQq_normal.jpg","","22003","https://twitter.com/CraigDMauger","user","https://x.com/CraigDMauger","CraigDMauger",,"Former President Donald Trump paired Republican advantages in rural areas with significant gains in Democratic strongholds and an expanding coalition to win Michigan in Tuesday's election: https://t.co/Fx2Hv7uLUO","Wed Nov 06 22:51:25 +0000 2024"
,,,,,,"false","true","https://pbs.twimg.com/profile_banners/53192519/1565428198","Thu Jul 02 21:23:54 +0000 2009","New 30 min special out 8/29/23 at 4pm EST ⬇️⬇️ YouTube link below ⬇️⬇️",,,,,,,,,,,,,,,,"youtube.com/channel/UCnXoI…","https://www.youtube.com/channel/UCnXoI0GGii2VbBRIIQ2bimw","0","23","https://t.co/PxKySDRpji","0","2126","118533","803","false","53192519","true","false","false","","671","Kurt Metzger",,"false","https://pbs.twimg.com/profile_images/1707955726071820288/zypKQRXt_normal.jpg","","11590","https://twitter.com/kurtmetzger","user","https://x.com/kurtmetzger","kurtmetzger",,"Oh shit, does the Trump win mean right-side-of-history heaven doesn’t exist?","Wed Nov 06 22:50:36 +0000 2024"
,,,,,,"false","true","https://pbs.twimg.com/profile_banners/1790419462446886912/1716328003","Tue May 14 16:30:59 +0000 2024","America First🗽 | Trump 2024🗳️ | Patriot 🇺🇸 | #MAGA | Political Commentator | #Travel✈️🔎🌎",,,,,,,,,,,,,,,,,,,,,"0","13247","12471","7431","false","1790419462446886912","true","false","false","Texas, USA","1345","Jesse Morgan","1857813924579586463","false","https://pbs.twimg.com/profile_images/1822193495253143552/Seu-nAni_normal.jpg","","3096","https://twitter.com/Jesse_Morgan_","user","https://x.com/Jesse_Morgan_","Jesse_Morgan_",,"BREAKING: NY AG Letitia James appears to threaten President Trump in response to his historic win:
 
“We did not expect this result, but we are prepared to respond to this result. We are prepared to fight back once again.”

What’s your response?

https://t.co/ocmMDZKYLx","Wed Nov 06 22:50:35 +0000 2024"
,,,,,,"true","true","https://pbs.twimg.com/profile_banners/14505245/1400706225","Thu Apr 24 02:26:22 +0000 2008","While Other Networks Lie To You About What's Happening Now, 𝐈𝐧𝐟𝐨𝐰𝐚𝐫𝐬 Tells You The Truth About What's Happening Next",,,,,,,,,,,,,,,,"infowarsstore.com","http://www.infowarsstore.com","0","23","https://t.co/xbq2XPiKzZ","0","10485","640188","1102","false","14505245","true","false","false","Austin, Texas","9823","INFOWARS","1863342721512976846","false","https://pbs.twimg.com/profile_images/1857843302311112704/9JIZKlh8_normal.jpg","","60520","https://twitter.com/infowars","user","https://x.com/infowars","infowars",,"Watch: ‘The View’ Copes With Massive Trump Win, Insists Kamala ‘Ran a Flawless Campaign’ https://t.co/9rz3XNnBCY","Wed Nov 06 22:50:00 +0000 2024"
,,,,,,"false","false","https://pbs.twimg.com/profile_banners/2897067504/1727832910","Wed Nov 12 03:20:48 +0000 2014","Australia's gold standard of daily news, current affairs and analysis. Retweeted by William Shatner, blocked by Miranda Devine. Satire site.",,,,,,,,,,,,,,,,"theunaustralian.net","http://www.theunaustralian.net","0","23","https://t.co/zzcefe5juR","0","6828","5153","2514","true","2897067504","false","false","false","Sydney, Australia","1713","theunaustralian.net",,"false","https://pbs.twimg.com/profile_images/1841290956915769344/OzooLnKk_normal.jpg","","5763","https://twitter.com/TheUnOz","user","https://x.com/TheUnOz","TheUnOz",,"BREAKING: Peter Dutton's Traditional Owner, Gina Rinehart, Spent The Night Partying At Mar-A-Lago Celebrating Donald Trump's Election Win.
Gina was joined by Liberal party stalwart, Teena McQueen, and British grifter, Nigel No Mates. #auspol https://t.co/DvRBwSHIrH","Wed Nov 06 22:49:32 +0000 2024"
,,,,,,"true","true","https://pbs.twimg.com/profile_banners/1740130597199085568/1713472238","Wed Dec 27 22:01:08 +0000 2023","The OG Mike Tyson Meme Coin On Solana. Now CTO

🥊 TG : https://t.co/k8GA7H3eAv
🥊 Memes : https://t.co/TM9baZV9CI
🥊 EKCW975DWdt1roK1NVQDf4QGfaGTcQPU5tFD1DMcMe9Q","t.me/tholana","http://t.me/tholana","55","78","https://t.co/k8GA7H3eAv","t.me/thol_memes","http://t.me/thol_memes","89","112","https://t.co/TM9baZV9CI",,,,,,"tholana.net","http://tholana.net","0","23","https://t.co/s0zjtiTWZ6","0","10248","4411","2278","false","1740130597199085568","true","false","false","","1856","Tholana(🥊,🕊️)","1857387401498292274","false","https://pbs.twimg.com/profile_images/1781057769837051904/qXeSpaV7_normal.jpg","","5009","https://twitter.com/tholanasol","user","https://x.com/tholanasol","tholanasol",,"Election Meta ✅ Trump Win ✅ Bitcoin up ✅
Heavy Champion Mike Tyson Vs Jake Paul Netflix Mega Event - Pending
All Hail KING MIKE... FULL SEND for Tyson Meta
#PAULTYSON #miketyson Join TG : https://t.co/4foMiVuE3g https://t.co/sdfpvOgHvP","Wed Nov 06 22:47:13 +0000 2024"
,,,,,,"false","true","https://pbs.twimg.com/profile_banners/925232770208579585/1626026069","Tue Oct 31 05:27:37 +0000 2017","Sports Olympics Government Politics Utes, Cal Bears, & Colorado Mesa Mavs",,,,,,,,,,,,,,,,,,,,,"0","27237","1367","707","true","925232770208579585","false","false","false","East Millcreek, UT","908","Melissa Anne Marlowe OLY","1326609083332403200","false","https://pbs.twimg.com/profile_images/1358274682982518784/XDDJUVVh_normal.jpg","","10543","https://twitter.com/MissyAMarlowe","user","https://x.com/MissyAMarlowe","MissyAMarlowe",,"Wow. There are an awful lot of performative supporters of sexually abused female athletes who whole heartedly endorsed the party of sexual assault. Tell me again how you were so sickened by Nassar that you voted for Trump. Lay off the fake outrage huh? You don't really care.","Wed Nov 06 21:05:47 +0000 2024"
,,,,,,"false","true","https://pbs.twimg.com/profile_banners/566014912/1700869847","Sun Apr 29 05:36:23 +0000 2012","Gabe • Father Calcium • Apex Enjoyer • @Elgato Partner • Alphabet Mafia • He/They 🏳️‍⚧️ 🏳️‍🌈 | Business: leto@gamertalent.com.au",,,,,,,,,,,,,,,,"twitch.tv/luckybonez","http://www.twitch.tv/luckybonez","0","23","https://t.co/APEw78Np0e","0","243841","126546","830","true","566014912","false","false","false","Sydney, Australia","9947","Bonez 🤍","1634083901789581312","false","https://pbs.twimg.com/profile_images/1840591882197651456/A7nmmIMP_normal.jpg","","49366","https://twitter.com/LuckyBonez","user","https://x.com/LuckyBonez","LuckyBonez",,"Hotter and gayer over on the butterfly site btw. Trump supporters need not follow.","Wed Nov 06 21:02:50 +0000 2024"
,,,,,,"false","true","https://pbs.twimg.com/profile_banners/1695777445759389696/1693147875","Sun Aug 27 12:37:39 +0000 2023","🔥All opinions are my own, we talk dating, politics, mental health & everything in between 🔥Don’t follow me, follow your dreams",,,,,,,,,,,,,,,,"tellonym.me/marlayna.79890…","https://tellonym.me/marlayna.7989023","0","23","https://t.co/22fuWldfjy","0","56012","11728","5592","false","1695777445759389696","true","false","false","Earth","5995","Marlayna","1863265788045480013","false","https://pbs.twimg.com/profile_images/1698788680507273216/gSOotPGZ_normal.jpg","","27073","https://twitter.com/Marlayna29","user","https://x.com/Marlayna29","Marlayna29",,"He says Trump supporters are freaks of nature 😂 cry baby cry
 https://t.co/UgO3iVu4wE","Wed Nov 06 20:53:25 +0000 2024"
,,,,,,"true","false","https://pbs.twimg.com/profile_banners/1146222260224712704/1718421422","Wed Jul 03 01:00:57 +0000 2019","Followed by @MarkHamill, @JohnCena @mmpadellan, @theliamnissan, @LakotaMan1, @NancySinatra @joncoopertweets...

Blocked by @KariLake. Unblocked by Metamucil.",,,,,,,,,,,,,,,,,,,,,"0","67733","43134","21188","true","1146222260224712704","true","false","false","","3269","💙🌊 Zero Dark Twenty-Nine 🌊🌊🖋️🧫","1851022547527024774","false","https://pbs.twimg.com/profile_images/1665404838023233537/UNgbb5V6_normal.jpg","","37105","https://twitter.com/herotimeszero","user","https://x.com/herotimeszero","herotimeszero",,"In the future, people will ask Trump supporters, ""Was it worth it? Selling our country, our freedom, our democracy, just to lower the price of eggs?... And did the price of eggs really go down?"" 

And Trump supporters will say, ""No. It didn't."" 

You sold us out for nothing.","Wed Nov 06 20:52:08 +0000 2024"
,,,,,,"true","false","https://pbs.twimg.com/profile_banners/1106771843929788419/1705153062","Sat Mar 16 04:19:05 +0000 2019","Commentary • Satirical Emeritus • My posts: https://t.co/346RRUl7n3","mobile.twitter.com/search?q=(from…","https://mobile.twitter.com/search?q=(from:nothoodlum","44","67","https://t.co/346RRUl7n3",,,,,,,,,,,,,,,,"0","1730712","200141","6354","true","1106771843929788419","true","false","false","New York, USA","22830","Hoodlum 🇺🇸","1243490007026937856","false","https://pbs.twimg.com/profile_images/1713455259564048384/82D6Ljgp_normal.jpg","","187006","https://twitter.com/NotHoodlum","user","https://x.com/NotHoodlum","NotHoodlum",,"Trump supporters are celebrating by dumping their trash at Mar-a-Lago. https://t.co/OM8Jxfesuc","Wed Nov 06 20:47:08 +0000 2024"
,,,,,,"false","false","https://pbs.twimg.com/profile_banners/1417545370272423937/1732499747","Tue Jul 20 18:02:16 +0000 2021","Just another rando swimming around in this cesspool. Secular Humanist. Progressive. I will check your grammar and spelling.",,,,,,,,,,,,,,,,,,,,,"0","85634","18346","6075","true","1417545370272423937","false","false","false","Metaluna","11656","Meacham",,"false","https://pbs.twimg.com/profile_images/1855098084608360448/uZLj3xk__normal.jpg","","57590","https://twitter.com/MeachamDr","user","https://x.com/MeachamDr","MeachamDr",,"When Trump fucks everything up, which he will, will his supporters blame him or somehow find a way to blame Biden?","Wed Nov 06 20:43:26 +0000 2024"
,,,,,,"false","true",,"Thu Aug 28 21:16:38 +0000 2008","Follow us for the latest political news and updates!",,,,,,,,,,,,,,,,"foxnews.com/politics","http://www.foxnews.com/politics","0","22","http://t.co/hp4EoFaNoR","0","7","1863060","250","true","16032925","true","false","false","Washington, D.C.","3197","Fox News Politics",,"false","https://pbs.twimg.com/profile_images/1028984467447341059/yha4NYkt_normal.jpg","","75954","https://twitter.com/foxnewspolitics","user","https://x.com/foxnewspolitics","foxnewspolitics",,"Harris now the second Dem candidate to lose to Trump and not speak to supporters election night https://t.co/cmG2Q3bLqP","Wed Nov 06 20:38:28 +0000 2024"
,,,,,,"false","false","https://pbs.twimg.com/profile_banners/978758798176382977/1724975252","Tue Mar 27 22:20:56 +0000 2018","Tweets are someone else's and they have opinions on current stuff. Purveyor of progressive conservative Canadian snark. Zero fucks left.",,,,,,,,,,,,,,,,,,,,,"0","244856","24808","2248","true","978758798176382977","false","false","false","North edge of Lake Ontario","11799","Roddy 🇨🇦",,"false","https://pbs.twimg.com/profile_images/1779225312049442816/AyWc7uFe_normal.jpg","","107717","https://twitter.com/RodKahx","user","https://x.com/RodKahx","RodKahx",,"Wonder if Canadian conservative MAGA supporters know what Trump's tariffs will do to this country.","Wed Nov 06 20:30:25 +0000 2024"
,,,,,,"true","true","https://pbs.twimg.com/profile_banners/3895214232/1634153219","Wed Oct 14 20:28:20 +0000 2015","Misinformation is the bread and butter of the “free thinking high IQ” denizens of Reddit. Home of Watchdog. Ephesians 5:11.

DMs open for submissions.",,,,,,,,,,,,,,,,,,,,,"0","95305","439169","861","true","3895214232","true","false","false","Tennessee, USA","15932","Reddit Lies","1856096110122512449","false","https://pbs.twimg.com/profile_images/1438530746164121602/esKsjv3b_normal.jpg","","28306","https://twitter.com/reddit_lies","user","https://x.com/reddit_lies","reddit_lies",,"""Latino Trump supporters are the stupidest people alive""

Just say you hate them. We all know it's true. https://t.co/d036dhVUAC","Wed Nov 06 20:30:07 +0000 2024"
,,,,,,"true","true","https://pbs.twimg.com/profile_banners/47293791/1595796201","Mon Jun 15 08:46:13 +0000 2009","Comedian & Founder of Cousin T’s. My New Children’s Book is out now, order yours here at https://t.co/lk1drhKLiR","littlekidwhocan.com","https://littlekidwhocan.com","89","112","https://t.co/lk1drhKLiR",,,,,,,,,,,"terrencekwilliams.com","https://terrencekwilliams.com","0","23","https://t.co/KXQLf7UgRq","0","5710","2129672","1047","true","47293791","true","false","false","United States","4232","Terrence K. Williams","1861233533357871390","false","https://pbs.twimg.com/profile_images/1263559832876900354/-XKHWR6m_normal.jpg","","12144","https://twitter.com/w_terrence","user","https://x.com/w_terrence","w_terrence",,"TRUMP and his family has been through so much. 

They attempted to bankrupt him,  
he was impeached, convicted, arrested and shot.

His supporters like you and me have been demonized and called every name in the book. 

They called us Deplorable, Garbage and said we were in a Cult but we are far from that!  

We just love our Country!  Right ? 
MAGA for Life.

Thank you @realDonaldTrump","Wed Nov 06 20:19:07 +0000 2024"
,,,,,,"false","false","https://pbs.twimg.com/profile_banners/1266209922/1590220861","Thu Mar 14 05:01:43 +0000 2013","Law professor at the University of California @BerkeleyLaw.   
https://t.co/YtnBrArHj3","law.berkeley.edu/our-faculty/fa…","https://www.law.berkeley.edu/our-faculty/faculty-profiles/orin-kerr/","63","86","https://t.co/YtnBrArHj3",,,,,,,,,,,"OrinKerr.com","http://OrinKerr.com","0","23","https://t.co/I5mv1EatC8","0","56482","120633","4434","true","1266209922","true","false","false","Berkeley, California","9922","Orin Kerr","1845985111164309533","false","https://pbs.twimg.com/profile_images/1773276846324600832/WufOOGL0_normal.jpg","","68441","https://twitter.com/OrinKerr","user","https://x.com/OrinKerr","OrinKerr",,"Curious to see if Trump winning again in 2024 will lead his supporters to now admit that they knew he lost in 2020. (Or will merely asking about that lead to accusations of TDS?)","Wed Nov 06 20:15:02 +0000 2024"
,,,,,,"true","false","https://pbs.twimg.com/profile_banners/386213011/1697196265","Thu Oct 06 21:21:14 +0000 2011","Journalist: @UncapturedNews Filmmaker: @KillingGaza, Gaza Fights Back, Another Vision, Haiti: Intervention versus Revolution",,,,,,,,,,,,,,,,"linktr.ee/dancohen3000","http://linktr.ee/dancohen3000","0","23","https://t.co/j6GRSYif8I","0","13668","347171","2709","true","386213011","true","false","false","Washington, DC","4829","Dan Cohen",,"false","https://pbs.twimg.com/profile_images/1717176197635809280/AYyNFlNG_normal.jpg","","27514","https://twitter.com/dancohen3000","user","https://x.com/dancohen3000","dancohen3000",,"Kamala supporters: ""Now Trump will turn Gaza into a parking lot""

Gaza under Kamala today: https://t.co/5aCnsd0d3a","Wed Nov 06 20:13:09 +0000 2024"
,,,,,,"true","false","https://pbs.twimg.com/profile_banners/978265628426432512/1664640210","Mon Mar 26 13:41:15 +0000 2018","Dedicated research monitoring and exposing right-wing extremism and other threats to democracy.",,,,,,,,,,,,,,,,"bsky.app/profile/patrio…","https://bsky.app/profile/patriottakes.bsky.social","0","23","https://t.co/rrRUf0jmB5","0","52497","443578","2703","true","978265628426432512","true","false","false","","32442","PatriotTakes 🇺🇸","1855965835258454378","false","https://pbs.twimg.com/profile_images/1412742355925405698/gdbs7Rye_normal.jpg","","63950","https://twitter.com/patriottakes","user","https://x.com/patriottakes","patriottakes",,"4 years ago, Trump and his supporters were already planning on how to overturn the election results, leading to the January 6th Capitol attack with multiples incarcerations, injured police officers, and death.","Wed Nov 06 20:09:52 +0000 2024"
,,,,,,"true","true","https://pbs.twimg.com/profile_banners/1608459779239706627/1672321794","Thu Dec 29 13:47:56 +0000 2022","",,,,,,,,,,,,,,,,"t.me/ShadowofEzra","http://t.me/ShadowofEzra","0","23","https://t.co/m8Dnga3fT0","0","1","591614","0","true","1608459779239706627","true","false","false","Nowhere","3857","Shadow of Ezra","1684651698067816448","false","https://pbs.twimg.com/profile_images/1608460256752926720/ouO0x9-k_normal.jpg","","4115","https://twitter.com/ShadowofEzra","user","https://x.com/ShadowofEzra","ShadowofEzra",,"LeBron James responded to Trump’s victory with a heavy heart, sharing a photo of himself with his daughter and expressing concerns for her safety, vowing to protect her. In his caption, he added, “we don’t need their help,” a possible reference to Trump and his supporters.

But was LeBron ever concerned about the underage kids attending Diddy’s parties?","Wed Nov 06 20:08:06 +0000 2024"
,,,,,,"false","false","https://pbs.twimg.com/profile_banners/151010098/1702376193","Wed Jun 02 11:30:17 +0000 2010","Just here to puncture all your overbloated Twitter egos",,,,,,,,,,,,,,,,,,,,,"0","5191","215371","2018","true","151010098","true","false","false","The Moon","7278","Souljah","1774665643054297160","false","https://pbs.twimg.com/profile_images/1858242636156448768/6oP7e1VM_normal.jpg","","306161","https://twitter.com/jeffphilips1","user","https://x.com/jeffphilips1","jeffphilips1",,"It's a fat lie. She's still waiting for the results inside the INEC server and IREV, plus Trump didn't get 25% in DC....
She's going to court, and if they don't give her victory, she'll advise her supporters to unleash venom on the judges and expose their families to danger as Trump cannot be their president.","Wed Nov 06 20:04:43 +0000 2024"
,,,,,,"true","false","https://pbs.twimg.com/profile_banners/2362018224/1731446912","Wed Feb 26 02:59:33 +0000 2014","ig: https://t.co/2mReCukTxz • tamu former student","Bella.cartier","http://Bella.cartier","4","27","https://t.co/2mReCukTxz",,,,,,,,,,,,,,,,"0","63473","1616","811","true","2362018224","false","false","false","Dallas, TX","120","Bella 🦦","1856797154095853851","false","https://pbs.twimg.com/profile_images/1854627485687717899/op4HmOlL_normal.jpg","","20416","https://twitter.com/bozybella","user","https://x.com/bozybella","bozybella",,"I unfollow ppl for posting ugly pics you think I’m not gonna unfollow trump supporters?? TUHHHHH 😂😂😂","Wed Nov 06 20:04:30 +0000 2024"
,,,,,,"true","false",,"Mon Apr 28 14:29:37 +0000 2008","Stories that reveal and inspire, challenging expectations. 

Weekdays 7-8pm on Channel 4.

Got a story? C4Nstories@itn.co.uk",,,,,,,,,,,,,,,,"channel4.com/news","http://www.channel4.com/news","0","23","https://t.co/s8MtXgFa2b","0","495","2444513","4190","true","14569869","true","false","false","United Kingdom","27150","Channel 4 News","1859295503218831575","false","https://pbs.twimg.com/profile_images/875404558528393216/cTknVhwm_normal.jpg","","127711","https://twitter.com/Channel4News","user","https://x.com/Channel4News","Channel4News",,"'We're a split country right now, that's the sad thing about it.'

Kamala Harris supporters react to her election defeat and question why their candidate failed to defeat Donald Trump. https://t.co/b0Gq3aOPmc","Wed Nov 06 20:01:01 +0000 2024"
,,,,,,"true","false","https://pbs.twimg.com/profile_banners/4822593580/1650606370","Sun Jan 17 23:44:45 +0000 2016","♏︎. musician. historian in training. black radical⚢🏳️‍🌈",,,,,,,,,,,,,,,,"instagram.com/jalauria.k","http://instagram.com/jalauria.k","0","23","https://t.co/N0NODNLZ5b","0","107931","1030","880","true","4822593580","false","false","false","orlando ➪famu ","193","j🦂✨","1848771798651048000","false","https://pbs.twimg.com/profile_images/1861134187857661952/x1z5yAJR_normal.jpg","","33935","https://twitter.com/jalauriak","user","https://x.com/jalauriak","jalauriak",,"“Unfollowing people today” ….ngl the fact that y’all were even in a position to follow this many trump supporters is beyond me. Maybe it’s just bc i curate my feed carefully but the signs be there, how do you even get to know someone without knowing they’re super conservative 😭","Wed Nov 06 19:59:49 +0000 2024"
,,,,,,"true","false","https://pbs.twimg.com/profile_banners/1157689921349521410/1564859376","Sat Aug 03 16:29:20 +0000 2019","one piece, communist, prison abolitionist, Elon Musk--obsessed much, anti-zionist | alt @eeesssjjj, esjesjesj on bsky",,,,,,,,,,,,,,,,,,,,,"0","121083","60430","957","true","1157689921349521410","true","false","false","","10934","evan loves worf","1728455828439486607","false","https://pbs.twimg.com/profile_images/1598444826357284867/G_wP0BZJ_normal.jpg","","61922","https://twitter.com/esjesjesj","user","https://x.com/esjesjesj","esjesjesj",,"I have Trump supporters telling me that it's all overblown, everything will be good for everyone, and I have other Trump supporters telling me that I'm going to be sent to a death camp","Wed Nov 06 19:57:42 +0000 2024"
,,,,,,"false","true","https://pbs.twimg.com/profile_banners/1230011019390382080/1696896615","Wed Feb 19 06:07:55 +0000 2020","News junkie| Love horror 😈| Democrat & Proud American | Uphold democracy eliminate Trumpism #TheResistance Ⓜ️Ⓜ️ MeidasMightyOG | On Threads: Meidas_Lauren",,,,,,,,,,,,,,,,"meidasnews.com","https://meidasnews.com/","0","23","https://t.co/eUwXwfpPIg","0","430554","18143","11862","true","1230011019390382080","false","false","false","Los Angeles, CA","13808","Ⓜ️Ⓜ️ Lauren Ashley Davis - OG Meidas Might 🇺🇲🦅","1391299401780367361","false","https://pbs.twimg.com/profile_images/1409765454378266625/8rzRXHSF_normal.jpg","","248273","https://twitter.com/Meidas_LaurenA","user","https://x.com/Meidas_LaurenA","Meidas_LaurenA",,"Supporters of President-elect Donald Trump are calling for mass executions of dissidents and posting murderous memes. “Build the gallows!!” said one post on the far-right, antisemitic platform Gab.

https://t.co/q7HmPBoDWd","Wed Nov 06 19:55:45 +0000 2024"
