,,,,,,"true","true","https://pbs.twimg.com/profile_banners/1592567673195470848/1693215410","Tue Nov 15 17:18:27 +0000 2022","Writer, former Senator, waived anonymity 2014. No 1 Bestselling Book Rough Beast, Shortlisted for Non-Fiction book of the year. https://t.co/nO9LwTTiwu","linktr.ee/cahillbooks","https://linktr.ee/cahillbooks","128","151","https://t.co/nO9LwTTiwu",,,,,,,,,,,"mairiacahill.com","http://www.mairiacahill.com","0","23","https://t.co/vXesi0sShD","0","3004","4851","476","false","1592567673195470848","false","false","false","Belfast, Northern Ireland","829","Máiría Cahill","1855390179584094630","false","https://pbs.twimg.com/profile_images/1696414504626565120/c3vkuT5V_normal.jpg","","5612","https://twitter.com/cahillbooks","user","https://x.com/cahillbooks","cahillbooks",,"Most ironic headline ever. 

‘I’m so disheartened US would vote for a felon’: People in Belfast express fears following ‘dangerous’ Trump’s re-election

https://t.co/t5LzNFsKN9","Wed Nov 06 18:10:53 +0000 2024"
,,,,,,"false","false","https://pbs.twimg.com/profile_banners/4018888580/1700495179","Mon Oct 26 00:41:32 +0000 2015","“You must accept the truth from whatever source it comes."" -Maimonides

Do not put a stumbling block before the blind.",,,,,,,,,,,,,,,,"theintellectualist.com","http://theintellectualist.com","0","23","https://t.co/TEeYfrZME7","0","136117","220757","4758","true","4018888580","true","false","false","Planet Earth","17563","The Intellectualist","1854225379906498699","false","https://pbs.twimg.com/profile_images/658451233057804291/4R_pmaso_normal.png","","230180","https://twitter.com/highbrow_nobrow","user","https://x.com/highbrow_nobrow","highbrow_nobrow",,"It was at this moment that Donald Trump won re-election.
 https://t.co/MUeQDoDTC2","Wed Nov 06 17:58:11 +0000 2024"
,,,,,,"true","false",,"Mon Dec 22 20:44:06 +0000 2008","Former U.S.Coast Guard Aviator, Now a Chem/Mech/Elec & Soft Engineer.  My factory manufactures in MN, USA!",,,,,,,,,,,,,,,,"a1x.us","http://www.a1x.us","0","23","https://t.co/oXtdiO3D7V","0","165","159","276","true","18316441","true","false","false","St Paul, MN","12","John Andrew Metza",,"false","https://pbs.twimg.com/profile_images/1072561739437355010/3dY92ud-_normal.jpg","","1577","https://twitter.com/metzajohn","user","https://x.com/metzajohn","metzajohn",,"@elonmusk I love Grok and asked it what Trump's re-election means for American Democracy.  Pretty damning &amp; accurate assessment.  Just what I expect from Grok.  Elon, I know you see Trump as a useful idiot, but you got in bed with the Devil.","Wed Nov 06 17:55:02 +0000 2024"
,,,,,,"false","false","https://pbs.twimg.com/profile_banners/812135885328236551/1667282944","Fri Dec 23 03:20:58 +0000 2016","@realDailyWire. Retweets ≠ endorsement.",,,,,,,,,,,,,,,,,,,,,"0","18610","350066","753","true","812135885328236551","true","false","false","USA","11483","Ryan Saavedra","1863381356442460469","false","https://pbs.twimg.com/profile_images/1783249903885373442/OM1JF8H9_normal.jpg","","93919","https://twitter.com/RealSaavedra","user","https://x.com/RealSaavedra","RealSaavedra",,"Kamala Harris' campaign is already blaming Biden for her loss to Trump by claiming he hurt the party by seeking re-election 

The argument from her campaign is essentially that he should have allowed Democrat primary voters to pick a better candidate than Harris https://t.co/ZMgyJfJ4S3","Wed Nov 06 17:47:32 +0000 2024"
,,,,,,"true","false","https://pbs.twimg.com/profile_banners/455264233/1728307549","Wed Jan 04 22:41:24 +0000 2012","Co-Leader of Britain First, the UK’s fastest growing patriotic and nationalist political party: @BFirstParty Registered with the Electoral Commission.",,,,,,,,,,,,,,,,"britainfirst.org","http://www.britainfirst.org","0","23","https://t.co/4HVQlIgz1h","0","9974","242685","297","false","455264233","true","false","false","London, England","24148","Paul Golding","1862200687364280389","false","https://pbs.twimg.com/profile_images/1840137699753144320/-0FTvyTn_normal.jpg","","37421","https://twitter.com/GoldingBF","user","https://x.com/GoldingBF","GoldingBF",,"🇺🇸 THE RE-ELECTION OF DONALD TRUMP WILL HERALD A NEW AGE OF FREE SPEECH. HERE'S WHY..... https://t.co/KemtctPYev","Wed Nov 06 17:17:37 +0000 2024"
,,,,,,"true","true","https://pbs.twimg.com/profile_banners/2283789074/1722989560","Thu Jan 09 16:11:21 +0000 2014","Official X For 🇺🇸 Joe Exotic 🐅 👑 Creator/Star of Tiger King Political Prisoner 🎶 Artist 🎥 Big Cat Expert 🦁 nudes at https://t.co/lYKULWQ3PS.","me4u.ai/joe_exotic","https://me4u.ai/joe_exotic","116","139","https://t.co/lYKULWQ3PS",,,,,,,,,,,"linktr.ee/joeexotictv","http://linktr.ee/joeexotictv","0","23","https://t.co/Oon0JeMI4w","0","37324","76692","7546","true","2283789074","false","false","false","Fort Worth, TX","7926","Joe Exotic","1856042506980368765","false","https://pbs.twimg.com/profile_images/1863000272932409344/AN_YmqQZ_normal.jpg","","26538","https://twitter.com/joe_exotic","user","https://x.com/joe_exotic","joe_exotic",,"I would like to thank my supporters all around the world who voted for Trump and made his re-election possible.

Now we must insist Trump signs my pardon since they all admitted to perjury and entrapment. 

I am an innocent man that does not belong in prison.

#pardonjoeexotic #Trump2024 #freejoeexotic","Wed Nov 06 17:04:35 +0000 2024"
,,,,,,"true","false","https://pbs.twimg.com/profile_banners/3095083228/1722770526","Wed Mar 18 17:44:08 +0000 2015","Prime Minister of the Biafra Republic Government in-Exile BRGIE 2023-, human rights activist, CEO, senior legal advisor at Ekpa & Co Oy, Finnish politician.",,,,,,,,,,,,,,,,"biafrarepublicgov.org","https://www.biafrarepublicgov.org","0","23","https://t.co/TfxQGAPwGQ","0","31","186747","320","true","3095083228","true","false","false","Lahti, Suomi","9465","Simon Ekpa","1752831839700488222","false","https://pbs.twimg.com/profile_images/1815816086861799424/H5NOgVKd_normal.jpg","","19157","https://twitter.com/simon_ekpa","user","https://x.com/simon_ekpa","simon_ekpa",,"CONGRATULATIONS TO THE USA PRESIDENT-ELECT DONALD TRUMP, @realDonaldTrump ON HIS RE-ELECTION AS THE 47TH PRESIDENT OF THE UNITED STATES OF AMERICA. 

AS A RE-EMERGING NATION, THE UNITED STATES OF BIAFRA LOOKS FORWARD TO THE USA’S COMMITMENT TO THE PRINCIPLES OF SELF DETERMINATION AND THE FREEDOM OF PEOPLE TO CHOOSE THEIR OWN FORM OF GOVERNMENT. 

AS WE GRADUALLY APPROACH TOWARDS THE DECLARATION OF THE RESTORATION OF INDEPENDENCE OF THE UNITED STATES OF 
BIAFRA. 
It is our fervent hope that your office will be one of the first to congratulate the United States of Biafra upon the declaration of the restoration of independence by referendum.
-Prime Minister of Biafra","Wed Nov 06 17:02:14 +0000 2024"
,,,,,,"false","true","https://pbs.twimg.com/profile_banners/4970411/1732015849","Tue Apr 17 08:23:08 +0000 2007","Your story. Your platform. Follow our live coverage. For breaking news alerts, follow @AJENews.",,,,,,,,,,,,,,,,"aljazeera.com/live","http://aljazeera.com/live","0","23","https://t.co/rGl3DGqvLr","0","17098","8934220","247","true","4970411","true","false","false","Doha, Qatar","148780","Al Jazeera English","1863464804867834145","false","https://pbs.twimg.com/profile_images/1818213127286087680/CtPVxlPF_normal.jpg","","376656","https://twitter.com/AJEnglish","user","https://x.com/AJEnglish","AJEnglish","Business","Trump won re-election as a convicted felon awaiting sentencing in a hush money case, and while facing ongoing state and federal prosecution in several cases - that’s an unprecedented position for a president-elect.

🗳️ Read analysis: https://t.co/39TBunqYtZ | #USElection2024 https://t.co/7yP414dRGr","Wed Nov 06 16:47:33 +0000 2024"
,,,,,,"false","true","https://pbs.twimg.com/profile_banners/7587032/1732564370","Thu Jul 19 14:42:53 +0000 2007","The full story, first. Free, wherever you get your news @skynewsbreak for breaking news. Live on the Sky News app: https://t.co/B2AP8GvitH","onelink.to/skynews","http://onelink.to/skynews","115","138","https://t.co/B2AP8GvitH",,,,,,,,,,,"news.sky.com","http://news.sky.com/","0","23","https://t.co/UuWgHECmV8","0","26","8547027","104","true","7587032","true","false","false","London, UK","217105","Sky News",,"false","https://pbs.twimg.com/profile_images/1604907328242962433/P_79at43_normal.jpg","","697050","https://twitter.com/SkyNews","user","https://x.com/SkyNews","SkyNews","Business","As the world reacts to a second Trump presidency in the US, how will his re-election impact Rachel Reeves's budget?

Listen to your guide to the day in politics with @SamCoatesSky and @Jack_Blanchard_

Listen to Politics at Jack &amp; Sam's 👇🏽           
https://t.co/ExOJ9c2gUC","Wed Nov 06 16:30:00 +0000 2024"
,,,,,,"true","true","https://pbs.twimg.com/profile_banners/1434450096557596680/1731804622","Sun Sep 05 09:35:36 +0000 2021","The Home of UK Political News | Follow & Notify For Impartial Coverage First | 

🌍 News: @PolitlcsGlobal",,,,,,,,,,,,,,,,"newshubgroup.co.uk/about-us","http://newshubgroup.co.uk/about-us","0","23","https://t.co/GM6SHOAJVX","0","10403","329127","1005","true","1434450096557596680","true","false","false","United Kingdom","2471","Politics UK",,"false","https://pbs.twimg.com/profile_images/1688954450675740688/t1aS9_3Y_normal.jpg","","13437","https://twitter.com/PolitlcsUK","user","https://x.com/PolitlcsUK","PolitlcsUK",,"🚨 NEW: Lib Dem leader Ed Davey has called on Keir Starmer to hold a “Save Ukraine” summit of European leaders in London   

“Donald Trump’s re-election risks having a devastating impact on European security.""","Wed Nov 06 16:28:54 +0000 2024"
,,,,,,"false","true","https://pbs.twimg.com/profile_banners/2313027666/1593194338","Mon Jan 27 04:58:03 +0000 2014","Writer, reporter & China expert. News & analysis on Chinese affairs.

Support me: https://t.co/3leIMfq0bV
Also @JenniferZeng15","donorbox.org/support-inconv…","http://donorbox.org/support-inconvenient-truths-by-jennifer-zeng","82","105","https://t.co/3leIMfq0bV",,,,,,,,,,,"jenniferzengblog.com","https://www.jenniferzengblog.com","0","23","https://t.co/Tcn9HdBxLG","0","41762","249650","393","true","2313027666","true","false","false","New York, USA ","9847","Inconvenient Truths by Jennifer Zeng","1863007476808905009","false","https://pbs.twimg.com/profile_images/1336689846409175043/PvMdO7Cr_normal.jpg","","38009","https://twitter.com/jenniferzeng97","user","https://x.com/jenniferzeng97","jenniferzeng97",,"Seems the CCP isn't very happy about Trump's re-election. 

At today's regular press conference hosted by the Chinese Foreign Ministry spokesperson Mao Ning, a reporter asked: If Trump wins the election, would China send him a congratulatory message?

Mao Ning responded by saying that once the results of the U.S. election are officially announced, we (China) will ""handle the relevant matters according to convention.""","Wed Nov 06 16:26:05 +0000 2024"
"https://pbs.twimg.com/profile_images/1726722240748662784/2BjaL8mX_bigger.jpg","Conservative 🇺🇸","https://twitter.com/ConservativeOG","DeepLink","Badge","BusinessLabel","true","true","https://pbs.twimg.com/profile_banners/537709549/1696882383","Tue Mar 27 00:53:56 +0000 2012","Investigative Journalist 🇺🇸 Free Spirit🇺🇸Founder of LOOMERED. Host of @LoomerUnleashed Former @Project_Veritas operative. 📸 America First ✡️ Feisty Jewess",,,,,,,,,,,,,,,,"loomered.com","http://loomered.com","0","23","https://t.co/TlkQhmcPoR","0","109081","1390571","6990","true","537709549","true","false","false","Florida ","12702","Laura Loomer","1853227576061280748","false","https://pbs.twimg.com/profile_images/1751805801520332800/WIWv-QP2_normal.jpg","","78740","https://twitter.com/LauraLoomer","user","https://x.com/LauraLoomer","LauraLoomer",,"Congratulations to my friend Senator Rick Scott on his re-election to the US SENATE last night. 

Now we need to make him our next Senate GOP leader! 

3 people are running for Senate GOP leader. 

@SenJohnThune 
@JohnCornyn 
@ScottforFlorida 

The first two are rabid Trump haters and Mitch McConnell puppets and Rick Scott is a TRUMP LOYALIST and a defender of MAGA! 

The election is on November 13th, in just 7 days. 

I need all of you to call your GOP Senators and tell them to support Rick Scott as our next Senate GOP leader, and tell them you are demanding an OPEN BALLOT VOTE so they cannot vote in secret to undermine Trump. 

Let’s get it done, MAGA! Let’s have a MAGA Senate GOP leader who will work with President Trump to MAKE AMERICA GREAT AGAIN! 

Kick Mitch’s bitches to the curb.","Wed Nov 06 15:44:04 +0000 2024"
,,,,,,"true","true","https://pbs.twimg.com/profile_banners/1104060854872481792/1552064275","Fri Mar 08 16:46:35 +0000 2019","Writer for https://t.co/nk9ehLjlYs. Nothing Matters.","RedState.com","http://RedState.com","11","34","https://t.co/nk9ehLjlYs",,,,,,,,,,,"Redstate.com","http://Redstate.com","0","23","https://t.co/157MVnOZFg","0","51210","108222","717","true","1104060854872481792","true","false","false","United States","549","Bonchie","1803245583399874951","false","https://pbs.twimg.com/profile_images/1233865104535543808/O6Z67awq_normal.jpg","","6908","https://twitter.com/bonchieredstate","user","https://x.com/bonchieredstate","bonchieredstate",,"Donald Trump's biggest weapon the next four years is that he's a lame duck. Nothing Democrats do matters now. They can impeach him. Who cares? The press can cry. Who cares? 

He can govern unimpeded by concerns about re-election. And that has to be terrifying to them.","Wed Nov 06 15:15:43 +0000 2024"
,,,,,,"true","true","https://pbs.twimg.com/profile_banners/1036308216/1701275445","Wed Dec 26 04:44:53 +0000 2012","The good, bad, ugly of being a fan of Philadelphia sports. Eagles content, Phillies content, and more. @C_F_92",,,,,,,,,,,,,,,,,,,,,"0","63","43890","250","false","1036308216","true","false","false","","5279","Eagles Fan Central","1764666058542027138","false","https://pbs.twimg.com/profile_images/1769114593241051136/U9KPCaEM_normal.jpg","","10847","https://twitter.com/EagleFanCentral","user","https://x.com/EagleFanCentral","EagleFanCentral",,"Bill Clinton served his last 4 years
Bush served 8 years
Obama served 8 years
Trump served 4 years
Trump lost re-election
Trump won again 4 years after that…

All before the Cowboys advanced past the second round of the playoffs. https://t.co/Jm1Hpojdce","Wed Nov 06 15:08:46 +0000 2024"
,,,,,,"true","true","https://pbs.twimg.com/profile_banners/22146373/1694070373","Fri Feb 27 14:48:46 +0000 2009","Sam Coates, Deputy Political Editor, Sky News 📺📰🎙️ Politics at Jack and Sam’s podcast🎙️TV by @TomLarkinSky",,,,,,,,,,,,,,,,"news.sky.com","http://news.sky.com","0","23","https://t.co/mI4SqueCVU","0","9193","257474","5547","true","22146373","true","false","false","London","5719","Sam Coates Sky",,"false","https://pbs.twimg.com/profile_images/1699681636340629504/QpnZgorl_normal.jpg","","47290","https://twitter.com/SamCoatesSky","user","https://x.com/SamCoatesSky","SamCoatesSky",,"UK growth forecast by Goldman Sachs cut from 1.6% to 1.4% next year after Trump re-election

They blame Trump imposing tarrifs

Source: John Glenn, Tory MP at Treasury Select Committee (14:37:25)","Wed Nov 06 15:03:24 +0000 2024"
,,,,,,"true","false","https://pbs.twimg.com/profile_banners/1459340247217717252/1723986637","Sat Nov 13 02:00:17 +0000 2021","Political Commentator on GB News, BBC, TalkTV, LBC and Reasoned UK. 🇬🇧🇺🇸",,,,,,,,,,,,,,,,"linktr.ee/Alexharmstrong","https://linktr.ee/Alexharmstrong","0","23","https://t.co/vGMKDNQgzQ","0","31513","63298","988","true","1459340247217717252","true","false","false","United Kingdom","2880","Alex Armstrong","1800072881977577510","false","https://pbs.twimg.com/profile_images/1832195577347481600/ewzWAFy5_normal.jpg","","9403","https://twitter.com/alexharmstrong","user","https://x.com/alexharmstrong","alexharmstrong",,"Many British people are likely to be astounded by Trump’s re-election.

If you are, and had anticipated a landslide victory for Kamala Harris, ask yourselves where you are getting your information.

The legacy media, as well as our political elite, reside in an echo chamber. They are not a reliable or credible source of truth anymore, their agenda has been completely exposed.","Wed Nov 06 14:54:17 +0000 2024"
,,,,,,"false","true","https://pbs.twimg.com/profile_banners/14157134/1725487819","Sun Mar 16 11:41:49 +0000 2008","ITV (pol ed), Speakers for Schools (founder), writer (WTF), Hospice UK (vice pres), Arsenal (East Stand), Peston (as in #Peston show, 10.45pm Weds). So?",,,,,,,,,,,,,,,,"itv.com/robertpeston","http://itv.com/robertpeston","0","23","https://t.co/KcrDn3jvur","0","221","1337221","1658","true","14157134","true","false","false","","2801","Robert Peston","1836680719042527640","false","https://pbs.twimg.com/profile_images/1831453869575897089/qFj552KM_normal.jpg","","37877","https://twitter.com/Peston","user","https://x.com/Peston","Peston",,"Why Donald Trump’s re-election is a potential crisis for Sir Keir Starmer | ITV News https://t.co/IolvkszR47","Wed Nov 06 14:49:53 +0000 2024"
,,,,,,"false","true","https://pbs.twimg.com/profile_banners/807095/1584666392","Fri Mar 02 20:41:42 +0000 2007","News tips? Share them here: https://t.co/ghL9OoYKMM","nyti.ms/2FVHq9v","http://nyti.ms/2FVHq9v","28","51","https://t.co/ghL9OoYKMM",,,,,,,,,,,"nytimes.com","http://www.nytimes.com/","0","22","http://t.co/ahvuWqicF9","0","18565","55217009","864","true","807095","true","false","false","New York City","72257","The New York Times",,"false","https://pbs.twimg.com/profile_images/1098244578472280064/gjkVMelR_normal.png","","556062","https://twitter.com/nytimes","user","https://x.com/nytimes","nytimes",,"News Analysis: Despite Donald Trump's campaign proposals, it's still unclear how his administration will handle policy decisions that are crucial to the global economy's path including on trade, technology, climate, industrial policy and more. https://t.co/mg62d9DXxI","Wed Nov 06 21:10:03 +0000 2024"
,,,,,,"true","true",,"Sat Apr 08 17:32:50 +0000 2017","Technically a philosopher, who hopefully will finish his PhD one day. I write about stuff. ""At least he's pretty smart."" (@bechhof)",,,,,,,,,,,,,,,,"philippelemoine.com","https://www.philippelemoine.com","0","23","https://t.co/Q6ALekcqY5","0","134557","52481","1640","true","850763376263299078","true","false","false","Paris, France","5040","Philippe Lemoine","1115970456983691264","false","https://pbs.twimg.com/profile_images/1836820908935135232/mrDw6Rry_normal.jpg","","141231","https://twitter.com/phl43","user","https://x.com/phl43","phl43",,"People in Republican policy-making circles, who are in a better position to know than me, are telling me that this time Trump won't let neocons highjack his agenda because he'll have a solid foreign policy team behind him. I wish I could believe that, but I don't.","Wed Nov 06 21:03:40 +0000 2024"
,,,,,,"false","false","https://pbs.twimg.com/profile_banners/26792275/1725886456","Thu Mar 26 16:57:01 +0000 2009","The magazine for global politics, economics, and ideas | Sign up for our newsletters: https://t.co/vasoTyHsYj","foreignpolicy.com/newsletters/","http://foreignpolicy.com/newsletters/","86","109","https://t.co/vasoTyHsYj",,,,,,,,,,,"foreignpolicy.com","http://www.foreignpolicy.com","0","23","https://t.co/91lmodrlGD","0","1755","1264006","1064","false","26792275","true","false","false","","22386","Foreign Policy","1854164007386567006","false","https://pbs.twimg.com/profile_images/1387089996532879364/WYZKsRZu_normal.jpg","","153736","https://twitter.com/ForeignPolicy","user","https://x.com/ForeignPolicy","ForeignPolicy",,"Meet the 11 men whose worldviews could shape Trump’s foreign policy: https://t.co/QI2RQuIpt3","Wed Nov 06 21:00:31 +0000 2024"
"https://pbs.twimg.com/profile_images/1750481240983994368/ijRW1a6Y_bigger.jpg","Mario Nawfal’s Roundtable","https://twitter.com/RoundtableSpace","DeepLink","Badge","BusinessLabel","true","true","https://pbs.twimg.com/profile_banners/1319287761048723458/1687204248","Thu Oct 22 14:42:25 +0000 2020","Host of the Largest Show on X | Unfiltered Unbiased 24x7 News | Founder & Investor",,,,,,,,,,,,,,,,"roundtable.live","https://roundtable.live","0","23","https://t.co/Lru9VAixI8","0","139559","1806750","36996","true","1319287761048723458","true","false","false","","64384","Mario Nawfal","1854149705879392479","false","https://pbs.twimg.com/profile_images/1670905743619268609/pYItlWat_normal.jpg","","89379","https://twitter.com/MarioNawfal","user","https://x.com/MarioNawfal","MarioNawfal",,"🇺🇸 VIVEK: HERE'S WHY TRUMP WON 

""Here’s the reason why Donald Trump won by the largest margin of any President in modern history. He’s not an ideologue. He’s not a policy wonk. He’s an American badass. They tried to DQ him, jail him, kill him (twice). None of it worked. Our self-appointed “betters” in the media misunderstood him, underestimated him, doubted him.  

But not once during this campaign did Trump misunderstand, underestimate, or doubt himself. As everyone at Mar-a-Lago celebrated around him last night, I watched him unfazed, with full conviction that he was exactly where he was destined to be. 

He’s just like our nation in that way. We’ve always believed it was our manifest destiny to be exceptional, to be the greatest nation on Earth, to show the world what’s possible for humanity to achieve, even when other countries doubted us. Some still do today.  

But they’re wrong. Trump’s comeback is the American comeback. Our nation deserves a badass Commander-in-Chief right now & that’s exactly what we got. Funny how well our democracy actually works.""

Source: @VivekGRamaswamy","Wed Nov 06 20:56:24 +0000 2024"
,,,,,,"true","true","https://pbs.twimg.com/profile_banners/16012783/1636046565","Wed Aug 27 15:24:02 +0000 2008","Independent. Intelligent. Influential. Send tips to tips@thedailybeast.com

Check out @beastobsessed, our new hub for pop-culture's moments, movies and shows!",,,,,,,,,,,,,,,,"thedailybeast.com","https://www.thedailybeast.com/","0","23","https://t.co/F8DfniC2XD","0","2933","1317140","1059","true","16012783","true","false","false","New York, NY","66745","The Daily Beast",,"false","https://pbs.twimg.com/profile_images/1234868520040771584/28a_ytJJ_normal.jpg","","457430","https://twitter.com/thedailybeast","user","https://x.com/thedailybeast","thedailybeast","Business","Jack Smith is in talks with officials about ending his criminal cases against President-elect Trump in line with a longstanding policy that sitting presidents cannot be prosecuted.

https://t.co/5ZWFeKHAEX","Wed Nov 06 20:53:26 +0000 2024"
,,,,,,"true","false","https://pbs.twimg.com/profile_banners/1480304164337033217/1683152356","Sun Jan 09 22:23:22 +0000 2022","Media platform covering global conflict zones. Focus on the Russian-Ukrainian war. If you'd like to support our voluntary work: https://t.co/PmM2wwDA1Y.","buymeacoffee.com/noelreports","http://buymeacoffee.com/noelreports","128","151","https://t.co/PmM2wwDA1Y",,,,,,,,,,,"linktr.ee/noelreports","https://linktr.ee/noelreports","0","23","https://t.co/r58LztmIvI","0","20329","470943","372","true","1480304164337033217","true","false","false","","31973","NOELREPORTS 🇪🇺 🇺🇦","1575803392483790849","false","https://pbs.twimg.com/profile_images/1653886968617488385/9tvStjKb_normal.jpg","","59763","https://twitter.com/NOELreports","user","https://x.com/NOELreports","NOELreports",,"🇩🇪🇫🇷 German Defense Minister Pistorius will head to France after Trump's election win for talks with his French counterpart Lecornu. Discussions will focus on the implications of Trump's victory, future support for Ukraine, and European defense policy.

https://t.co/HDBpWPoCHu","Wed Nov 06 20:52:14 +0000 2024"
,,,,,,"true","true","https://pbs.twimg.com/profile_banners/1227799690579718144/1706208030","Thu Feb 13 03:41:05 +0000 2020","Small-government crusader",,,,,,,,,,,,,,,,,,,,,"0","11331","3357171","292","false","1227799690579718144","true","false","false","Ohio, USA","4342","Vivek Ramaswamy","1862183684457058617","false","https://pbs.twimg.com/profile_images/1848818505556094977/bfQ4OO7F_normal.jpg","","14666","https://twitter.com/VivekGRamaswamy","user","https://x.com/VivekGRamaswamy","VivekGRamaswamy",,"Here’s the reason why Donald Trump won by the largest margin of any President in modern history. He’s not an ideologue. He’s not a policy wonk. He’s an American badass. They tried to DQ him, jail him, kill him (twice). None of it worked. Our self-appointed “betters” in the media misunderstood him, underestimated him, doubted him.

But not once during this campaign did Trump misunderstand, underestimate, or doubt himself. As everyone at Mar-a-Lago celebrated around him last night, I watched him unfazed, with full conviction that he was exactly where he was destined to be.

He’s just like our nation in that way. We’ve always believed it was our manifest destiny to be exceptional, to be the greatest nation on Earth, to show the world what’s possible for humanity to achieve, even when other countries doubted us. Some still do today.

But they’re wrong. Trump’s comeback is the American comeback. Our nation deserves a badass Commander-in-Chief right now & that’s exactly what we got. Funny how well our democracy actually works.","Wed Nov 06 20:46:43 +0000 2024"
