,,,,,,"true","true","https://pbs.twimg.com/profile_banners/14780915/1731938492","Thu May 15 02:52:27 +0000 2008","The latest news and more from Rolling Stone magazine and https://t.co/yJnSOtbi68. Got a tip? Share it here: https://t.co/4pKrTBMI3A","RollingStone.com","http://RollingStone.com","57","80","https://t.co/yJnSOtbi68","rol.st/tips","http://rol.st/tips","108","131","https://t.co/4pKrTBMI3A",,,,,,"rollingstone.com","http://www.rollingstone.com","0","23","https://t.co/HPZh9kIhYX","0","1412","6114128","528","true","14780915","true","false","false","New York, New York","102034","Rolling Stone","1858510835066318879","false","https://pbs.twimg.com/profile_images/1616119148911771668/Nwdk0gjU_normal.jpg","","230146","https://twitter.com/RollingStone","user","https://x.com/RollingStone","RollingStone","Business","Kamala Harris called Donald Trump on Wednesday afternoon to concede and congratulate him on winning the 2024 presidential election.

Harris discussed the “importance of a peaceful transfer of power and being a president for all Americans.""

More: https://t.co/haRAuEkajl https://t.co/zP5K0EFgAv","Wed Nov 06 19:17:26 +0000 2024"
,,,,,,"false","false","https://pbs.twimg.com/profile_banners/2207129125/1724836333","Thu Nov 21 12:57:08 +0000 2013","The leader in Bitcoin, Ethereum & blockchain news. TG: https://t.co/M6iNuH7EmF Mobile app: https://t.co/6IsiPgeFHp","t.me/cointelegraph","http://t.me/cointelegraph","55","78","https://t.co/M6iNuH7EmF","linktr.ee/cointelegraph_…","https://linktr.ee/cointelegraph_mobile","91","114","https://t.co/6IsiPgeFHp",,,,,,"cointelegraph.com","https://cointelegraph.com/","0","23","https://t.co/td5A2zRInc","0","12772","2396873","1166","true","2207129125","true","false","false","New York, New York","27262","Cointelegraph",,"false","https://pbs.twimg.com/profile_images/1755983593925378048/kYutau0B_normal.jpg","","150936","https://twitter.com/Cointelegraph","user","https://x.com/Cointelegraph","Cointelegraph","Business","🇺🇸 LATEST: Kamala Harris concedes the 2024 presidential election.

This cycle saw $245 million in campaign finances from top crypto PACs, per CNBC. https://t.co/jCLBJAXfrH","Wed Nov 06 19:17:20 +0000 2024"
,,,,,,"true","true","https://pbs.twimg.com/profile_banners/44425241/1576502915","Wed Jun 03 18:49:42 +0000 2009","Executive Editor TV9 Network | National Security-Strategic Affairs | ACYPL/Bucerius Fellow | 40 Under 40 | Jethmalani Journalism Prize | Red Ink Special Mention",,,,,,,,,,,,,,,,"linkedin.com/in/aditya-raj-…","https://www.linkedin.com/in/aditya-raj-kaul-60689515","0","23","https://t.co/2c2gm7uTzJ","0","136850","424953","7938","true","44425241","true","false","false","New Delhi, India","18236","Aditya Raj Kaul","1862837170983018744","false","https://pbs.twimg.com/profile_images/1774343694268645376/ExyPf45R_normal.jpg","","114068","https://twitter.com/AdityaRajKaul","user","https://x.com/AdityaRajKaul","AdityaRajKaul",,"#BREAKING: Kamala Harris has officially conceded the 2024 election, calling President-elect Donald Trump to offer her congratulations on winning the 2024 presidential election. “She discussed the importance of a peaceful transfer of power &amp; being a president for all Americans.”","Wed Nov 06 19:14:19 +0000 2024"
,,,,,,"true","true","https://pbs.twimg.com/profile_banners/10774652/1731456636","Sat Dec 01 22:23:57 +0000 2007","News and entertainment for people who love the American way of life. Retweets =/= endorsements.",,,,,,,,,,,,,,,,"theblaze.com","https://www.theblaze.com/","0","23","https://t.co/fzW2udWeEx","0","9344","1005970","748","true","10774652","false","false","false","Dallas, TX","43274","TheBlaze",,"false","https://pbs.twimg.com/profile_images/1716691045419765760/YatcqDHU_normal.jpg","","190142","https://twitter.com/theblaze","user","https://x.com/theblaze","theblaze","Business","🚨 

“Kamala Harris has officially conceded the 2024 presidential election, calling president-elect Donald Trump to offer her congratulations.”  https://t.co/3R9k02bvi5","Wed Nov 06 19:14:03 +0000 2024"
,,,,,,"false","false","https://pbs.twimg.com/profile_banners/1518680588756131841/1732768088","Mon Apr 25 19:57:29 +0000 2022","Independent journalist focusing on federal politics |
Contact for public speaking, advertising |
Latest article: https://t.co/uqAlG4NXAn","toronto99.com/author/mark_sl…","https://www.toronto99.com/author/mark_slapinski","113","136","https://t.co/uqAlG4NXAn",,,,,,,,,,,"Linktr.ee/MarkSlapinski","http://Linktr.ee/MarkSlapinski","0","23","https://t.co/rQijf2SkqI","0","14888","39078","697","true","1518680588756131841","true","false","false","Toronto","3645","Mark Slapinski","1863405602329727383","false","https://pbs.twimg.com/profile_images/1693325263180861440/UnQkc17c_normal.jpg","","26845","https://twitter.com/mark_slapinski","user","https://x.com/mark_slapinski","mark_slapinski",,"Canada is set to become a HOT BED for illegal aliens now that Donald Trump won the 2024 presidential election. Gangsters, serial rapists, and mass murderers are already crossing into Canada in record numbers.

Is it time to close the border down?

https://t.co/WKFPvI6Sg9","Wed Nov 06 19:08:41 +0000 2024"
,,,,,,"false","true","https://pbs.twimg.com/profile_banners/25589776/1703179451","Fri Mar 20 22:30:24 +0000 2009","The #1 source for celebrity news and inspiring stories. ✨

If you click on the links we provide, we may receive compensation.",,,,,,,,,,,,,,,,,,,,,"0","4608","7575478","1592","true","25589776","true","false","false","","127112","People",,"false","https://pbs.twimg.com/profile_images/1781063289474109440/-FXlO5UM_normal.jpg","","497859","https://twitter.com/people","user","https://x.com/people","people","Business","Kamala Harris Concedes to Donald Trump in the 2024 Presidential Election https://t.co/3GoXdHAh1X","Wed Nov 06 19:05:22 +0000 2024"
,,,,,,"false","false","https://pbs.twimg.com/profile_banners/14173315/1731686804","Tue Mar 18 23:19:17 +0000 2008","News updates from around the 🌎, all day, every day.",,,,,,,,,,,,,,,,"NBCNews.com","http://NBCNews.com","0","23","https://t.co/2f2PctyT1n","0","733","9405591","1331","true","14173315","true","false","false","New York, NY","96173","NBC News",,"false","https://pbs.twimg.com/profile_images/1726675942938980352/bxKUxCUp_normal.jpg","","415055","https://twitter.com/NBCNews","user","https://x.com/NBCNews","NBCNews","Business","BREAKING: Kamala Harris called President-elect Trump ""to congratulate him on winning the 2024 presidential election,"" a senior Harris aide tells NBC News. 

https://t.co/ttOXJiIZmI https://t.co/v8Q7NQdzVd","Wed Nov 06 19:04:48 +0000 2024"
,,,,,,"false","true","https://pbs.twimg.com/profile_banners/472325162/1732290200","Mon Jan 23 20:49:17 +0000 2012","Exploring the Unknown 🌍 | Philosophy 👨‍🎨 | Student of Life 🇱🇧🇺🇸 | partnerships@arabuncut.com",,,,,,,,,,,,,,,,"taboo.tv","http://taboo.tv","0","23","https://t.co/cYwf6FOb65","0","114466","239954","967","true","472325162","true","false","false","worldwide","1812","Arab",,"false","https://pbs.twimg.com/profile_images/1520295667796742144/xPIW_ziK_normal.jpg","","9549","https://twitter.com/YourFellowArab","user","https://x.com/YourFellowArab","YourFellowArab",,"Taliban Reacts to 2024 U.S. Presidential Election 🇺🇸 🇦🇫 https://t.co/DcilgWkjsI","Wed Nov 06 19:04:30 +0000 2024"
,,,,,,"true","true","https://pbs.twimg.com/profile_banners/1176026136117166080/1704687518","Mon Sep 23 06:51:06 +0000 2019","RawsAlerts is your go-to source for fast and accurate news coverage, specializing in groundbreaking events across the USA. Follow @Rawsglobal for world news",,,,,,,,,,,,,,,,"linktr.ee/Rawsalerts","https://linktr.ee/Rawsalerts","0","23","https://t.co/xCzsNRZy23","0","50304","1146962","2011","true","1176026136117166080","true","false","false","United states ","4675","R A W S A L E R T S",,"false","https://pbs.twimg.com/profile_images/1603089247313035264/ZRPrAxM1_normal.jpg","","15180","https://twitter.com/rawsalerts","user","https://x.com/rawsalerts","rawsalerts",,"🚨#BREAKING: Vice president Kamala Harris has called President elect Donald Trump to congratulate him on 2024 U.S. presidential election victory","Wed Nov 06 19:03:39 +0000 2024"
,,,,,,"true","true","https://pbs.twimg.com/profile_banners/189305014/1499145031","Fri Sep 10 22:43:34 +0000 2010","Breaking news and developing stories from the U.S. and around the world. For insights, follow @BNODesk. Hit the subscribe button to support our work.",,,,,,,,,,,,,,,,"bnonews.com","https://www.bnonews.com","0","23","https://t.co/fGKMFDLP7l","0","324","491324","11","true","189305014","true","false","false","Worldwide","6284","BNO News",,"false","https://pbs.twimg.com/profile_images/882103883610427393/vLTiH3uR_normal.jpg","","25353","https://twitter.com/BNONews","user","https://x.com/BNONews","BNONews",,"Kamala Harris has called President-elect Donald Trump to congratulate him on 2024 U.S. presidential election victory","Wed Nov 06 18:58:42 +0000 2024"
,,,,,,"false","true","https://pbs.twimg.com/profile_banners/267283006/1593215053","Wed Mar 16 17:04:21 +0000 2011","Father of 9, Army veteran, marathon runner, NRA, believer in The Church of Jesus Christ of Latter-day Saints. Talk-show host at WHAM radio and WSYR radio.",,,,,,,,,,,,,,,,"lonsberry.com","http://www.lonsberry.com","0","23","https://t.co/76q67PuknY","0","43633","35310","837","true","267283006","true","false","false","Mount Morris, New York","13980","Bob Lonsberry",,"false","https://pbs.twimg.com/profile_images/1109054115747979264/wpNqXKwU_normal.png","","141360","https://twitter.com/BobLonsberry","user","https://x.com/BobLonsberry","BobLonsberry",,"Thank God and the good judgment of the American people for the re-election of Donald Trump. The country and the world have dodged a bullet. Peace, prosperity and progress are more likely now, and the socialist degradation of our country has been rejected.","Wed Nov 06 11:09:37 +0000 2024"
,,,,,,"false","false","https://pbs.twimg.com/profile_banners/1345311614166134785/1688705187","Sat Jan 02 10:11:12 +0000 2021","@actorvijay  ᴛʜᴀɴɢᴀᴄʜɪ ᴀɴʙᴜᴋᴜ ꜱᴏɴᴛʜᴀᴋᴀʀɪ.ᴋᴏᴠᴀᴋᴀʀɪ
ɴᴀɴᴀ ꜱᴀɴᴅᴀɪᴋᴜ ᴩᴏɢᴀ ᴍᴀᴛᴇɴ ᴠᴀɴᴛʜᴀ ᴠɪᴅᴀ ᴍᴀᴛᴛᴇɴ✍
ᴜyɪʀ💘#ʙᴀʙᴜ💘  ᴍɪꜱꜱ ᴍy ᴅᴀᴅ💔 #TVK",,,,,,,,,,,,,,,,,,,,,"0","481167","27350","10710","true","1345311614166134785","true","false","false","Tamilnadu","22692","💘𝐉𝐞𝐧𝐢💘 𝐕𝐢𝐉𝐚𝐘","1863536398344614210","false","https://pbs.twimg.com/profile_images/1753837671846187009/KbZJTYSF_normal.jpg","","724958","https://twitter.com/Jeni__Vijay","user","https://x.com/Jeni__Vijay","Jeni__Vijay",,"Donald Trump is making history as he seeks to become the first former U.S. president to reclaim the presidency after losing a re-election bid. With the support of the #MAGA movement, Trump’s 2024 campaign aims to emphasize his previous policy successes and focus on issues like economic growth, border security, and reducing government regulation. This comeback bid is a pivotal moment in U.S. political history, drawing interest from high-profile figures, including Elon Musk, who has taken a renewed interest in political discourse and free speech on his platform, X (formerly Twitter).

Whether Trump’s campaign succeeds or not, his run is already shaping the 2024 election landscape, influencing conversations about the future of American leadership and policy direction.

#MAGA #Trump2024 #USAelections2024 #MakeAmericaGreatAgain #DonaldTrump #ElonMusk #PoliticalComeback #TrumpCampaign #Election2024 #USPolitics #Vote2024 #TrumpForPresident #MAGA2024 #ElonAndPolitics #AmericanLeadership","Wed Nov 06 10:25:30 +0000 2024"
,,,,,,"false","true","https://pbs.twimg.com/profile_banners/17409452/1556090507","Sat Nov 15 16:31:32 +0000 2008","Citizen Reporters In New York",,,,,,,,,,,,,,,,"saharareporters.com","http://saharareporters.com/","0","23","https://t.co/pbfWbFrVHa","0","161","5458809","611","true","17409452","true","false","false","New York","105211","Sahara Reporters","1797320831258734900","false","https://pbs.twimg.com/profile_images/484178487360499712/LeRpr7xQ_normal.png","","188309","https://twitter.com/SaharaReporters","user","https://x.com/SaharaReporters","SaharaReporters",,"President Tinubu @officialABAT  Congratulates Donald Trump @realDonaldTrump  On Re-Election Victory, Seeks Stronger Nigeria-US Partnership | Sahara Reporters https://t.co/xALCLG9or7 https://t.co/7MPJ7DsieW","Wed Nov 06 10:06:03 +0000 2024"
,,,,,,"false","true","https://pbs.twimg.com/profile_banners/24291371/1641817325","Sat Mar 14 00:27:10 +0000 2009","This is the official Twitter handle of PUNCH Newspapers, the most widely read newspaper in Nigeria.",,,,,,,,,,,,,,,,"punchng.com","http://www.punchng.com","0","23","https://t.co/JwPtwCGMPv","0","134","6896277","2119","true","24291371","true","false","false","Lagos, Nigeria","111523","Punch Newspapers","1863420084217151987","false","https://pbs.twimg.com/profile_images/1480515290416963584/EiZOsM_f_normal.jpg","","684894","https://twitter.com/MobilePunch","user","https://x.com/MobilePunch","MobilePunch",,"President Bola Tinubu on Wednesday extended his congratulations to Donald Trump on his re-election as the 47th President of the United States of America.

https://t.co/WqpjPIDeUb","Wed Nov 06 10:01:45 +0000 2024"
,,,,,,"false","false","https://pbs.twimg.com/profile_banners/221133325/1564219238","Mon Nov 29 20:51:17 +0000 2010","Special Adviser, Media & Public Communication  to President of Nigeria, Bola Tinubu.Studied @ ABU, UNIJOS, NYU,Harvard and Oxford Universities.",,,,,,,,,,,,,,,,"Sundaydare.com","http://www.Sundaydare.com","0","23","https://t.co/iKxqg3kxh9","0","1103","105085","1188","true","221133325","true","false","false","Abuja | Ibadan | Lagos","694","Sunday Dare,CON",,"false","https://pbs.twimg.com/profile_images/1857332864024510464/VBMvV77p_normal.jpg","","10259","https://twitter.com/SundayDareSD","user","https://x.com/SundayDareSD","SundayDareSD",,"STATE HOUSE PRESS RELEASE

PRESIDENT TINUBU CONGRATULATES PRESIDENT-ELECT TRUMP

President Bola Tinubu extends his heartfelt congratulations to President Donald Trump on his re-election as the 47th President of the United States of America. 

President Tinubu looks forward to strengthening the ties between Nigeria and the United States amid the complex challenges and opportunities of the contemporary world.

President Tinubu says, “Together, we can foster economic cooperation, promote peace, and address global challenges that affect our citizens.”

According to President Tinubu, Trump’s victory reflects the trust and confidence the American people have placed in his leadership. He congratulates them on their commitment to democracy.

President Tinubu believes that, given President Trump’s experience as the 45th president of the United States from 2017 to 2021, his return to the White House as the 47th president will usher in an era of earnest, beneficial, and reciprocal economic and development partnerships between Africa and the United States.

Acknowledging the United States' influence, power, and position in determining the trend and course of global events, the Nigerian leader trusts that President Trump will bring the world closer to peace and prosperity. 

Bayo Onanuga 
Special Adviser to the President
(Information & Strategy) 
November 6, 2024","Wed Nov 06 09:57:59 +0000 2024"
,,,,,,"false","true","https://pbs.twimg.com/profile_banners/242907470/1707500254","Tue Jan 25 21:40:14 +0000 2011","Investigative correspondent for The Washington Post based in London. 
Pulitzer Prizes 2018, 2014. greg.miller@washpost.com; signal +1 202-494-1545.",,,,,,,,,,,,,,,,"washingtonpost.com/people/greg-mi…","https://www.washingtonpost.com/people/greg-miller/","0","23","https://t.co/2MqunesRq8","0","1160","112447","1736","true","242907470","true","false","false","London","72","Greg Miller","1067604171917062144","false","https://pbs.twimg.com/profile_images/1756009455072796672/cDcm2wyp_normal.jpg","","3553","https://twitter.com/gregpmiller","user","https://x.com/gregpmiller","gregpmiller",,"""Russia’s Vladimir Putin will doubtless see huge advantages to Trump’s re-election, notably in Ukraine. Yet it was Americans who put Trump back in office without obvious help."" https://t.co/bwmH3vr2AE via @ft","Wed Nov 06 09:38:12 +0000 2024"
,,,,,,"false","false","https://pbs.twimg.com/profile_banners/328576792/1558702668","Sun Jul 03 16:53:11 +0000 2011","Former MP & Justice Minister. GP. Husband. Father to two beautiful daughters. For evidence-based policymaking. Support UK joining EU #PowerofSport #ActOnClimate",,,,,,,,,,,,,,,,,,,,,"0","1542","38791","439","true","328576792","false","false","false","Berkshire","611","Dr Phillip Lee","1191695877267689479","false","https://pbs.twimg.com/profile_images/882260379480592384/Zr-MhDcu_normal.jpg","","5039","https://twitter.com/DrPhillipLee","user","https://x.com/DrPhillipLee","DrPhillipLee",,"One positive outcome of Trump’s win is that Europe’s democracies will have to come together more in future to guarantee their security. And yes Britain will &amp; should be a major player in that. Brexit was always a mistake. With Trump’s re-election its reversal has become essential","Wed Nov 06 09:31:48 +0000 2024"
,,,,,,"true","true","https://pbs.twimg.com/profile_banners/1518252654346051587/1650815014","Sun Apr 24 15:37:11 +0000 2022","Buharist, APC member, @manutd fan",,,,,,,,,,,,,,,,,,,,,"0","442","164594","1715","true","1518252654346051587","true","false","false","","12391","Imran Muhammad",,"false","https://pbs.twimg.com/profile_images/1633635748099371008/EIE_fh7U_normal.jpg","","16337","https://twitter.com/Imranmuhdz","user","https://x.com/Imranmuhdz","Imranmuhdz",,"President Bola Tinubu warmly congratulates President Donald Trump on his successful re-election as the 47th President of the United States of America.

President Tinubu is eager to enhance the relationship between Nigeria and the United States, particularly in light of the intricate challenges and opportunities presented by today's global landscape.

“Together, we can foster economic cooperation, promote peace, and address global challenges that affect our citizens,” the president said.","Wed Nov 06 09:21:11 +0000 2024"
,,,,,,"true","true","https://pbs.twimg.com/profile_banners/1104311159203790849/1676129051","Sat Mar 09 09:21:12 +0000 2019","Facts and amazing stories from Nigeria |

Don’t forget to turn our notification ON 🔔| Email: Contact@nigeriastories.com or DM for promo and partnership",,,,,,,,,,,,,,,,"Nigeriastories.com","https://Nigeriastories.com","0","23","https://t.co/nBGwPohPIR","0","8625","530182","1","true","1104311159203790849","true","false","false","Nigeria","17886","Nigeria Stories",,"false","https://pbs.twimg.com/profile_images/1380447351345668097/GYSwCSGR_normal.jpg","","45388","https://twitter.com/NigeriaStories","user","https://x.com/NigeriaStories","NigeriaStories",,"PRESIDENT  BOLA TINUBU CONGRATULATES USA 🇺🇸 PRESIDENT-ELECT TRUMP

President Bola Tinubu extends his heartfelt congratulations to President Donald Trump on his re-election as the 47th President of the United States of America. https://t.co/lDeZb4g5c1","Wed Nov 06 09:21:05 +0000 2024"
,,,,,,"true","true","https://pbs.twimg.com/profile_banners/80610492/1677610650","Wed Oct 07 16:05:55 +0000 2009","Newspaper Chief Executive, Former Director Media and Publicity Tinubu/Shettima Campaign, Special Adviser Information and Strategy to President Tinubu. Married.",,,,,,,,,,,,,,,,"statehouse.gov.ng/press-office/","https://statehouse.gov.ng/press-office/","0","23","https://t.co/gd9EmTYchg","0","11416","103564","2398","true","80610492","true","false","false","Lagos, Nigeria","1272","Bayo Onanuga","1862201747189510224","false","https://pbs.twimg.com/profile_images/1630643643882061836/9C-DIu9f_normal.jpg","","11711","https://twitter.com/aonanuga1956","user","https://x.com/aonanuga1956","aonanuga1956",,"PRESIDENT TINUBU CONGRATULATES PRESIDENT-ELECT TRUMP

President Bola Tinubu extends his heartfelt congratulations to President Donald Trump on his re-election as the 47th President of the United States of America.

President Tinubu looks forward to strengthening the ties between Nigeria and the United States amid the complex challenges and opportunities of the contemporary world.

President Tinubu says, “Together, we can foster economic cooperation, promote peace, and address global challenges that affect our citizens.”

According to President Tinubu, Trump’s victory reflects the trust and confidence the American people have placed in his leadership. He congratulates them on their commitment to democracy.

President Tinubu believes that, given President Trump’s experience as the 45th president of the United States from 2017 to 2021, his return to the White House as the 47th president will usher in an era of earnest, beneficial, and reciprocal economic and development partnerships between Africa and the United States.

Acknowledging the United States' influence, power, and position in determining the trend and course of global events, the Nigerian leader trusts that President Trump will bring the world closer to peace and prosperity.

Bayo Onanuga

Special Adviser to the President

(Information & Strategy)

November 6, 2024","Wed Nov 06 09:18:42 +0000 2024"
,,,,,,"false","true","https://pbs.twimg.com/profile_banners/950900447908306944/1704036742","Wed Jan 10 01:21:48 +0000 2018","Now: Climate advocate. Then: Threatened Species Commissioner and Ambassador for Australia.",,,,,,,,,,,,,,,,"lyrebirddreaming.com","http://www.lyrebirddreaming.com/","0","23","https://t.co/PFl0MApxK1","0","39277","5853","3194","false","950900447908306944","true","false","false","Canberra","1023","Gregory Andrews",,"false","https://pbs.twimg.com/profile_images/1472583386950778880/NtMYVCDv_normal.jpg","","4862","https://twitter.com/LyrebirdDream","user","https://x.com/LyrebirdDream","LyrebirdDream",,"@PhillipAdams_1 With Trump's re-election, it's time for Australia to reassess our alliance and dependence on the US.

We must forge a more independent path.

Just published my latest blog: ""American Democratic Decay: Australia Must Find New Friends."" 

Read more here.👇🏽

https://t.co/hQ2eoRfWQD","Wed Nov 06 09:18:18 +0000 2024"
,,,,,,"false","true","https://pbs.twimg.com/profile_banners/950900447908306944/1704036742","Wed Jan 10 01:21:48 +0000 2018","Now: Climate advocate. Then: Threatened Species Commissioner and Ambassador for Australia.",,,,,,,,,,,,,,,,"lyrebirddreaming.com","http://www.lyrebirddreaming.com/","0","23","https://t.co/PFl0MApxK1","0","39277","5853","3194","false","950900447908306944","true","false","false","Canberra","1023","Gregory Andrews",,"false","https://pbs.twimg.com/profile_images/1472583386950778880/NtMYVCDv_normal.jpg","","4862","https://twitter.com/LyrebirdDream","user","https://x.com/LyrebirdDream","LyrebirdDream",,"@JaneCaro With Trump's re-election, it's time for Australia to reassess our alliance and dependence on the US.

We must forge a more independent path.

Just published my latest blog: ""American Democratic Decay: Australia Must Find New Friends."" 

Read more here.👇🏽

https://t.co/hQ2eoRfWQD","Wed Nov 06 09:18:00 +0000 2024"
,,,,,,"true","false","https://pbs.twimg.com/profile_banners/104296908/1685193992","Tue Jan 12 22:47:44 +0000 2010","Journalist • Husband • Father • Special Assistant on Digital Communications to Muhammadu Buhari, former President of the Federal Republic of Nigeria. | 𝙊𝙊𝙉.",,,,,,,,,,,,,,,,"linktr.ee/bashirahmaad","https://linktr.ee/bashirahmaad","0","23","https://t.co/piWQ83SiqP","0","21189","1695459","422","true","104296908","true","false","false","📍Abuja, Nigeria","9412","Bashir Ahmad","1781476044974833671","false","https://pbs.twimg.com/profile_images/1564318503846412295/DE0T7sg0_normal.jpg","","60071","https://twitter.com/BashirAhmaad","user","https://x.com/BashirAhmaad","BashirAhmaad",,"PRESIDENT TINUBU CONGRATULATES PRESIDENT-ELECT TRUMP
 
President Bola Tinubu extends his heartfelt congratulations to President Donald Trump on his re-election as the 47th President of the United States of America.  
 
President Tinubu looks forward to strengthening the ties between Nigeria and the United States amid the complex challenges and opportunities of the contemporary world.
 
President Tinubu says, “Together, we can foster economic cooperation, promote peace, and address global challenges that affect our citizens.”
 
According to President Tinubu, Trump’s victory reflects the trust and confidence the American people have placed in his leadership. He congratulates them on their commitment to democracy.
 
President Tinubu believes that, given President Trump’s experience as the 45th president of the United States from 2017 to 2021, his return to the White House as the 47th president will usher in an era of earnest, beneficial, and reciprocal economic and development partnerships between Africa and the United States. 
 
Acknowledging the United States' influence, power, and position in determining the trend and course of global events, the Nigerian leader trusts that President Trump will bring the world closer to peace and prosperity.  
 
Bayo Onanuga
Special Adviser to the President
(Information & Strategy) 
November 6, 2024","Wed Nov 06 09:17:06 +0000 2024"
