"author/affiliatesHighlightedLabel/label/badge/url","author/affiliatesHighlightedLabel/label/description","author/affiliatesHighlightedLabel/label/url/url","author/affiliatesHighlightedLabel/label/url/urlType","author/affiliatesHighlightedLabel/label/userLabelDisplayType","author/affiliatesHighlightedLabel/label/userLabelType","author/canDm","author/canMediaTag","author/coverPicture","author/createdAt","author/description","author/entities/description/urls/0/display_url","author/entities/description/urls/0/expanded_url","author/entities/description/urls/0/indices/0","author/entities/description/urls/0/indices/1","author/entities/description/urls/0/url","author/entities/description/urls/1/display_url","author/entities/description/urls/1/expanded_url","author/entities/description/urls/1/indices/0","author/entities/description/urls/1/indices/1","author/entities/description/urls/1/url","author/entities/description/urls/2/display_url","author/entities/description/urls/2/expanded_url","author/entities/description/urls/2/indices/0","author/entities/description/urls/2/indices/1","author/entities/description/urls/2/url","author/entities/url/urls/0/display_url","author/entities/url/urls/0/expanded_url","author/entities/url/urls/0/indices/0","author/entities/url/urls/0/indices/1","author/entities/url/urls/0/url","author/fastFollowersCount","author/favouritesCount","author/followers","author/following","author/hasCustomTimelines","author/id","author/isBlueVerified","author/isTranslator","author/isVerified","author/location","author/mediaCount","author/name","author/pinnedTweetIds/0","author/possiblySensitive","author/profilePicture","author/status","author/statusesCount","author/twitterUrl","author/type","author/url","author/userName","author/verifiedType","text","createdAt"
,,,,,,"false","true","https://pbs.twimg.com/profile_banners/1486756034697904136/1725137033","Thu Jan 27 17:40:53 +0000 2022","https://t.co/n2pBxgJpWU","t.me/theferrymansto…","http://t.me/theferrymanstoll","0","23","https://t.co/n2pBxgJpWU",,,,,,,,,,,,,,,,"0","33671","47165","664","true","1486756034697904136","true","false","false","","5255","◽⨁ The Ferryman's Toll ⨁◽",,"false","https://pbs.twimg.com/profile_images/1859769855051706368/nhGTLeE0_normal.jpg","","20493","https://twitter.com/ferryman4747","user","https://x.com/ferryman4747","ferryman4747",,"There are two kinds of  Pierre Poilievre supporters:

The ones that swear he's nothing like Trump, and the ones that swear he's exactly like Trump lol.","Wed Nov 06 23:59:30 +0000 2024"
,,,,,,"true","true","https://pbs.twimg.com/profile_banners/274891222/1697419772","Thu Mar 31 06:44:35 +0000 2011","TRUMP SUPPORTER. I am here to awaken Democrat voters . I work for MyPillow (promo code M) #MyPillowPromoCodeM #MAGA #Trump2024 #TrumpWasRightAboutEverything",,,,,,,,,,,,,,,,"MyPillow.com/promocodem","http://MyPillow.com/promocodem","0","23","https://t.co/xgZ9Gtieia","0","253834","241360","162564","true","274891222","true","false","false"," British Columbia ","18069","BRIAN FRASER","1823087950022009160","false","https://pbs.twimg.com/profile_images/1798939587072634880/jJB75gDL_normal.jpg","","402973","https://twitter.com/bfraser747","user","https://x.com/bfraser747","bfraser747",,"For all the Trump supporters posting on social media our narrative of why Trump was a better candidate needs to shift towards ensuring the American people why Trump policies and his presidency can Make America Again and why they should be hopeful, give me an opportunity and pray for his success.

Just explain how his policies will make life and the state of the union better. Explain how on the world stage Trump can make the world a safer and more peaceful place.

Let them know that all the fear and lies they were told were not true and things will be better than they realize.

Americans united ultimately is Making America Great Again.","Wed Nov 06 23:49:03 +0000 2024"
,,,,,,"true","true","https://pbs.twimg.com/profile_banners/24787367/1579547587","Mon Mar 16 22:45:21 +0000 2009","The Official Account of #LOTUS (Lionel of the U.S.) — Emmy® Fêted Praxeologist, Flanêur, Logodaedalus, Husband, Haruspex, Philologist, Zaouli Expert, Lawyer",,,,,,,,,,,,,,,,"youtube.com/@LionelNation","https://youtube.com/@LionelNation","0","23","https://t.co/sjDMtUZlRd","0","1232","174286","7026","true","24787367","true","false","false","Hell's Kitchen, USA","41157","🇺🇸Lionel🇺🇸","1863399885656985979","false","https://pbs.twimg.com/profile_images/1205911859850821637/frZ7zTpH_normal.jpg","","278987","https://twitter.com/LionelMedia","user","https://x.com/LionelMedia","LionelMedia",,"When Trump had the 2020 election stolen, I mean, when he lost the election, do you remember any supporter or supporters acting like this? I’ll save you the time. No. https://t.co/QCMXY521ep","Wed Nov 06 23:45:59 +0000 2024"
,,,,,,"false","true","https://pbs.twimg.com/profile_banners/847908896698241024/1657908906","Fri Mar 31 20:30:09 +0000 2017","Attorney and columnist. Guest on OANN. Published in The Wash. Exam, Federalist, RSBN, Townhall. Tweets are not legal advice.  Re-tweets are not endorsements.",,,,,,,,,,,,,,,,,,,,,"0","15576","3805","2117","false","847908896698241024","false","false","false","USA","558","Elad",,"false","https://pbs.twimg.com/profile_images/1839021029030526976/2Rjcljt0_normal.jpg","","15318","https://twitter.com/EladHakim","user","https://x.com/EladHakim","EladHakim",,"How do you come together and find common ground when the opposing party intentionally and maliciously unleashed hell on earth against President Trump, many of his supporters, the Constitution and rule of law, and other R's/conservatives?","Wed Nov 06 23:43:46 +0000 2024"
,,,,,,"false","true","https://pbs.twimg.com/profile_banners/811239440916054016/1602808515","Tue Dec 20 15:58:49 +0000 2016","Diplomat, father, former Congressman proudly representing New Jersey's 7th district.",,,,,,,,,,,,,,,,"malinowskifornj.com","https://malinowskifornj.com","0","23","https://t.co/MfAqREni3Z","0","2933","49553","951","true","811239440916054016","false","false","false","Ringoes, NJ","576","Tom Malinowski","1136613636015894528","false","https://pbs.twimg.com/profile_images/943502582416379904/bb4np4WL_normal.jpg","","6643","https://twitter.com/Malinowski","user","https://x.com/Malinowski","Malinowski","Government","Meanwhile, at multiple rallies, Trump referred to people like me - whether Democrats or his Republican critics - as ""scum"" and ""vermin"" and ""domestic enemies"" who are worse than our foreign enemies. Are we going to talk about Dems offending Trump supporters and ignore that? 3/","Wed Nov 06 23:39:04 +0000 2024"
,,,,,,"false","true","https://pbs.twimg.com/profile_banners/811239440916054016/1602808515","Tue Dec 20 15:58:49 +0000 2016","Diplomat, father, former Congressman proudly representing New Jersey's 7th district.",,,,,,,,,,,,,,,,"malinowskifornj.com","https://malinowskifornj.com","0","23","https://t.co/MfAqREni3Z","0","2933","49553","951","true","811239440916054016","false","false","false","Ringoes, NJ","576","Tom Malinowski","1136613636015894528","false","https://pbs.twimg.com/profile_images/943502582416379904/bb4np4WL_normal.jpg","","6643","https://twitter.com/Malinowski","user","https://x.com/Malinowski","Malinowski","Government","First, Harris never once called Trump backers ""Nazis,"" ""fascists"" or anything similar. Trump's Marine general former chief of staff did say Trump admired Hitler and many of us cited that (how could we ignore it?), but that was not about his supporters. 2/","Wed Nov 06 23:39:03 +0000 2024"
,,,,,,"true","true","https://pbs.twimg.com/profile_banners/3895214232/1634153219","Wed Oct 14 20:28:20 +0000 2015","Misinformation is the bread and butter of the “free thinking high IQ” denizens of Reddit. Home of Watchdog. Ephesians 5:11.

DMs open for submissions.",,,,,,,,,,,,,,,,,,,,,"0","95305","439169","861","true","3895214232","true","false","false","Tennessee, USA","15932","Reddit Lies","1856096110122512449","false","https://pbs.twimg.com/profile_images/1438530746164121602/esKsjv3b_normal.jpg","","28306","https://twitter.com/reddit_lies","user","https://x.com/reddit_lies","reddit_lies",,"Kamala's supporters are now trying to get Latinos deported because they voted for Trump. https://t.co/OoBXQUmWoR","Wed Nov 06 23:35:58 +0000 2024"
,,,,,,"true","true","https://pbs.twimg.com/profile_banners/890872630462599168/1708969039","Fri Jul 28 09:52:41 +0000 2017","",,,,,,,,,,,,,,,,"stellale.com","http://www.stellale.com","0","23","https://t.co/ELYyNBaIy6","0","4039","17209","3733","false","890872630462599168","false","false","false","Houston, TX","46","Lecie Geneva","1848416280551800852","false","https://pbs.twimg.com/profile_images/1832637803672326145/uvqVC3aT_normal.jpg","","7460","https://twitter.com/LecieGeneva","user","https://x.com/LecieGeneva","LecieGeneva",,"@Tayswiftie198 SO THIS IS THE EDUCATIONAL DIVIDE they are talking about with Trump supporters. To INFER, is a comprehension skill. He said if we were to have just one really violent hour a year where everything goes, crime would go way down. What does that sound like to you? Think hard.","Wed Nov 06 23:31:04 +0000 2024"
"https://pbs.twimg.com/profile_images/1726722240748662784/2BjaL8mX_bigger.jpg","Conservative 🇺🇸","https://twitter.com/ConservativeOG","DeepLink","Badge","BusinessLabel","true","false","https://pbs.twimg.com/profile_banners/211025537/1710618790","Tue Nov 02 02:41:25 +0000 2010","Gaming, Guns, and Gains; Heavyweight Mixed Martial Artist {6'5, 255}. Striking Specialist  & Verbal Pugilist.",,,,,,,,,,,,,,,,,,,,,"0","143695","167730","2484","true","211025537","true","false","false","Alternate Timeline Earth","4496","Malcolm FleX","1697986663522177057","false","https://pbs.twimg.com/profile_images/1838325414340501504/meEGe7bl_normal.jpg","","31971","https://twitter.com/Malcolm_fleX48","user","https://x.com/Malcolm_fleX48","Malcolm_fleX48",,"Absolutely unhinged liberal goes on tirade wishing for Trump supporters to have pregnancy issues. 

 Magnanimity is too good for some people. https://t.co/IqMiq7YW32","Wed Nov 06 23:30:09 +0000 2024"
,,,,,,"false","true","https://pbs.twimg.com/profile_banners/14629315/1720542618","Fri May 02 18:29:28 +0000 2008","Hip-Hop on a Higher Level",,,,,,,,,,,,,,,,"xxlmag.com/linkinbio/","https://www.xxlmag.com/linkinbio/","0","23","https://t.co/GMnXL2yaVw","0","3681","4800096","702","false","14629315","true","false","false","","72172","XXL Magazine","1851293359349891174","false","https://pbs.twimg.com/profile_images/1650620495451025410/4c1ZAkiP_normal.jpg","","260112","https://twitter.com/XXL","user","https://x.com/XXL","XXL","Business","Cardi B sends a message to the Trump supporters harassing her. 

“Y’all need to leave me the fu*k alone.”
https://t.co/FQ0IaeKuly","Wed Nov 06 23:28:44 +0000 2024"
,,,,,,"false","false","https://pbs.twimg.com/profile_banners/1394680198705123329/1674071752","Tue May 18 15:44:18 +0000 2021","Video editor. Content creator.",,,,,,,,,,,,,,,,,,,,,"0","106141","387734","10232","true","1394680198705123329","true","false","false","","5144","MAZE","1595305491156111361","false","https://pbs.twimg.com/profile_images/1615800151750152208/qeY0l05r_normal.jpg","","24295","https://twitter.com/mazemoore","user","https://x.com/mazemoore","mazemoore",,"""Trump supporters are racist!"" 🤣

This is who Democrats narrowed it down to in 2020, back when Kamala dropped out after getting about 2% support within her own party. https://t.co/rSD7BS8gY7","Wed Nov 06 23:26:31 +0000 2024"
,,,,,,"true","false","https://pbs.twimg.com/profile_banners/304127632/1725212548","Tue May 24 00:14:38 +0000 2011","Social commentator on 𝕏 l 🤍✌🏻🌺 5’10” (means I’m not a Krassenstein) l #SpacesHost",,,,,,,,,,,,,,,,,,,,,"0","288281","61021","2500","true","304127632","true","false","false","Boulder, CO","5461","Maile","1862696688986857914","false","https://pbs.twimg.com/profile_images/1861828016713678848/sROd03Tk_normal.jpg","","134232","https://twitter.com/MaileOnX","user","https://x.com/MaileOnX","MaileOnX",,"The only thing that gives me solace today is that Trump destroys relationships - who will he go to war with in the coming years that were once supporters?

Zero chance RFK Jr., Vivek, Elon, Grant Cardone all survive the next administration if history is any indicator.

May the odds be ever in your favor.","Wed Nov 06 23:25:44 +0000 2024"
,,,,,,"true","true","https://pbs.twimg.com/profile_banners/1244663153872560129/1695515677","Mon Mar 30 16:30:16 +0000 2020","Convict Trump Again, Resister, BLM, FBR, NAFO Ally, Kamala , Attorney, Professor, Historian, Love: classical art, music, opera, philosophy, theology, 🇵🇷",,,,,,,,,,,,,,,,,,,,,"0","49846","101075","98121","true","1244663153872560129","false","false","false","","16225","Fernando Oliver, Esq.",,"false","https://pbs.twimg.com/profile_images/1499606880682921984/WFb0Dwoj_normal.jpg","","130435","https://twitter.com/Fernand46357857","user","https://x.com/Fernand46357857","Fernand46357857",,"Trump’s Victory Just Made Him Radically Richer — And He Will Also Make His Billionaire Friend Supporters Much Richer With Government Contracts And Tax Cuts At the Expense Of The Middle Class Snd The Poor https://t.co/JR6zSTddU1","Wed Nov 06 23:25:25 +0000 2024"
,,,,,,"false","false","https://pbs.twimg.com/profile_banners/1549183329206996992/1664636845","Tue Jul 19 00:04:37 +0000 2022","•Activist •Community •Influencer •SpoilerAlert #TheJigIsUp",,,,,,,,,,,,,,,,,,,,,"0","109693","70226","10918","false","1549183329206996992","true","false","false","","10426","Luther ‘Ćyrus’","1843338734143451493","false","https://pbs.twimg.com/profile_images/1862396864672260096/dRNKmJbH_normal.jpg","","35223","https://twitter.com/Censored4sure","user","https://x.com/Censored4sure","Censored4sure",,"To be fair, if Kamala won, Trump supporters would have done the exact same thing. But this, this here, is comedy gold.  😂 https://t.co/Jj0Q7b40Au","Wed Nov 06 23:24:21 +0000 2024"
,,,,,,"true","true","https://pbs.twimg.com/profile_banners/767788995962998784/1497068795","Mon Aug 22 18:22:16 +0000 2016","Grassroots political organization producing the most impactful political content every day. Join us.",,,,,,,,,,,,,,,,"youtube.com/reallyamerican","http://youtube.com/reallyamerican","0","23","https://t.co/jLl1jUugt5","0","52825","650048","2392","true","767788995962998784","true","false","false","","6207","Really American 🇺🇸",,"false","https://pbs.twimg.com/profile_images/1118326373049933825/nN83E6O1_normal.jpg","","46145","https://twitter.com/ReallyAmerican1","user","https://x.com/ReallyAmerican1","ReallyAmerican1",,"Trae Crowder explains BRILLIANTLY to Trump supporters why they shouldn't be spiking the football for voting against their own self-interests.

If you only watch ONE video today, make it this one.
https://t.co/D0v6ZxsbWo","Wed Nov 06 23:23:01 +0000 2024"
"https://pbs.twimg.com/profile_images/1519695868097613825/m5uhNsEh_bigger.jpg","Sticker Mule","https://twitter.com/stickermule","DeepLink","Badge","BusinessLabel","true","true","https://pbs.twimg.com/profile_banners/1063501592/1732895810","Sat Jan 05 17:14:46 +0000 2013","CEO, Sticker Mule  #NY21",,,,,,,,,,,,,,,,"stickermule.com","http://www.stickermule.com","0","23","https://t.co/HSV9j6AQk1","0","117666","21659","354","true","1063501592","true","false","false","New York","185","Anthony Constantino","1860468297067880650","false","https://pbs.twimg.com/profile_images/1852227477935968256/-mJ94JFj_normal.jpg","","2630","https://twitter.com/ac132","user","https://x.com/ac132","ac132",,"STATEMENT TO ON TRUMP LANDSLIDE

Far too many people have been hateful towards Trump supporters for the last 8 years. I hope, and know, many haters will join us soon... as they should. 

President Trump won a LANDSLIDE victory for all Americans and, really, for the good of everyone who lives on planet earth. Let the hate go and JOIN THE FUN!

Anthony Constantino
CEO, Sticker Mule","Wed Nov 06 23:22:28 +0000 2024"
,,,,,,"false","false","https://pbs.twimg.com/profile_banners/17060573/1523985720","Thu Oct 30 05:18:03 +0000 2008","My Interests: Finance, Whiskey, Politics, Books, Food, Meeting Strangers
#altcenter

Disinformation and misinformation researcher",,,,,,,,,,,,,,,,"ruthlesspodcast.com","https://ruthlesspodcast.com/","0","23","https://t.co/MjIvEjg8i0","0","298882","322441","7608","true","17060573","true","false","false","New York, New York","27883","Comfortably Smug","1819442298041606157","false","https://pbs.twimg.com/profile_images/1812267315368534016/5OXLDP6i_normal.jpg","","392161","https://twitter.com/ComfortablySmug","user","https://x.com/ComfortablySmug","ComfortablySmug",,"THIS

Peace was tried after 2016, and the left decided they wanted to cosplay as the resistance, then they focused on trying to jail Trump and his supporters once Dems were in control

We don't need to offer the olive branch. 

We must only offer justice.","Wed Nov 06 23:20:31 +0000 2024"
,,,,,,"true","true","https://pbs.twimg.com/profile_banners/1248724333834444801/1721081091","Fri Apr 10 21:28:12 +0000 2020","- Love God-Family-Country -  TRUMP/VANCE 2024 -  Followed by Ian Carroll-Gunther Eagleman-Juanita Brodderick -Roger Stone-Gen Michael Flynn-Scott Presler",,,,,,,,,,,,,,,,,,,,,"0","372859","106361","14499","true","1248724333834444801","true","false","false","","5046","BelannF","1840866634157998320","false","https://pbs.twimg.com/profile_images/1710293793965039616/dS2pA5tV_normal.jpg","","409899","https://twitter.com/BelannF","user","https://x.com/BelannF","BelannF",,"@TaraBull808 Until there are consequences for malicious prosecutions, the DA's will continue to lie - cheat and trying to destroy Trump and Trump supporters.","Wed Nov 06 23:15:45 +0000 2024"
,,,,,,"false","false","https://pbs.twimg.com/profile_banners/15115280/1725381594","Sat Jun 14 07:46:44 +0000 2008","also on Blu sky at https://t.co/09CAdJmkoa","bsky.app/profile/palmer…","https://bsky.app/profile/palmerreport.com","19","42","https://t.co/09CAdJmkoa",,,,,,,,,,,"bsky.app/profile/palmer…","https://bsky.app/profile/palmerreport.com","0","23","https://t.co/09CAdJmkoa","0","112466","492724","101598","true","15115280","true","false","false","Los Angeles, CA","582","Palmer Report","1862645316127793499","false","https://pbs.twimg.com/profile_images/1301392629230338048/wEJnZzSn_normal.jpg","","242383","https://twitter.com/PalmerReport","user","https://x.com/PalmerReport","PalmerReport",,"Trump supporters are unthinking unfeeling trash and nothing says you have to allow them to remain in your life.","Wed Nov 06 23:14:44 +0000 2024"
,,,,,,"true","false","https://pbs.twimg.com/profile_banners/91416107/1722797314","Fri Nov 20 20:14:21 +0000 2009","📖Author | 📺 News Contributor |📚Book a video consultation: https://t.co/Wz0xMtPEtH","app.minnect.com/expert/OliLond…","https://app.minnect.com/expert/OliLondon","58","81","https://t.co/Wz0xMtPEtH",,,,,,,,,,,"amazon.com/dp/1510778063?…","https://www.amazon.com/dp/1510778063?ref_=cm_sw_r_mwn_dp_YNRR7MBX971ZJ6MKX2D2","0","23","https://t.co/RXoqXiB83G","0","69270","543837","2277","true","91416107","true","false","false","","19251","Oli London","1782898432375447826","false","https://pbs.twimg.com/profile_images/1789810649121341441/AD1SbYAr_normal.jpg","","32970","https://twitter.com/OliLondonTV","user","https://x.com/OliLondonTV","OliLondonTV",,"Cardi B goes on expletive laden tirade against Trump supporters, threatening to ‘light yer as*es up.” 

“Ya’ll need to leave me the f**k alone. Because I’ve got one more f**king cigarette in me before I start lighting yer as*es up. A’ight.” https://t.co/3r1jk51tMe","Wed Nov 06 23:10:41 +0000 2024"
,,,,,,"true","true","https://pbs.twimg.com/profile_banners/1441965051414339586/1722900474","Sun Sep 26 03:17:22 +0000 2021","Reporting the news the mainstream media won’t.⁣ | DM business inquiries",,,,,,,,,,,,,,,,"linktr.ee/ResisttheMains…","http://linktr.ee/ResisttheMainstream","0","23","https://t.co/c1MX0OVGH8","0","178","317421","153","false","1441965051414339586","true","false","false","","9612","Resist the Mainstream","1861249015582433338","false","https://pbs.twimg.com/profile_images/1777217835036495872/atU7ay85_normal.jpg","","29934","https://twitter.com/ResisttheMS","user","https://x.com/ResisttheMS","ResisttheMS","Business","🚨 CNN’s Scott Jennings DESTROYS liberal cohosts over Trump’s re-election. 

""This is a mandate to do what you said you were gonna do. Get the economy working again for regular working-class Americans.""

https://t.co/qccxiB8e6H","Wed Nov 06 23:59:00 +0000 2024"
,,,,,,"true","true","https://pbs.twimg.com/profile_banners/826065164504006657/1674148495","Mon Jan 30 13:50:57 +0000 2017","Congresswoman for GA-14, Christian, Mom, Small Business Owner, Proud American 100% Pro-Life Pro-Gun Pro-Trump https://t.co/S8mJPFXYX0","t.me/RealMarjorieGr…","https://t.me/RealMarjorieGreene","110","133","https://t.co/S8mJPFXYX0",,,,,,,,,,,"MTG4America.com","http://MTG4America.com","0","23","https://t.co/nCHOx7ePTj","0","24389","1355417","1745","true","826065164504006657","true","false","false","Georgia, USA","5858","Marjorie Taylor Greene 🇺🇸","1704223564050706847","false","https://pbs.twimg.com/profile_images/1616121847099047936/d8K1nljH_normal.jpg","","17986","https://twitter.com/mtgreenee","user","https://x.com/mtgreenee","mtgreenee",,"THE JACK SMITH WITCH HUNT IS OVER

Thankfully, now that President Trump has won re-election the federal cases against him are dropped!

But this isn’t over. Every politically motivated case must be thrown out from this corrupt DOJ. 

It’s time for the American people to be free from political persecution!!!","Wed Nov 06 23:29:47 +0000 2024"
,,,,,,"false","true","https://pbs.twimg.com/profile_banners/1367531/1492649996","Sat Mar 17 19:01:26 +0000 2007","Follow America's #1 cable news network, delivering you breaking news, insightful analysis, and must-see videos. https://t.co/sXA1eVB5Gv","foxnews.com/contact","http://foxnews.com/contact","112","135","https://t.co/sXA1eVB5Gv",,,,,,,,,,,"foxnews.com","http://www.foxnews.com","0","23","https://t.co/s4jEId5Aef","0","2","25321478","262","true","1367531","true","false","false","U.S.A.","157352","Fox News",,"false","https://pbs.twimg.com/profile_images/1591278197844414464/O6Fp0hFB_normal.jpg","","635996","https://twitter.com/FoxNews","user","https://x.com/FoxNews","FoxNews",,"Faith leaders react to Trump re-election: 'God spared my life for a reason' https://t.co/ihTOhL0g7l","Wed Nov 06 23:24:38 +0000 2024"
,,,,,,"false","true","https://pbs.twimg.com/profile_banners/334053327/1701722488","Tue Jul 12 14:14:33 +0000 2011","Official account of 'The Five' on FNC hosted by @danaperino @jessebwatters @greggutfeld and @judgejeanine @haroldfordjr @jessicatarlov  Weeknights at 5pm ET.",,,,,,,,,,,,,,,,"foxnews.com/thefive","http://www.foxnews.com/thefive","0","23","https://t.co/v6ENbmedj9","0","132","729503","84","false","334053327","true","false","false","","2187","The Five",,"false","https://pbs.twimg.com/profile_images/1731775702821724160/YbFPYofW_normal.jpg","","8922","https://twitter.com/TheFive","user","https://x.com/TheFive","TheFive",,"The Five reacts to President Trump’s re-election https://t.co/OeH61uz2s7","Wed Nov 06 22:53:45 +0000 2024"
,,,,,,"false","true","https://pbs.twimg.com/profile_banners/632817143/1707438949","Wed Jul 11 11:32:00 +0000 2012","Radical plans for renewables are destroying our farmland and environment. Senator for QLD.

Authorised by Matt Canavan, LNP, 34 East St, Rockhampton Qld 4700",,,,,,,,,,,,,,,,"mattcanavan.com.au","http://mattcanavan.com.au","0","23","https://t.co/AUImLoynXF","0","2024","65692","2531","false","632817143","true","false","false","Rockhampton","1322","Senator Matt Canavan",,"false","https://pbs.twimg.com/profile_images/1755760381879017472/eJ_vDmSc_normal.png","","9685","https://twitter.com/mattjcan","user","https://x.com/mattjcan","mattjcan",,"The re-election of Trump means that we can all say what we think again.","Wed Nov 06 22:45:13 +0000 2024"
,,,,,,"false","true","https://pbs.twimg.com/profile_banners/807095/1584666392","Fri Mar 02 20:41:42 +0000 2007","News tips? Share them here: https://t.co/ghL9OoYKMM","nyti.ms/2FVHq9v","http://nyti.ms/2FVHq9v","28","51","https://t.co/ghL9OoYKMM",,,,,,,,,,,"nytimes.com","http://www.nytimes.com/","0","22","http://t.co/ahvuWqicF9","0","18565","55217009","864","true","807095","true","false","false","New York City","72257","The New York Times",,"false","https://pbs.twimg.com/profile_images/1098244578472280064/gjkVMelR_normal.png","","556062","https://twitter.com/nytimes","user","https://x.com/nytimes","nytimes",,"When it comes to President-elect Donald Trump, the world seems just as polarized as the U.S. does. Here’s how our foreign correspondents say his re-election could affect the regions and issues they report on. https://t.co/5igZjzrbNf","Wed Nov 06 22:40:05 +0000 2024"
