"author/affiliatesHighlightedLabel/label/badge/url","author/affiliatesHighlightedLabel/label/description","author/affiliatesHighlightedLabel/label/url/url","author/affiliatesHighlightedLabel/label/url/urlType","author/affiliatesHighlightedLabel/label/userLabelDisplayType","author/affiliatesHighlightedLabel/label/userLabelType","author/canDm","author/canMediaTag","author/coverPicture","author/createdAt","author/description","author/entities/description/urls/0/display_url","author/entities/description/urls/0/expanded_url","author/entities/description/urls/0/indices/0","author/entities/description/urls/0/indices/1","author/entities/description/urls/0/url","author/entities/url/urls/0/display_url","author/entities/url/urls/0/expanded_url","author/entities/url/urls/0/indices/0","author/entities/url/urls/0/indices/1","author/entities/url/urls/0/url","author/fastFollowersCount","author/favouritesCount","author/followers","author/following","author/hasCustomTimelines","author/id","author/isBlueVerified","author/isTranslator","author/isVerified","author/location","author/mediaCount","author/name","author/pinnedTweetIds/0","author/possiblySensitive","author/profilePicture","author/status","author/statusesCount","author/twitterUrl","author/type","author/url","author/userName","author/verifiedType","text","createdAt"
,,,,,,"false","true","https://pbs.twimg.com/profile_banners/805906353663410177/1544613050","Mon Dec 05 22:47:02 +0000 2016","Your shadow is proof that light has travelled 93 million miles only to be deprived of reaching the ground, thanks to you.",,,,,,,,,,,"0","253","121","167","true","805906353663410177","false","false","false","Detroit, MI","3434","Steve West","844137021304197120","false","https://pbs.twimg.com/profile_images/1119430441155604480/IReksFDe_normal.png","","14753","https://twitter.com/SteveWest_68","user","https://x.com/SteveWest_68","SteveWest_68",,"@marthamaccallum Thought Democrats wanted to get to bottom of Russia meddling in  our sacred election? Why they blocking Fusion GPS proof?","Fri Oct 20 23:58:00 +0000 2017"
,,,,,,"false","true","https://pbs.twimg.com/profile_banners/974549935/1395652194","Tue Nov 27 19:37:53 +0000 2012","Marine environmental protection advocate rugby nut",,,,,,,,,,,"0","2316","1020","1816","false","974549935","false","false","false","Hervey Bay Australia","916","Tony Moore",,"false","https://pbs.twimg.com/profile_images/836667363458101248/EPIeTWUB_normal.jpg","","39670","https://twitter.com/crystalize61","user","https://x.com/crystalize61","crystalize61",,"""CIA Backs Off Director's Claim That Russian Meddling Didn't Swing Election"" https://t.co/AFvs9irwV5 ifttt, reddit","Fri Oct 20 23:44:10 +0000 2017"
,,,,,,"true","true","https://pbs.twimg.com/profile_banners/823671000474656769/1534986431","Mon Jan 23 23:17:24 +0000 2017","I hate absolutes! That's not an absolute. Is it?",,,,,,,,,,,"0","54082","148","1302","true","823671000474656769","false","false","false","Philadelphia, PA","67","Kyle M","1356063278317920260","false","https://pbs.twimg.com/profile_images/1016006361023483906/5x01HMRo_normal.jpg","","5254","https://twitter.com/215Kym","user","https://x.com/215Kym","215Kym",,"CIA director rebuked for false claim on Kremlin's election meddling https://t.co/pN7AQRtTbF","Fri Oct 20 23:41:47 +0000 2017"
,,,,,,"false","true","https://pbs.twimg.com/profile_banners/777635238725951488/1474735100","Sun Sep 18 22:27:43 +0000 2016","Rossella the TwitterBot - Tweet Your Topic - Engage Your Audience",,,,,,,,,,,"0","429","130","857","false","777635238725951488","false","false","false","","45","Rossella","942472410619670528","false","https://pbs.twimg.com/profile_images/777636577094823936/SSlKcjX__normal.jpg","","3563","https://twitter.com/gorossella","user","https://x.com/gorossella","gorossella",,"Sheryl Sandberg Says Facebook Owes America An Apology For Enabling Russia Meddling in 2016's Election https://t.co/Medw6YY8E6 via @Inc","Fri Oct 20 23:30:02 +0000 2017"
,,,,,,"false","true","https://pbs.twimg.com/profile_banners/3092489374/1496424661","Mon Mar 16 16:31:23 +0000 2015","The site with #Wrestling #Gaming #Movies #Books #Writing and more. Weekly pieces and steams. From average middle aged gamers. 📧 contact@established82.com",,,,,,"established82.com","https://established82.com","0","23","https://t.co/aWM0L7DtaM","0","14","153","365","false","3092489374","false","false","false","","9141","established82.com","1645738027753381889","false","https://pbs.twimg.com/profile_images/937790800469086210/9ygIYdzF_normal.jpg","","11003","https://twitter.com/established82","user","https://x.com/established82","established82",,"CIA Backs Off Director's Claim That Russian Meddling Didn't Swing Election via /r/worldnews https://t.co/Juj94LfpOM #worldnews #news","Fri Oct 20 23:24:08 +0000 2017"
,,,,,,"true","false","https://pbs.twimg.com/profile_banners/102763552/1560875195","Thu Jan 07 19:10:32 +0000 2010","Especialista Multimidia, editor e consultor. Proteção de dados, privacidade e direitos humanos. Vigilante da NASA APOD. Minhas opiniões são minhas.",,,,,,,,,,,"0","5164","491","91","false","102763552","false","false","false","","10089","Ricardo",,"false","https://pbs.twimg.com/profile_images/1475457349041205252/AoCmOO2h_normal.jpg","","51484","https://twitter.com/ric4m","user","https://x.com/ric4m","ric4m",,"CIA Backs Off Director's Claim That Russian Meddling Didn't Swing Election https://t.co/dFtnRa6iH9 #worldnews","Fri Oct 20 23:23:19 +0000 2017"
,,,,,,"true","false","https://pbs.twimg.com/profile_banners/22061225/1690733116","Thu Feb 26 21:00:37 +0000 2009","American, #TeamPelosi #liberal #DemCast #TheInsistence #BLM #SuburbanWomen #JohnLewis #VoteBlue2022 #TruthMatters  #ERA #GoodTrouble #roeVwade",,,,,,,,,,,"0","77990","7817","8808","false","22061225","false","false","false","Nebraska, USA","2460","BusyRebel",,"false","https://pbs.twimg.com/profile_images/894736564953075713/8VUARGbO_normal.jpg","","228272","https://twitter.com/wendydshaffer","user","https://x.com/wendydshaffer","wendydshaffer",,"How Russia's election meddling could spell the end of an era for Facebook, Google and Twitter https://t.co/PGNDaGuloQ #SmartNews","Fri Oct 20 23:18:20 +0000 2017"
,,,,,,"false","true","https://pbs.twimg.com/profile_banners/3397650045/1458706670","Fri Jul 31 20:47:40 +0000 2015","News-like information of Reddit: when you want it, where you want it, with a garnish of
why not want it?",,,,,,,,,,,"0","2","131","24","false","3397650045","false","false","false","Seattle","2","Reddit Right Now",,"false","https://pbs.twimg.com/profile_images/757867367867125761/JK73shwU_normal.jpg","","161356","https://twitter.com/RedditRightNow","user","https://x.com/RedditRightNow","RedditRightNow",,"#RRN https://t.co/IYiGuBNLsk CIA Backs Off Director's Claim That Russian Meddling Didn't Swing Election","Fri Oct 20 23:12:09 +0000 2017"
,,,,,,"false","true","https://pbs.twimg.com/profile_banners/2544914191/1410300360","Wed Jun 04 01:26:59 +0000 2014","",,,,,,,,,,,"0","36673","8969","6659","true","2544914191","false","false","false","","6806","Gina Lawriw","783381703008092160","false","https://pbs.twimg.com/profile_images/476133212532387840/qzZ04Svd_normal.jpeg","","1376618","https://twitter.com/GinaLawriw","user","https://x.com/GinaLawriw","GinaLawriw",,"CIA Backs Off Director's Claim That Russian Meddling Didn't Swing Election https://t.co/O1wZpUsRXM","Fri Oct 20 23:00:48 +0000 2017"
,,,,,,"false","true","https://pbs.twimg.com/profile_banners/325476184/1596041839","Tue Jun 28 10:54:14 +0000 2011","EIN Presswire is Everyone's Internet News Presswire™. We make issuing and distributing press releases easy and affordable.",,,,,,"einpresswire.com","https://www.einpresswire.com/","0","23","https://t.co/44nSzkPk8p","0","0","561","856","false","325476184","false","false","false","Washington, D.C.","0","EIN Presswire: Palin Newswire",,"false","https://pbs.twimg.com/profile_images/1288518977581461504/o_TMhFLS_normal.jpg","","24277","https://twitter.com/EINPalinNews","user","https://x.com/EINPalinNews","EINPalinNews",,"Paul Ryan &amp; Other Elites Yuck It Up About Russian Election Meddling At Al Smith Dinner https://t.co/9McvCPjP3G","Fri Oct 20 22:50:09 +0000 2017"
,,,,,,"true","true",,"Mon Dec 19 18:26:02 +0000 2011","AA, BA, MBA, DBA: Occupation; Falcon-1st student school bus driver & owner Fein Tax Emergency Small Movers 1-2-3 11/21/2017 Twitter Blue November 6, 2022 11:04A",,,,,,"linkedin.com/inbox/#compose","http://www.linkedin.com/inbox/#compose","0","23","https://t.co/PAxRxcYKUX","0","31","32","170","true","441076284","true","false","false","Chicago 2023 update","10887","edwinwatson JR-FDR","1719641941833392631","false","https://pbs.twimg.com/profile_images/933030681017434113/pPu9emkh_normal.jpg","","49589","https://twitter.com/edwinwatson7","user","https://x.com/edwinwatson7","edwinwatson7",,"CIA Backs Off Director's Claim That Russian Meddling Didn't Swing Election : The Two-Way : NPR https://t.co/Dx8u89b0Dr #SmartNews","Fri Oct 20 22:48:19 +0000 2017"
,,,,,,"false","true",,"Sun Aug 07 13:39:45 +0000 2011","Christian Conservative, retired Navy, anti-Obama, anti-Hillary, Univ  of AZ & OK graduate and freedom loving Buick owner. #TrumpTrain #MAGA Gdson in Marines",,,,,,,,,,,"0","78575","7239","7858","true","350261087","false","false","false","Tennessee, USA","69","LPC:MAGA",,"false","https://pbs.twimg.com/profile_images/557009753360957440/O14qshdS_normal.jpeg","","274585","https://twitter.com/PabloLeslie","user","https://x.com/PabloLeslie","PabloLeslie",,"Here's What the CIA Dir Said About Whether Russian Meddling Influenced the Election @erinburnett @jaketapper https://t.co/d0ExLit8QO","Fri Oct 20 22:33:04 +0000 2017"
,,,,,,"true","false","https://pbs.twimg.com/profile_banners/24645871/1401342752","Mon Mar 16 03:52:48 +0000 2009","Progressive, Former Policy Analyst for two NYC Mayors; Consultant; Retired Professor & Sr. Exec; Published writer; ASCAP Songwriter; Dog lover; Proud NYU Alum.",,,,,,,,,,,"0","649","8850","7886","true","24645871","false","false","false","Las Vegas, NV","6524","Stephen Gary",,"false","https://pbs.twimg.com/profile_images/627856807/RedLibraScaleModern_normal.jpg","","78906","https://twitter.com/kindcutesteve","user","https://x.com/kindcutesteve","kindcutesteve",,"CIA director Pompeo rebuked for false claim on Kremlin's election meddling #p2 #TNTweeters #USLatino #resist https://t.co/1CUO6f0Lf7","Fri Oct 20 22:30:31 +0000 2017"
"https://pbs.twimg.com/profile_images/1669780523911110656/K9gaaM1g_bigger.jpg","CNN","https://twitter.com/CNN","DeepLink","Badge","BusinessLabel","false","false","https://pbs.twimg.com/profile_banners/34310801/1478895946","Wed Apr 22 16:01:45 +0000 2009","From the staff of The #SitRoom w/ @WolfBlitzer. Tune in 6 pm ET weekdays on @CNN.",,,,,,"cnn.com/situationroom","http://cnn.com/situationroom","0","22","http://t.co/9Ohl84xOrq","0","998","490148","886","true","34310801","true","false","false","Washington ","12534","The Situation Room",,"false","https://pbs.twimg.com/profile_images/626775966422016000/Lo6b0kNl_normal.jpg","","28519","https://twitter.com/CNNSitRoom","user","https://x.com/CNNSitRoom","CNNSitRoom",,"The CIA corrects Director Mike Pompeo’s claim about Russian election meddling https://t.co/l9ySPUoqv1 https://t.co/1u77LWXRjN","Fri Oct 20 22:23:48 +0000 2017"
,,,,,,"false","true","https://pbs.twimg.com/profile_banners/71156816/1722189659","Thu Sep 03 03:10:02 +0000 2009","Chief Data and Artificial Intelligence Officer @ucla ✍️ @mlwtensorflow2 🔎 @sportingtrib Interests 🏃‍♂️🤖🌇 Rep: @chartwell_ideas",,,,,,"mattmann.ai","http://mattmann.ai","0","23","https://t.co/yy08ZgNHIV","0","313054","19661","2860","true","71156816","true","false","false","chrismattmann.eth","3204","Chris Mattmann","1855712868907512242","false","https://pbs.twimg.com/profile_images/1752834619270131712/U4KgROuM_normal.jpg","","82827","https://twitter.com/chrismattmann","user","https://x.com/chrismattmann","chrismattmann",,"""The Intelligence community's assessment is that the (Russian) meddling..did not interfere with the outcome of the election"" - CIA Director","Fri Oct 20 22:18:18 +0000 2017"
,,,,,,"false","true","https://pbs.twimg.com/profile_banners/163211758/1368500551","Mon Jul 05 20:58:53 +0000 2010","Rational human being! German born/ Southern bred!",,,,,,,,,,,"0","2089","230","365","false","163211758","false","false","false","Georgia, USA","150","Doc",,"false","https://pbs.twimg.com/profile_images/769636481157783552/naCu8Ucq_normal.jpg","","19139","https://twitter.com/barber_docd","user","https://x.com/barber_docd","barber_docd",,"CIA Backs Off Director's Claim That Russian Meddling Didn't Swing Election. https://t.co/o4LX9NcO7Y","Fri Oct 20 22:15:06 +0000 2017"
,,,,,,"false","true","https://pbs.twimg.com/profile_banners/18930712/1518392270","Tue Jan 13 05:55:14 +0000 2009","B.S. Sp.Ed; B.S. El. Ed. Master's-Curriculum & Supervision. 35 year educator. Hubby- 35 year teacher/administrator.  Proud Dem 💙🇺🇸",,,,,,,,,,,"0","101624","877","1828","false","18930712","false","false","false","","37","35 Year Veteran Teacher 💯🖍 Linda S",,"false","https://pbs.twimg.com/profile_images/962831398674497536/72254WUm_normal.jpg","","43811","https://twitter.com/LindaSC","user","https://x.com/LindaSC","LindaSC",,"A new legitimate election with no Russian meddling would eliminate the need for vacuum fillers https://t.co/F2ktxEd7kh","Fri Oct 20 22:09:12 +0000 2017"
,,,,,,"false","true","https://pbs.twimg.com/profile_banners/82489457/1608660101","Wed Oct 14 23:52:16 +0000 2009","U.S. Senator for California. Husband & Dad. Former CA Secretary of State. @MIT Grad. San Fernando Valley native. Defending the dream.",,,,,,"alex-padilla.com","https://alex-padilla.com/","0","23","https://t.co/KuZLTGnYRZ","0","1451","108869","1528","true","82489457","false","false","false","Los Angeles, CA","1361","Alex Padilla","1590212686813745152","false","https://pbs.twimg.com/profile_images/1380612391356993540/pwXozxYU_normal.jpg","","15878","https://twitter.com/AlexPadilla4CA","user","https://x.com/AlexPadilla4CA","AlexPadilla4CA","Government","Failure to take foreign meddling &amp; election security seriously is a failure to defend our democracy.","Fri Oct 20 21:59:01 +0000 2017"
,,,,,,"false","false","https://pbs.twimg.com/profile_banners/4912507513/1460590731","Mon Feb 15 19:01:48 +0000 2016","The opposite of our constitutional republic is autocracy. I support separation of powers, rule of law, real journalism. Fascism sucks. No lists, namecallers. 🌊",,,,,,,,,,,"0","116707","1658","1366","true","4912507513","false","false","false","","1222","#DoNotComplyInAdvance #ProtectTruth 🇺🇸","1834041049263865865","false","https://pbs.twimg.com/profile_images/1855345228120743936/pdJsSPhf_normal.jpg","","78733","https://twitter.com/TerriDNW","user","https://x.com/TerriDNW","TerriDNW",,"@Evan_McMullin @roberttraynham @peterbakernyt @TheRevAl @meganmurp @MARCMORIAL @DefenseBaron @MSNBC @NicolleDWallace The point you made abt Russia election meddling was SO important. Please get yourself on all the Sunday shows &amp; shout it to the world!","Fri Oct 20 21:50:02 +0000 2017"
,,,,,,"false","true",,"Sat Jul 09 16:49:32 +0000 2016","",,,,,,,,,,,"0","169","72","1021","false","751820593360695296","false","false","false","","3","CHRISTOPHER JAIJAIRA",,"false","https://abs.twimg.com/sticky/default_profile_images/default_profile_normal.png","","3716","https://twitter.com/eagl6374425","user","https://x.com/eagl6374425","eagl6374425",,"Here's What the CIA Director Had to Say About Whether Russian Meddling Influenced the Election https://t.co/mJ204UetgT","Fri Oct 20 21:44:53 +0000 2017"
,,,,,,"true","false","https://pbs.twimg.com/profile_banners/153811467/1401325839","Wed Jun 09 14:44:44 +0000 2010","Statistics, probability, risk, due diligence, mirth",,,,,,,,,,,"0","118557","4401","1595","true","153811467","true","false","false","Phoenix AZ","1047","Ellie ♕",,"false","https://pbs.twimg.com/profile_images/1386628238353461257/sb5DiajM_normal.jpg","","74335","https://twitter.com/EllieAsksWhy","user","https://x.com/EllieAsksWhy","EllieAsksWhy",,"Chronology of Mueller special investigation of Trump-Russia (thread) 
https://t.co/G0N7Hoeep9","Fri Oct 20 23:54:44 +0000 2017"
,,,,,,"false","false","https://pbs.twimg.com/profile_banners/904080314485547008/1611114504","Sat Sep 02 20:35:18 +0000 2017","Vote Blue! #Resister🌊Against Fascism, Hate TFG 🚫MAGAts🏳️‍🌈✊🏽🇺🇦",,,,,,,,,,,"0","20085","3974","3713","true","904080314485547008","false","false","false","USA","3742","Dump Trump",,"false","https://pbs.twimg.com/profile_images/1351390333897121793/UJMN6Ffe_normal.jpg","","17303","https://twitter.com/PUNCHDUMP","user","https://x.com/PUNCHDUMP","PUNCHDUMP",,"@NRATV @DLoesch Yes, bc the dump colluded w/ Russia to manipulate our electoral process.  It’s called TREASON &amp; Dump is a TRAITOR &amp; is under investigation","Fri Oct 20 23:54:00 +0000 2017"
,,,,,,"false","false",,"Mon May 04 00:14:47 +0000 2015","Retired educator. Speech-Language Pathologist, MA  SLP/CCC Believer in math and science.",,,,,,,,,,,"0","486689","1083","1886","true","3184559208","false","false","false","Sewell, NJ","34","Billie Furdyna",,"false","https://abs.twimg.com/sticky/default_profile_images/default_profile_normal.png","","212227","https://twitter.com/BillieF1234","user","https://x.com/BillieF1234","BillieF1234",,"Russia Update: Trump Campaign Official Under Investigation https://t.co/SVQy40UrYO","Fri Oct 20 23:48:13 +0000 2017"
,,,,,,"false","false","https://pbs.twimg.com/profile_banners/289148078/1668785838","Thu Apr 28 03:19:08 +0000 2011","Selected content...",,,,,,,,,,,"0","2144","4821","2209","true","289148078","false","false","false","By The Blue/Brown, Stuff.. !!","1476296","🔽...just @Sussex_Jones 🔽","1593620187294695426","false","https://pbs.twimg.com/profile_images/1477649540442472456/R1Fiy-Jm_normal.jpg","","2686408","https://twitter.com/Sussex_Jones","user","https://x.com/Sussex_Jones","Sussex_Jones",,"#New Russia Update: Trump Campaign Official Under Investigation https://t.co/4nE7wmIDrI","Fri Oct 20 23:44:28 +0000 2017"
,,,,,,"false","true","https://pbs.twimg.com/profile_banners/55312746/1424729112","Thu Jul 09 18:11:41 +0000 2009","These polls are not scientific and have no particular meaning.  Just something fun to do and hopefully they can spark positive conversations. Hope you enjoy.",,,,,,"egyptday1.blogspot.com","http://egyptday1.blogspot.com/","0","23","https://t.co/mhXQYWArqE","0","77647","28762","9263","true","55312746","false","false","false","Earth","3843","Slothana",,"false","https://pbs.twimg.com/profile_images/1791471774363680768/VMXKDgxI_normal.jpg","","275562","https://twitter.com/SlothanasCoinn","user","https://x.com/SlothanasCoinn","SlothanasCoinn",,"#Obama sent $150 billion to Iran, #Clinton approved 20% of our Uranium to Russia, and #Trump under investigation? #Maga #Resist #Friday","Fri Oct 20 23:35:29 +0000 2017"
,,,,,,"false","true","https://pbs.twimg.com/profile_banners/108412794/1517832412","Mon Jan 25 21:35:47 +0000 2010","US Editor https://t.co/QfciXZgtRx
Disability rights advocate.","e-architect.co.uk","http://www.e-architect.co.uk","10","33","https://t.co/QfciXZgtRx","joelsolkoff.com","http://www.joelsolkoff.com","0","23","https://t.co/7YePXZSW5J","0","485","757","3853","true","108412794","false","false","false","Williamsport, PA","2653","Joel Solkoff","754353639876009984","false","https://pbs.twimg.com/profile_images/655511208/Joel_Photo_normal.jpg","","39581","https://twitter.com/jsolkoff","user","https://x.com/jsolkoff","jsolkoff",,"BREAKING NEWS TRUMP 10/20/17 JOHN KELLY, BUSH VS TRUMP, RUSSIA INVESTIGATION, ROBERT MUELLER https://t.co/P9hfN4GxYe","Fri Oct 20 23:35:25 +0000 2017"
,,,,,,"false","true",,"Wed Feb 11 20:30:33 +0000 2015","",,,,,,,,,,,"0","52","3","18","false","3031206743","false","false","false","","1108","Patrick Doyle",,"false","https://pbs.twimg.com/profile_images/565609955596574720/tbEAWelH_normal.jpeg","","1152","https://twitter.com/pdoylemi1","user","https://x.com/pdoylemi1","pdoylemi1",,"I liked a @YouTube video https://t.co/hYcWnEx8U7 BREAKING NEWS TRUMP 10/19/17 BUSH VS TRUMP, JEFF SESSIONS, RUSSIA INVESTIGATION,","Fri Oct 20 23:35:18 +0000 2017"
,,,,,,"false","true",,"Sun Sep 24 01:50:11 +0000 2017","",,,,,,,,,,,"0","11","0","21","false","911769700106870784","false","false","false","","0","BA Mom",,"false","https://abs.twimg.com/sticky/default_profile_images/default_profile_normal.png","","738","https://twitter.com/BAMom7","user","https://x.com/BAMom7","BAMom7",,"lock them up!!! Both Clinton’s and Obama’s!!  And stop the Russia investigation on trump! U have wasted $$  while u assist the real criminal","Fri Oct 20 23:29:28 +0000 2017"
,,,,,,"false","true","https://pbs.twimg.com/profile_banners/804271002679021568/1490088933","Thu Dec 01 10:28:44 +0000 2016","""Day of Hot Topics."" BREAKING NEW TRUMP",,,,,,"youtube.com/channel/UCLZw1…","https://www.youtube.com/channel/UCLZw1gpGlfZJi-tflsIpMrg","0","23","https://t.co/UySDq7yysF","0","54","78","438","false","804271002679021568","false","false","false","New York, USA","12817","TRUMP WATCH TRUMP","985678258149601282","false","https://pbs.twimg.com/profile_images/844120913142411264/FaFpUD4Q_normal.jpg","","12827","https://twitter.com/TRUMPWATCHNEW","user","https://x.com/TRUMPWATCHNEW","TRUMPWATCHNEW",,"RACHEL MADDOW NEWS TRUMP 10/20/17 BUSH VS TRUMP, JEFF SESSIONS, RUSSIA INVESTIGATION, ROBERT MUELLER https://t.co/j60ZiMsfe9","Fri Oct 20 22:39:06 +0000 2017"
,,,,,,"false","true",,"Fri Jan 13 14:05:23 +0000 2017","",,,,,,,,,,,"0","18753","190","683","true","819908202707886081","false","false","false","","2094","Geoff Smith",,"false","https://pbs.twimg.com/profile_images/834731674260877316/Jgs9q_Vk_normal.jpg","","31999","https://twitter.com/geoffsmithsmind","user","https://x.com/geoffsmithsmind","geoffsmithsmind",,"@newcivilrights The Clinton Foundation received $145 million from Russia connection. One year ""investigation"" of Trump-Russia collusion? Bupkis.","Fri Oct 20 22:33:22 +0000 2017"
,,,,,,"false","true","https://pbs.twimg.com/profile_banners/68149768/1600596668","Sun Aug 23 14:02:09 +0000 2009","Less Government, Less Taxes, More individual responsibility",,,,,,,,,,,"0","106430","1464","2475","true","68149768","false","false","false","","1987","LisaStahl🇺🇸🐴🐴🥕🥕","1854068463288938615","false","https://pbs.twimg.com/profile_images/990256694092615684/NyeLMWXX_normal.jpg","","303846","https://twitter.com/Lisa32686","user","https://x.com/Lisa32686","Lisa32686",,"@MZHemingway Excellent article. @TheJusticeDept Call off the ""Russia-Trump"" ""investigation &amp; turn up the Russia-OBAMA-Clinton-UraniumOne investigation","Fri Oct 20 22:24:26 +0000 2017"
,,,,,,"true","true","https://pbs.twimg.com/profile_banners/720688018051375104/1517383349","Thu Apr 14 18:59:48 +0000 2016","🇺🇸 🇺🇸 Conservative 🇺🇸First Amendment 🐝 Save the Bees❤️ Rescue Border Collies. WBCR   https://t.co/nextMYmNX7","wbcrescue.org","http://wbcrescue.org","85","108","https://t.co/nextMYmNX7",,,,,,"0","24608","3825","4265","false","720688018051375104","true","false","false","Greenwood Village, CO","33","Bugaboo Boon",,"false","https://pbs.twimg.com/profile_images/1607147935472709635/Qju3DNqy_normal.jpg","","35944","https://twitter.com/BoonBugaboo","user","https://x.com/BoonBugaboo","BoonBugaboo",,"@DonaldJTrumpJr You mean Mueller’s Investigation has been in vain all along? Yes. Huge waste of taxpayers $$? Yes. Russia was never out to help Trump? Yes.","Fri Oct 20 22:23:00 +0000 2017"
,,,,,,"true","true","https://pbs.twimg.com/profile_banners/50943752/1692657949","Fri Jun 26 06:00:40 +0000 2009","Married, Retired, Patriot. If you want to chat, you must be willing to prove your TRUE IDENTITY. No exceptions! No investment or trading solicitation!",,,,,,,,,,,"0","1687","1228","2196","false","50943752","false","false","false","Walla Walla, WA","329","Michael",,"false","https://pbs.twimg.com/profile_images/1693757290489446400/rhZBY_Rf_normal.jpg","","9336","https://twitter.com/MikeTiner","user","https://x.com/MikeTiner","MikeTiner",,"Key officials leading Trump Russia collusion investigation linked to secret Russian deal https://t.co/G0W7twEV03","Fri Oct 20 22:13:21 +0000 2017"
,,,,,,"false","false","https://pbs.twimg.com/profile_banners/4739729796/1484420782","Sun Jan 10 20:04:30 +0000 2016","San Francisco Entrepreneur who likes geeky things, pro-privacy, political commentator, and world traveler. I follow back. #Vote 🌊🌊🌊",,,,,,,,,,,"0","9187","2904","2372","false","4739729796","true","false","false","San Francisco, CA","902","SurfBot",,"false","https://pbs.twimg.com/profile_images/840698731980767232/v47uLqJE_normal.jpg","","22681","https://twitter.com/SurfBot6","user","https://x.com/SurfBot6","SurfBot6",,"@realDonaldTrump Trump resurrects a debunked story about the Uranium One deal to deflect from the ongoing Russia investigation led by Bob Mueller.  #Sad","Fri Oct 20 21:42:22 +0000 2017"
,,,,,,"false","true","https://pbs.twimg.com/profile_banners/2384589829/1731017817","Wed Mar 12 03:13:33 +0000 2014","",,,,,,,,,,,"0","111994","1099","4584","false","2384589829","false","false","false","San Diego California","3959","Rusty Jufiar",,"false","https://pbs.twimg.com/profile_images/488557769168281600/c90Q6Xm-_normal.jpeg","","44951","https://twitter.com/rjufiar","user","https://x.com/rjufiar","rjufiar",,"Trump’s strategy: DIVERT/UNDERMINE the Russia investigation and what happened in Niger. https://t.co/o0PDsbC6v1","Fri Oct 20 21:39:07 +0000 2017"
