,,,,,,"false","true","https://pbs.twimg.com/profile_banners/1193964072/1593288747","Mon Feb 18 17:02:58 +0000 2013","Author of ""Democracy for the rest of us. A strategy guide to transform the US plutocracy into a democracy.""",,,,,,"store.bookbaby.com/bookshop/book/…","https://store.bookbaby.com/bookshop/book/index.aspx?bookURL=Democracy-for-the-rest-of-us","0","23","https://t.co/rTt6a6NkPq","0","20","19","32","false","1193964072","false","false","false","Boston, MA","360","perry krasow",,"false","https://pbs.twimg.com/profile_images/1276971672457949184/IHSuc5k5_normal.jpg","","3893","https://twitter.com/perrykrasow","user","https://x.com/perrykrasow","perrykrasow",,"Carter Page Refuses to Cooperate with Senate @ https://t.co/JJqeKoIkJn

#trump #russia #page #carterpage #investigation #senate #politics","Fri Oct 20 21:35:42 +0000 2017"
,,,,,,"false","false","https://pbs.twimg.com/profile_banners/103979872/1444546934","Mon Jan 11 21:51:43 +0000 2010","Worrying doesn't take away tomorrow's troubles.  It takes away today's peace.",,,,,,,,,,,"0","2327","8680","8031","true","103979872","false","false","false","New York, NY","479","b@rry",,"false","https://pbs.twimg.com/profile_images/1555854028923445248/0RRXpDRl_normal.jpg","","122809","https://twitter.com/midtownNY","user","https://x.com/midtownNY","midtownNY",,"Trump's lies matter. They matter even more when they concern the Russia investigation, argues @DLeonhardt https://t.co/SG2n7n17CM","Fri Oct 20 21:35:27 +0000 2017"
,,,,,,"true","false","https://pbs.twimg.com/profile_banners/16686144/1580770032","Fri Oct 10 17:32:53 +0000 2008","We amplify voices on the issues that matter to you. | Tell us what you think: letters@nytimes.com",,,,,,"nytimes.com/opinion","http://nytimes.com/opinion","0","23","https://t.co/Xvmkj3iIHM","0","4356","788250","1397","true","16686144","true","false","false","NYC, London, Seoul","39829","New York Times Opinion",,"false","https://pbs.twimg.com/profile_images/963564424278650886/ibjM-Kyv_normal.jpg","","249597","https://twitter.com/nytopinion","user","https://x.com/nytopinion","nytopinion",,"President Trump's lies matter. They matter even more when they concern the Russia investigation, argues @DLeonhardt https://t.co/dJsgR30YJo","Fri Oct 20 21:30:33 +0000 2017"
,,,,,,"false","true","https://pbs.twimg.com/profile_banners/28499257/1503088436","Fri Apr 03 04:03:53 +0000 2009","Husband of one, father of five, teacher of many. Catholic convert. Ad Majorem Dei Gloriam",,,,,,"coxmath.blogspot.com","http://coxmath.blogspot.com","0","23","https://t.co/qxoamKrj4o","0","832","1369","1013","true","28499257","false","false","false","Central CA","1614","David Cox",,"false","https://pbs.twimg.com/profile_images/1641629972656963584/xnpNX-2l_normal.jpg","","39194","https://twitter.com/dcox21","user","https://x.com/dcox21","dcox21",,"@karlfisch When the thought was Trump/Russia, then the left wanted investigation, the right said there's no evidence. (2/3)","Fri Oct 20 21:09:50 +0000 2017"
,,,,,,"false","false","https://pbs.twimg.com/profile_banners/862452054245203968/1529128116","Wed May 10 23:39:28 +0000 2017","I want love 2 be palpable, not hate Time doesn't heal wounds, love does. W 2 sing U my understanding mathematical & lyrical. If Einstein had been born into pov",,,,,,"gofundme.com/a62736-cancer-…","https://www.gofundme.com/a62736-cancer-again&rcid=r01-15336019341-cde","0","23","https://t.co/cseFQoT5Oi","0","8895","785","1703","true","862452054245203968","false","false","false","RockInSpace","510","one in 7b","1026644053662867456","false","https://pbs.twimg.com/profile_images/1052766955004817408/aZFU0xJ9_normal.jpg","","17068","https://twitter.com/SoarWildly","user","https://x.com/SoarWildly","SoarWildly",,"Ann, do you blame Trump for the Obstruction of the Democrats which is slowing down funding for the wall, judge appointments, Obamacare Repeal, Clinton, Comey, Lynch, Russia Investigation, all while under constant attack from both parties &amp; the media? Your #BelovedPharaoh !! https://t.co/pca4QrAzlL","Fri Oct 20 21:03:31 +0000 2017"
,,,,,,"true","true","https://pbs.twimg.com/profile_banners/40392655/1640452545","Sat May 16 02:37:46 +0000 2009","My tweets are good tbh. One of the main ones on here. Williamson voter. Stuff’s gettin better. Kind of lowkey elite. Pretty smart but not Smart, never Smart.",,,,,,,,,,,"0","34947","6115","6089","true","40392655","true","false","false","","4109","sonch","1575296802546401280","false","https://pbs.twimg.com/profile_images/1795791882045231104/YzxLaME3_normal.png","","171586","https://twitter.com/soncharm","user","https://x.com/soncharm","soncharm",,"46,094:

Citing lack of evidence and absence of witnesses to subpoena, the Grand Mueller formally closes the investigation.","Fri Oct 20 23:58:54 +0000 2017"
,,,,,,"true","false",,"Thu Aug 13 17:03:58 +0000 2009","",,,,,,,,,,,"0","170448","1400","1274","true","65410543","false","false","false","Maryland, USA","153","trina d firey",,"false","https://pbs.twimg.com/profile_images/968935936716283904/sTZL8Dye_normal.jpg","","189739","https://twitter.com/madorairene","user","https://x.com/madorairene","madorairene",,"@jennsweetgapch @Stands4Trump @SenSanders The Mueller investigation is necessary. A huge waste is taxes paid 4 entire Trump Family security. There's no way Trump isn't taking money.","Fri Oct 20 23:58:17 +0000 2017"
,,,,,,"true","true","https://pbs.twimg.com/profile_banners/64168570/1537879957","Sun Aug 09 12:58:26 +0000 2009","Conservative. Proud Father. Never responds to (or sends) DMs. Semper Fi. Dems Cheat. My Governor Is An Idiot.  
pronouns:  pepperoni/sausage",,,,,,,,,,,"0","87416","3978","4516","true","64168570","false","false","false","Wisconsin, USA","7192","JR 🇮🇹🇺🇸","1854050141352657387","false","https://pbs.twimg.com/profile_images/1802492396954886144/aSmEXS6s_normal.jpg","","41823","https://twitter.com/jorrzz","user","https://x.com/jorrzz","jorrzz",,"@VickiMcKenna Mueller should b removed from the Russia investigation due to his complicit behavior, overseeing Clintons Russia deal. He can't b trusted.","Fri Oct 20 23:57:16 +0000 2017"
,,,,,,"true","false","https://pbs.twimg.com/profile_banners/859923863697797120/1493945975","Thu May 04 00:13:20 +0000 2017","Simple Snowdonian Welsh Lass living in New England. CYMRU AM BYTH! 🏴󠁧󠁢󠁷󠁬󠁳󠁿 Veterinary Medicine*Welsh/Roman History*Medievalist*Roman Britain Archaeology",,,,,,,,,,,"0","75204","638","4666","true","859923863697797120","false","false","false","Massachusetts, USA","830","Abigail Doull","1243390581427941377","false","https://pbs.twimg.com/profile_images/871495559676215296/1csWMaLa_normal.jpg","","35227","https://twitter.com/abigail_doull","user","https://x.com/abigail_doull","abigail_doull",,"@thehill Naturally! He's subject of investigation. Mueller is getting all the accounts of those in room. Then when he asks Trump &amp; he lies, GOTCHA!","Fri Oct 20 23:56:05 +0000 2017"
,,,,,,"true","false","https://pbs.twimg.com/profile_banners/153811467/1401325839","Wed Jun 09 14:44:44 +0000 2010","Statistics, probability, risk, due diligence, mirth",,,,,,,,,,,"0","118557","4401","1595","true","153811467","true","false","false","Phoenix AZ","1047","Ellie ♕",,"false","https://pbs.twimg.com/profile_images/1386628238353461257/sb5DiajM_normal.jpg","","74335","https://twitter.com/EllieAsksWhy","user","https://x.com/EllieAsksWhy","EllieAsksWhy",,"Chronology of Mueller special investigation of Trump-Russia (thread) 
https://t.co/G0N7Hoeep9","Fri Oct 20 23:54:44 +0000 2017"
,,,,,,"true","false","https://pbs.twimg.com/profile_banners/759601184848031745/1732146195","Sun Jul 31 04:06:49 +0000 2016","UCLA '70 Cranbrook ‘74 ERA/VRA Family, Ukrainian Jewish immigrants. DOJ IRS law 80s. My U.S. WWII Capt. Dad, liberator of Dachau. I shook hands with JFK in ‘59!",,,,,,,,,,,"0","209203","10778","6073","true","759601184848031745","false","false","false","☀️🌴 Coachella Valley 🌵","69830","A Woke in the Desert","1392876198494031880","false","https://pbs.twimg.com/profile_images/1327076201844801536/j7ytSVeK_normal.jpg","","184119","https://twitter.com/Desert_yoSemite","user","https://x.com/Desert_yoSemite","Desert_yoSemite",,"@TheBeatWithAri @AriMelber @matthewamiller He's terrified of the investigation.  Even doing this is gravy for Mueller.","Fri Oct 20 23:51:25 +0000 2017"
,,,,,,"true","false","https://pbs.twimg.com/profile_banners/759601184848031745/1732146195","Sun Jul 31 04:06:49 +0000 2016","UCLA '70 Cranbrook ‘74 ERA/VRA Family, Ukrainian Jewish immigrants. DOJ IRS law 80s. My U.S. WWII Capt. Dad, liberator of Dachau. I shook hands with JFK in ‘59!",,,,,,,,,,,"0","209203","10778","6073","true","759601184848031745","false","false","false","☀️🌴 Coachella Valley 🌵","69830","A Woke in the Desert","1392876198494031880","false","https://pbs.twimg.com/profile_images/1327076201844801536/j7ytSVeK_normal.jpg","","184119","https://twitter.com/Desert_yoSemite","user","https://x.com/Desert_yoSemite","Desert_yoSemite",,"@TeaPainUSA He's terrified of the investigation.  Even doing this is gravy for Mueller.","Fri Oct 20 23:50:52 +0000 2017"
,,,,,,"true","false","https://pbs.twimg.com/profile_banners/759601184848031745/1732146195","Sun Jul 31 04:06:49 +0000 2016","UCLA '70 Cranbrook ‘74 ERA/VRA Family, Ukrainian Jewish immigrants. DOJ IRS law 80s. My U.S. WWII Capt. Dad, liberator of Dachau. I shook hands with JFK in ‘59!",,,,,,,,,,,"0","209203","10778","6073","true","759601184848031745","false","false","false","☀️🌴 Coachella Valley 🌵","69830","A Woke in the Desert","1392876198494031880","false","https://pbs.twimg.com/profile_images/1327076201844801536/j7ytSVeK_normal.jpg","","184119","https://twitter.com/Desert_yoSemite","user","https://x.com/Desert_yoSemite","Desert_yoSemite",,"@Bellarealness @jlynndingle @PuestoLoco @WaltFrench @RonaldKlain He's terrified of the investigation.  Even doing this is gravy for Mueller.","Fri Oct 20 23:49:34 +0000 2017"
,,,,,,"false","true",,"Wed Jan 04 21:25:34 +0000 2017","#resistance Country over party #BlueWave.",,,,,,,,,,,"0","41488","864","1456","true","816757486883639296","false","false","false","","294","maggie titus","1702607021160251413","false","https://pbs.twimg.com/profile_images/1045617040634138625/w_2RCLqV_normal.jpg","","72363","https://twitter.com/urgentfacts","user","https://x.com/urgentfacts","urgentfacts",,"@autumnsgrammy This can't be good. Mueller's Investigation must be closing in and DJT is in a panic to start something to distract. https://t.co/cZxTyrN9sn","Fri Oct 20 23:46:49 +0000 2017"
,,,,,,"true","false",,"Tue Feb 21 18:45:54 +0000 2017","I’m just here. Sober.",,,,,,,,,,,"0","123891","10948","5087","true","834111924312891397","false","false","false","Phoenix, AZ","3167","Jarrød","1609290450334277633","false","https://pbs.twimg.com/profile_images/1821903992328474624/DlSJXXPp_normal.jpg","","35492","https://twitter.com/jpederson202","user","https://x.com/jpederson202","jpederson202",,"@marsialynn86 He recused himself long before the Mueller investigation.","Fri Oct 20 23:42:26 +0000 2017"
,,,,,,"false","false",,"Sun Mar 15 16:24:09 +0000 2009","Conservative concerned about the future of America- time to stand up for traditional American values- time to stand up for true American patriotism & freedom.",,,,,,,,,,,"0","247","69570","76501","false","24544802","true","false","false","Cheyenne, WY","7955","bill",,"false","https://abs.twimg.com/sticky/default_profile_images/default_profile_normal.png","","402142","https://twitter.com/shortman5427","user","https://x.com/shortman5427","shortman5427",,"In Case You Missed It: Robert Mueller Was FBI Director During The Russia Uranium Investigation https://t.co/umHkXOVZHn via @mediaite","Fri Oct 20 23:39:40 +0000 2017"
,,,,,,"false","true","https://pbs.twimg.com/profile_banners/108412794/1517832412","Mon Jan 25 21:35:47 +0000 2010","US Editor https://t.co/QfciXZgtRx
Disability rights advocate.","e-architect.co.uk","http://www.e-architect.co.uk","10","33","https://t.co/QfciXZgtRx","joelsolkoff.com","http://www.joelsolkoff.com","0","23","https://t.co/7YePXZSW5J","0","485","757","3853","true","108412794","false","false","false","Williamsport, PA","2653","Joel Solkoff","754353639876009984","false","https://pbs.twimg.com/profile_images/655511208/Joel_Photo_normal.jpg","","39581","https://twitter.com/jsolkoff","user","https://x.com/jsolkoff","jsolkoff",,"BREAKING NEWS TRUMP 10/20/17 JOHN KELLY, BUSH VS TRUMP, RUSSIA INVESTIGATION, ROBERT MUELLER https://t.co/P9hfN4GxYe","Fri Oct 20 23:35:25 +0000 2017"
,,,,,,"false","false","https://pbs.twimg.com/profile_banners/1537826988/1553598108","Sat Jun 22 03:32:37 +0000 2013","Christian, Conservative. #MAGA #KAG Here to support Trump and USA. Not looking to date. I FB all Patriots!",,,,,,,,,,,"0","16565","2912","3151","true","1537826988","false","false","false","Arkansas, USA","199","Constance","1192453879457337349","false","https://pbs.twimg.com/profile_images/1195119869924118528/rnpxoelt_normal.jpg","","13525","https://twitter.com/Nursing35","user","https://x.com/Nursing35","Nursing35",,"In Case You Missed It: Robert Mueller Was FBI Director During The Russia Uranium Investigation | Mediaite https://t.co/LAzTmOgUep","Fri Oct 20 23:34:12 +0000 2017"
,,,,,,"false","true","https://pbs.twimg.com/profile_banners/55414986/1487340456","Fri Jul 10 00:34:22 +0000 2009","Transportation/urban planning consultant in Florida. Author of forthcoming ""Paleo Places"" - an evolutionary approach to urban planning.",,,,,,,,,,,"0","284520","3556","4455","true","55414986","false","false","false","","6829","Elizabeth Rodriguez",,"false","https://pbs.twimg.com/profile_images/832592330473537536/i07vfAJ0_normal.jpg","","177462","https://twitter.com/LibbyBlog","user","https://x.com/LibbyBlog","LibbyBlog",,"@BudgenRupert @fawfulfan Not duly elected.  The Mueller investigation will show the actual vote was tampered with. Trump was projecting with his 'Its Rigged' talk.","Fri Oct 20 23:34:09 +0000 2017"
,,,,,,"false","false","https://pbs.twimg.com/profile_banners/87977606/1690357668","Fri Nov 06 16:36:36 +0000 2009","Author, Editor, Journalist, Public Speaker, Member FBI-CAAA, Dog Lover, Book Hoarder, Chocolate Addict My author acct: @AuthorFairchild",,,,,,"beachreadauthors.blogspot.com/p/christine-m-…","http://beachreadauthors.blogspot.com/p/christine-m-fairchild.html","0","23","https://t.co/1rJvNjKcTW","0","55415","5247","5846","true","87977606","false","false","false","","3532","The Editor Devil","1270760953290915841","false","https://pbs.twimg.com/profile_images/1638752548759957504/mAwwX7Gq_normal.jpg","","75910","https://twitter.com/fairchild01","user","https://x.com/fairchild01","fairchild01",,"Wven FoxNews participating in RU attack on Mueller. 
Last I recall they were under investigation 4 participating in RU ops too. https://t.co/Whsn8l5aye","Fri Oct 20 23:29:43 +0000 2017"
,,,,,,"false","false","https://pbs.twimg.com/profile_banners/97212964/1585531550","Wed Dec 16 13:53:58 +0000 2009","Wife, Mother, Grandmother, Christian and an Independent. President Donald J Trump supporter.",,,,,,,,,,,"0","336689","832","1098","true","97212964","false","false","false","","1334","NancyLH ☆☆☆",,"false","https://pbs.twimg.com/profile_images/1349219726149488641/5-V-i14P_normal.jpg","","191095","https://twitter.com/hfc7507","user","https://x.com/hfc7507","hfc7507",,"I am tired of Mueller and his FAKE investigation into TRUMP, when all he &amp; his crew is doing is destroying everything connected with Uranium https://t.co/hcGZhdABAU","Fri Oct 20 23:28:42 +0000 2017"
,,,,,,"false","false","https://pbs.twimg.com/profile_banners/87977606/1690357668","Fri Nov 06 16:36:36 +0000 2009","Author, Editor, Journalist, Public Speaker, Member FBI-CAAA, Dog Lover, Book Hoarder, Chocolate Addict My author acct: @AuthorFairchild",,,,,,"beachreadauthors.blogspot.com/p/christine-m-…","http://beachreadauthors.blogspot.com/p/christine-m-fairchild.html","0","23","https://t.co/1rJvNjKcTW","0","55415","5247","5846","true","87977606","false","false","false","","3532","The Editor Devil","1270760953290915841","false","https://pbs.twimg.com/profile_images/1638752548759957504/mAwwX7Gq_normal.jpg","","75910","https://twitter.com/fairchild01","user","https://x.com/fairchild01","fairchild01",,"BEWARE Russian propaganda pushed against Mueller--Putin knows the investigation is about to drop the ax on his ops &amp; deza is skyrocketing https://t.co/Mcr5YcdWb5","Fri Oct 20 23:27:59 +0000 2017"
,,,,,,"false","true","https://pbs.twimg.com/profile_banners/2915483421/1629309417","Thu Dec 11 13:53:38 +0000 2014","Semi-retired lawyer, some ROL work in Kosovo, Russia, Afghanistan, traveler, teacher. R/T are not endorsements.",,,,,,,,,,,"0","59368","428","1095","true","2915483421","false","false","false","New Jersey New York area ","258","Bernadette Foley",,"false","https://pbs.twimg.com/profile_images/1428050352339931142/2AvlqkHi_normal.jpg","","41843","https://twitter.com/forestland6","user","https://x.com/forestland6","forestland6",,"@ericgeller @Susan_Hennessey https://t.co/fWOZcE0ZvS  Blocking Mueller from getting transcript of Senate hearing is basically condoning possible perjury investigation.","Fri Oct 20 23:26:11 +0000 2017"
,,,,,,"false","true",,"Fri Sep 23 01:10:35 +0000 2016","Hip-Hop/Rap R&B/Soul Celebrity News TV Shows Government & Politics #Election2016 NFL NBA College Football Tennis Music Pop Pop",,,,,,,,,,,"0","5784","93","219","true","779125775362580481","false","false","false","South Apopka, FL","0","Holly God. Rhodes",,"false","https://pbs.twimg.com/profile_images/880782666752299008/smwG16G__normal.jpg","","5291","https://twitter.com/sallysue9376","user","https://x.com/sallysue9376","sallysue9376",,"@EdKrassen @IRdotnet @realDonaldTrump People to see the pee pee tape that's why nothing has been done about Russia meddling in our election 🤔🤔🤔🤔 #SAD","Fri Oct 20 21:40:51 +0000 2017"
