,,,,,,"false","false","https://pbs.twimg.com/profile_banners/44672556/1714333765","Thu Jun 04 17:48:28 +0000 2009","Doing what I can to be part of a good conversation on religion and politics. I try to be fair.",,,,,,,,,,,,,,,,,,,,,,,,,,"0","38566","126568","97433","true","44672556","true","false","false","The Free State of Florida","14290","Church & State","1862213267680371034","false","https://pbs.twimg.com/profile_images/1742190414617059329/62tSoEDH_normal.jpg","","151204","https://twitter.com/SrvG_d","user","https://x.com/SrvG_d","SrvG_d",,"President-elect Donald Trump has confirmed that former Representative Mike Rogers will not be appointed as FBI Director, says Dan Scavino. This decision follows significant pushback from Trump's supporters, who favor Kash Patel for the position, emphasizing their desire for a director aligned with MAGA values. The transition team is considering various candidates, with Kash Patel being prominently discussed as a potential appointee.

#OnlyKash","Fri Nov 22 20:08:49 +0000 2024"
,,,,,,"true","false","https://pbs.twimg.com/profile_banners/1222773302441148416/1715766741","Thu Jan 30 06:48:04 +0000 2020","Aggregating and curating news, politics and current affairs. #BTC",,,,,,,,,,,,,,,,,,,,,"visegrad24.com","http://www.visegrad24.com","0","23","https://t.co/qpd6ZYX46V","0","61246","1217773","1787","true","1222773302441148416","true","false","false","Visegrad","36111","Visegrád 24","1862952261262979431","false","https://pbs.twimg.com/profile_images/1798263200648994816/qFYydb3B_normal.jpg","","57891","https://twitter.com/visegrad24","user","https://x.com/visegrad24","visegrad24",,"I care about Trump supporters. 
I care about RFK Jr. supporters. 
I care about Tucker Carlson supporters. 
I care about Charlie Kirk supporters. 
I care about Ben Shapiro supporters. 
I care about all people.""

claims California Governor Gavin Newsom.
https://t.co/F0R7by9mQh","Fri Nov 22 17:28:59 +0000 2024"
,,,,,,"true","true","https://pbs.twimg.com/profile_banners/1833606833442889728/1726965696","Tue Sep 10 20:42:00 +0000 2024","modern american patriot (democrat) | i stream daily on tiktok (2M+) | hello@deanwithers.com",,,,,,,,,,,,,,,,,,,,,"linktr.ee/deanwithers","https://linktr.ee/deanwithers","0","23","https://t.co/vQP2SHSUlb","0","441","357930","26","false","1833606833442889728","true","false","false","","88","Dean Withers","1854036315886829810","false","https://pbs.twimg.com/profile_images/1833607015119130624/y8Vm1xTj_normal.jpg","","438","https://twitter.com/itsdeaann","user","https://x.com/itsdeaann","itsdeaann",,"Good morning to everyone except Trump supporters😁","Fri Nov 22 17:21:02 +0000 2024"
,,,,,,"false","false","https://pbs.twimg.com/profile_banners/1187915088960917504/1670735403","Sat Oct 26 02:13:40 +0000 2019","Host of Sabby Sabs Podcast • Co-host @RevBlackNetwork •
https://t.co/9SbXOMNRWi •
https://t.co/qiEFRkDfiY •","youtube.com/c/SabbySabs","http://youtube.com/c/SabbySabs","56","79","https://t.co/9SbXOMNRWi","muckrack.com/sabrina-salvati","http://muckrack.com/sabrina-salvati","82","105","https://t.co/qiEFRkDfiY",,,,,,,,,,,"sabbysabs.com","https://www.sabbysabs.com","0","23","https://t.co/IEVVT6mcHM","0","53483","81140","2584","true","1187915088960917504","true","false","false","Boston, MA","5076","Sabby Sabs","1578842134807187458","false","https://pbs.twimg.com/profile_images/1599980724689436674/l9fZxOWT_normal.jpg","","24328","https://twitter.com/SabbySabs2","user","https://x.com/SabbySabs2","SabbySabs2",,"Trump's new AG is out here calling Palestine supporters ""ignorant children."" No, what's ignorant is supporting a genocide. https://t.co/RhRs1MtvW9","Fri Nov 22 17:06:25 +0000 2024"
,,,,,,"false","false","https://pbs.twimg.com/profile_banners/1274852794206388225/1692493201","Sun Jun 21 23:52:56 +0000 2020","Chairman on House @GOPoversight. Proudly representing Kentucky in Congress. #KY1",,,,,,,,,,,,,,,,,,,,,"comer.house.gov","http://comer.house.gov","0","23","https://t.co/62lrfum2yH","0","3941","211030","258","true","1274852794206388225","true","false","false","Tompkinsville, KY","1178","Rep. James Comer",,"false","https://pbs.twimg.com/profile_images/1408448254010875910/b5h3Hehs_normal.jpg","","4739","https://twitter.com/RepJamesComer","user","https://x.com/RepJamesComer","RepJamesComer","Government","🚨@GOPoversight is calling on FEMA Administrator Criswell to provide documents &amp; info following whistleblower allegations that FEMA is discriminating against Trump supporters.

Administrator Criswell UNDER OATH this week committed to producing this information. @HARRISFAULKNER https://t.co/wbPXs1h6r2","Fri Nov 22 17:00:54 +0000 2024"
,,,,,,"false","false","https://pbs.twimg.com/profile_banners/732980827/1730906227","Thu Aug 02 14:55:41 +0000 2012","TRUMP WON, AGAIN! Let’s work to MAGA, Forever. With President @realDonaldTrump The Best Is Yet To Come!",,,,,,,,,,,,,,,,,,,,,"truthsocial.com/@ChatByCC","https://truthsocial.com/@ChatByCC","0","23","https://t.co/q5B4JUzBBt","0","131219","252759","20880","true","732980827","true","false","false","","10155","𝐂𝐂","1216834650410119168","false","https://pbs.twimg.com/profile_images/1861980384398848000/C10CzYSr_normal.jpg","","490629","https://twitter.com/ChatByCC","user","https://x.com/ChatByCC","ChatByCC",,"@elonmusk Liberalism is a mental disorder.
4 years ago Trump supporters found themselves on the losing team.

I don't know one Trump supporter who disowned family and friends over biden being installed.

NOT ONE! We are not the same.","Fri Nov 22 16:54:37 +0000 2024"
,,,,,,"true","false","https://pbs.twimg.com/profile_banners/19211550/1671288734","Tue Jan 20 00:45:40 +0000 2009","Official Twitter account of The Gateway Pundit | Send tips to tips@thegatewaypundit.com",,,,,,,,,,,,,,,,,,,,,"thegatewaypundit.com","http://www.thegatewaypundit.com/","0","23","https://t.co/YqbW6M2uwk","0","13863","855406","2334","true","19211550","false","false","false","","10590","The Gateway Pundit",,"false","https://pbs.twimg.com/profile_images/1744786260072321024/930fTDx0_normal.jpg","","160292","https://twitter.com/gatewaypundit","user","https://x.com/gatewaypundit","gatewaypundit","Business","WATCH: Dozens of Pennsylvania Trump Supporters Wear MAGA Hats to Protest City Council President Who Compared Them to KKK Hoods https://t.co/rcV5bnZjc5 https://t.co/mNxxSoPYLl","Fri Nov 22 15:53:56 +0000 2024"
,,,,,,"false","false","https://pbs.twimg.com/profile_banners/321954654/1668045045","Wed Jun 22 12:06:56 +0000 2011","Independent journalist. Freelance Writer & Producer. Previous: Writer/Assoc. Producer for #1 Fox News show. Sr. Managing Editor for Top 5 News Publication.",,,,,,,,,,,,,,,,,,,,,"thekylebecker.com","https://www.thekylebecker.com/","0","23","https://t.co/hVChFZaQ3D","0","397832","627503","2794","false","321954654","true","false","false","Dallas, TX","12571","Kyle Becker","1863401896288960554","false","https://pbs.twimg.com/profile_images/1758497181210734593/GTx_3XCf_normal.jpg","","121657","https://twitter.com/kylenabecker","user","https://x.com/kylenabecker","kylenabecker",,"Trump supporters need to beat two enemies every election: The Dems and GOPe.

This is why Republican primary elections need to be treated like general elections in every state.

The Uniparty frauds must be put on notice: It's *OVER.* https://t.co/GEsGfow6Oc","Fri Nov 22 15:45:58 +0000 2024"
,,,,,,"true","true","https://pbs.twimg.com/profile_banners/763094579491008512/1651332472","Tue Aug 09 19:28:20 +0000 2016","Assistant News Director @FLVoiceNews | Marylander-turned-Floridian | Politics & breaking news alerts | https://t.co/55cqQGUClp","flvoicenews.com","http://flvoicenews.com","103","126","https://t.co/55cqQGUClp",,,,,,,,,,,,,,,,"ericdaugherty.net","http://ericdaugherty.net","0","23","https://t.co/9JrzFB6FPm","0","62720","252064","1145","true","763094579491008512","true","false","false","","5044","Eric Daugherty","1861851444556464631","false","https://pbs.twimg.com/profile_images/1823491411934633984/eY6C-778_normal.png","","25854","https://twitter.com/EricLDaugh","user","https://x.com/EricLDaugh","EricLDaugh",,"CALIFORNIA GOV. GAVIN NEWSOM: ""I care about Trump supporters. I care about RFK Jr. supporters. I care about Tucker Carlson supporters. I care about Charlie Kirk supporters. I care about Ben Shapiro supporters. I care about all people.""

https://t.co/GyxBzTTiqA","Fri Nov 22 15:33:09 +0000 2024"
,,,,,,"false","true","https://pbs.twimg.com/profile_banners/68739089/1722946943","Tue Aug 25 16:39:34 +0000 2009","Charles Gasparino joined FOX Business in 2010 as Senior Correspondent. He is a New York Post columnist & author of the upcoming book Go Woke, Go Broke.",,,,,,,,,,,,,,,,,,,,,"hachettebookgroup.com/titles/charles…","https://www.hachettebookgroup.com/titles/charles-gasparino/go-woke-go-broke/9781546007418/","0","23","https://t.co/het36xLRBs","0","22635","188648","4643","false","68739089","true","false","false","","3769","Charles Gasparino",,"false","https://pbs.twimg.com/profile_images/1504155169134727171/h1d-cili_normal.jpg","","118859","https://twitter.com/CGasparino","user","https://x.com/CGasparino","CGasparino",,"Breaking: As @realDonaldTrump’s @USTreasury pick goes down to the wire, supporters of Marc Rowan are making their pitch for his selection. Here’s what one has argued to the Trump transition team

“He founded a company that now has 800bn of AUM, a 100bn market cap, and 300k employees in its ecosystem.   Leadership and Operational experience across the economy that is second to none. “

Hunger games indeed !","Fri Nov 22 15:17:57 +0000 2024"
,,,,,,"true","true","https://pbs.twimg.com/profile_banners/1389833864122613761/1724888596","Wed May 05 06:46:46 +0000 2021","America First • 𝕏  Breaking News • MAGA🇺🇸 🔥just a dude with an IPhone ✝️",,,,,,,,,,,,,,,,,,,,,,,,,,"0","97537","415067","29598","true","1389833864122613761","true","false","false","Florida, USA","15898","American AF 🇺🇸","1860697517521846534","false","https://pbs.twimg.com/profile_images/1677756031324102659/QmkoTNg5_normal.jpg","","74334","https://twitter.com/iAnonPatriot","user","https://x.com/iAnonPatriot","iAnonPatriot",,"Gavin Newsom says, “I care about Trump supporters, I care about Robert Kennedy Jr supporters, I care about Tucker Carlson supporters ... I care about all people.”

Thoughts? 🤨
 https://t.co/N5JvTUpFMW","Fri Nov 22 15:16:28 +0000 2024"
,,,,,,"true","true","https://pbs.twimg.com/profile_banners/1441965051414339586/1722900474","Sun Sep 26 03:17:22 +0000 2021","Reporting the news the mainstream media won’t.⁣ | DM business inquiries",,,,,,,,,,,,,,,,,,,,,"linktr.ee/ResisttheMains…","http://linktr.ee/ResisttheMainstream","0","23","https://t.co/c1MX0OVGH8","0","178","317444","153","false","1441965051414339586","true","false","false","","9612","Resist the Mainstream","1861249015582433338","false","https://pbs.twimg.com/profile_images/1777217835036495872/atU7ay85_normal.jpg","","29934","https://twitter.com/ResisttheMS","user","https://x.com/ResisttheMS","ResisttheMS","Business","JUST IN: Gavin Newsom attempts to bring unity to voters.

“I care about Trump supporters, I care about Robert Kennedy Jr supporters, I care about Tucker Carlson supporters ... I care about all people.”

https://t.co/uHW12W7cQF","Fri Nov 22 15:12:00 +0000 2024"
"https://pbs.twimg.com/profile_images/1605211963096801282/3flU1i5o_bigger.jpg","ABC News","https://twitter.com/ABC","DeepLink","Badge","BusinessLabel","false","true","https://pbs.twimg.com/profile_banners/21258337/1725500071","Thu Feb 19 00:18:04 +0000 2009","Join us weekday mornings on ABC with #WhoopiGoldberg, @joyvbehar, @sunny, @sarahaines, @alyssafarah and @ananavarro!",,,,,,,,,,,,,,,,,,,,,"ABCNews.com/TheView","http://ABCNews.com/TheView","0","23","https://t.co/rZwammTMaR","0","13219","903510","1873","true","21258337","true","false","false","Weekdays 11e|10c|p on ABC","53722","The View",,"false","https://pbs.twimg.com/profile_images/1831506114581508096/Y0NHoAM5_normal.jpg","","87339","https://twitter.com/TheView","user","https://x.com/TheView","TheView","Business",".@HakeemJeffries' message to Americans who are upset by President-elect Trump's 2024 win: ""A knockdown is different than a knockout."" https://t.co/gUNM2ji8AN","Fri Nov 22 23:00:52 +0000 2024"
,,,,,,"true","true","https://pbs.twimg.com/profile_banners/335312037/1661190663","Thu Jul 14 13:56:30 +0000 2011","Reporter. Presenter: @thenewsagents and Sunday with Lewis Goodall @lbc | Formerly of @bbcnewsnight @skynews. DMs open- tell me your stories.",,,,,,,,,,,,,,,,,,,,,"lewisgoodall.com","http://www.lewisgoodall.com","0","23","https://t.co/IWGUCagtPU","0","31616","359852","5254","true","335312037","true","false","false","Lewis.goodall@global.com","6235","Lewis Goodall","1852710099170607153","false","https://pbs.twimg.com/profile_images/1818855261827633152/gnjEhwiI_normal.jpg","","75943","https://twitter.com/lewis_goodall","user","https://x.com/lewis_goodall","lewis_goodall",,"Good to see partisanship continues to fry the brains of many who remain on here. To those criticising the above tweet I’ve repeatedly said Trump’s win was impressive, especially in how he gained across the boars and especially among minority voters and described the win as a red wave. But as the vote margin is finally settling into its final form the above is important context. The popular vote margin is narrower than we thought it might be election night and is historically slight. GOP is talking about an overwhelming mandate for complete transformation. The results suggest something more measured. A v narrow House win, a non-blowout in the Senate and a comfortable but not overwhelming win in the electoral college/popular vote in a year which was primed against the incumbent party. GOP would do well to recognise the win was very solid but not spectacular and build a strategy from there- because they clearly have an opportunity to permanently expand their coalition.","Fri Nov 22 22:29:38 +0000 2024"
,,,,,,"true","true","https://pbs.twimg.com/profile_banners/283258239/1693926549","Sat Apr 16 22:56:55 +0000 2011","Words in The Atlantic, The Washington Post, The Guardian, New Statesman, Smithsonian. Columnist at Jacobin. Seeking Social Democracy w/Ed Broadbent out now.",,,,,,,,,,,,,,,,,,,,,"ecwpress.com/products/seeki…","https://ecwpress.com/products/seeking-social-democracy-ed-broadbent","0","23","https://t.co/RBEdWFzOJv","0","80674","70956","3495","true","283258239","false","false","false","Toronto, Ontario","10127","Luke Savage",,"false","https://pbs.twimg.com/profile_images/1664434496328826880/Xq7S6BU6_normal.jpg","","102265","https://twitter.com/LukewSavage","user","https://x.com/LukewSavage","LukewSavage",,"Since 2016, a non-negligible segment of American liberalism has invested itself in the idea Democrats can (and should want to) win elections by embracing anti-Trump Republicans. All of it — the editorials, the plumb TV spots, the Lincoln Project ads — came to this.","Fri Nov 22 22:02:18 +0000 2024"
,,,,,,"true","false","https://pbs.twimg.com/profile_banners/358545917/1727203462","Sat Aug 20 03:02:29 +0000 2011","America was able to free itself from a hostile, occupying regime, due to freedom of speech and the right to bear arms. The UK is a prison colony.",,,,,,,,,,,,,,,,,,,,,"MikeCernovich.Substack.com","http://MikeCernovich.Substack.com","0","23","https://t.co/DOjmWxh2RJ","0","91437","1347320","3911","true","358545917","true","false","false","United States","13219","Cernovich","1863403373464289681","false","https://pbs.twimg.com/profile_images/1788999802526789632/4xyOtQLZ_normal.jpg","","260723","https://twitter.com/Cernovich","user","https://x.com/Cernovich","Cernovich",,"The recent election results understate the major win it was for Trump.

Democrats in Illinois and other states gerrymandered away Republican congressional districts. Also the census data was faked to help Dems.

The House would be a 240 GOP majority right now.","Fri Nov 22 20:42:48 +0000 2024"
,,,,,,"true","true","https://pbs.twimg.com/profile_banners/335312037/1661190663","Thu Jul 14 13:56:30 +0000 2011","Reporter. Presenter: @thenewsagents and Sunday with Lewis Goodall @lbc | Formerly of @bbcnewsnight @skynews. DMs open- tell me your stories.",,,,,,,,,,,,,,,,,,,,,"lewisgoodall.com","http://www.lewisgoodall.com","0","23","https://t.co/IWGUCagtPU","0","31616","359852","5254","true","335312037","true","false","false","Lewis.goodall@global.com","6235","Lewis Goodall","1852710099170607153","false","https://pbs.twimg.com/profile_images/1818855261827633152/gnjEhwiI_normal.jpg","","75943","https://twitter.com/lewis_goodall","user","https://x.com/lewis_goodall","lewis_goodall",,"Trump’s vote share is now at 49.9% with some votes still being counted. Looks like his margin over Harris will be around 1.5%- the third smallest winning margin since 1888.

Trump’s win was solid in the popular vote and electoral college. But it was not a landslide and it was not overwhelming.","Fri Nov 22 20:23:24 +0000 2024"
,,,,,,"true","true","https://pbs.twimg.com/profile_banners/55060090/1671052038","Wed Jul 08 22:59:13 +0000 2009","A news center for the left. I say bad things! Parody, Satire, and News! @realTuckFrumper everywhere. Send all love/hate mail to: realtuckfrumper@gmail.com",,,,,,,,,,,,,,,,,,,,,,,,,,"0","283933","295274","127063","true","55060090","true","false","false","Witness Protection","13816","#TuckFrump","1862043411512991880","false","https://pbs.twimg.com/profile_images/1603134556587974656/hvRUosxG_normal.jpg","","908892","https://twitter.com/realTuckFrumper","user","https://x.com/realTuckFrumper","realTuckFrumper",,"'Fuming': Loss of 'landslide' win reportedly has Trump team furious https://t.co/qDHGqCs3lL","Fri Nov 22 19:35:44 +0000 2024"
,,,,,,"false","true","https://pbs.twimg.com/profile_banners/16041234/1705435418","Fri Aug 29 12:29:21 +0000 2008","The official Twitter of the award-winning  https://t.co/82Vd6MCBSq. 

Want to get our daily newsletter? Click here: https://t.co/HG5k8Afv6f…","RawStory.com","http://RawStory.com","43","66","https://t.co/82Vd6MCBSq","rawstory.com/st/Newsletter_","http://rawstory.com/st/Newsletter_","116","139","https://t.co/HG5k8Afv6f",,,,,,,,,,,"rawstory.com/st/Newsletter_…","https://www.rawstory.com/st/Newsletter_Twitter_Signup","0","23","https://t.co/mClFX8k9WZ","0","10943","219133","3896","true","16041234","true","false","false","Washington, DC","44000","Raw Story",,"false","https://pbs.twimg.com/profile_images/879061537423544320/99vcNM5N_normal.jpg","","344487","https://twitter.com/RawStory","user","https://x.com/RawStory","RawStory",,"'Fuming': Loss of 'landslide' win reportedly has Trump team furious
https://t.co/WXuprFDh3e","Fri Nov 22 19:22:10 +0000 2024"
,,,,,,"true","false","https://pbs.twimg.com/profile_banners/32804484/1604824524","Sat Apr 18 05:35:53 +0000 2009","SAVE AMERICA NOW",,,,,,,,,,,,,,,,,,,,,,,,,,"0","33345","262995","60677","false","32804484","true","false","false","Cold Spring, NY","17605","Paul A. Szypula 🇺🇸","1862874849195995392","false","https://pbs.twimg.com/profile_images/1325363057556590594/AvCcEAo5_normal.jpg","","89785","https://twitter.com/Bubblebathgirl","user","https://x.com/Bubblebathgirl","Bubblebathgirl",,"Biden regime has been using our tax dollars to host “therapy and listening sessions” for federal employees following Trump’s election win.

Rep. Darrell Issa sent a letter to Antony Blinken demanding answers.

We shouldn’t be paying for the fragile egos of leftists in government. https://t.co/qMonFl6BsL","Fri Nov 22 18:17:11 +0000 2024"
"https://pbs.twimg.com/profile_images/1726722240748662784/2BjaL8mX_bigger.jpg","Conservative 🇺🇸","https://twitter.com/ConservativeOG","DeepLink","Badge","BusinessLabel","true","true","https://pbs.twimg.com/profile_banners/537709549/1696882383","Tue Mar 27 00:53:56 +0000 2012","Investigative Journalist 🇺🇸 Free Spirit🇺🇸Founder of LOOMERED. Host of @LoomerUnleashed Former @Project_Veritas operative. 📸 America First ✡️ Feisty Jewess",,,,,,,,,,,,,,,,,,,,,"loomered.com","http://loomered.com","0","23","https://t.co/TlkQhmcPoR","0","109081","1390556","6990","true","537709549","true","false","false","Florida ","12702","Laura Loomer","1853227576061280748","false","https://pbs.twimg.com/profile_images/1751805801520332800/WIWv-QP2_normal.jpg","","78740","https://twitter.com/LauraLoomer","user","https://x.com/LauraLoomer","LauraLoomer",,"STEVEN CHEUNG: “In a decisive win for President Trump, the hoax Manhattan Case is now fully stayed and sentencing is adjourned. President Trump won a landslide victory as the American People have issued a mandate to return him to office and dispose of all remnants of the Witch Hunt cases. All of the sham lawfare attacks against President Trump are now destroyed and we are focused on Making America Great Again.” — @StevenCheung","Fri Nov 22 18:06:16 +0000 2024"
,,,,,,"true","true","https://pbs.twimg.com/profile_banners/1359293410847383558/1644564586","Wed Feb 10 00:12:49 +0000 2021","Pop Culture: News, Updates, Rumors & Opinions. Turn notifications on! 📧: ThePopTingz@gmail.com",,,,,,,,,,,,,,,,,,,,,"poptingz.com","http://www.poptingz.com","0","23","https://t.co/UYdk54BPgd","0","258","202072","7085","true","1359293410847383558","true","false","false","","31359","Pop Tingz","1779976183188267149","false","https://pbs.twimg.com/profile_images/1565676819730276359/53Pb7UYR_normal.jpg","","34961","https://twitter.com/ThePopTingz","user","https://x.com/ThePopTingz","ThePopTingz",,"Ellen DeGeneres was spotted with brunette hair in the UK after leaving the US following Trump’s election win. https://t.co/J2C3kgk9Sh","Fri Nov 22 17:46:18 +0000 2024"
,,,,,,"false","false","https://pbs.twimg.com/profile_banners/115129636/1722415937","Wed Feb 17 18:12:05 +0000 2010","Silence Is Complicity | Gunner⚽️ #akaonyewetara #mementomori",,,,,,,,,,,,,,,,,,,,,,,,,,"0","22138","31800","1615","true","115129636","false","false","false","HQ","11758","𝐂𝐡𝐢𝐝𝐢",,"false","https://pbs.twimg.com/profile_images/1406027513227366401/Fs4w9tbd_normal.jpg","","59833","https://twitter.com/ChidiNwatu","user","https://x.com/ChidiNwatu","ChidiNwatu",,"@elonmusk More than half of American voters didn’t vote for Trump. He did not win the popular vote by a decisive margin. But go on. 

Trump 76,666,332 (49.93%)  
Harris 74,086,596 (48.25%)","Fri Nov 22 17:40:10 +0000 2024"
"https://pbs.twimg.com/profile_images/1852358694798807040/rvwtIsg8_bigger.jpg","OpTic","https://twitter.com/OpTic","DeepLink","Badge","BusinessLabel","false","true","https://pbs.twimg.com/profile_banners/284422688/1722269681","Tue Apr 19 07:38:55 +0000 2011","Daily YouTube videos 👉 https://t.co/Qgwo0TYsH5 Biz inquiries 👉 hutchinquiries@gmail.com Check out @PinePark 🌲🌲🌲I might be live on Twitch right now 👇","youtube.com/Hutch","http://www.youtube.com/Hutch","23","46","https://t.co/Qgwo0TYsH5",,,,,,,,,,,,,,,,"twitch.tv/Hutch","http://www.twitch.tv/Hutch","0","23","https://t.co/0LbKq5yHoE","0","17834","330759","1715","true","284422688","true","false","false","earth","5941","Hutch","1857857787533078775","false","https://pbs.twimg.com/profile_images/1830641131262234624/loPtG86W_normal.jpg","","21288","https://twitter.com/hutchinson","user","https://x.com/hutchinson","hutchinson",,"Trump did not win more than half of voters and his popular vote margin of victory is the slimmest since Bush v Gore in 2000 (currently 1.6% and still declining).","Fri Nov 22 17:40:06 +0000 2024"
,,,,,,"false","true","https://pbs.twimg.com/profile_banners/60783724/1685026176","Tue Jul 28 02:23:28 +0000 2009","@eurasiagroup & @gzeromedia. political scientist, author. if you lived here, you'd be home now.",,,,,,,,,,,,,,,,,,,,,"bit.ly/iancommencement","http://bit.ly/iancommencement","0","23","https://t.co/wMx6VY9kcr","0","18681","771096","1712","true","60783724","true","false","false","","27644","ian bremmer","801590659291480068","false","https://pbs.twimg.com/profile_images/1669005424467628033/Unv6Q_Va_normal.jpg","","92019","https://twitter.com/ianbremmer","user","https://x.com/ianbremmer","ianbremmer",,"planned parenthood: vasectomies rose 1,200% the day after trump’s election win https://t.co/Fy46Ors9FR","Fri Nov 22 17:39:00 +0000 2024"
,,,,,,"false","false","https://pbs.twimg.com/profile_banners/1630649273191743488/1695736500","Tue Feb 28 19:21:19 +0000 2023","Navy SEAL, Job creator, Husband, Father of four, and Montana’s U.S. Senator-Elect 🇺🇸",,,,,,,,,,,,,,,,,,,,,"timformt.com","https://timformt.com/","0","23","https://t.co/kbAu01Yg3v","0","5","68268","37","false","1630649273191743488","true","false","false","Bozeman, Montana","594","Tim Sheehy","1856407581532795316","false","https://pbs.twimg.com/profile_images/1673602117498437634/ShaDKG7O_normal.jpg","","1119","https://twitter.com/TimPSheehyMT","user","https://x.com/TimPSheehyMT","TimPSheehyMT",,"Another win for President Trump! It’s clear this bogus lawfare case was another disgraceful attempt by the Democrats to weaponize the government against their top political opponent in an election year.","Fri Nov 22 17:27:53 +0000 2024"
