"author/affiliatesHighlightedLabel/label/badge/url","author/affiliatesHighlightedLabel/label/description","author/affiliatesHighlightedLabel/label/url/url","author/affiliatesHighlightedLabel/label/url/urlType","author/affiliatesHighlightedLabel/label/userLabelDisplayType","author/affiliatesHighlightedLabel/label/userLabelType","author/canDm","author/canMediaTag","author/coverPicture","author/createdAt","author/description","author/entities/description/urls/0/display_url","author/entities/description/urls/0/expanded_url","author/entities/description/urls/0/indices/0","author/entities/description/urls/0/indices/1","author/entities/description/urls/0/url","author/entities/description/urls/1/display_url","author/entities/description/urls/1/expanded_url","author/entities/description/urls/1/indices/0","author/entities/description/urls/1/indices/1","author/entities/description/urls/1/url","author/entities/description/urls/2/display_url","author/entities/description/urls/2/expanded_url","author/entities/description/urls/2/indices/0","author/entities/description/urls/2/indices/1","author/entities/description/urls/2/url","author/entities/description/urls/3/display_url","author/entities/description/urls/3/expanded_url","author/entities/description/urls/3/indices/0","author/entities/description/urls/3/indices/1","author/entities/description/urls/3/url","author/entities/url/urls/0/display_url","author/entities/url/urls/0/expanded_url","author/entities/url/urls/0/indices/0","author/entities/url/urls/0/indices/1","author/entities/url/urls/0/url","author/fastFollowersCount","author/favouritesCount","author/followers","author/following","author/hasCustomTimelines","author/id","author/isBlueVerified","author/isTranslator","author/isVerified","author/location","author/mediaCount","author/name","author/pinnedTweetIds/0","author/possiblySensitive","author/profilePicture","author/status","author/statusesCount","author/twitterUrl","author/type","author/url","author/userName","author/verifiedType","text","createdAt"
,,,,,,"false","true",,"Sun Feb 22 23:45:46 +0000 2009","Editor in chief, @j_insider. @foxnewsradio political analyst. Political reporting & analysis, without fear or favor.",,,,,,,,,,,,,,,,,,,,,"wwsg.com/speakers/josh-…","https://www.wwsg.com/speakers/josh-kraushaar/","0","23","https://t.co/Kr1GSXsoXb","0","32228","123104","3181","true","21612122","true","false","false","Washington, DC","1999","Josh Kraushaar",,"false","https://pbs.twimg.com/profile_images/923616463897931777/A5rzMcn4_normal.jpg","","392515","https://twitter.com/JoshKraushaar","user","https://x.com/JoshKraushaar","JoshKraushaar",,"""Ossoff is the only Democratic senator from a state that Trump carried in 2024 who is up for re-election in 2026 and voted for any of the resolutions to block aid.""
https://t.co/U7eR0P1zwj","Fri Nov 22 21:44:56 +0000 2024"
,,,,,,"false","true",,"Sun May 01 03:53:22 +0000 2022","Host of 'The Gen Z Perspective' 
Podcast/Newsletter 👇",,,,,,,,,,,,,,,,,,,,,"linktr.ee/DashDobrofsky","http://linktr.ee/DashDobrofsky","0","23","https://t.co/uhL5PLzAsF","0","5562","191960","311","false","1520612280643162112","true","false","false","","997","Dash Dobrofsky","1863402154666398088","false","https://pbs.twimg.com/profile_images/1607052560661348362/BQGYEdDI_normal.jpg","","7136","https://twitter.com/DashDobrofsky","user","https://x.com/DashDobrofsky","DashDobrofsky",,"Don’t blame Harris for her election loss, blame our criminal justice system — who at every turn, has bent over backward to accommodate criminal Trump.

In fact, their failure to bring Trump to justice is the only reason he was able to run for re-election. https://t.co/ZlmWrt1c0p","Fri Nov 22 19:25:30 +0000 2024"
,,,,,,"false","false","https://pbs.twimg.com/profile_banners/998573295044874241/1677802616","Mon May 21 14:36:40 +0000 2018","22
(he/him/his)
was: @GeorgiaStateU, @decisiondeskhq
now: @GeorgiaSouthern, Peach State Politics",,,,,,,,,,,,,,,,,,,,,"nilesfrancis.Substack.com","http://nilesfrancis.Substack.com","0","23","https://t.co/1wFsac218j","0","157059","23062","1893","true","998573295044874241","false","false","false","Atlanta","3635","Niles Francis","1853566443482206391","false","https://pbs.twimg.com/profile_images/1625293859256258564/x7Cvo8ph_normal.jpg","","35620","https://twitter.com/NilesGApol","user","https://x.com/NilesGApol","NilesGApol",,"He can’t run for re-election and it’s far too early to know but I do wonder if we’ll see any kind of event during Trump’s term that will mark a turning point in his national popularity. In his last term it was Charlottesville and for Biden it was the Afghanistan withdrawal","Fri Nov 22 14:14:43 +0000 2024"
,,,,,,"true","true","https://pbs.twimg.com/profile_banners/49698174/1479775446","Mon Jun 22 17:30:02 +0000 2009","Biased. Journalist. Telegram: https://t.co/lpowB2yrIb Founder: Grabien, The Pub, NewsLists & BioSpa","t.me/tomselliott","http://t.me/tomselliott","30","53","https://t.co/lpowB2yrIb",,,,,,,,,,,,,,,,"linktr.ee/tomselliott","https://linktr.ee/tomselliott","0","23","https://t.co/zP8FgclRaQ","0","38071","199658","583","true","49698174","true","false","false","Madrid, Spain","11816","Tom Elliott","1779514129868267995","false","https://pbs.twimg.com/profile_images/1167191123615506432/lEL7IBnw_normal.jpg","","67020","https://twitter.com/tomselliott","user","https://x.com/tomselliott","tomselliott",,"The @FBI scandal of manufacturing fake crime data to try preventing Trump's re-election only grows worse. It turns out they not only deliberately pretended violent crime was falling during the Biden era, but also revised previous crime data to inflate previous murder rates. 

""Death certificates have always provided broader and more accurate data than the FBI’s figures, but the gap between them has grown sharply under the Biden administration ... As a result of those factors and others, the gap between murders reported by the FBI and the number of homicides recorded on death certificates has grown from a low of 16 killings in 2003 to an average of 3,711 killings per year during Biden’s presidency.""

""Biden’s FBI irregularly increased the murder counts throughout Trump’s term, making it seem like the gap jumped up and down between 7% to 13%""
https://t.co/f3de8LWyvo","Fri Nov 22 12:46:39 +0000 2024"
"https://pbs.twimg.com/profile_images/1482179968083836928/7prxRZ4M_bigger.jpg","Wall Street Mav","https://twitter.com/WallStreetMav","DeepLink","Badge","BusinessLabel","false","false","https://pbs.twimg.com/profile_banners/930212715422998530/1731260342","Mon Nov 13 23:16:08 +0000 2017","Defeating wokeness one post at a time",,,,,,,,,,,,,,,,,,,,,,,,,,"0","178533","497032","16787","true","930212715422998530","true","false","false","USA","3982","🇺🇸Jessica🇺🇸",,"false","https://pbs.twimg.com/profile_images/1855701497079549952/ZMT1PrCI_normal.jpg","","15014","https://twitter.com/Jessica_4_Trump","user","https://x.com/Jessica_4_Trump","Jessica_4_Trump",,"Trump nominating Matt Gaetz showed us the useless Republicans in the Senate. None of them should bother running for re-election 👋","Fri Nov 22 00:04:04 +0000 2024"
,,,,,,"false","false","https://pbs.twimg.com/profile_banners/15308281/1648825815","Thu Jul 03 13:46:55 +0000 2008","Tech CxO. Still think Jack's 144ch site was a good idea.  Not sure what  Xwitter is becoming.   Other than NAFO / Ukraine news, just see a lot of weirdness.",,,,,,,,,,,,,,,,,,,,,"spoutible.com/Spoonamore","https://spoutible.com/Spoonamore","0","23","https://t.co/7hniKpmc1u","0","13481","10676","1379","true","15308281","false","false","false","Central PA","602","Spoonamore: On a bike? Get a like.","1179383023718031367","false","https://pbs.twimg.com/profile_images/1857067020648361984/cS78G_Dx_normal.jpg","","16170","https://twitter.com/Spoonamore","user","https://x.com/Spoonamore","Spoonamore",,"I was approached by folks at https://t.co/oxBDyDbXst  They posted $100K reward for election fraud tips regarding 2024's Presidential Election. I agreed to assemble a team to help vet any tips.  It should be law enforcement doing this work.  But they have not acted, citizens have.","Fri Nov 22 18:39:25 +0000 2024"
,,,,,,"false","false","https://pbs.twimg.com/profile_banners/988524457621966848/1524517849","Mon Apr 23 21:06:11 +0000 2018","Your No. 1 source for Political Gossip! #MAGA #TRUMPTEAM 🦅 🇺🇸Subscribe to my profile to support my work",,,,,,,,,,,,,,,,,,,,,,,,,,"0","5951","191232","1999","true","988524457621966848","true","false","false","Turn ON notifications 🔔","2313","Wake Up America","1860771525214806257","false","https://pbs.twimg.com/profile_images/1625124944181964802/wyHjOG1U_normal.jpg","","11599","https://twitter.com/_wake_up_USA","user","https://x.com/_wake_up_USA","_wake_up_USA",,"BREAKING: Meghan McCain reveals she voted for her late father, John McCain, in the 2024 Presidential Election.

“I just couldn’t explain voting for Trump to my kids, and Kamala never gave me a reason.”

What’s your reaction? https://t.co/FDn6v55TPr","Fri Nov 22 16:46:12 +0000 2024"
,,,,,,"false","true","https://pbs.twimg.com/profile_banners/60876782/1674594907","Tue Jul 28 11:16:35 +0000 2009","Conservative. Foodie. Entrepreneur. UGA Dawg. Former @SandySpringsGA Councilman. COO for @GASecofState.",,,,,,,,,,,,,,,,,,,,,"gabrielsterling.org","http://www.gabrielsterling.org/","0","23","https://t.co/oge5IjNgV1","0","23400","71260","1674","true","60876782","false","false","false","Sandy Springs, GA","3569","Gabriel Sterling",,"false","https://pbs.twimg.com/profile_images/1341437766106832900/vMtlasaU_normal.jpg","","31610","https://twitter.com/GabrielSterling","user","https://x.com/GabrielSterling","GabrielSterling",,"This morning @GaSecofState Raffensperger certified the results of GA’s 2024 General Election. Our office is proud of the work of our elections division &amp; counties for running a great, fair, &amp; accurate election. The presidential certification will now be transmitted to @GovKemp","Fri Nov 22 14:30:27 +0000 2024"
,,,,,,"true","false","https://pbs.twimg.com/profile_banners/79205875/1548444675","Fri Oct 02 15:17:46 +0000 2009","Official Twitter for Georgia Secretary of State Brad Raffensperger. Integrity Counts.",,,,,,,,,,,,,,,,,,,,,"sos.ga.gov","http://sos.ga.gov/","0","23","https://t.co/ISGXPmWMb7","0","291","64177","54","false","79205875","false","false","false","Atlanta, GA","707","GA Secretary of State Brad Raffensperger",,"false","https://pbs.twimg.com/profile_images/1168914860014542849/01FAOMBh_normal.jpg","","1883","https://twitter.com/GaSecofState","user","https://x.com/GaSecofState","GaSecofState","Government","The people of Georgia have spoken, and I am proud to certify the results of Georgia’s 2024 Presidential Election this morning. 

Congratulations to President-Elect Donald J. Trump! https://t.co/rKH2sjcYtT","Fri Nov 22 14:19:31 +0000 2024"
,,,,,,"false","true","https://pbs.twimg.com/profile_banners/1790419462446886912/1716328003","Tue May 14 16:30:59 +0000 2024","America First🗽 | Trump 2024🗳️ | Patriot 🇺🇸 | #MAGA | Political Commentator | #Travel✈️🔎🌎",,,,,,,,,,,,,,,,,,,,,,,,,,"0","13247","12471","7431","false","1790419462446886912","true","false","false","Texas, USA","1345","Jesse Morgan","1857813924579586463","false","https://pbs.twimg.com/profile_images/1822193495253143552/Seu-nAni_normal.jpg","","3096","https://twitter.com/Jesse_Morgan_","user","https://x.com/Jesse_Morgan_","Jesse_Morgan_",,"BREAKING: Meghan McCain reveals she cast her vote for her late father, John McCain, in the 2024 Presidential Election.

“I just couldn’t explain voting for Trump to my kids, and Kamala never gave me a reason.” https://t.co/OojvviN7f7","Fri Nov 22 13:30:00 +0000 2024"
,,,,,,"false","true","https://pbs.twimg.com/profile_banners/853318060052291584/1723933151","Sat Apr 15 18:44:14 +0000 2017","I post interesting news and opinion stories, for @scottadamssays and for you. Support my work and get more content at https://t.co/zIi9RVC0OJ!","owengregorian.locals.com","https://owengregorian.locals.com","118","141","https://t.co/zIi9RVC0OJ",,,,,,,,,,,,,,,,"owengregorian.locals.com","https://owengregorian.locals.com","0","23","https://t.co/zIi9RVC0OJ","0","170866","74492","7578","true","853318060052291584","true","false","false","United States","12712","Owen Gregorian","1860378890599817368","false","https://pbs.twimg.com/profile_images/870041464843227139/GSuKAV4t_normal.jpg","","95461","https://twitter.com/OwenGregorian","user","https://x.com/OwenGregorian","OwenGregorian",,"Most of the country shifted right in the 2024 presidential election | NPR

The country largely shifted to the right in this presidential election from where it was four years ago.

In 2020, President Biden won six of the seven most closely watched states, but this year, they all shifted toward President-elect Donald Trump.

What's more, Trump is on track to win the popular vote this time, when Biden won it by 7 million in 2020.

Trump won the suburbs

The suburbs have become increasingly diverse and populous. More than half of voters in 2024 were in suburban areas, according to exit polls. They have become swing areas, home to some of the most closely targeted House seats, and a good barometer of who will win the presidential election.

The winner in the suburbs has won 11 of the last 12 presidential elections, dating back to 1980. And this year that was Trump, 51%-47%, according to exit polls.

Vice President Harris was hoping she could turn out women in the suburbs in key swing states to get her across the finish line. But that didn't happen. Trump, for example, won white suburban women by 7 points, as well as white suburban men — by 27. So there were some split kitchen tables, but not enough to help Harris win.

In multiple swing states, there were significant shifts in Trump's direction in the suburbs, based on nearly final vote totals. That includes a net swing of almost 60,000 votes in the four counties that make up the Philadelphia suburbs and the two major ones north of Detroit, more than 10,000 in the ""WOW"" counties around Milwaukee (Waukesha, Ozaukee and Washington) and in the counties touching Fulton County, Ga., where Atlanta is.

In some of those Atlanta metro counties, though, Harris did better than Biden, and her losses weren't as bad in the Charlotte metro area as in the former Blue Wall states. That's one reason Democrats have been more optimistic about the future in the Sun Belt than the industrial Midwest.

Rural areas went even more for Trump

Trump has done extremely well in rural areas, and in 2024, he won by a record margin. Since 1980, no candidate has done better. Trump won 64% of voters in rural areas this year, according to exit polls. The previous best was 61% – set by Trump in 2016.

That helped him in all of the swing states, but also in red states, like Texas, which boosted his total in the popular vote. He gained, for example, a net of more than 900,000 votes in Texas compared to 2020; and more than 1 million in Florida, a longtime competitive state that saw a dramatic swing in Trump's direction.

His improvement in those states also reflects the major shifts in his direction with Latino voters in South Florida and South Texas.

Harris also underperformed in urban areas

A lot of Democratic base voters live in big cities, and those urban areas are often key to a Democrat winning in the swing states. But Harris got just 59% of voters in urban areas, lower than Biden, former President Barack Obama or Hillary Clinton.

That underperformance is a large part of why she lost in key states. For example, in Maricopa County, Ariz., home to Phoenix, Harris got roughly 61,000 fewer votes than Biden in 2020. Trump, on the other hand, gained about 56,000, for a 117,000-vote shift in just one county.

Read more:

https://t.co/owzNFl3UvM","Fri Nov 22 12:22:56 +0000 2024"
,,,,,,"true","false","https://pbs.twimg.com/profile_banners/1344058907895820288/1649463488","Tue Dec 29 23:13:45 +0000 2020","MR NOBODY 🇺🇸 U.S.A. 🇺🇸
🇺🇸AMERICA WILL NEVER SURRENDER TO EVIL🇺🇸 Thy word is a lamp unto my feet, and a light unto my path.  #SpacesHost",,,,,,,,,,,,,,,,,,,,,,,,,,"0","72","64463","23362","true","1344058907895820288","true","false","false","","35025","🔨Robert The Builder 🇺🇸","1784318351617187975","false","https://pbs.twimg.com/profile_images/1344070453271261184/vFzpY7AY_normal.jpg","","185089","https://twitter.com/NobodymrRobert","user","https://x.com/NobodymrRobert","NobodymrRobert",,"John Fetterman Reacts to Matt Gaetz withdrawing his nomination for Attorney General. 
Here's the Deal.. Gaetz will have even a Better opportunity for him .. 
We won the 2024 presidential election..
You don't always get what you want. https://t.co/7IWou0ox3T","Fri Nov 22 11:54:19 +0000 2024"
,,,,,,"false","false","https://pbs.twimg.com/profile_banners/1498697025994432518/1681476567","Tue Mar 01 16:30:14 +0000 2022","Mens physique bodybuilder, Political Commentator.",,,,,,,,,,,,,,,,,,,,,,,,,,"0","13272","213108","3214","true","1498697025994432518","true","false","false","United States","8049","Ian Jaeger","1863221771077378250","false","https://pbs.twimg.com/profile_images/1602055610903691264/owmk2WyJ_normal.jpg","","28395","https://twitter.com/IanJaeger29","user","https://x.com/IanJaeger29","IanJaeger29",,"BREAKING: Meghan McCain announces that she voted for her late father, John McCain in the 2024 Presidential Election. 

“I just couldn’t explain voting for Trump to my kids, and Kamala never gave me a reason.” https://t.co/7x8wvQB4X4","Fri Nov 22 02:36:05 +0000 2024"
,,,,,,"true","true","https://pbs.twimg.com/profile_banners/20545835/1621263045","Tue Feb 10 21:04:49 +0000 2009","Real News for Real People. 

Watch NEWSMAX, an independent news network with a conservative perspective, available in 100M+ U.S. homes: https://t.co/rs8XZDalW3","nws.mx/tv","http://nws.mx/tv","136","159","https://t.co/rs8XZDalW3",,,,,,,,,,,,,,,,"newsmax.com","http://www.newsmax.com","0","23","https://t.co/mEKjDDH0HC","0","6736","3138442","758","true","20545835","true","false","false","United States","61751","NEWSMAX",,"false","https://pbs.twimg.com/profile_images/1394735604269817857/AXKKo6XT_normal.jpg","","221045","https://twitter.com/NEWSMAX","user","https://x.com/NEWSMAX","NEWSMAX","Business","COMING UP: Trump border czar Tom Homan joins ""American Agenda"" to talk about plans for the new administration's border policy — TODAY at 3 PM ET on NEWSMAX. WATCH: https://t.co/VlT7z8dZjm 
 
@RealTomHoman @KatrinaSzish @BobBrooks_NMX https://t.co/DivPrhZ6Vz","Fri Nov 22 18:25:01 +0000 2024"
,,,,,,"false","true","https://pbs.twimg.com/profile_banners/1610415578207981568/1731172937","Tue Jan 03 23:19:45 +0000 2023","Democrat,retired WallSt analyst (bond underwriting,credit/trading lines)Scotch, Boxing,Tattoos,Photographer,Dog lover. TrumpsGOP is a cult not a political party",,,,,,,,,,,,,,,,,,,,,,,,,,"0","11519","7590","4201","false","1610415578207981568","true","false","false","Brooklyn, NY","6621","Leonidas K","1742178032402440271","false","https://pbs.twimg.com/profile_images/1855945612740476928/QKeVMwLG_normal.jpg","","24702","https://twitter.com/leoknyc777","user","https://x.com/leoknyc777","leoknyc777",,"It’s got less to do with how much they dislike Trump and more to do with his policy proposals. Nobody is saying they’re evil. What happened is they were hoodwinked into voting against themselves and in the process we all suffer. Trump could teach a master class in sales. He played on their unjustified fears that most migrants are bad and they will kill you or rape you and their economic insecurities as he gives corporations an even bigger tax cut and hands working people the bill…his TARIFFS costing them 4 grand a year if not more. Economists are already predicting a75% chance for a recession within 12 months 👇. And women should be happy with those that supported the Republican war on women’s reproductive rights?. Women are already dying from lack of access to abortion care. And we should be all copacetic for his plan to strip away health coverage from working people; cut Medicaid for the poor, cut public education and Pell Grants. Now who’s delusional?","Fri Nov 22 17:18:56 +0000 2024"
,,,,,,"false","true","https://pbs.twimg.com/profile_banners/1606734564734402561/1733068590","Sat Dec 24 19:32:42 +0000 2022","🇺🇸💥#𝐏𝐚𝐭𝐫𝐢𝐨𝐭𝐖𝐚𝐫𝐫𝐢𝐨𝐫𝐬💥🇺🇸 Patriotism is supporting your country all the time, and your government when it deserves it - Mark Twain",,,,,,,,,,,,,,,,,,,,,,,,,,"0","37200","120527","65518","true","1606734564734402561","true","false","false","United States","4182","🇺🇸𝐃𝐔𝐓𝐂𝐇🇺🇸",,"false","https://pbs.twimg.com/profile_images/1863250832470249472/l0rtdye9_normal.jpg","","184854","https://twitter.com/pr0ud_americans","user","https://x.com/pr0ud_americans","pr0ud_americans",,"Tucker Carlson isn't mincing words about the Biden administration's foreign policy:

Claims it's setting up Trump for a potential World War or nuclear conflict.
Critiques the decision to allow Ukraine to use US weapons against Russia.

Is this an overblown scenario or a wake-up call? Watch the video to decide🤔","Fri Nov 22 16:16:33 +0000 2024"
,,,,,,"true","false","https://pbs.twimg.com/profile_banners/2167177693/1728620639","Thu Oct 31 20:08:34 +0000 2013","On the front lines of the battle against a rising wave of online antisemitism. JOIN US in this historic fight to defend the truth and stand with Israel.🇮🇱🇺🇸",,,,,,,,,,,,,,,,,,,,,,,,,,"0","46737","27679","7222","true","2167177693","true","false","false","","2273","Jews Fight Back 🇺🇸🇮🇱","1857218669564113025","false","https://pbs.twimg.com/profile_images/1825625499328196609/O6xDyONv_normal.jpg","","31730","https://twitter.com/JewsFightBack","user","https://x.com/JewsFightBack","JewsFightBack",,"Flashback to when the President of Harvard, Claudine Gay, claimed that calling for genocide of Jews didn’t violate school policy. 

Like this post if you’re glad Pres. Trump chose Rep. Stefanik as Ambassador to the UN!","Fri Nov 22 15:06:33 +0000 2024"
,,,,,,"true","false","https://pbs.twimg.com/profile_banners/1424949789758824449/1731995462","Tue Aug 10 04:24:54 +0000 2021","Team @DougDucey @Citizens4FE | Prev: @DCIGroup | Alum: @uarizona",,,,,,,,,,,,,,,,,,,,,,,,,,"0","6347","1651","901","true","1424949789758824449","true","false","false","Arizona, USA","140","Dan Coulson","1854047235341996396","false","https://pbs.twimg.com/profile_images/1494554343147589636/LtZ6_PmX_normal.jpg","","2424","https://twitter.com/DanCoulsonAZ","user","https://x.com/DanCoulsonAZ","DanCoulsonAZ",,"NEW: @FoxNews @HarrisFaulkner raising the alarm on @KatieHobbs dangerous “sanctuary state” policy to block President Trump from deporting criminal illegal aliens, including violent felons, gang members, and even suspected terrorists.

WATCH: https://t.co/Yesaig9t7a","Fri Nov 22 14:35:49 +0000 2024"
,,,,,,"false","true","https://pbs.twimg.com/profile_banners/1742596295213318147/1731805676","Wed Jan 03 17:18:46 +0000 2024","Hello world!!!

Follow @ezyFitness_ and get in shape",,,,,,,,,,,,,,,,,,,,,"instagram.com/sde.ray","http://instagram.com/sde.ray","0","23","https://t.co/s0mXPRgSIh","0","4414","12741","131","false","1742596295213318147","true","false","false","India 🇮🇳 ","284","Ray","1808845551884251297","false","https://pbs.twimg.com/profile_images/1780042990721077248/TDmtm0K2_normal.jpg","","2797","https://twitter.com/sde_ray","user","https://x.com/sde_ray","sde_ray",,"Most Indians in USA are happy that Trump won, because he has a strong immigration policy. 

Indian themselves, don’t want more Indians coming to USA 🇺🇸 

Some Punjabis in Canada don’t want more punjabis coming to Canada 🇨🇦 

My acquaintance working in Germany is sick of more Indians students migrating to Germany 🇩🇪 

It certainly doesn’t mean all Indians want this. It’s a mentality of most PR and Green Card holders.","Fri Nov 22 13:43:30 +0000 2024"
,,,,,,"false","true","https://pbs.twimg.com/profile_banners/38495835/1695085064","Thu May 07 19:18:36 +0000 2009","THIS IS THE OFFICIAL MARK LEVIN SHOW X PAGE. 
DOWNLOAD MY PODCAST FOR FREE https://t.co/LbO9BeMtMZ   Join me at https://t.co/ARrBQZKtMb","marklevinshow.com/audio-rewind","http://marklevinshow.com/audio-rewind","75","98","https://t.co/LbO9BeMtMZ","LevinTV.com","http://LevinTV.com","112","135","https://t.co/ARrBQZKtMb",,,,,,,,,,,"marklevinshow.com/links/","https://www.marklevinshow.com/links/","0","23","https://t.co/sSubsV2DiI","0","1226","4510675","5","false","38495835","true","false","false","Underground Bunker","1906","Mark R. Levin",,"false","https://pbs.twimg.com/profile_images/378800000116305623/80c5515ce8244c85105172fe5640f550_normal.jpeg","","41460","https://twitter.com/marklevinshow","user","https://x.com/marklevinshow","marklevinshow",,"Personnel is policy! The first battle Trump faces is to get the cabinet that he wants. Listen to the Mark Levin Show podcast for free now.
https://t.co/KkI4Bzp7ag https://t.co/cJ6XrVeDzu","Fri Nov 22 13:25:27 +0000 2024"
