,,,,,,"false","false","https://pbs.twimg.com/profile_banners/18034061/1591557451","Wed Dec 10 23:19:27 +0000 2008","22 years as fed. prosecutor; Def. Attorney for 55+ Jan 6 Defs. Donations accepted at https://t.co/7q3GPrN2Y7.  Comments not legal advice.","givesendgo.com/shipwreckedsj6…","https://www.givesendgo.com/shipwreckedsj6ldf","85","108","https://t.co/7q3GPrN2Y7",,,,,,,,,,,,,,,,,,,,,"0","7924","127141","1811","true","18034061","true","false","false","Interspace","1821","Shipwreckedcrew","1853649706733220296","false","https://pbs.twimg.com/profile_images/1269710615167111168/PuUP773S_normal.jpg","","55385","https://twitter.com/shipwreckedcrew","user","https://x.com/shipwreckedcrew","shipwreckedcrew",,"Gaetz never had a chance at getting confirmed. Bondi always had an “inside track” on the job because of he involvement with America First Policy Institute and Brooke Rollins.  That is the center of gravity for staffing Trump 2.0.  

So why was Gaetz nominated?

As things stand now, 3 of the top 4 jobs at DOJ have nominees who were Trump’s personal attorneys, along with one of the most important operational jobs.

That might have drawn some criticism before. Now the reaction is “At least Matt Gaetz isn’t among them.”

Look for Gaetz to end up as Special Counsel to the President.","Fri Nov 22 13:15:07 +0000 2024"
,,,,,,"false","true","https://pbs.twimg.com/profile_banners/1917731/1434034905","Thu Mar 22 18:15:18 +0000 2007","The Hill is the premier source for policy and political news. Follow for tweets on what's happening in Washington, breaking news and retweets of our reporters.",,,,,,,,,,,,,,,,,,,,,"thehill.com","http://www.thehill.com","0","23","https://t.co/YepTkupUgx","0","230","4356023","345","true","1917731","true","false","false","Washington, DC","1039354","The Hill",,"false","https://pbs.twimg.com/profile_images/1849116977312256002/42BKINwn_normal.png","","1202025","https://twitter.com/thehill","user","https://x.com/thehill","thehill","Business","Bill O’Reilly says Donald Trump Cabinet will have zero policy input https://t.co/fDa6lLZfjh","Fri Nov 22 09:36:02 +0000 2024"
,,,,,,"true","true","https://pbs.twimg.com/profile_banners/402862978/1722340612","Tue Nov 01 17:45:33 +0000 2011","NYT bestselling author, reporter @realDailyWire. Other words: @wsj @nro @firstthingsmag @telegraph. Unabashed church lady. Aspiring matriarch. Eph 5:11",,,,,,,,,,,,,,,,,,,,,"dailywire.com/author/megan-b…","https://www.dailywire.com/author/megan-basham","0","23","https://t.co/413WoCogA4","0","90591","135120","1571","true","402862978","true","false","false","","3693","Megan Basham","1780349641193619482","false","https://pbs.twimg.com/profile_images/1858739157347991552/aXro1b_X_normal.jpg","","43192","https://twitter.com/megbasham","user","https://x.com/megbasham","megbasham",,"Weird, I just checked the press releases of the Evangelical Immigration Table and its partners @WorldRelief, @ERLC and @NAEvangelicals. Though they all signed on to statements demanding the end of Trump’s so-called family separation policy, I cannot find any statements or even press comments addressing Biden’s policy of placing illegal minors with sponsors who are not their relatives, causing an estimated 300,000 to go missing.

Reports now show that some of these children are being sex trafficked and used on porn sites, yet not a single word.","Fri Nov 22 05:09:26 +0000 2024"
,,,,,,"true","false","https://pbs.twimg.com/profile_banners/1222773302441148416/1715766741","Thu Jan 30 06:48:04 +0000 2020","Aggregating and curating news, politics and current affairs. #BTC",,,,,,,,,,,,,,,,,,,,,"visegrad24.com","http://www.visegrad24.com","0","23","https://t.co/qpd6ZYX46V","0","61246","1217773","1787","true","1222773302441148416","true","false","false","Visegrad","36111","Visegrád 24","1862952261262979431","false","https://pbs.twimg.com/profile_images/1798263200648994816/qFYydb3B_normal.jpg","","57891","https://twitter.com/visegrad24","user","https://x.com/visegrad24","visegrad24",,"Trump has nominated Florida's former
AG, and chief of the legal arm of the Trump-aligned America First Policy Institute, Pam Bondi as his new Attorney General.

She’s known as a hardliner on immigration and crime. https://t.co/2Z5wlR2HJS","Fri Nov 22 04:33:42 +0000 2024"
,,,,,,"false","false","https://pbs.twimg.com/profile_banners/120132202/1610346313","Fri Mar 05 15:19:21 +0000 2010","US esp. Georgia politics. Frequent typos. More videos in Highlights.",,,,,,,,,,,,,,,,,,,,,"linktr.ee/blueatlgeorgia","https://linktr.ee/blueatlgeorgia","0","23","https://t.co/ZCt9cU6aQa","0","68557","30206","1755","true","120132202","true","false","false","Atlanta, GA","5313","Blue Georgia","1802904289783767542","false","https://pbs.twimg.com/profile_images/1339850066362851329/Iwf2bRsg_normal.jpg","","34938","https://twitter.com/BlueATLGeorgia","user","https://x.com/BlueATLGeorgia","BlueATLGeorgia",,"RFK Jr: ""He's not like Hitler. Hitler had like a plan... Hitler was interested in policy... he had a historical view. I don't think Trump has any of that. I think he's like non compos."" https://t.co/rIQlv8fDGM","Fri Nov 22 03:43:25 +0000 2024"
,,,,,,"true","false","https://pbs.twimg.com/profile_banners/1456305934393823236/1686026105","Thu Nov 04 17:03:38 +0000 2021","Retired, VA-Cytology
#2A/#MAGA/#FreeJ6/#DiamondHogs
Proud to have served those who serve
Make America Healthy Again
What A Great Time To Be Alive
God Wins",,,,,,,,,,,,,,,,,,,,,"truthsocial.com/@MrMojoRizen86","https://truthsocial.com/@MrMojoRizen86","0","23","https://t.co/hIJDndESLK","0","25860","2021","1862","false","1456305934393823236","true","false","false","Right of center","2549","Ray Zorback",,"false","https://pbs.twimg.com/profile_images/1843024007987093504/LfxNABh9_normal.jpg","","16201","https://twitter.com/Ray_Zorback77","user","https://x.com/Ray_Zorback77","Ray_Zorback77",,"@austerrewyatt1 I think that was the chess move.  Trump exposed them.  And wrap your head around this...
What if Gaetz is named Chief of staff to the AG?  This position does not require Senate approval and Gaetz is suddenly working with Bondi to shape Trump's judicial policy.  5-D chess.","Fri Nov 22 02:19:38 +0000 2024"
,,,,,,"true","true","https://pbs.twimg.com/profile_banners/858812544/1684575002","Tue Oct 02 22:34:51 +0000 2012","Gen-Z Reporter @meidastouch | Top-Tier Politics",,,,,,,,,,,,,,,,,,,,,"youtube.com/@adammockler?s…","https://youtube.com/@adammockler?si=9URwkhOxrrQrQyRP","0","23","https://t.co/6WFe6h3P8L","0","12033","53292","2369","true","858812544","true","false","false","Chicago, IL","300","Adam Mockler🇺🇸🦅","1769827343084786129","false","https://pbs.twimg.com/profile_images/1734611977253892096/SItz3Ylr_normal.jpg","","1628","https://twitter.com/adammocklerr","user","https://x.com/adammocklerr","adammocklerr",,"Liberal vs MAGA host on Trump’s policy https://t.co/A9DGfcKDeK","Fri Nov 22 02:00:13 +0000 2024"
,,,,,,"true","false","https://pbs.twimg.com/profile_banners/2538196992/1429980116","Sat May 31 20:48:09 +0000 2014","Gab: https://t.co/N5oSuM2Qwe
Substack: https://t.co/loaxjKTEiY
SubscribeStar: https://t.co/Pw3febSbeY
Rumble: https://t.co/aD840hQ4Z5","gab.com/TheZBlog","http://gab.com/TheZBlog","5","28","https://t.co/N5oSuM2Qwe","thedissident.substack.com","http://thedissident.substack.com","39","62","https://t.co/loaxjKTEiY","subscribestar.com/the-z-blog","http://subscribestar.com/the-z-blog","78","101","https://t.co/Pw3febSbeY","rumble.com/c/c-2410510","http://rumble.com/c/c-2410510","110","133","https://t.co/aD840hQ4Z5","thezman.com","http://thezman.com","0","23","https://t.co/04tluNhfxx","0","1314","12228","183","false","2538196992","true","false","false","Equatorial Guinea","728","The Z Blog","1862842122610659438","false","https://pbs.twimg.com/profile_images/1642132955878260737/AykmBAht_normal.jpg","","16413","https://twitter.com/TheRealZBlog","user","https://x.com/TheRealZBlog","TheRealZBlog",,"The hard thing many will have to learn is that the point of Trump winning a second term was never about what he would do in terms of policy. He is the same boomer retard he was ten years ago. He will be led around by the nose by Washington a second time.

There is no answer at the ballot box. The point of 2024 was to get used to battling through the moral headwinds in order to reach a goal. Lots of people got used to not caring what the usual suspects said about them and publicly supported Trump.

The way the masses get used to disobeying their betters is by disobeying their betters. All those suburban peasants holding up signs that read ""Mass Deportation Now"" got used to being bad. The next step is for them to be bad in their own interests.","Fri Nov 22 01:35:09 +0000 2024"
,,,,,,"false","true","https://pbs.twimg.com/profile_banners/39076082/1576261795","Sun May 10 17:00:12 +0000 2009","I make my living writing stuff that annoys all the right people.  ITS AWESOME.

Overton Window Mover

Former columnist for The Epoch Times, Uncover DC",,,,,,,,,,,,,,,,,,,,,"briancates.substack.com/archive","https://briancates.substack.com/archive","0","23","https://t.co/Jtjoj9UQDD","0","82063","265803","5932","true","39076082","true","false","false","Lakeland, Florida, USA","28165","Brian Cates - Political Columnist & Pundit","1863247994587377730","false","https://pbs.twimg.com/profile_images/1735085280338567168/D2YgwKL8_normal.jpg","","675361","https://twitter.com/drawandstrike","user","https://x.com/drawandstrike","drawandstrike",,"@livefree0rDie2 Unlike you, I've followed her work at the America First Policy Institute. 

I **strongly** disagree with you. 

https://t.co/E6wQZAY0Rs

I will, however, hear you out as to why you think this is Trump making a bad pick.","Fri Nov 22 00:55:43 +0000 2024"
,,,,,,"true","true","https://pbs.twimg.com/profile_banners/1298372735383605249/1627596282","Tue Aug 25 21:32:51 +0000 2020","Editor-in Chief https://t.co/HLS0hEHY1C, Co-host Uncovered, Attorney, Marine, Former Federal and State Prosecutor, Republican Party Insane Asylum Escapee","MeidasTouch.com","http://MeidasTouch.com","16","39","https://t.co/HLS0hEHY1C",,,,,,,,,,,,,,,,"meidasplus.com/subscribe","http://meidasplus.com/subscribe","0","23","https://t.co/uOScyuLzKo","0","45665","946206","1728","true","1298372735383605249","true","false","false","Maine, USA","30731","Ron Filipkowski","1861934181820866891","false","https://pbs.twimg.com/profile_images/1848186486161575936/hN0rYram_normal.jpg","","83458","https://twitter.com/RonFilipkowski","user","https://x.com/RonFilipkowski","RonFilipkowski",,"So Trump’s VP said he was “America’s Hitler,” and his HHS nominee agreed that he is like Hitler except “Hitler was interested in policy.”

This is where we are at. https://t.co/4ohjIF31vA","Fri Nov 22 00:52:52 +0000 2024"
,,,,,,"true","true","https://pbs.twimg.com/profile_banners/835627637049450497/1727911768","Sat Feb 25 23:08:48 +0000 2017","I'm just here for the Awakening |  Contributor: @BadlandsMedia_ | Head Shitposter: @WeTheMedia17 | Founder: @ConsciousSTRG",,,,,,,,,,,,,,,,,,,,,"allmylinks.com/jordansather","https://allmylinks.com/jordansather","0","23","https://t.co/6AeT2SurKS","0","21032","138117","1120","true","835627637049450497","true","false","false","all points in space and time","5447","Jordan Sather",,"false","https://pbs.twimg.com/profile_images/1841620325857165312/6xQ_b-iD_normal.jpg","","27862","https://twitter.com/Jordan_Sather_","user","https://x.com/Jordan_Sather_","Jordan_Sather_",,"Pam Bondi has been leading the legal arm of the America First Policy Institute, which is the legal institute aligned with Trump that is leading Trump‘s class action lawsuit against Big Tech (among everything else they do).

I sent AFPI a video of my censorship story back in 2021 that they posted on their Facebook page. I’ve been waiting for that class action suit to move forward for a while now, as have many others. 

Maybe soon we’ll finally get reparations for all the censorship we endured throughout 2020/2021. 

Go Pam!","Fri Nov 22 00:50:19 +0000 2024"
,,,,,,"false","true","https://pbs.twimg.com/profile_banners/1366850512247812099/1708018451","Tue Mar 02 20:39:04 +0000 2021","We craft policy, counsel policymakers, amplify activists, challenge media narratives, & do everything we can to build an America where Americans come FIRST.🇺🇸",,,,,,,,,,,,,,,,,,,,,"americafirstpolicy.com","https://americafirstpolicy.com/","0","23","https://t.co/6yHRhNUiiM","0","2054","71513","151","true","1366850512247812099","true","false","false","Washington, D.C.","2398","America First Policy Institute",,"false","https://pbs.twimg.com/profile_images/1758127890401460224/9Trs3aDU_normal.jpg","","6199","https://twitter.com/A1Policy","user","https://x.com/A1Policy","A1Policy","Business","CONGRATULATIONS to former Florida AG @PamBondi, our Chair for the Center for Litigation & Co-Chair of the Center for Law and Justice, on being nominated by President Trump as Attorney General of the United States! 🇺🇸

A fierce advocate for justice and defender of American values, Pam Bondi has shown unwavering dedication to upholding the rule of law and protecting the rights of every citizen.

Our Nation deserves bold leadership, and Pam Bondi is ready to deliver.

Let’s get to work!","Fri Nov 22 00:04:16 +0000 2024"
,,,,,,"false","false","https://pbs.twimg.com/profile_banners/1344401582557786113/1670177989","Wed Dec 30 21:55:12 +0000 2020","𝕊𝕥𝕒𝕟𝕕 𝕗𝕠𝕣 𝕥𝕙𝕖 🇺🇸 & 𝕂𝕟𝕖𝕖𝕝 𝕒𝕥 𝕥𝕙𝕖 ✝️ 🆃🅱🅸🆈🆃🅲❤️𝚂𝚝𝚊𝚢 𝙵𝚛𝚘𝚜𝚝𝚢 & 𝚄𝚗𝚐𝚘𝚟𝚎𝚛𝚗𝚊𝚋𝚕𝚎 👊𝚁𝚃 𝚋𝚢 𝙼𝙰𝙶𝙰 𝙺𝙸𝙽𝙶 𝙳𝙹𝚃𝚡4",,,,,,,,,,,,,,,,,,,,,"truthsocial.com/@nomandates","https://truthsocial.com/@nomandates","0","23","https://t.co/FnGLT6HFra","0","66488","49409","40256","true","1344401582557786113","true","false","false","Florida, USA formerly Colorado","7120","𝕊𝕔𝕒𝕣𝕪 𝔼𝕝𝕖𝕔𝕥𝕚𝕠𝕟 𝔻𝕖𝕟𝕚𝕖𝕣 🇺🇸","1652207967775883266","false","https://pbs.twimg.com/profile_images/1861291031511109632/p-yWhQn0_normal.jpg","","59168","https://twitter.com/nomandatesco","user","https://x.com/nomandatesco","nomandatesco",,"🚨Pam Bondi, former Florida AG, currently heads up America First Policy Institute’s Legal Arm- is tapped by President Trump to be the next Attorney General🚨

Thoughts⁉️ https://t.co/JXMF85K8lR","Fri Nov 22 00:01:56 +0000 2024"
,,,,,,"false","false","https://pbs.twimg.com/profile_banners/49151622/1651905341","Sat Jun 20 23:05:08 +0000 2009","Singer/Songwriter, Actor, Author, Speaker, Antagonist, I resist!",,,,,,,,,,,,,,,,,,,,,"stellaparton.com","http://stellaparton.com","0","23","https://t.co/7MYifeKqSO","0","122860","134710","154","false","49151622","false","false","false","Washington, DC","1639","Stella Parton","1860889638677664143","false","https://pbs.twimg.com/profile_images/1779513958086651904/_UsL2KyG_normal.jpg","","30227","https://twitter.com/StellaParton","user","https://x.com/StellaParton","StellaParton",,"Does it bother any of you trump supporters and voters that he’s living outside the law and has not been held accountable for any of his well known crimes ? You know you would be in prison for just one of his crimes. Why is that ok with you?","Fri Nov 22 23:45:19 +0000 2024"
,,,,,,"false","false","https://pbs.twimg.com/profile_banners/988524457621966848/1524517849","Mon Apr 23 21:06:11 +0000 2018","Your No. 1 source for Political Gossip! #MAGA #TRUMPTEAM 🦅 🇺🇸Subscribe to my profile to support my work",,,,,,,,,,,,,,,,,,,,,,,,,,"0","5951","191232","1999","true","988524457621966848","true","false","false","Turn ON notifications 🔔","2313","Wake Up America","1860771525214806257","false","https://pbs.twimg.com/profile_images/1625124944181964802/wyHjOG1U_normal.jpg","","11599","https://twitter.com/_wake_up_USA","user","https://x.com/_wake_up_USA","_wake_up_USA",,"Gavin Newsom says, “I care about Trump supporters, I care about Robert Kennedy Jr supporters, I care about Tucker Carlson supporters ... I care about all people.”

Do you believe him? https://t.co/arCDl5zmAc","Fri Nov 22 23:30:01 +0000 2024"
,,,,,,"true","true","https://pbs.twimg.com/profile_banners/1312133657080012807/1706840680","Fri Oct 02 20:54:31 +0000 2020","𝓐𝓶𝓮𝓻𝓲𝓬𝓪’𝓼 𝓢𝓽𝓮𝓹𝓭𝓪𝓭",,,,,,,,,,,,,,,,,,,,,,,,,,"0","101771","136981","3025","true","1312133657080012807","true","false","false","Monkey Junction, NC","5743","Kristi Yamaguccimane","1639245882288930816","false","https://pbs.twimg.com/profile_images/1811819019688620032/3rhxzIss_normal.jpg","","35587","https://twitter.com/TheWapplehouse","user","https://x.com/TheWapplehouse","TheWapplehouse",,"It’s imperative the Left start planting conspiracy theories about JD Vance plotting against Trump so that when a routine coronary sends him to the big McDonald’s in the sky there’s a mob of deranged MAGA supporters dragging JD out the naval observatory convinced he was behind it","Fri Nov 22 22:30:43 +0000 2024"
,,,,,,"true","false","https://pbs.twimg.com/profile_banners/1089308757035794432/1722113100","Sat Jan 26 23:47:00 +0000 2019","Content Creator, Political Strategist, Zoomer, Conservative, National Populist, Orthodox Christian 🇦🇲☦️, #AmericaFirst 🇺🇸 #Trump2024 🍊",,,,,,,,,,,,,,,,,,,,,"youtube.com/channel/UC0SMG…","https://www.youtube.com/channel/UC0SMGmU6X9zJBGCGarr7ODQ?view_as=subscriber","0","23","https://t.co/wTJqTa8B8U","0","32042","101909","811","true","1089308757035794432","true","false","false","DET/DFW","906","Red Eagle Politics","1854049355147424229","false","https://pbs.twimg.com/profile_images/1837973789495136256/RfWEZNvU_normal.jpg","","12747","https://twitter.com/RedEaglePatriot","user","https://x.com/RedEaglePatriot","RedEaglePatriot",,"True. But you know who else did? Matt Gaetz.

Bondi was one of Trump's most prominent original supporters, and backed Trump in the March FL Primary. Led the ""Lock Her Up!"" chants at the 2016 RNC.

I get skepticism, but using this to discredit her is dumb. It's not 2015 anymore.","Fri Nov 22 22:12:08 +0000 2024"
,,,,,,"true","false","https://pbs.twimg.com/profile_banners/1486068736306167823/1691105069","Tue Jan 25 20:09:59 +0000 2022","Independent Photographer in NYC |Breaking News | Viral Videos | Take no sides | For News tip or license Copyright protected footage email viralnewsnyc@gmail.com",,,,,,,,,,,,,,,,,,,,,"linktr.ee/viralnewsnyc","https://linktr.ee/viralnewsnyc","0","23","https://t.co/PdA9UV89hE","0","20774","128568","6099","true","1486068736306167823","true","false","false","New York, NY","7139","Viral News NYC","1863019096209576401","false","https://pbs.twimg.com/profile_images/1490027619441590273/YskMMmYs_normal.jpg","","30734","https://twitter.com/ViralNewsNYC","user","https://x.com/ViralNewsNYC","ViralNewsNYC",,"🚨Anarchists Among Trump Supporters at the January 6 Capitol Riot🚨

While the mainstream media has focused primarily on Trump supporters during the January 6 Capitol riot, evidence is emerging that far-left anarchists infiltrated the crowd, disguised as Trump supporters, and played a key role in escalating the chaos. This critical aspect of the riot has been largely ignored, but it is crucial to understanding the full scope of the events.

Although I wasn’t filming at the Capitol on January 6, I had been documenting far-left anarchist groups in Brooklyn and other areas leading up to the event. These groups had coordinated their efforts to travel to Washington, D.C., arriving by car, van, plane, and caravans. They were actively involved in stoking violence at the Capitol.

One anarchist I spoke with shared that, as he was leaving a hotel to head to the Capitol, he saw Proud Boys nearby and became nervous. However, because he was dressed as a Trump supporter, he was able to blend in without being recognized. This shows how anarchists strategically disguised themselves to infiltrate the crowd while advancing their disruptive agenda.

I also caught anarchist Talia Jane on camera at a protest, dressed as a Trump supporter. When confronted, she lied about being there, falsely claiming she was in D.C. as a member of the press—despite not having a press pass. Independent photographers confirmed spotting anarchists like Talia Jane at the Capitol, further corroborating the evidence that these groups were embedded within the crowd.

Videos from the day show anarchists changing into Trump supporter clothing as they participated in the riot. Some were filmed wearing black bloc gear and then quickly switching into Trump attire, further muddying the waters between the two factions. This shift in clothing shows that these anarchists were deliberately trying to blend in and escalate the situation.

In the lead-up to the riot, far-left anarchists made calls to action, urging people to come to D.C. and confront Republicans. I have screenshots of these communications, which show their intent to agitate and escalate tensions at the Capitol.

These anarchist groups are notorious for blending into protests and stirring up violence. They’ve done it before—at the Watson Hotel during a protest involving migrants and at Columbia College during a student protest. Their tactic is to appear as participants or press but are, in fact, organizers pushing their agenda from within the crowd.

A common tactic of these groups is to agitate crowds into violent confrontations and then step back, letting others take the brunt of the consequences from law enforcement. This strategy, which is also adopted by terrorist organizations, allows anarchists to avoid responsibility while others face the heat.

It’s my opinion that these anarchists played a central role in starting the riot in D.C. and that Trump supporters took the brunt of it. Trump supporters, many of whom were likely confused by the chaos around them, reacted in the only way they knew—by fighting back. While they were wrong for entering the Capitol and attacking Capitol Police, their reaction must be understood in the context of the anarchists who stirred the violence in the first place.

Despite all the evidence, the mainstream media largely failed to cover the role of anarchists at the Capitol riot. Videos from Instagram, Twitter, and TikTok show anarchists bragging about their participation, yet many of these accounts have been deleted or suspended. I’m calling on @elonmusk to review these suspended accounts and provide transparency about their involvement in the riot.

While Trump supporters were certainly a major presence at the Capitol, they weren’t the only ones fueling the violence. Anarchists, disguised as Trump supporters, played a significant role in escalating the riot, and their involvement should not be ignored. 

I'll attach more proof at the bottom. 

By @LeeroyPress","Fri Nov 22 21:26:29 +0000 2024"
,,,,,,"false","true","https://pbs.twimg.com/profile_banners/39344374/1674355501","Mon May 11 21:18:33 +0000 2009","",,,,,,,,,,,,,,,,,,,,,"linktr.ee/donaldjtrumpjr","https://linktr.ee/donaldjtrumpjr","0","23","https://t.co/ni5HwFvEjX","0","37486","13214235","2109","true","39344374","true","false","false","Florida, USA","3220","Donald Trump Jr.","1861626140441616678","false","https://pbs.twimg.com/profile_images/766652495858896897/LjrJJB9a_normal.jpg","","50643","https://twitter.com/DonaldJTrumpJr","user","https://x.com/DonaldJTrumpJr","DonaldJTrumpJr",,"In all fairness I think my family and I may have been some of the only people who supported @realDonaldTrump in the 2016 GOP primary. Once he broke through the lies and stereotypes and proved to be a populist leader that all changed. @PamBondi was one of his earliest supporters!","Fri Nov 22 21:06:27 +0000 2024"
,,,,,,"false","true","https://pbs.twimg.com/profile_banners/1575138829/1676465713","Sun Jul 07 13:02:59 +0000 2013","Meh...",,,,,,,,,,,,,,,,,,,,,,,,,,"0","156109","78629","691","true","1575138829","true","false","false","Missouri State 🐻","11320","EducatëdHillbilly™","1714613528705880135","false","https://pbs.twimg.com/profile_images/1741605692249620480/ACUI9ZI6_normal.jpg","","53278","https://twitter.com/RobProvince","user","https://x.com/RobProvince","RobProvince",,"A man in Dakota ran over a 18 year old high school student and killed him because people like Biden and the Democrats convinced him all Trump supporters were a threat. He believed this so wholeheartedly he left the 18 to die at the side of the road and only called police later from his home. 

He got only 5 years for this.","Fri Nov 22 20:23:02 +0000 2024"
,,,,,,"true","true","https://pbs.twimg.com/profile_banners/1441965051414339586/1722900474","Sun Sep 26 03:17:22 +0000 2021","Reporting the news the mainstream media won’t.⁣ | DM business inquiries",,,,,,,,,,,,,,,,,,,,,"linktr.ee/ResisttheMains…","http://linktr.ee/ResisttheMainstream","0","23","https://t.co/c1MX0OVGH8","0","178","317444","153","false","1441965051414339586","true","false","false","","9612","Resist the Mainstream","1861249015582433338","false","https://pbs.twimg.com/profile_images/1777217835036495872/atU7ay85_normal.jpg","","29934","https://twitter.com/ResisttheMS","user","https://x.com/ResisttheMS","ResisttheMS","Business","9. Woman appears to threaten Trump supporters. 

""Consequences are attached to their vote."" https://t.co/SkOV8I2LOm","Fri Nov 22 20:16:32 +0000 2024"
