,,,,,,"false","false","https://pbs.twimg.com/profile_banners/1593635660681957399/1700080620","Fri Nov 18 16:02:22 +0000 2022","SpacesHo(st) trying to find common ground. Dubbed a “liberal pundit” by Alter Net. Smack Talker. The country is doomed if we don't communicate.",,,,,,,,,,,,,,,,,,,,,,,,,,"0","203321","103880","5633","true","1593635660681957399","true","false","false","Rent Free in MAGAland","14803","Art Candee 🍿🥤","1859617166175129604","false","https://pbs.twimg.com/profile_images/1682807417371779073/v0CjudT4_normal.jpg","","125338","https://twitter.com/ArtCandee","user","https://x.com/ArtCandee","ArtCandee",,"Donald Trump's win was not a ""landslide"" nor a ""mandate.""

Bro didn't get 50% of the votes which means that more people voted against him than for him. https://t.co/OcmH3GnqaB","Fri Nov 22 16:21:51 +0000 2024"
,,,,,,"false","true","https://pbs.twimg.com/profile_banners/1679184068204691457/1689184872","Wed Jul 12 17:41:14 +0000 2023","Retired Army. OIF. My dd-214 blanket protects me. Happily married. God is good. Politically homeless. @AlabamaFTBL @Cubs @Eagles @ChicagoBulls #rolltide",,,,,,,,,,,,,,,,,,,,,,,,,,"0","38321","14019","9451","false","1679184068204691457","true","false","false","Florida, USA","1161","Stephen",,"false","https://pbs.twimg.com/profile_images/1793747044445675520/BdeZLdeX_normal.jpg","","20617","https://twitter.com/Smitty68WF2","user","https://x.com/Smitty68WF2","Smitty68WF2",,"What y'all think?

""Tubes Tied for Trump""

A leftist movement. 

It's a win win no abortion needed and you'll never be able to brainwash a poor innocent child with your nonsense. 

Pass it on. Lol","Fri Nov 22 16:20:44 +0000 2024"
,,,,,,"false","true","https://pbs.twimg.com/profile_banners/39344374/1674355501","Mon May 11 21:18:33 +0000 2009","",,,,,,,,,,,,,,,,,,,,,"linktr.ee/donaldjtrumpjr","https://linktr.ee/donaldjtrumpjr","0","23","https://t.co/ni5HwFvEjX","0","37486","13214235","2109","true","39344374","true","false","false","Florida, USA","3220","Donald Trump Jr.","1861626140441616678","false","https://pbs.twimg.com/profile_images/766652495858896897/LjrJJB9a_normal.jpg","","50643","https://twitter.com/DonaldJTrumpJr","user","https://x.com/DonaldJTrumpJr","DonaldJTrumpJr",,"YUGE win in Manhattan DA case Sentencing cancelled, the judge also apparently asked to file papers to dismiss case.
Another one bites the dust!!! LFG🇺🇸🇺🇸🇺🇸 https://t.co/soLqPAs3Qh","Fri Nov 22 16:09:27 +0000 2024"
,,,,,,"true","true","https://pbs.twimg.com/profile_banners/764187379/1731347345","Fri Aug 17 18:11:47 +0000 2012","National Political Analyst. if you like reality straight with no chaser, subscribe: The Cycle on Substack. We Went High and Lost (Again)",,,,,,,,,,,,,,,,,,,,,"thecycle.substack.com","https://thecycle.substack.com/","0","23","https://t.co/ahKiPdwAkO","0","60908","203538","22537","true","764187379","true","false","false","Real America","11439","Rachel Bitecofer 🗽🦆","1855028913518657843","false","https://pbs.twimg.com/profile_images/1856031404850823168/Q2fe2Lwr_normal.jpg","","117692","https://twitter.com/RachelBitecofer","user","https://x.com/RachelBitecofer","RachelBitecofer",,"This is the reason he’s been nominated. 

Trump’s Pentagon pick Hegseth wrote of US military taking sides in ‘civil war’

Defense secretary pick said in 2020 that should Democrats win election the military ‘will be forced to make a choice’ https://t.co/S9tZimohzi","Fri Nov 22 15:59:31 +0000 2024"
,,,,,,"true","false","https://pbs.twimg.com/profile_banners/127941629/1733095434","Tue Mar 30 17:37:29 +0000 2010","Official Ben Garrison Cartoons on X  Ben Draws Tina Posts 🇺🇸
Main Account /reinstated in 2023. Political Cartoons and more. 
Follow backup @GrrrGraphics2 🤠",,,,,,,,,,,,,,,,,,,,,"grrrgraphics.com","http://grrrgraphics.com","0","23","https://t.co/1HTTba62kf","0","55065","208161","17575","true","127941629","true","false","false","NW Montana USA ","17699","Real Ben Garrison Cartoons","1862888052974334239","false","https://pbs.twimg.com/profile_images/1863364365170397184/IwqR1Zit_normal.jpg","","69732","https://twitter.com/GrrrGraphics","user","https://x.com/GrrrGraphics","GrrrGraphics",,"Merchan has thrown in the towel...Decisive win for Trump","Fri Nov 22 15:56:30 +0000 2024"
,,,,,,"true","false","https://pbs.twimg.com/profile_banners/9300262/1479760803","Mon Oct 08 00:29:38 +0000 2007","Politics. Policy. Power.
Congress nerds 👉 @politicongress 
Longreads and opinions 👉 @politicomag
Got a news tip? 👉 https://t.co/JBzpu588Hy","politi.co/2LcOtt5","http://politi.co/2LcOtt5","115","138","https://t.co/JBzpu588Hy",,,,,,,,,,,,,,,,"politico.com","http://politico.com","0","23","https://t.co/scdhnZnzfN","0","209","4535210","1213","true","9300262","true","false","false","Washington, D.C.","157963","POLITICO",,"false","https://pbs.twimg.com/profile_images/1821642506800353280/xIpx4wIO_normal.jpg","","389738","https://twitter.com/politico","user","https://x.com/politico","politico",,"Column: Calling Trump’s win ""resounding"" isn’t just wrong. It’s risky, writes @michaelschaffer. https://t.co/fu8fc0Kl6C","Fri Nov 22 15:48:38 +0000 2024"
,,,,,,"true","true","https://pbs.twimg.com/profile_banners/177812997/1695702256","Fri Aug 13 03:35:22 +0000 2010","executive director of @amconmag, The American Conservative magazine",,,,,,,,,,,,,,,,,,,,,"theamericanconservative.com","http://theamericanconservative.com","0","23","https://t.co/rJutbQPF42","0","21936","19025","4922","true","177812997","true","false","false","Washington, DC, USA","1728","Curt Mills",,"false","https://pbs.twimg.com/profile_images/1801057075016986624/Krm1TUoj_normal.jpg","","6123","https://twitter.com/CurtMills","user","https://x.com/CurtMills","CurtMills",,"So it really was win-or-go-to-jail for Trump. Far from stabilizing our justice system and the rule of law, the prosecutions (defended by many smart, serious liberals) and the implications of this would seem to destabilize faith in it... https://t.co/JGTtjvT4Hg","Fri Nov 22 15:47:01 +0000 2024"
,,,,,,"true","true","https://pbs.twimg.com/profile_banners/1441965051414339586/1722900474","Sun Sep 26 03:17:22 +0000 2021","Reporting the news the mainstream media won’t.⁣ | DM business inquiries",,,,,,,,,,,,,,,,,,,,,"linktr.ee/ResisttheMains…","http://linktr.ee/ResisttheMainstream","0","23","https://t.co/c1MX0OVGH8","0","178","317444","153","false","1441965051414339586","true","false","false","","9612","Resist the Mainstream","1861249015582433338","false","https://pbs.twimg.com/profile_images/1777217835036495872/atU7ay85_normal.jpg","","29934","https://twitter.com/ResisttheMS","user","https://x.com/ResisttheMS","ResisttheMS","Business","NEW: Liberal woman says she feels uncomfortable in public after Trump's landslide win. 

""I feel so mistrustful ... I don't know who's on my side and who's on the other side.""

https://t.co/96Vh7aYnMv","Fri Nov 22 15:42:00 +0000 2024"
,,,,,,"false","true","https://pbs.twimg.com/profile_banners/1336724094188969992/1732129025","Wed Dec 09 17:27:38 +0000 2020","Chief White House Correspondent for @OANN",,,,,,,,,,,,,,,,,,,,,"oann.com","http://oann.com","0","23","https://t.co/WPGACutNZI","0","12869","53484","2744","true","1336724094188969992","true","false","false","","1698","Daniel Baldwin",,"false","https://pbs.twimg.com/profile_images/1826326203935969280/03xsXjty_normal.jpg","","6655","https://twitter.com/baldwin_daniel_","user","https://x.com/baldwin_daniel_","baldwin_daniel_",,"NEW: President Trump's sentencing date has been delayed indefinitely by Judge Juan Merchan.

Massive Trump win. The lawfare lost.","Fri Nov 22 15:41:32 +0000 2024"
,,,,,,"true","false","https://pbs.twimg.com/profile_banners/807975026/1613848509","Fri Sep 07 01:50:06 +0000 2012","White House correspondent at HuffPost. Author of THE USEFUL IDIOT -- Now fully updated post-January 6. https://t.co/88HnBbA8a7","amzn.to/3dwnydp","http://amzn.to/3dwnydp","103","126","https://t.co/88HnBbA8a7",,,,,,,,,,,,,,,,"svdate.com","http://svdate.com/","0","23","https://t.co/25GEfItwPN","0","1629","199321","1036","true","807975026","false","false","false","","6530","S.V. Dáte","1723884168483058045","false","https://pbs.twimg.com/profile_images/1760136955063341056/_vxICbBK_normal.jpg","","84983","https://twitter.com/svdate","user","https://x.com/svdate","svdate",,"He got less than 50 pct of the votes. His electoral college margin was again smaller than Obama’s in both 2008 and 2012. 

The ONLY thing “historic” about Trump’s win is that America had never elected a coup-attempting criminal before.","Fri Nov 22 15:34:00 +0000 2024"
"https://pbs.twimg.com/profile_images/1706335295673643008/oZ6-fC_p_bigger.jpg","Washington Free Beacon","https://twitter.com/FreeBeacon","DeepLink","Badge","BusinessLabel","true","true","https://pbs.twimg.com/profile_banners/131538331/1723608247","Sat Apr 10 15:35:15 +0000 2010","Senior Writer, Foreign Policy & National Security for @FreeBeacon. I'm that guy you don't like. Perpetually enraged. (E-mail: AKReporter@protonmail.com)",,,,,,,,,,,,,,,,,,,,,"freebeacon.com/author/adam-kr…","http://freebeacon.com/author/adam-kredo/","0","23","https://t.co/6CrByXbu0G","0","12865","36486","2408","true","131538331","true","false","false","Hell (Washington, D.C.)","2352","Adam Kredo",,"false","https://pbs.twimg.com/profile_images/428947244323049472/qWeRiNB4_normal.png","","70533","https://twitter.com/Kredo0","user","https://x.com/Kredo0","Kredo0",,"SCOOP: State Dept Probed Over In-House Therapy Sessions for Employees After Trump Win -- @repdarrellissa wants to know how much taxpayer cash was spent on 'cry' sessions https://t.co/MnK9Hen5AD","Fri Nov 22 15:23:16 +0000 2024"
,,,,,,"false","true","https://pbs.twimg.com/profile_banners/1398371181615583238/1732977249","Fri May 28 20:10:57 +0000 2021","""Surely, everyone knows the great furry bumblebee, that gentle giant of the blossoms, that somehow awkward, slow, bumbling bear of a bee.""",,,,,,,,,,,,,,,,,,,,,"janbhommel.nl","http://www.janbhommel.nl","0","23","https://t.co/wKIgVs0ts8","0","223027","61490","300","true","1398371181615583238","true","false","false","Dalfsen","2747","Jan B. Hommel","1862181713465516374","false","https://pbs.twimg.com/profile_images/1862888940572655616/GQfFqWXA_normal.jpg","","41542","https://twitter.com/john_bumblebee","user","https://x.com/john_bumblebee","john_bumblebee",,"Het vermoedelijke antwoord van Trump:

“Well, maybe you should try to win the war on your own.”

Stilte.

#RussiaUkraineWar","Fri Nov 22 15:05:45 +0000 2024"
,,,,,,"true","false","https://pbs.twimg.com/profile_banners/427630477/1729705502","Sat Dec 03 19:33:33 +0000 2011","Senior congressional reporter @PunchbowlNews, covering the Senate. Proud Italian-American 🇮🇹 & Philly native. andrew@punchbowl.news",,,,,,,,,,,,,,,,,,,,,,,,,,"0","36131","90968","1020","true","427630477","true","false","false","Washington, D.C.","6024","Andrew Desiderio",,"false","https://pbs.twimg.com/profile_images/1743136989023547393/dp9DdZAi_normal.jpg","","66664","https://twitter.com/AndrewDesiderio","user","https://x.com/AndrewDesiderio","AndrewDesiderio",,"Mike Rogers, formerly a Trump critic, hugged Trump tightly to try to win his Senate race in Michigan, lost, then was rumored to be under consideration for FBI director, the MAGA right went nuts, and now this from a Trump adviser:","Fri Nov 22 14:55:49 +0000 2024"
,,,,,,"true","false","https://pbs.twimg.com/profile_banners/1407287713531899911/1730259157","Tue Jun 22 10:42:02 +0000 2021","Columnist @Townhallcom | Proud Minnesota conservative | Elections, takes, breaking news #MemeCaucus",,,,,,,,,,,,,,,,,,,,,"dustingrage.com","http://www.dustingrage.com","0","23","https://t.co/RUTTiOd37k","0","109070","61506","4220","true","1407287713531899911","true","false","false","Minnesota ","9888","Dustin Grage","1863028756501131545","false","https://pbs.twimg.com/profile_images/1799469009714233344/f69nVrmA_normal.jpg","","47952","https://twitter.com/GrageDustin","user","https://x.com/GrageDustin","GrageDustin",,"🚨 BREAKING: Trump confirms that Mike Rogers will NOT be heading the FBI.

This is a huge win for Liberty. https://t.co/O3M4HnYhxb","Fri Nov 22 14:55:47 +0000 2024"
,,,,,,"true","false","https://pbs.twimg.com/profile_banners/499154896/1702478678","Tue Feb 21 20:46:09 +0000 2012","Trump Campaign Advisor | CEO of @XStrategiesLLC | America First. Always 🇺🇸",,,,,,,,,,,,,,,,,,,,,"DonaldJTrump.com","http://DonaldJTrump.com","0","23","https://t.co/T4075vHFfa","0","72013","509956","2361","true","499154896","true","false","false","Palm Beach, FL","3654","Alex Bruesewitz 🇺🇸","1812333419302383718","false","https://pbs.twimg.com/profile_images/1619776218907148288/uSY9SPVw_normal.jpg","","27817","https://twitter.com/alexbruesewitz","user","https://x.com/alexbruesewitz","alexbruesewitz",,"After Donald Trump's 2016 election win, largely propelled by his effective use of social media platforms, the Democrats put maximum pressure on these platforms to censor Trump and conservative voices.

Should the Democrats ever regain control of the House or Senate, they would leverage their power to reinstate censorship policies on platforms like X and TRUTH, as well as on podcasts and all other forms of independent media.

It's crucial that Republicans remain vigilant and ready to protect free speech rights!","Fri Nov 22 14:52:00 +0000 2024"
,,,,,,"true","true","https://pbs.twimg.com/profile_banners/763094579491008512/1651332472","Tue Aug 09 19:28:20 +0000 2016","Assistant News Director @FLVoiceNews | Marylander-turned-Floridian | Politics & breaking news alerts | https://t.co/55cqQGUClp","flvoicenews.com","http://flvoicenews.com","103","126","https://t.co/55cqQGUClp",,,,,,,,,,,,,,,,"ericdaugherty.net","http://ericdaugherty.net","0","23","https://t.co/9JrzFB6FPm","0","62720","252064","1145","true","763094579491008512","true","false","false","","5044","Eric Daugherty","1861851444556464631","false","https://pbs.twimg.com/profile_images/1823491411934633984/eY6C-778_normal.png","","25854","https://twitter.com/EricLDaugh","user","https://x.com/EricLDaugh","EricLDaugh",,"I think a lot of elected Republicans are failing to realize that THEY did not win. Trump won.

He just has such a turnout impact that many of them were dragged over the finish line because Trump was on the ballot.

I’m serious. 2026 will be rough if the entitlement continues.","Fri Nov 22 14:46:04 +0000 2024"
,,,,,,"false","true","https://pbs.twimg.com/profile_banners/1824800868618919936/1724013145","Sat Aug 17 13:30:41 +0000 2024","",,,,,,,,,,,,,,,,,,,,,"wildworldofhistory.com","http://www.wildworldofhistory.com","0","23","https://t.co/TdWjW1dGm9","0","3169","23991","4827","false","1824800868618919936","true","false","false","","220","Larry Schweikart","1828131191154974904","false","https://pbs.twimg.com/profile_images/1825269543343931392/Uh71Rz3l_normal.jpg","","7402","https://twitter.com/LarrySchwe94560","user","https://x.com/LarrySchwe94560","LarrySchwe94560",,"@elonmusk Too late. There was a deal today to give Trump four current appointments in return for not opposing 13.

Doesn't sound like a win to me.","Fri Nov 22 14:29:40 +0000 2024"
,,,,,,"true","true","https://pbs.twimg.com/profile_banners/50772918/1448333179","Thu Jun 25 21:16:40 +0000 2009","https://t.co/GDdmAGFxIU founder, @outkick @clayandbuck radio 12-3 pm et, author, American Playbook, dad of three boys, lawyer","Outkick.com","http://Outkick.com","0","23","https://t.co/GDdmAGFxIU",,,,,,,,,,,,,,,,"outkick.com","http://www.outkick.com","0","23","https://t.co/5cIt9LNswn","0","45826","1324072","561","true","50772918","true","false","false","Nashville","10368","Clay Travis","1863222712283381851","false","https://pbs.twimg.com/profile_images/668983225860034564/PIdSf23G_normal.jpg","","147063","https://twitter.com/ClayTravis","user","https://x.com/ClayTravis","ClayTravis",,"Celebrities leaving the country after Trump’s win are shallow, privileged losers showing just how out of touch they are per a fired up @LaraTravis: https://t.co/gD0PItqvg2","Fri Nov 22 14:17:38 +0000 2024"
,,,,,,"true","false","https://pbs.twimg.com/profile_banners/415376420/1723748133","Fri Nov 18 07:52:09 +0000 2011","Oregon St. Rep. (N/NE Portland), Registered Nurse, Head Start Kid, Former Janitor, Community College Grad, UNION Rep, Bernie Delegate, Advocate, He/Him 🌈",,,,,,,,,,,,,,,,,,,,,"nelsonfororegon.com","http://www.nelsonfororegon.com","0","23","https://t.co/qMSl5ZiUWB","0","4698","3050","914","true","415376420","false","false","false","Portland, OR","559","Rep. Travis E. Nelson 🩺","1656041677545693184","false","https://pbs.twimg.com/profile_images/1849932206346731522/Sf6SsOJJ_normal.jpg","","3268","https://twitter.com/IamTravisNelson","user","https://x.com/IamTravisNelson","IamTravisNelson",,"Seems many of us overreacted on election night. That Trump landslide we saw on election night has evaporated into a 1 point win.

Trump is going to get less than 50% of the popular vote. 

This is no mandate….. 

The national polls were right too, this was basically a tie. https://t.co/8ZrlXqArzM","Fri Nov 22 14:14:40 +0000 2024"
,,,,,,"false","true","https://pbs.twimg.com/profile_banners/1605612129045909504/1731123147","Wed Dec 21 17:12:32 +0000 2022","🇺🇸 Proudly supporting Democracy & President Joe Biden
#SlavaUkraini #LGBTQRights
#WomensRightsAreHumanRights 💙 #FBR",,,,,,,,,,,,,,,,,,,,,,,,,,"0","41678","14002","13607","false","1605612129045909504","true","false","false","Knoxville, TN","4707","Brian Carniello 🇺🇸","1856932262568218837","false","https://pbs.twimg.com/profile_images/1860114203362598912/7KPjXMXg_normal.jpg","","20340","https://twitter.com/BrianCarniello1","user","https://x.com/BrianCarniello1","BrianCarniello1",,"@TheTNHoller Trump didn't win because his MAGA base cares about the economy. He won because he validates their hate &amp; bigotry and because he kicks the people they hate harder than anyone. Nancy Mace knows what she's doing.","Fri Nov 22 14:10:41 +0000 2024"
,,,,,,"false","false","https://pbs.twimg.com/profile_banners/41634520/1733090158","Thu May 21 17:41:12 +0000 2009","TV Host Fox News Channel 9 PM EST. Nationally Syndicated Radio Host 3-6 PM EST. https://t.co/0WmPPuxbkF Retweets, Follows NOT endorsements! Due to hackings, no DM’s!","Hannity.com","http://Hannity.com","80","103","https://t.co/0WmPPuxbkF",,,,,,,,,,,,,,,,"hannity.com","https://hannity.com","0","23","https://t.co/NVYzWzCPMh","0","97","6863688","13","true","41634520","true","false","false","New York, USA","1811","Sean Hannity 🇺🇸","1862853808944042422","false","https://pbs.twimg.com/profile_images/1862487402163433472/Ccr7C3Lh_normal.jpg","","31520","https://twitter.com/seanhannity","user","https://x.com/seanhannity","seanhannity",,"‘Hysteria’ is at the core of this behavior, says @drdrew on celebrities relocating after Trump win https://t.co/HUuMKHSHSE","Fri Nov 22 13:53:04 +0000 2024"
,,,,,,"true","false",,"Wed Feb 13 10:21:18 +0000 2008","Advisor on Trump’s 2016 Transition team & 2020 Trump Victory Committee   Political Psychologist & Media Commentator @GBNews @BBCWorld @Sky @CNBC @CNN @Breitbart",,,,,,,,,,,,,,,,,,,,,"drjan.substack.com","http://drjan.substack.com","0","23","https://t.co/WF7MbFmd0d","0","1569","93025","2812","true","13424892","true","false","false","London, England","592","Dr. Jan Halper-Hayes","1862551936987447358","false","https://pbs.twimg.com/profile_images/700750315029557252/ZWyVl_VY_normal.png","","8965","https://twitter.com/Biz_Shrink","user","https://x.com/Biz_Shrink","Biz_Shrink",,"Musk and Trump Take On DEEP STATE - Will They Win? -    I did an interview this week that was aired in the Middle East, Turkey, and Europe. Matthew Moore is a great presenter.  https://t.co/AycHsb4MtQ","Fri Nov 22 13:52:54 +0000 2024"
,,,,,,"false","false","https://pbs.twimg.com/profile_banners/1498697025994432518/1681476567","Tue Mar 01 16:30:14 +0000 2022","Mens physique bodybuilder, Political Commentator.",,,,,,,,,,,,,,,,,,,,,,,,,,"0","13272","213108","3214","true","1498697025994432518","true","false","false","United States","8049","Ian Jaeger","1863221771077378250","false","https://pbs.twimg.com/profile_images/1602055610903691264/owmk2WyJ_normal.jpg","","28395","https://twitter.com/IanJaeger29","user","https://x.com/IanJaeger29","IanJaeger29",,"BREAKING: Rob Reiner says he has checked himself into a Facility for “Peace and Relaxation” following President Trump’s Election Win. https://t.co/2102817qJg","Fri Nov 22 13:31:41 +0000 2024"
,,,,,,"false","true","https://pbs.twimg.com/profile_banners/177564016/1732889146","Thu Aug 12 13:32:41 +0000 2010","Husband, father, grandpop, child of the King. BlazeTV host. 3x best-selling author. EP of Nefarious. You'll call me a prophet and grifter before we're through.",,,,,,,,,,,,,,,,,,,,,"stevedeace.com","http://www.stevedeace.com","0","23","https://t.co/CH2oK8uTLd","0","1446","260644","510","true","177564016","false","false","false","I'm always around.","5262","Steve Deace",,"false","https://pbs.twimg.com/profile_images/1862006191196389376/NsILWqNG_normal.jpg","","152920","https://twitter.com/SteveDeaceShow","user","https://x.com/SteveDeaceShow","SteveDeaceShow",,"I backed DeSantis in the primary because Trump showed no remorse/awareness for a COVID reckoning, I believed we desperately needed to win in 24 and DeSantis was the clear winner of the 22 midterms, and I thought we had to get serious on the Right about the kind of disciplined governing DeSantis had shown and make America Florida.

What Trump has done here the last few months is answered and satisfied all my objections. He ran a great and disciplined campaign down the stretch and won. He appointed the most renowned scamdemic skeptic, RFK Jr, to the top health policy post in the land. He continues to raid Florida for top posts in his administration. And he is efficiently assembling his government while unveiling a very specific policy vision. 

So, yes, I couldn’t be happier. For me, it’s about the name on the front of the jersey (‘Merica) not the back. I’m a big believer in the plaque on Reagan’s desk: “There is no limit to how much good you can do if you don’t care who gets the credit for it.” 

Therefore, if Trump and his team want to kick my arse in the primary and then turn right around and do the kind of stuff I was hoping for if my guy won anyway, then I thank them for paying back my vote in the general and praise Jesus for that!","Fri Nov 22 13:23:29 +0000 2024"
,,,,,,"false","true","https://pbs.twimg.com/profile_banners/1560341081576939524/1681050926","Thu Aug 18 19:01:35 +0000 2022","It’s always darkest just before the dawn. MARRIED.. No Dms.",,,,,,,,,,,,,,,,,,,,,,,,,,"0","36288","746351","1907","true","1560341081576939524","true","false","false","","9518","Insurrection Barbie","1847089954448724147","false","https://pbs.twimg.com/profile_images/1842740427872522240/X0Sggcwq_normal.jpg","","411299","https://twitter.com/DefiyantlyFree","user","https://x.com/DefiyantlyFree","DefiyantlyFree",,"Because Republicans never learn. Because Republicans don’t understand that the only reason they have the majority of anything is because of Donald Trump.

And because they’re going to continue down this path until they never win anything again.","Fri Nov 22 13:03:36 +0000 2024"
"https://pbs.twimg.com/profile_images/1750481240983994368/ijRW1a6Y_bigger.jpg","Mario Nawfal’s Roundtable","https://twitter.com/RoundtableSpace","DeepLink","Badge","BusinessLabel","true","true","https://pbs.twimg.com/profile_banners/1319287761048723458/1687204248","Thu Oct 22 14:42:25 +0000 2020","Host of the Largest Show on X | Unfiltered Unbiased 24x7 News | Founder & Investor",,,,,,,,,,,,,,,,,,,,,"roundtable.live","https://roundtable.live","0","23","https://t.co/Lru9VAixI8","0","139559","1806750","36996","true","1319287761048723458","true","false","false","","64386","Mario Nawfal","1854149705879392479","false","https://pbs.twimg.com/profile_images/1670905743619268609/pYItlWat_normal.jpg","","89380","https://twitter.com/MarioNawfal","user","https://x.com/MarioNawfal","MarioNawfal",,"🚨DANA WHITE: “I’M DONE WITH POLITICS” AFTER TRUMP WIN

UFC CEO Dana White says he’s finished with politics after helping Trump secure the presidency:

“I’m never f–king doing this again. I want nothing to do with this s–t. It’s gross. It’s disgusting. I want nothing to do with politics.”

White, who campaigned for his friend of 25 years, spoke at the Republican National Convention and helped Trump connect with young male voters.

Source: NY Post","Fri Nov 22 12:30:31 +0000 2024"
,,,,,,"true","false","https://pbs.twimg.com/profile_banners/878219545785372673/1561981385","Fri Jun 23 11:53:51 +0000 2017","Vaxxed Matrix Agent
Smug prick
Gay GCR
Paid @_WOO_X shill",,,,,,,,,,,,,,,,,,,,,"youtube.com/c/TechnicalRou…","https://youtube.com/c/TechnicalRoundup","0","23","https://t.co/QIpNwNYcjL","0","29830","620987","482","true","878219545785372673","true","false","false","Pond","5254","DonAlt",,"false","https://pbs.twimg.com/profile_images/1805463878471417857/hXKyF93b_normal.png","","34716","https://twitter.com/CryptoDonAlt","user","https://x.com/CryptoDonAlt","CryptoDonAlt",,"My XRP bet is essentially a bet on Trump being influenced by the worst crypto has to offer

I think they'll be able to sway him because at a surface level they're successful, professional and rich

Can't believe my negative European thinking is actually making me win","Fri Nov 22 12:16:42 +0000 2024"
