"author/canDm","author/canMediaTag","author/coverPicture","author/createdAt","author/description","author/entities/description/urls/0/display_url","author/entities/description/urls/0/expanded_url","author/entities/description/urls/0/indices/0","author/entities/description/urls/0/indices/1","author/entities/description/urls/0/url","author/entities/url/urls/0/display_url","author/entities/url/urls/0/expanded_url","author/entities/url/urls/0/indices/0","author/entities/url/urls/0/indices/1","author/entities/url/urls/0/url","author/fastFollowersCount","author/favouritesCount","author/followers","author/following","author/hasCustomTimelines","author/id","author/isBlueVerified","author/isTranslator","author/isVerified","author/location","author/mediaCount","author/name","author/pinnedTweetIds/0","author/possiblySensitive","author/profilePicture","author/status","author/statusesCount","author/twitterUrl","author/type","author/url","author/userName","author/verifiedType","text","createdAt"
"false","true","https://pbs.twimg.com/profile_banners/28453911/1612107934","Fri Apr 03 00:03:19 +0000 2009","Entrepreneur @❤ who loves tech, social media, leadership, Advocacy, puppies, family, friends, good people, kindness & honesty",,,,,,,,,,,"0","60440","1284","4896","true","28453911","true","false","false","NE","2599","somedaygirl","1813378401509486741","false","https://pbs.twimg.com/profile_images/1355905064968343556/4wFjUQro_normal.jpg","","157908","https://twitter.com/somedaygirl","user","https://x.com/somedaygirl","somedaygirl",,"@JessieJaneDuff @RealJamesWoods #OMG #WOW #HOLYSHIT #WTF THIS IS #BS WHOSE THE ONE MEDDLING IN AN ELECTION???!! #SUETHEM #MAGA","Sat Sep 29 23:19:26 +0000 2018"
"false","false","https://pbs.twimg.com/profile_banners/15910793/1508818232","Tue Aug 19 22:56:21 +0000 2008","CGTN Washington DC. China-US Foreign Policy+White House my beats. Opinions are my own, retweets not an endorsement-more of a discussion really.",,,,,,,,,,,"0","50650","11981","7066","true","15910793","false","false","false","Washington D.C. ","2770","nathanking",,"false","https://pbs.twimg.com/profile_images/1527978550141145090/6BYuYbzz_normal.jpg","","143651","https://twitter.com/nathanking","user","https://x.com/nathanking","nathanking",,"Very funny joke this week .... Chinese election meddling is like Russian election meddling -just more efficient and half the price !  https://t.co/bw9MAY8PYP","Sat Sep 29 23:04:07 +0000 2018"
"false","true","https://pbs.twimg.com/profile_banners/737098052998037506/1464576425","Mon May 30 01:47:25 +0000 2016","My name is Mark Chestnut my goal is to simplify Real Estate Process. - https://t.co/6NA0lAlCm6","happybuyersclickhere.com","http://happybuyersclickhere.com","71","94","https://t.co/6NA0lAlCm6","smartinvestorsclickhere.com","http://www.smartinvestorsclickhere.com","0","23","https://t.co/hINWNXxvvD","0","2961","287","247","false","737098052998037506","false","false","false","Jacksonville Florida","20061","Nuview Realty Inc",,"false","https://pbs.twimg.com/profile_images/737098746350178304/Tq9HzyVY_normal.jpg","","60456","https://twitter.com/amazing_nuview","user","https://x.com/amazing_nuview","amazing_nuview",,"JW filed a FOIA lawsuit w/ the State Dept for info on any improper unmasking efforts and on all of the intelligence leaking efforts connected to Obama U.N. Ambassador Samantha Power's involvement with the probes into Russia's meddling in 2016's election. https://t.co/P1mloM8ifS","Sat Sep 29 22:57:00 +0000 2018"
"false","true","https://pbs.twimg.com/profile_banners/16647814/1535573344","Wed Oct 08 12:20:04 +0000 2008","Project and change communications at Jacobs Engineering Group / @JacobsConnects | Tweets are my own",,,,,,"linkedin.com/in/catherineon…","https://www.linkedin.com/in/catherineonline","0","23","https://t.co/ndUohrP3kx","0","3781","1633","1338","false","16647814","false","false","false","Dallas, TX","879","Catherine Mitchell, CCMP","850453192756350978","false","https://pbs.twimg.com/profile_images/957311716462751744/x97LohKY_normal.jpg","","6319","https://twitter.com/catherineonline","user","https://x.com/catherineonline","catherineonline",,"Cyber Saturday—Facebook Hack, Spotify Data Prying, China Election Meddling https://t.co/OEllRrL5Se","Sat Sep 29 22:44:41 +0000 2018"
"false","true",,"Mon May 07 19:57:08 +0000 2012","",,,,,,,,,,,"0","0","87","6","false","573920657","false","false","false","Every where all the time!","14","Bob Jones",,"false","https://pbs.twimg.com/profile_images/2199656129/images-temp_normal.jpg","","89927","https://twitter.com/BobJone43773862","user","https://x.com/BobJone43773862","BobJone43773862",,"Lavrov notes Trump blamed China, not Russia, for U.S. election meddling https://t.co/o8cOEjTqVs","Sat Sep 29 22:34:04 +0000 2018"
"false","true","https://pbs.twimg.com/profile_banners/1475316656/1460165687","Sat Jun 01 17:53:56 +0000 2013","",,,,,,,,,,,"0","4946","117","569","true","1475316656","false","false","false","California, USA","5055","T.Sherman","1352445945036738562","false","https://pbs.twimg.com/profile_images/378800000807218949/f6e262433801a6a3f63983652320a059_normal.jpeg","","20928","https://twitter.com/TimothySBranch","user","https://x.com/TimothySBranch","TimothySBranch",,"Lavrov notes Trump blamed China, not Russia, for U.S. election meddling https://t.co/y3AWbEAmys via @YahooNews Cover up America Knows","Sat Sep 29 22:28:54 +0000 2018"
"false","true","https://pbs.twimg.com/profile_banners/2484736416/1730882280","Fri May 09 00:57:22 +0000 2014","Choose to be Informed; Do Not Trust Mainstream Media
 #MSM is the problem; Presstitutes 
 We The People are United.
11/08/2016 and 11-5-2024 #MAGA",,,,,,,,,,,"0","18590","784","1187","true","2484736416","false","false","false","TX,NJ,GA","1451","Eddie❤🇺🇸 W","840756142439579648","false","https://pbs.twimg.com/profile_images/1551889739032236032/CQpm2XW__normal.jpg","","38990","https://twitter.com/gpobre2","user","https://x.com/gpobre2","gpobre2",,"Fake woman, fake investigation, like the fake Russian Election meddling. 
The #Dumbocrats r winning and the #Republicans r allowing it. 
#GOP","Sat Sep 29 22:18:06 +0000 2018"
"true","true","https://pbs.twimg.com/profile_banners/62128121/1457728324","Sat Aug 01 22:00:17 +0000 2009","#houstonRealtor,#Houstonrealestate, #katyrealestate,#HAR,#realestate,#houstonhomes,#sellers,#buyers,#jairorealtor4u. call me now 2816588263",,,,,,,,,,,"0","186","1927","965","true","62128121","false","false","false","Houston,TX","342399","Jairo Rodriguez",,"false","https://pbs.twimg.com/profile_images/699053602430590977/qkq4M2C2_normal.jpg","","691565","https://twitter.com/RealtorJairo","user","https://x.com/RealtorJairo","RealtorJairo",,"Lavrov notes Trump blamed China, not Russia, for U.S. election meddling https://t.co/LxdkOUQEkV","Sat Sep 29 22:09:08 +0000 2018"
"true","true","https://pbs.twimg.com/profile_banners/62128121/1457728324","Sat Aug 01 22:00:17 +0000 2009","#houstonRealtor,#Houstonrealestate, #katyrealestate,#HAR,#realestate,#houstonhomes,#sellers,#buyers,#jairorealtor4u. call me now 2816588263",,,,,,,,,,,"0","186","1927","965","true","62128121","false","false","false","Houston,TX","342399","Jairo Rodriguez",,"false","https://pbs.twimg.com/profile_images/699053602430590977/qkq4M2C2_normal.jpg","","691565","https://twitter.com/RealtorJairo","user","https://x.com/RealtorJairo","RealtorJairo",,"Lavrov notes Trump blamed China, not Russia, for U.S. election meddling https://t.co/0Qk5GR2K8d https://t.co/HisgzGQDdk","Sat Sep 29 22:08:06 +0000 2018"
"false","true",,"Wed Mar 14 10:52:18 +0000 2012","",,,,,,,,,,,"0","0","12","46","false","524240476","false","false","false","","30","jose652524",,"false","https://pbs.twimg.com/profile_images/1999228728/T1J5B1XgljXXak_h7W_023716_normal.jpg","","22501","https://twitter.com/jose652524","user","https://x.com/jose652524","jose652524",,"Lavrov notes Trump blamed China, not Russia, for U.S. election meddling

Russian Foreign Minister Sergei Lavrov took pleasure in pointing out on Friday that U.S. President Donald Trump this week accused China, not Russia, of interfering in U.S. elections. Trump on Wednesday …","Sat Sep 29 22:06:10 +0000 2018"
"false","true","https://pbs.twimg.com/profile_banners/724665080923717632/1473772815","Mon Apr 25 18:23:13 +0000 2016","Business of Turkey",,,,,,"businessofturkey.com","http://businessofturkey.com","0","23","https://t.co/nxEloh0KbG","0","9549","164","641","true","724665080923717632","false","false","false","Turkey","83328","Business of Turkey",,"false","https://pbs.twimg.com/profile_images/775685045138907136/4SGFcVYk_normal.jpg","","90104","https://twitter.com/B2Turkey","user","https://x.com/B2Turkey","B2Turkey",,"Trump says 'plenty of evidence' of Chinese meddling in U.S. election https://t.co/H7nc1WrEeJ https://t.co/mOsq4nh1kR","Sat Sep 29 22:05:52 +0000 2018"
"false","true",,"Fri Apr 06 15:56:54 +0000 2012","Internet privacy involves the right or mandate of personal privacy concerning the storing, providing to third-parties, & displaying of info about oneself online",,,,,,"facebook.com/socialhax","http://www.facebook.com/socialhax","0","22","http://t.co/mw8bpoNC7i","0","37","301","121","false","546910610","false","false","false","","1","Save Privacy",,"false","https://pbs.twimg.com/profile_images/2681490212/a6aa4a5bbb962acf8dcc353da0a6942b_normal.jpeg","","73640","https://twitter.com/SavePrivacyNow","user","https://x.com/SavePrivacyNow","SavePrivacyNow",,"Cyber Saturday—Facebook Hack, Spotify Data Prying, China Election Meddling - Fortune https://t.co/GxtFfvKtVD","Sat Sep 29 21:59:16 +0000 2018"
"false","true",,"Wed Dec 21 00:58:37 +0000 2011","To Err is human, to forgive is not a Company policy.",,,,,,,,,,,"0","281","300","299","true","442335746","false","false","false","","17","Socimotion","743108016090779648","false","https://pbs.twimg.com/profile_images/2545531323/4sau1xihq0mldg1ms5iw_normal.png","","65567","https://twitter.com/Socimotion","user","https://x.com/Socimotion","Socimotion",,"Cyber Saturday—Facebook Hack, Spotify Data Prying, China Election Meddling - Fortune https://t.co/Vcfz8nd1fZ","Sat Sep 29 21:56:16 +0000 2018"
"false","false","https://pbs.twimg.com/profile_banners/429580982/1674669801","Tue Dec 06 04:14:04 +0000 2011","Try to keep up! BREAKING & up to the minute #news, #cybersecurity tips and #technology best practices. Visit website for more. 
#cyber #infosec #humanfirewall",,,,,,"secguro.com","http://secguro.com","0","23","https://t.co/L9UejyOv0z","0","254","19712","1758","false","429580982","true","false","false","255.255.255.255","452","𝗛𝘂𝗺𝗮𝗻 𝗙𝗶𝗿𝗲𝘄𝗮𝗹𝗹",,"false","https://pbs.twimg.com/profile_images/1717661997737623552/rlWAoVG8_normal.jpg","","294769","https://twitter.com/secguro","user","https://x.com/secguro","secguro",,"#cyber Saturday-Facebook #hack, Spotify Data Prying, China Election Meddling https://t.co/CJKSryEr3Y","Sat Sep 29 21:47:29 +0000 2018"
"true","true","https://pbs.twimg.com/profile_banners/786681999213953025/1693576384","Thu Oct 13 21:36:19 +0000 2016","",,,,,,,,,,,"0","584","24","146","false","786681999213953025","false","false","false","","91","Darnell Horton",,"false","https://pbs.twimg.com/profile_images/1040579219795992576/85Gfax5v_normal.jpg","","3708","https://twitter.com/DarnellHortonSr","user","https://x.com/DarnellHortonSr","DarnellHortonSr",,"@realDonaldTrump Donald J Trump must talk about his alleged fraudulent business practices, tax evasion and money laundering.

Possible collusion with Russia to steal the 2016 election.

Obstruction of justice, attempting to stop Russia meddling investigation.

Sexual assault admission on tape.","Sat Sep 29 21:40:09 +0000 2018"
"false","true","https://pbs.twimg.com/profile_banners/109610849/1396998426","Fri Jan 29 17:07:19 +0000 2010","Proud father, journalist, webpreneur @gourmethaus, PhD @LSEalumni",,,,,,,,,,,"0","341","7442","4536","false","109610849","false","false","false","Global citizen based in Mexico","126","Uzzi Ohana",,"false","https://pbs.twimg.com/profile_images/453670578222665729/w0rNOqXD_normal.png","","435944","https://twitter.com/uohanalilly","user","https://x.com/uohanalilly","uohanalilly",,"Cyber Saturday—Facebook Hack, Spotify Data Prying, China Election Meddling https://t.co/u8nxXwpjmy","Sat Sep 29 21:37:27 +0000 2018"
"false","true","https://pbs.twimg.com/profile_banners/751412985608962048/1728691029","Fri Jul 08 13:49:51 +0000 2016","Married southern goth, devoted to  my two little creatures of the night, but still shrouded in mystery and darkness.",,,,,,,,,,,"0","16624","479","642","false","751412985608962048","false","false","false","Loudon, TN","278","Brittany",,"false","https://pbs.twimg.com/profile_images/1100922071675211777/FE_Jmavf_normal.jpg","","6424","https://twitter.com/MetriaRussell","user","https://x.com/MetriaRussell","MetriaRussell",,"@realDonaldTrump please tell us what you were going to do to stop the big Tech Giants and the Democrats from meddling in the 2018 election? Which they already are!","Sat Sep 29 21:34:14 +0000 2018"
"false","true","https://pbs.twimg.com/profile_banners/788203416811995136/1477727299","Tue Oct 18 02:21:53 +0000 2016","We Dare Not Forget That We Are Heirs Of The Revolution. #wikileaks #NeverHillary #TheUP #UnitedPatriots UrbanPatriot@USA.com",,,,,,"facebook.com/The-Urban-Patr…","https://www.facebook.com/The-Urban-Patriot-1760166780890892/","0","23","https://t.co/87NuSQkEbx","0","142","299","413","false","788203416811995136","false","false","false","United States","7015","The Urban Patriot","792370768990597120","false","https://pbs.twimg.com/profile_images/792271797244694528/MriOnbhM_normal.jpg","","52148","https://twitter.com/TheUrbanPatriot","user","https://x.com/TheUrbanPatriot","TheUrbanPatriot",,"JW filed its FOIA lawsuit w/ the State Dept for info on any improper unmasking efforts &amp; on all of the intelligence leaking efforts connected to Obama U.N. Ambassador Samantha Power's involvement with the probes into Russia's meddling in 2016's election. https://t.co/6If0MRzqxn","Sat Sep 29 21:01:53 +0000 2018"
"false","true","https://pbs.twimg.com/profile_banners/51562658/1635686977","Sat Jun 27 21:33:22 +0000 2009","Founder @TraceFireSecure▪️EVP #CyberSecurity @InferSight▪️Former @RealNCIS #Agent @Worldpay_Global @RSASecurity▪️On 📺 w/ #news on #Hacking #CyberCrime-24/7",,,,,,"petertran.com","http://www.petertran.com","0","23","https://t.co/iCMCNUF3Jw","0","14511","3993","2229","false","51562658","true","false","false","On-Air/In the Cloud","9019","Peter Tran","1856012746371793401","false","https://pbs.twimg.com/profile_images/1783496850995105794/pMu_D5kv_normal.jpg","","18753","https://twitter.com/ptrancyber","user","https://x.com/ptrancyber","ptrancyber",,"Cyber Saturday: #Facebook hack, #Spotify data prying, China election meddling https://t.co/dsAQnJ17AP via @FortuneMagazine #databreach https://t.co/sVangd0j57","Sat Sep 29 21:00:14 +0000 2018"
"false","true","https://pbs.twimg.com/profile_banners/18247062/1696268589","Fri Dec 19 18:04:57 +0000 2008","A conservative non-partisan educational foundation promoting transparency, accountability, & integrity in government. Follow us on FB & Instagram: judicialwatch",,,,,,"jwatch.us/prmMwg","http://jwatch.us/prmMwg","0","23","https://t.co/5jmPRuECas","0","1430","2194645","1720","false","18247062","true","false","false","Washington, DC","29257","Judicial Watch ⚖️","1861153111055691880","false","https://pbs.twimg.com/profile_images/1564371419307409408/8nktWC02_normal.jpg","","105760","https://twitter.com/JudicialWatch","user","https://x.com/JudicialWatch","JudicialWatch","Business","JW filed its FOIA lawsuit w/ the State Dept for info on any improper unmasking efforts &amp; on all of the intelligence leaking efforts connected to Obama U.N. Ambassador Samantha Power's involvement with the probes into Russia's meddling in 2016's election. https://t.co/Z2NqyyRtLQ","Sat Sep 29 21:00:00 +0000 2018"
"false","true",,"Wed Oct 18 01:04:53 +0000 2017","The NRA enables gun violence for the sake of gun industry profit & American lives are being lost every day. It's time to fight back (peacefully). #FuckTheNRA",,,,,,,,,,,"0","77851","12089","4969","true","920455609056559105","false","false","false","","893","F*ck the NRA","1757926074565231103","false","https://pbs.twimg.com/profile_images/1212244206715994113/0ct0iE3F_normal.jpg","","15125","https://twitter.com/FuckThe_NRA","user","https://x.com/FuckThe_NRA","FuckThe_NRA",,"So Trump is now obstructing an FBI investigation (#Kavanaugh), while he's already being investigated for obstruction of justice in another investigation (Russia)? 

Oh what a tangled web of shit he weaves. https://t.co/oNDQYTa6F9","Sat Sep 29 23:56:39 +0000 2018"
"false","false","https://pbs.twimg.com/profile_banners/811335668433489920/1624921250","Tue Dec 20 22:21:12 +0000 2016","🌊💙 If you are not willing to learn, no one can help you. If you are determined to learn, no one can stop you. 💙🌊",,,,,,,,,,,"0","207260","3689","3660","true","811335668433489920","false","false","false","United States","3135","DD","1747984949742096758","false","https://pbs.twimg.com/profile_images/858481839333232640/-Ad-qnWd_normal.jpg","","144885","https://twitter.com/votebluein24","user","https://x.com/votebluein24","votebluein24",,"@MichaelAvenatti tRump alone thinks he can fix everything. Make No Mistake tRump needs this appointment to keep us from ever hearing the truth about Russia and his appointment to the White House. 
FBI investigation is a sham. Rules from the same guy that paid hush money to hide his dirty secrets.","Sat Sep 29 23:48:06 +0000 2018"
"false","true",,"Fri Nov 21 19:47:19 +0000 2014","I am a wife mother &grandmother to five beautiful grandchildren. I am a Democrat No for Trump. I fight for human rights for everyone no matter who. NO DM",,,,,,,,,,,"0","120892","9752","10767","true","2887224675","false","false","false","","6441","Susan Butterfly",,"false","https://pbs.twimg.com/profile_images/547474036549099520/CmOA5iIr_normal.jpeg","","212279","https://twitter.com/susanbutterfly2","user","https://x.com/susanbutterfly2","susanbutterfly2",,"Can you say Trump is interfering with a investigation just like he is doing in Russia investigation that he call a witch hunt. This proves he is one dirty bastard. He will stop at nothing to stop a investigation of wrong doing pertains to him.","Sat Sep 29 23:45:46 +0000 2018"
"false","false","https://pbs.twimg.com/profile_banners/22301571/1486743233","Sat Feb 28 22:13:40 +0000 2009","Science, education, and truth advance society.  Hate, bigotry, greed, and ignorance destroy society.",,,,,,,,,,,"0","9082","998","1552","true","22301571","false","false","false","USA","309","Lise",,"false","https://pbs.twimg.com/profile_images/991835639774621696/JZ5I0EVn_normal.jpg","","9722","https://twitter.com/LiveFree2018","user","https://x.com/LiveFree2018","LiveFree2018",,"@FBI Kavanaugh Investigation:

Kavanaugh raged about the damage to HIS good name.  He did'nt consider Renate's reputation when he and his friends wrote about her in their yearbooks.

If you want to indict &amp; jail all those involved with Russia, he'll expand Trump's pardon powers.","Sat Sep 29 23:45:14 +0000 2018"
"true","true","https://pbs.twimg.com/profile_banners/2423537112/1607479459","Wed Apr 02 09:46:51 +0000 2014","PhD in economics. Former visiting professor at IMI Kyiv. Ukrainian Politics, Economics, and History",,,,,,,,,,,"0","39711","1456","490","true","2423537112","false","false","false","","2381","Michael","1823143074740244501","false","https://pbs.twimg.com/profile_images/1677336104146554881/7EUxDhVB_normal.jpg","","64348","https://twitter.com/MykhailoXPIH","user","https://x.com/MykhailoXPIH","MykhailoXPIH",,"@MichaelAvenatti #Trump, whose Mafia connections barred him from owning a casino in #Australia, who has multiple sexual misconduct allegations, will not release his tax returns &amp; has obstructed justice re the #Russia investigation, is dragging the #US down to the level of other corrupt nations.","Sat Sep 29 23:45:12 +0000 2018"
"false","false","https://pbs.twimg.com/profile_banners/998281856/1523515105","Sun Dec 09 00:32:44 +0000 2012","Keeper of the zoo, my wards are all loved equally. A very woke, angry and profane American grandma. #TheResistance #VoteOutGOP #VoteBlue 🆘️ #BLM",,,,,,,,,,,"0","118402","3084","3845","true","998281856","false","false","false","Where the wild things are","343","ZookeeperJones 😷","1618613906444013569","false","https://pbs.twimg.com/profile_images/3071682767/487d0f145fd935f71bbe7e7f8083b80a_normal.jpeg","","115881","https://twitter.com/ZookeeperJones","user","https://x.com/ZookeeperJones","ZookeeperJones",,"@SDISBEAUTIFUL1 @Gloria4Educ @4everNeverTrump That is correct. They have their policies rules for investigation and the law requires them to follow where ever the facts lead them. It's why trump bucks his own russia/trump investigation so much. They follow the leads to the end good or bad.","Sat Sep 29 23:19:45 +0000 2018"
"false","true","https://pbs.twimg.com/profile_banners/922837557603336192/1519677024","Tue Oct 24 14:49:54 +0000 2017","Biblical Conservative with same lady since 1975. Takes care of my vaccine injured special needs Girl. Loves outdoors, Followed by Rita Cosby. 50 yrs at Guitar.",,,,,,,,,,,"0","24344","1567","2038","false","922837557603336192","false","false","false","","5417","david",,"false","https://pbs.twimg.com/profile_images/968550803630936064/jxCUvPpp_normal.jpg","","53298","https://twitter.com/hanktheyank58","user","https://x.com/hanktheyank58","hanktheyank58",,"Trump said ok to short FBI investigation. Hopefully there is a huge  team of investigators on it right now to expose the crooked criminal left again as the Russia Russia probe did.","Sat Sep 29 23:05:36 +0000 2018"
"false","true","https://pbs.twimg.com/profile_banners/182425068/1629986628","Tue Aug 24 15:29:08 +0000 2010","Account shuttered until it stops being Hatred Central. If you need me either DM or find me at @thekitastrophe.bsky.social",,,,,,"kityonaedits.com","http://kityonaedits.com/","0","23","https://t.co/dfKwvth65z","0","46727","545","1076","true","182425068","false","false","false","","1511","Kit Y Says That Elon is a Clown","1598883486072328192","false","https://pbs.twimg.com/profile_images/1485075284873383937/kmn9Syip_normal.jpg","","76245","https://twitter.com/TheKitastrophe","user","https://x.com/TheKitastrophe","TheKitastrophe",,"Look, it's some obstruction that's not tied to the Russia investigation. Good to see that Trump is branching out.","Sat Sep 29 23:02:21 +0000 2018"
"false","true","https://pbs.twimg.com/profile_banners/24382901/1610849180","Sat Mar 14 15:30:55 +0000 2009","#Resistance #Roe",,,,,,,,,,,"0","308946","1900","4885","true","24382901","false","false","false","","2945","Roe, Roe, Roe your Vote",,"false","https://pbs.twimg.com/profile_images/1548665636645126145/9pdQSaJW_normal.jpg","","161748","https://twitter.com/sarah_siskin","user","https://x.com/sarah_siskin","sarah_siskin",,"@FoxNews @kayleighmcenany @FoxNewsOpinion U know what is politics? Gamble v US, the reason trump wants Kavanaugh on the court in the first place. U know what else is politics? Cutting a deal w Kennedy so he could keep his son from the Russia investigation if he would retire...","Sat Sep 29 22:57:38 +0000 2018"
"false","false","https://pbs.twimg.com/profile_banners/773570120132202497/1629425549","Wed Sep 07 17:14:23 +0000 2016","Proud #PublicSchool Teacher/History/Govt/RETIRED
NO LISTS! NO DMs! ALL BLOCKED! 
Accounts that only RT=BLOCKED.
All followers vetted. 
#1u #HillaryWasRight",,,,,,,,,,,"0","71395","2436","2415","true","773570120132202497","false","false","false","","4486","RA #UniteAgainstFascism","793587688364470272","false","https://pbs.twimg.com/profile_images/1466114843782565892/8MkUOLRd_normal.jpg","","142993","https://twitter.com/rosieogrady53","user","https://x.com/rosieogrady53","rosieogrady53",,"@maddow Avenatti &amp; trump can handle their own stuff. Our job is to recognize this as a blatant attempt to give the masses enuf to soothe them while this govt becomes more authoritarian. We are in big trouble. 

What the hell is Mueller doing? If Kavanaugh wins-Russia investigation STOPS.","Sat Sep 29 22:53:38 +0000 2018"
"false","false","https://pbs.twimg.com/profile_banners/433697321/1730953367","Sat Dec 10 22:17:15 +0000 2011","#Memes #Gaming #Photography #Art #Writing #SciFi #Fantasy #Horror I’d rather not. https://t.co/bWkW3emXJe","bsky.app/profile/postap…","https://bsky.app/profile/postapocalypse.bsky.social","82","105","https://t.co/bWkW3emXJe","postapocalypse.bsky.social","http://postapocalypse.bsky.social","0","23","https://t.co/GMDu0xUK8R","0","307869","20744","21576","true","433697321","false","false","false","Lexington, KY","22836","🦸🏽‍♂️ Thomas 🖤",,"false","https://pbs.twimg.com/profile_images/1856125525195997184/iB8LzQmw_normal.jpg","","219925","https://twitter.com/ResistMonsters","user","https://x.com/ResistMonsters","ResistMonsters",,"#Kavanaugh 
#Trump

Anyone afraid for Democracy should immediately begin putting pressure on your elected representatives.

If Donald Trump can order the FBI to investigate select crimes and to ignore other crimes for political reasons, he can do so for the Russia investigation.","Sat Sep 29 22:45:37 +0000 2018"
