"true","true","https://pbs.twimg.com/profile_banners/1019273767225212928/1536190490","Tue Jul 17 17:32:58 +0000 2018","#VoteRed",,,,,,,,,,,,,,,,,,,,,,,,,,"0","9137","2106","633","false","1019273767225212928","false","false","false","","1446","Rose","1056243803722579968","false","https://pbs.twimg.com/profile_images/1055999358209060864/toxoz_04_normal.jpg","","10827","https://twitter.com/StopMediaHate","user","https://x.com/StopMediaHate","StopMediaHate",,"@RiflemanPartTwo @DanCovfefe1 @TomFitton @Twitter @realDonaldTrump what they're doing, is worse than anything a Russian could do. This is rigging, this is meddling, this is election interference.","Sat Aug 04 22:43:33 +0000 2018"
"false","true",,"Sat Apr 08 14:09:09 +0000 2017","",,,,,,,,,,,,,,,,,,,,,,,,,,"0","51793","1132","4689","false","850712117573537793","false","false","false","","44406","Cheryl Amber Dotson",,"false","https://abs.twimg.com/sticky/default_profile_images/default_profile_normal.png","","336609","https://twitter.com/GODZILLASLAYS65","user","https://x.com/GODZILLASLAYS65","GODZILLASLAYS65",,"Putin Compares Yevgeny Prigozhin, Accused of U.S. Election Meddling, to George Soros https://t.co/ExX8idkG6d","Sat Aug 04 22:40:29 +0000 2018"
"false","false","https://pbs.twimg.com/profile_banners/834297172170465280/1641746842","Wed Feb 22 07:02:01 +0000 2017","Married gay male!Trump=Treason!GOP’s a Cult! NRA kills kids, ruins families! Dem Gen-Xer!🚫list,🚫Porn,🚫Trump! He Ruined🇺🇸!Protect 🇺🇦,🖕Putin! #ADHD",,,,,,,,,,,,,,,,,,,,,,,,,,"0","13798","1489","1616","true","834297172170465280","false","false","false","Austin, TX - Killeen sometimes","1639","Texas Bear","947869743087865857","false","https://pbs.twimg.com/profile_images/1480225181616545799/Q9LN3DtO_normal.jpg","","23320","https://twitter.com/2Texasbears","user","https://x.com/2Texasbears","2Texasbears",,"@BlogChurchWork @skyred1970 @hollymwchris @WinansMeg @ConnieMessina That’s what’s insane about this! He has always been a Con Artist &amp; serial sexual assaulter! Went to 🇷🇺 in 2013,spent the night. Knew they where involved in meddling in the election. This has been planned longer than most think! Asked 🇷🇺 to hack HRC on TV! They did! Guilty!","Sat Aug 04 22:38:36 +0000 2018"
"false","true",,"Sat Nov 11 23:39:19 +0000 2017","",,,,,,,,,,,,,,,,,,,,,,,,,,"0","674","5","36","false","929493774983684096","false","false","false","","1","@brucesampson13",,"false","https://abs.twimg.com/sticky/default_profile_images/default_profile_normal.png","","444","https://twitter.com/vonnegut314","user","https://x.com/vonnegut314","vonnegut314",,"@Kevin17146844 @KarlTowns @Rachel__Nichols Tell us about the time tRump brought sides together.  Tell me when he went high instead of going low.  He wants peace with Russia while he defends their meddling in our election.  He wants war with American Democrats","Sat Aug 04 22:35:20 +0000 2018"
"true","true","https://pbs.twimg.com/profile_banners/1019273767225212928/1536190490","Tue Jul 17 17:32:58 +0000 2018","#VoteRed",,,,,,,,,,,,,,,,,,,,,,,,,,"0","9137","2106","633","false","1019273767225212928","false","false","false","","1446","Rose","1056243803722579968","false","https://pbs.twimg.com/profile_images/1055999358209060864/toxoz_04_normal.jpg","","10827","https://twitter.com/StopMediaHate","user","https://x.com/StopMediaHate","StopMediaHate",,"@djcip @PaulConservativ he's worse than any russian. He's meddling in our election and working to rig it. make no mistake about it","Sat Aug 04 22:34:17 +0000 2018"
"true","true","https://pbs.twimg.com/profile_banners/202864920/1494726064","Fri Oct 15 00:24:48 +0000 2010","Zen-oriented laid-back guy. Unabashed capitalist. Former flying student. Middle East watcher. Disciple of Snake Plissken. Miami Beach. Namaste.",,,,,,,,,,,,,,,,,,,,,,,,,,"0","36577","887","162","true","202864920","false","false","false","Washington DC","181","The Prisoner",,"false","https://pbs.twimg.com/profile_images/667490883189755904/qaXulR1E_normal.jpg","","34727","https://twitter.com/6number6","user","https://x.com/6number6","6number6",,"#Mueller #Manafort trial shows that Mueller investigation has become a circus with no relationship at all to Russian meddling in the 2016 election.","Sat Aug 04 22:30:08 +0000 2018"
"false","true","https://pbs.twimg.com/profile_banners/1398747840/1404257479","Fri May 03 03:46:03 +0000 2013","#Hope USA defend #Democracy🇺🇸⚕#USConstitution ""by any(#GoodOverEvil=#VoteBlue)means necessary""~#MalcolmX #HumanTrafficking awareness I victim #Stalked25Years",,,,,,,,,,,,,,,,,,,,,"youtube.com/watch?v=_LUdPa…","https://www.youtube.com/watch?v=_LUdPaFRB60&list=RD_LUdPaFRB60#t=7","0","23","https://t.co/wZcwhpmn28","0","4396","596","445","true","1398747840","false","false","false","#StGeorge~#StatenIsland~#NYC","5400","Mx. Joe-Anthony Sierra #GetVaccinated","1846242014389514304","false","https://pbs.twimg.com/profile_images/1441154122325970950/aJKX3HKB_normal.jpg","","109696","https://twitter.com/Joeanthony_nyc","user","https://x.com/Joeanthony_nyc","Joeanthony_nyc",,"#Hope #USA #MidtermsBeforeSCOTUS #MitchMcConnellRule moreover wadr #SCOTUSAfterSpecialCounselRussiaProbe #JustAndFair #WhiteHouse #NationalSecurity announces #Russia still #Election #Midterms2018 meddling &amp; #POTUS minimizes the national threat. https://t.co/h0pqUTYdGy","Sat Aug 04 22:19:20 +0000 2018"
"false","false","https://pbs.twimg.com/profile_banners/761259480164274176/1708632540","Thu Aug 04 17:56:18 +0000 2016","#MAGA being used. Steve Bannon: “This will be the LAST ELECTION EVER” & “Trump will NEVER need another VOTER AGAIN” https://t.co/kAstwk6756","youtube.com/watch?v=OxNoUn…","https://www.youtube.com/watch?v=OxNoUnxN_cs","116","139","https://t.co/kAstwk6756",,,,,,,,,,,,,,,,,,,,,"0","127233","6185","5856","true","761259480164274176","false","false","false","NewRussia","8432","dani graham","1223203819452076033","false","https://pbs.twimg.com/profile_images/1760758539742576640/Lc15KPoe_normal.jpg","","95946","https://twitter.com/DaniGramFLA","user","https://x.com/DaniGramFLA","DaniGramFLA",,"Trump keeps telling his cult it's great to get along w/ Putin...what they don't get is Trump meet with Putin 1 on 1 during investigation &amp; ongoing PROVEN interference is NOT A ""GOOD THING""...the fact congress even allowed 1 on 1 confirms for me Russia $$ to NRA; NRA $ to Congress","Sat Aug 04 23:58:17 +0000 2018"
"false","true","https://pbs.twimg.com/profile_banners/424759254/1566784077","Wed Nov 30 04:24:34 +0000 2011","Cat Dad. Software Engineer. Political junkie. Perspective is everything.",,,,,,,,,,,,,,,,,,,,,,,,,,"0","112533","661","75","true","424759254","false","false","false","Minnesota, USA","1861","Bryan",,"false","https://pbs.twimg.com/profile_images/1296595107060187136/877j1B-j_normal.jpg","","73246","https://twitter.com/NotAChaunce","user","https://x.com/NotAChaunce","NotAChaunce",,"@realDonaldTrump Off to feed my followers. Lies tonight will include:
- US Steel opening 7(or 6) new plants
- Russia’s sad that Trump won
- Biggest tax cut in history
- North Korea no longer a nuclear threat
- Mueller investigation a hoax
and of course the crowd will be the biggest ever assembled","Sat Aug 04 23:54:44 +0000 2018"
"false","false","https://pbs.twimg.com/profile_banners/13850422/1692614972","Sat Feb 23 03:12:49 +0000 2008","Political news, campaign stories and Washington coverage from CNN Politics.",,,,,,,,,,,,,,,,,,,,,"cnn.com/politics","http://cnn.com/politics","0","23","https://t.co/F5tsftvQpR","0","4","4566852","327","true","13850422","true","false","false","Washington, DC","153718","CNN Politics",,"false","https://pbs.twimg.com/profile_images/1693576055737487360/7rbADPvJ_normal.jpg","","222639","https://twitter.com/CNNPolitics","user","https://x.com/CNNPolitics","CNNPolitics","Business","President Donald Trump is concerned about whether his son Donald Trump Jr. might have exposure in the special counsel's Russia investigation https://t.co/1BqH6qO6hj https://t.co/fWJnP9Akh1","Sat Aug 04 23:53:25 +0000 2018"
"false","false","https://pbs.twimg.com/profile_banners/260537575/1507209225","Fri Mar 04 02:19:19 +0000 2011","Calabi-Yau spaces, six-dimensional object represented here in two-dimensions,",,,,,,,,,,,,,,,,,,,,,,,,,,"0","14730","268","457","true","260537575","false","false","false","","1753","Mary Grace","691413479199100928","false","https://pbs.twimg.com/profile_images/1107475622530412544/yyZc_pab_normal.jpg","","43327","https://twitter.com/marygrace0503","user","https://x.com/marygrace0503","marygrace0503",,"Trump called on Attorney General Sessions to end the special counsel’s inquiry into Russia’s interference in the 2016 election, issuing a directive on Twitter to shut down an investigation that is scrutinizing his tweets now for evidence of obstruction. https://t.co/oMY8niPXnY","Sat Aug 04 23:53:24 +0000 2018"
"false","false","https://pbs.twimg.com/profile_banners/51728851/1488930232","Sun Jun 28 13:27:58 +0000 2009","Have you ever wondered what you would do during the civil rights movement? Stop wondering. It is the civil rights movement. What are you doing? C Savage
👋☺️ 🌊",,,,,,,,,,,,,,,,,,,,,"threads.net/@twitterkatey","https://www.threads.net/@twitterkatey","0","23","https://t.co/Ux9ccqyZzR","0","205795","5894","6226","true","51728851","false","false","false","","6281","Katey","1022157301648580608","false","https://pbs.twimg.com/profile_images/876888951776137216/_vnK1SFi_normal.jpg","","335916","https://twitter.com/Bewitched9","user","https://x.com/Bewitched9","Bewitched9",,"@gibson_medley @JohnWat99017786 @SenFeinstein Congressional hearings concurred with IC assessment &amp; Mueller's indictments that proved Russia attacked the US 2016 election to help Trump win.
We don't know if Trump conspired with Russia to defraud the United States yet.. The investigation is not over.
https://t.co/9kYqPq5Sjz","Sat Aug 04 23:49:42 +0000 2018"
"false","true","https://pbs.twimg.com/profile_banners/786913853208686592/1560630931","Fri Oct 14 12:57:37 +0000 2016","The Best deals tweeted daily so you never miss a bargain",,,,,,,,,,,,,,,,,,,,,"tweet247.co.uk","http://tweet247.co.uk","0","23","https://t.co/qy5tQnBw1T","0","32","186","29","false","786913853208686592","false","false","false","Atlanta, GA","52636","Daily Deals USA",,"false","https://pbs.twimg.com/profile_images/1139994857521459203/qlBc5taL_normal.jpg","","55878","https://twitter.com/Daily_trend_USA","user","https://x.com/Daily_trend_USA","Daily_trend_USA",,"Trump voicing concerns about son being entangled in Mueller probe: President Donald Trump is concerned about whether his son Donald Trump Jr. might have exposure in the special counsel's Russia investigation, leading to his increasingly frenzied public… https://t.co/TUN7odYJBW https://t.co/63hIYpMnxB","Sat Aug 04 23:48:07 +0000 2018"
"false","true",,"Thu Oct 07 23:01:05 +0000 2010","Marketer, Entrepreneur, Blogger.
I keep watching all kind of news. Just follow me! Bilingual",,,,,,,,,,,,,,,,,,,,,"africaisoft.marketing","http://africaisoft.marketing","0","23","https://t.co/3K5qfrsHhu","0","1791","1117","988","true","199874723","false","false","false","Toronto, Ontario","391305","News by Amanda","1821993947973267892","false","https://pbs.twimg.com/profile_images/768972424645898240/_AtgZ0os_normal.jpg","","477846","https://twitter.com/amandasome","user","https://x.com/amandasome","amandasome",,"Trump voicing concerns about son being entangled in Mueller probe: President Donald Trump is concerned about whether his son Donald Trump Jr. might have exposure in the special counsel's Russia investigation, leading to his increasingly frenzied public… https://t.co/nYPi6Sx1Qw https://t.co/qsC7V7b9Vr","Sat Aug 04 23:48:07 +0000 2018"
"false","false","https://pbs.twimg.com/profile_banners/38388599/1638517698","Thu May 07 07:06:37 +0000 2009","Xoomer. Seattle sports, sci-fi, trivia, toons, TV/film, humor. Usually follows back. BLM/LGBTQ 👍. RTs/hearts = support. He/Him. ISTP. Cover by @sigmas",,,,,,,,,,,,,,,,,,,,,,,,,,"0","312145","3873","4411","true","38388599","false","false","false","Coast Salish Territory ","1904","Michael B 🖖🌎 🌻","1734487476016922937","false","https://pbs.twimg.com/profile_images/1726787745824325632/lHvA49Zs_normal.jpg","","22105","https://twitter.com/JrMariner77","user","https://x.com/JrMariner77","JrMariner77",,"The Russia Investigation is hard to kill cuz it's not a hoax. Democracy's under siege, but the repair can start in November. Trump's on deadly ground cuz he's a traitor. Oh, and Mueller's out for justice. Donald should make an executive decision &amp; resign. https://t.co/s1sBOT5v0x","Sat Aug 04 23:31:35 +0000 2018"
"false","true","https://pbs.twimg.com/profile_banners/875712269329473537/1552670269","Fri Jun 16 13:50:49 +0000 2017","",,,,,,,,,,,,,,,,,,,,,,,,,,"0","627","25","67","true","875712269329473537","false","false","false","California, USA","50","Adam Corera",,"false","https://pbs.twimg.com/profile_images/1107855083348189184/xmgW6ALT_normal.jpg","","738","https://twitter.com/Adam4857462","user","https://x.com/Adam4857462","Adam4857462",,"@FoxNews @Mark_Penn Wow the investigation was not based on the dossier as alleged  by Fox. The special counsel was appointed after Trump fired Comey and the second day after Trump brought Russia’s top spy to the White House","Sat Aug 04 23:27:37 +0000 2018"
"false","false","https://pbs.twimg.com/profile_banners/4634538081/1451325430","Mon Dec 28 17:46:21 +0000 2015","Web Page https://t.co/OnE4Yi7EpR Like on Facebook https://t.co/LaAGveAaYm   Add on Google Plus https://t.co/8WmHTY1fxL
Donate https://t.co/FomLvU9cMZ","baconzbitz.net","http://www.baconzbitz.net/","9","32","https://t.co/OnE4Yi7EpR","facebook.com/BaconsBitsOU812","http://facebook.com/BaconsBitsOU812","50","73","https://t.co/LaAGveAaYm","plus.google.com/u/0/1155170594…","https://plus.google.com/u/0/115517059478743490635","95","118","https://t.co/8WmHTY1fxL","baconzbitz.net/index.php/dona…","http://www.baconzbitz.net/index.php/donation","126","149","https://t.co/FomLvU9cMZ","baconzbitz.net","http://www.baconzbitz.net/","0","23","https://t.co/OnE4Yipfhp","0","0","164","726","false","4634538081","false","false","false","Pennsylvania, USA","210","Bacon'z Bitz","689883459599339520","false","https://pbs.twimg.com/profile_images/681532512066093056/evN8zxb__normal.jpg","","58478","https://twitter.com/BaconzBitz1","user","https://x.com/BaconzBitz1","BaconzBitz1",,"Joyce Vance, a former federal prosecutor, predicted that special counsel Robert Mueller will send evidence to Congress that lists President Trump as an “unindicted co-conspirator” in the Russia investigation so lawmakers can ""form the body, potentially,... https://t.co/VDoE14d2E1","Sat Aug 04 23:27:23 +0000 2018"
"false","true",,"Mon Jan 29 20:46:35 +0000 2018","#FilAm #FilipinoAmazing #FilipinoAmerican #FilipinaAmerican #Filipinx #Immigrant #Resist #BrownLivesMatter #StopAAPIhate #StopAsianHate",,,,,,,,,,,,,,,,,,,,,"filam.one","http://filam.one","0","23","https://t.co/5k9SGT5jPW","0","40","437","475","false","958078945223520256","false","false","false","California, USA","5212","FIL AM🇵🇭🇺🇸",,"false","https://pbs.twimg.com/profile_images/1223073778340515840/yQMRCsb0_normal.jpg","","8883","https://twitter.com/FILAM_one","user","https://x.com/FILAM_one","FILAM_one",,"Trump Tells Sessions to End Mueller's Russia Investigation https://t.co/Rn4iOGThha https://t.co/A755ZuhK1Y","Sat Aug 04 23:27:03 +0000 2018"
"false","true","https://pbs.twimg.com/profile_banners/4853450417/1595173725","Wed Jan 27 12:55:29 +0000 2016","a senior, veteran, husband,father, grandfather, brother, caregiver and I work part time, cancer survivor, cancer is back ,    ABBR!",,,,,,,,,,,,,,,,,,,,,,,,,,"0","30022","554","435","true","4853450417","false","false","false","Chili Center, NY","47","Tom Kauffman",,"false","https://pbs.twimg.com/profile_images/1544259502777802754/0kSAkcki_normal.jpg","","30361","https://twitter.com/tomkat61347","user","https://x.com/tomkat61347","tomkat61347",,"@realDonaldTrump Troy balderson is obviously the person tovote AGAINST! If trump is for him, he can’t be good for our country,russia,maybe but trump wants toend the investigation to prove him innocent or guilty!If he is innocent,let them prove it and finish the investigation!","Sat Aug 04 23:20:59 +0000 2018"
"false","true",,"Tue Oct 16 01:10:45 +0000 2012","🌻Retired Paralegal standing in solidarity w/ACLU, LGBT, PPF &TheResistance! Trump is a malignant narcissist psychopath but is cognizant of his crimes!",,,,,,,,,,,,,,,,,,,,,"crimewatchers.forumotion.com","http://crimewatchers.forumotion.com/","0","23","https://t.co/m45bidPw8L","0","589469","9453","4843","true","883421593","false","false","false","92058","2783","CherokeeNative ☮️🌻🇺🇦 #🟦 🟧 🏳️‍🌈🇺🇸🌈","1650994416117751809","false","https://pbs.twimg.com/profile_images/1299072909940408320/67qmLZcE_normal.jpg","","825973","https://twitter.com/CherokeeNative3","user","https://x.com/CherokeeNative3","CherokeeNative3",,"Nikki Haley boards Airforce1 w/Trump. 

“Trump, who has decamped to his New Jersey golf estate for an 11-day working vacation, is at a critical juncture in the Russia investigation as he decides in coming days whether to sit for an interview with Mueller”

https://t.co/jTFLP5S4Yr","Sat Aug 04 23:20:26 +0000 2018"
"true","true","https://pbs.twimg.com/profile_banners/2819505166/1692071114","Thu Oct 09 12:32:19 +0000 2014","✍ Timo L 🕊️ 🇫🇮 🇸🇪🇳🇴🇩🇰🇮🇸 🇫🇷🇬🇧🇺🇸🇨🇦 💙
🤝 NATO 🇪🇺 🇪🇪🇱🇻🇱🇹🇵🇱🇺🇦🇬🇷🇮🇹🇮🇱 🇩🇪🇳🇱🇧🇪🇪🇸🇵🇹🇮🇪 🇦🇺🇳🇿🇯🇵🇰🇷🇹🇼 🇵🇭🇮🇩 💙",,,,,,,,,,,,,,,,,,,,,,,,,,"0","43262","1040","106","true","2819505166","false","false","false","Finland","979","""active democrat, loyal friend, creative producer""","1699555434871341348","false","https://pbs.twimg.com/profile_images/1861582921313746944/7jYqkOTT_normal.jpg","","49056","https://twitter.com/TimoLempiainen","user","https://x.com/TimoLempiainen","TimoLempiainen",,"@realDonaldTrump Robert Swan Mueller III 🗽

Robert Mueller is leading an amazing investigation to TAKE DOWN Twi😈ler and find the truth about Russia rigging the elections of the United Stupids ⛄

Robert Mueller would BEAT Trump in 2020 ⛳ https://t.co/1Yfi4jxHW3","Sat Aug 04 23:10:20 +0000 2018"
"false","true","https://pbs.twimg.com/profile_banners/637311096/1722100987","Mon Jul 16 19:51:58 +0000 2012","",,,,,,,,,,,,,,,,,,,,,"hollykbates.wix.com/hollykbatespho…","http://hollykbates.wix.com/hollykbatesphoto","0","23","https://t.co/m8VSOXK6B3","0","40051","241","630","false","637311096","false","false","false","Saratoga Springs, NY","1366","Holly Bates",,"false","https://pbs.twimg.com/profile_images/1819098300403904512/SYmzrELP_normal.jpg","","14750","https://twitter.com/hollykbates","user","https://x.com/hollykbates","hollykbates",,"I hope people will be done talking about the LeBron comment soon. Rs are still trying to take healthcare from people with pre-existing conditions &amp; create in a SCOTUS to overturn Roe v. Wade, while protecting Trump from the Russia investigation. LeBron can take care of himself.","Sat Aug 04 22:56:49 +0000 2018"
"true","false","https://pbs.twimg.com/profile_banners/739844197935644672/1731009508","Mon Jun 06 15:39:37 +0000 2016","Pro-Democracy. Anti-Fascism. Gay AF. Trump is a convicted felon and rapist who remains constitutionally DISQUALIFIED from office. ARREST HIM",,,,,,,,,,,,,,,,,,,,,"amoneyresists.substack.com/subscribe","https://amoneyresists.substack.com/subscribe","0","23","https://t.co/4jvwgmxPOB","0","197627","239845","90793","true","739844197935644672","true","false","false","","18062","Andrew—Author of America Rises","1816032451400994945","false","https://pbs.twimg.com/profile_images/1855637765712396288/BY4EprkP_normal.jpg","","282016","https://twitter.com/AmoneyResists","user","https://x.com/AmoneyResists","AmoneyResists",,"In private, Trump has spent much of the past week brooding, as he often does. He has reportedly become increasingly anxious about the Russia investigation’s widening fallout, with his former campaign chairman standing trial.  https://t.co/3yVC1fx5ib","Sat Aug 04 22:34:57 +0000 2018"
"true","true","https://pbs.twimg.com/profile_banners/827334641073922048/1491621737","Fri Feb 03 01:55:24 +0000 2017","Concerned.",,,,,,,,,,,,,,,,,,,,,,,,,,"0","133256","1352","4516","true","827334641073922048","false","false","false","","818","Waverly Hudson",,"false","https://pbs.twimg.com/profile_images/850547778300391425/mI5vQStp_normal.jpg","","161220","https://twitter.com/WaverlyHudson","user","https://x.com/WaverlyHudson","WaverlyHudson",,"Hicks heads to Ohio rally with Trump. Gives the appearance that the US President is coordinating testimony with a federal witness in the Russia investigation. Witness tampering. Collusion in plain sight. Not a good look. #Impeach45 #BlueWave2018","Sat Aug 04 22:34:12 +0000 2018"
"false","true","https://pbs.twimg.com/profile_banners/921842109082083328/1508642760","Sat Oct 21 20:54:20 +0000 2017","All Breaking News Alerts Around World from The Trusted Sources or NOT.",,,,,,,,,,,,,,,,,,,,,,,,,,"0","0","807","0","false","921842109082083328","false","false","false","Seattle, WA","3","All Breaking News",,"false","https://pbs.twimg.com/profile_images/924789195155021824/WS9biEN4_normal.jpg","","91556","https://twitter.com/AllBRKNews","user","https://x.com/AllBRKNews","AllBRKNews",,"In public, he’s roaring at enemies. In private, he’s brooding over the Russia investigation. President Trump is a man on the edge. -- The Washington Post","Sat Aug 04 22:30:35 +0000 2018"
"false","true",,"Tue Dec 26 17:12:56 +0000 2017","",,,,,,,,,,,,,,,,,,,,,,,,,,"0","81477","347","3329","true","945703989903052800","false","false","false","","396","Politic Patriot",,"false","https://pbs.twimg.com/profile_images/1066786465420648448/lleyryYn_normal.jpg","","9338","https://twitter.com/politicpatriot1","user","https://x.com/politicpatriot1","politicpatriot1",,"@jeannefisher17 @TheofficialGump @hfinch61 @FBI @DHSgov @FBIStLouis @SLMPD The premise of the Mueller investigation was collusion with Russia. What evidence is there that Trump colluded with Russia and how did Russia influence the election?","Sat Aug 04 22:22:14 +0000 2018"
"true","true",,"Sun Mar 01 23:30:41 +0000 2015","Fourth President of the United States Husband of Dolley - Specified parody",,,,,,,,,,,,,,,,,,,,,,,,,,"0","45175","1080","675","true","3053978610","false","false","false","","1289","Jimmy Madison",,"false","https://pbs.twimg.com/profile_images/572178308453953536/QRg7KZQ5_normal.jpeg","","120818","https://twitter.com/Federalist_10","user","https://x.com/Federalist_10","Federalist_10",,"@JuddLegum Trump knows all of the collusion with Russia was deliberate, which is why he obstructed justice in firing Comey and in his attempts to shut down the Russia-Trump investigation. 

He’s trying to condition his cult into thinking that he is pardoning everyone b/c this was an oopsie","Sat Aug 04 22:00:28 +0000 2018"
"false","false","https://pbs.twimg.com/profile_banners/864160114009407488/1724888926","Mon May 15 16:46:41 +0000 2017","Father, husband, Proud military family, #GoArmy #TheResistance NeverTrump 💙#VoteBlue In 2026",,,,,,,,,,,,,,,,,,,,,,,,,,"0","208598","5222","4136","false","864160114009407488","false","false","false","New York, USA","5158","KM 🇺🇸🦅","1837183771109466234","false","https://pbs.twimg.com/profile_images/865989389335142400/y0iuC8mH_normal.jpg","","75896","https://twitter.com/democraticitizn","user","https://x.com/democraticitizn","democraticitizn",,"@PrincessBravato This is why Mueller can never finish the investigation bc Trump commits more crimes in plain sight daily.","Sat Aug 04 23:39:00 +0000 2018"
"false","false","https://pbs.twimg.com/profile_banners/18483124/1603512134","Tue Dec 30 17:56:15 +0000 2008","",,,,,,,,,,,,,,,,,,,,,,,,,,"0","23","98","1185","false","18483124","false","false","false","Mobile, AL","58","bullet2916",,"false","https://abs.twimg.com/sticky/default_profile_images/default_profile_normal.png","","5173","https://twitter.com/bullet2916","user","https://x.com/bullet2916","bullet2916",,"@BecomeMeme @freedom_moates That's why we need to have the Mueller investigation. We need to know what he did","Sat Aug 04 23:31:39 +0000 2018"
