"author/canDm","author/canMediaTag","author/coverPicture","author/createdAt","author/description","author/entities/description/urls/0/display_url","author/entities/description/urls/0/expanded_url","author/entities/description/urls/0/indices/0","author/entities/description/urls/0/indices/1","author/entities/description/urls/0/url","author/entities/description/urls/1/display_url","author/entities/description/urls/1/expanded_url","author/entities/description/urls/1/indices/0","author/entities/description/urls/1/indices/1","author/entities/description/urls/1/url","author/entities/description/urls/2/display_url","author/entities/description/urls/2/expanded_url","author/entities/description/urls/2/indices/0","author/entities/description/urls/2/indices/1","author/entities/description/urls/2/url","author/entities/description/urls/3/display_url","author/entities/description/urls/3/expanded_url","author/entities/description/urls/3/indices/0","author/entities/description/urls/3/indices/1","author/entities/description/urls/3/url","author/entities/url/urls/0/display_url","author/entities/url/urls/0/expanded_url","author/entities/url/urls/0/indices/0","author/entities/url/urls/0/indices/1","author/entities/url/urls/0/url","author/fastFollowersCount","author/favouritesCount","author/followers","author/following","author/hasCustomTimelines","author/id","author/isBlueVerified","author/isTranslator","author/isVerified","author/location","author/mediaCount","author/name","author/pinnedTweetIds/0","author/possiblySensitive","author/profilePicture","author/status","author/statusesCount","author/twitterUrl","author/type","author/url","author/userName","author/verifiedType","text","createdAt"
"false","true","https://pbs.twimg.com/profile_banners/122837924/1679930134","Sun Mar 14 03:00:21 +0000 2010","Adult Human Female. 👑Don’t expect me to forsake honesty for your personal comfort. Happily married. Politically Homeless.",,,,,,,,,,,,,,,,,,,,,"livinglikekingsburys.blogspot.com","http://livinglikekingsburys.blogspot.com","0","23","https://t.co/OOlvylLTpZ","0","107513","3994","3955","true","122837924","true","false","false","Land of the FREE 🇺🇸","3308","The Queen™ 👑","1642886842021191683","false","https://pbs.twimg.com/profile_images/1824580245145419776/lwJSED14_normal.jpg","","44298","https://twitter.com/1Queentm","user","https://x.com/1Queentm","1Queentm",,"@JessicaBloomwd @JackPosobiec Reminds me of Mueller and Russia Collusion investigation...🤔","Sat Aug 04 23:59:51 +0000 2018"
"false","false","https://pbs.twimg.com/profile_banners/260537575/1507209225","Fri Mar 04 02:19:19 +0000 2011","Calabi-Yau spaces, six-dimensional object represented here in two-dimensions,",,,,,,,,,,,,,,,,,,,,,,,,,,"0","14730","268","457","true","260537575","false","false","false","","1753","Mary Grace","691413479199100928","false","https://pbs.twimg.com/profile_images/1107475622530412544/yyZc_pab_normal.jpg","","43327","https://twitter.com/marygrace0503","user","https://x.com/marygrace0503","marygrace0503",,"Trump asking Sessions, the US’ top law enforcement official, to take specific action, raised questions about whether Trump was attempting to obstruct justice, already an issue being examined extensively by Mueller who is leading the investigation. https://t.co/oMY8niPXnY","Sat Aug 04 23:58:56 +0000 2018"
"false","true","https://pbs.twimg.com/profile_banners/2476171104/1714093306","Sun May 04 00:49:07 +0000 2014","Shows: Jonathan.Briks@unitedtalent.com ... BUSINESS: yodbiz7@gmail.com",,,,,,,,,,,,,,,,,,,,,"yourolddroog.com","http://yourolddroog.com","0","23","https://t.co/Djl8yJJpJi","0","3593","48296","6219","false","2476171104","false","false","false","","2343","YOD","1791453705994219649","false","https://pbs.twimg.com/profile_images/1783950238291484672/nydcnuhJ_normal.jpg","","23630","https://twitter.com/YourOldDroog","user","https://x.com/YourOldDroog","YourOldDroog",,"“In the words of Bo$$, this mueller investigation is deep but I’m going deeper” https://t.co/uWnLJRZgzl","Sat Aug 04 23:58:03 +0000 2018"
"false","false","https://pbs.twimg.com/profile_banners/3428316383/1621458610","Mon Aug 17 15:34:44 +0000 2015","The Third Transformation of Human Consciousness is inexorable.",,,,,,,,,,,,,,,,,,,,,,,,,,"0","26123","1473","2571","true","3428316383","false","false","false","","14336","Timothy Taubes",,"false","https://pbs.twimg.com/profile_images/1789504615869800448/OqQjNgS7_normal.jpg","","82336","https://twitter.com/TimTaubes","user","https://x.com/TimTaubes","TimTaubes",,"@MplsMe @summer7570 That's why Mueller can't wrap up the investigation. Every day new crimes are being committed.","Sat Aug 04 23:56:48 +0000 2018"
"true","false","https://pbs.twimg.com/profile_banners/49685124/1457276135","Mon Jun 22 16:46:20 +0000 2009","Exposing hidden agendas behind the news,,,tomorrow's news today

.Creator of ""America First"" slogan. and https://t.co/QMjuhkYgO1, a place for free expression..","dellpedia.com","http://dellpedia.com","105","128","https://t.co/QMjuhkYgO1",,,,,,,,,,,,,,,,"dellpedia.com","https://dellpedia.com","0","23","https://t.co/GORwCoykjW","0","11123","3975","3522","true","49685124","false","false","false","United States","2687","Ramparts","952175457016758273","false","https://pbs.twimg.com/profile_images/1356385598748184576/1lSLaoQr_normal.jpg","","36861","https://twitter.com/RampartNews","user","https://x.com/RampartNews","RampartNews",,"Oy vey...Rosenstein doesn't have standing to make the Mueller appointment. He's overseeing an investigation into his own actions Rosenstein reminds me of that character Kaiser Sothe in Usual Suspects as he dupes judge https://t.co/joByrG5ksl","Sat Aug 04 23:55:57 +0000 2018"
"false","false","https://pbs.twimg.com/profile_banners/992170664/1543748372","Thu Dec 06 01:40:27 +0000 2012","My primary language is sarcasm. so get over it!  I’m a https://t.co/RWalWD8YVk veteran. 🚫No I don’t want to know you better don’t DM me.","US.Navy","http://US.Navy","55","78","https://t.co/RWalWD8YVk",,,,,,,,,,,,,,,,,,,,,"0","30193","2747","2878","true","992170664","false","false","false","United States","1105","🇺🇸Navy Vet🇺🇸❌❌",,"false","https://pbs.twimg.com/profile_images/1640434289371226112/E5NH9Gu0_normal.jpg","","18933","https://twitter.com/FrankieFuller13","user","https://x.com/FrankieFuller13","FrankieFuller13",,"@KoparaFallsKid The Left is NOT too good hearted. Where have you been hiding. Maxine Waters inciting violence against republicans, Pelosi spewing hate, the Dems and the Mueller investigation, Antifa riots, how can you seriously believe this hogwash!","Sat Aug 04 23:55:54 +0000 2018"
"true","true","https://pbs.twimg.com/profile_banners/1011673074490474496/1599691399","Tue Jun 26 18:10:31 +0000 2018","Retired Navy, inveterate contrarian, remembers when conservatives knew what patriotism really was. #UnlearnYourRacism",,,,,,,,,,,,,,,,,,,,,"glennrocess.medium.com","https://glennrocess.medium.com/","0","23","https://t.co/PpOSNdKIZy","0","173084","2924","4728","true","1011673074490474496","false","false","false","Washington, USA","2692","Glenn Rocess, #NAFO Pit Snipe (Ret.)","1085357624495726593","false","https://pbs.twimg.com/profile_images/1014169394044289024/abYY0OS-_normal.jpg","","91616","https://twitter.com/RocessGlenn","user","https://x.com/RocessGlenn","RocessGlenn",,"@bobloblawone @realDonaldTrump If you had paid attention in years past, you’d know that this investigation is moving MUCH faster than normal, esp. given how complex it is...and it’s already gotten 5 guilty pleas and 20 other indictments. Mueller’s not required to show ANY evidence to public before indictment.","Sat Aug 04 23:55:47 +0000 2018"
"false","false",,"Thu May 17 14:33:56 +0000 2018","From Military family. Respect our Flag, 
constitution, rule of law. we should help America's homeless, veterans, end poverty n suicide in America. Show Respect.",,,,,,,,,,,,,,,,,,,,,,,,,,"0","464","13","26","true","997123052247900162","false","false","false","","6","Billy Ranger",,"false","https://abs.twimg.com/sticky/default_profile_images/default_profile_normal.png","","2685","https://twitter.com/BillyAmerican","user","https://x.com/BillyAmerican","BillyAmerican",,"@kampra Trump seldom gets good press if not for Fox. He is really upset with the Mueller investigation. It's been nearly 2 yrs if there was anything on Trump I think it would have come out by now. Looks like Mueller is catching incidental crimes unrelated to Trump.","Sat Aug 04 23:55:21 +0000 2018"
"false","true","https://pbs.twimg.com/profile_banners/424759254/1566784077","Wed Nov 30 04:24:34 +0000 2011","Cat Dad. Software Engineer. Political junkie. Perspective is everything.",,,,,,,,,,,,,,,,,,,,,,,,,,"0","112533","661","75","true","424759254","false","false","false","Minnesota, USA","1861","Bryan",,"false","https://pbs.twimg.com/profile_images/1296595107060187136/877j1B-j_normal.jpg","","73246","https://twitter.com/NotAChaunce","user","https://x.com/NotAChaunce","NotAChaunce",,"@realDonaldTrump Off to feed my followers. Lies tonight will include:
- US Steel opening 7(or 6) new plants
- Russia’s sad that Trump won
- Biggest tax cut in history
- North Korea no longer a nuclear threat
- Mueller investigation a hoax
and of course the crowd will be the biggest ever assembled","Sat Aug 04 23:54:44 +0000 2018"
"false","false","https://pbs.twimg.com/profile_banners/218643395/1590028827","Mon Nov 22 22:00:21 +0000 2010","Happily married retired clinical data analyst, proud father/grandfather, cancer battler, Libertarian, Follow Covid-19. Following til I hit the arbitrary number.",,,,,,,,,,,,,,,,,,,,,,,,,,"0","44012","1343","3296","true","218643395","false","false","false","United States","625","Jean Lafitte",,"false","https://pbs.twimg.com/profile_images/1177883644/flanders2_normal.gif","","19546","https://twitter.com/loupgarous","user","https://x.com/loupgarous","loupgarous",,"Close the Mueller investigation and have those people investigate @antifa and why cities from Portland to Berkeley let them run wild and armed through the streets.  Do it NOW before an actual civil war breaks out.","Sat Aug 04 23:54:31 +0000 2018"
"false","false","https://pbs.twimg.com/profile_banners/260537575/1507209225","Fri Mar 04 02:19:19 +0000 2011","Calabi-Yau spaces, six-dimensional object represented here in two-dimensions,",,,,,,,,,,,,,,,,,,,,,,,,,,"0","14730","268","457","true","260537575","false","false","false","","1753","Mary Grace","691413479199100928","false","https://pbs.twimg.com/profile_images/1107475622530412544/yyZc_pab_normal.jpg","","43327","https://twitter.com/marygrace0503","user","https://x.com/marygrace0503","marygrace0503",,"Mueller’s investigation shined a spotlight on the waves of foreign money washing through American politics. Other DOJ dpts did not have the resources to find all the interference Manafort’s trial alone showed a lavish world of extravagance by lobby’s https://t.co/CaC1p0hLJH","Sat Aug 04 23:51:12 +0000 2018"
"false","false","https://pbs.twimg.com/profile_banners/402495326/1516606980","Tue Nov 01 04:52:22 +0000 2011","Doing the right thing shouldn’t be a matter of what political party you affiliate with.Patriotism is putting Country over Party.I REPORT BOTS. Don’t Dm me w/ BS",,,,,,,,,,,,,,,,,,,,,,,,,,"0","1060683","2288","3322","true","402495326","false","false","false","PNW USA","1802","Tybin",,"false","https://pbs.twimg.com/profile_images/1351365241045569540/ZlUfCKOx_normal.jpg","","731651","https://twitter.com/4tybin","user","https://x.com/4tybin","4tybin",,"And so it begins. Trump will soon endorse Jim for Speaker, fulfilling his part of the deal. Treason Caucus detroys the Mueller investigation and DJT helps them get Speakership. Google past Vanity Fair interview with Steve Bannon","Sat Aug 04 23:50:14 +0000 2018"
"false","false","https://pbs.twimg.com/profile_banners/51728851/1488930232","Sun Jun 28 13:27:58 +0000 2009","Have you ever wondered what you would do during the civil rights movement? Stop wondering. It is the civil rights movement. What are you doing? C Savage
👋☺️ 🌊",,,,,,,,,,,,,,,,,,,,,"threads.net/@twitterkatey","https://www.threads.net/@twitterkatey","0","23","https://t.co/Ux9ccqyZzR","0","205795","5894","6226","true","51728851","false","false","false","","6281","Katey","1022157301648580608","false","https://pbs.twimg.com/profile_images/876888951776137216/_vnK1SFi_normal.jpg","","335916","https://twitter.com/Bewitched9","user","https://x.com/Bewitched9","Bewitched9",,"@gibson_medley @JohnWat99017786 @SenFeinstein Congressional hearings concurred with IC assessment &amp; Mueller's indictments that proved Russia attacked the US 2016 election to help Trump win.
We don't know if Trump conspired with Russia to defraud the United States yet.. The investigation is not over.
https://t.co/9kYqPq5Sjz","Sat Aug 04 23:49:42 +0000 2018"
"false","true",,"Thu Jul 28 06:27:59 +0000 2016","",,,,,,,,,,,,,,,,,,,,,,,,,,"0","65","1","54","false","758549544489680896","false","false","false","","1","whiz666",,"false","https://abs.twimg.com/sticky/default_profile_images/default_profile_normal.png","","1312","https://twitter.com/whiz666","user","https://x.com/whiz666","whiz666",,"@MSNBC If Mueller is too chickenshit to indict Trump for whatever crimes he finds Ttrump committed, then his investigation might not be worth shit. With the current corrupt GOP running the show they will just sit on their laurels &amp; ignore Mueller's findings.","Sat Aug 04 23:48:20 +0000 2018"
"false","true","https://pbs.twimg.com/profile_banners/786913853208686592/1560630931","Fri Oct 14 12:57:37 +0000 2016","The Best deals tweeted daily so you never miss a bargain",,,,,,,,,,,,,,,,,,,,,"tweet247.co.uk","http://tweet247.co.uk","0","23","https://t.co/qy5tQnBw1T","0","32","186","29","false","786913853208686592","false","false","false","Atlanta, GA","52636","Daily Deals USA",,"false","https://pbs.twimg.com/profile_images/1139994857521459203/qlBc5taL_normal.jpg","","55878","https://twitter.com/Daily_trend_USA","user","https://x.com/Daily_trend_USA","Daily_trend_USA",,"Trump voicing concerns about son being entangled in Mueller probe: President Donald Trump is concerned about whether his son Donald Trump Jr. might have exposure in the special counsel's Russia investigation, leading to his increasingly frenzied public… https://t.co/TUN7odYJBW https://t.co/63hIYpMnxB","Sat Aug 04 23:48:07 +0000 2018"
"false","true",,"Thu Oct 07 23:01:05 +0000 2010","Marketer, Entrepreneur, Blogger.
I keep watching all kind of news. Just follow me! Bilingual",,,,,,,,,,,,,,,,,,,,,"africaisoft.marketing","http://africaisoft.marketing","0","23","https://t.co/3K5qfrsHhu","0","1791","1117","988","true","199874723","false","false","false","Toronto, Ontario","391305","News by Amanda","1821993947973267892","false","https://pbs.twimg.com/profile_images/768972424645898240/_AtgZ0os_normal.jpg","","477846","https://twitter.com/amandasome","user","https://x.com/amandasome","amandasome",,"Trump voicing concerns about son being entangled in Mueller probe: President Donald Trump is concerned about whether his son Donald Trump Jr. might have exposure in the special counsel's Russia investigation, leading to his increasingly frenzied public… https://t.co/nYPi6Sx1Qw https://t.co/qsC7V7b9Vr","Sat Aug 04 23:48:07 +0000 2018"
"true","true","https://pbs.twimg.com/profile_banners/268967465/1646026839","Sat Mar 19 21:01:16 +0000 2011","Followed by @glennkirschner and @edkrassen💖🌏#FBR Anti-fascism#TheResistance #BLM FvckPutin #IStandWithUkraine 🚫DM💙💙🌊🇺🇦 💙💛@salthenson.bsky.social",,,,,,,,,,,,,,,,,,,,,,,,,,"0","81815","9959","10039","true","268967465","false","false","false","Planet Arcturus","6473","SalThenson","1625635157649809411","false","https://pbs.twimg.com/profile_images/1066187207587713024/GVnoUfKt_normal.jpg","","82500","https://twitter.com/arcturus300","user","https://x.com/arcturus300","arcturus300",,"@OfficialJonZal @OleVetUSAF The only reason he's tweeting so much about the #Mueller investigation is because he knows they are have the TRUTH, and all Trump has  is a swamp-filled with LIES!","Sat Aug 04 23:45:32 +0000 2018"
"true","true","https://pbs.twimg.com/profile_banners/264621328/1655162329","Sat Mar 12 05:42:32 +0000 2011","Half Mauritian Chinese, Half Irish, Full Habs fan season ticket holder. Gooner, Lakers fan and Dolfan too. But mostly reppin’ la Sainte-Flanelle everywhere I go",,,,,,,,,,,,,,,,,,,,,,,,,,"0","6325","991","295","true","264621328","false","false","false","Wherever I currently am","1310","Robert Louis","1838567199113646473","false","https://pbs.twimg.com/profile_images/1850250123647066113/khHv5FyL_normal.jpg","","29448","https://twitter.com/robertlouis33","user","https://x.com/robertlouis33","robertlouis33",,"@xxRobbieRoBBxx @MsPatsyy @KimJamul @ananavarro No but the majority of Americans fall under one of the two categories I mentioned. So this idea that Americans do not hold the responsibility for the outcome of the last election is nonsense. The Russian meddling only worked because the group that didn’t care enough was so big","Sat Aug 04 23:40:33 +0000 2018"
"false","false","https://pbs.twimg.com/profile_banners/258230465/1491275630","Sun Feb 27 07:06:29 +0000 2011","Surf's Up!",,,,,,,,,,,,,,,,,,,,,,,,,,"0","36","6832","6816","false","258230465","false","false","false","","8789","Butterfly Effect",,"false","https://pbs.twimg.com/profile_images/849096463019896832/vDLDiuQ3_normal.jpg","","87984","https://twitter.com/_quantum_fx","user","https://x.com/_quantum_fx","_quantum_fx",,"Twitter Caught Committing Massive Election Fraud: Conservative Voices Shadow-banned; Liberal Voices Up-ranked During Critical Election Year 

(Ethan Huff) We now have proof that meddling is a factor in American elections – but not by Russia, and not in f… https://t.co/GRrOqPLEGp","Sat Aug 04 23:40:14 +0000 2018"
"false","true","https://pbs.twimg.com/profile_banners/809840586/1433287441","Sat Sep 08 00:12:48 +0000 2012","",,,,,,,,,,,,,,,,,,,,,,,,,,"0","10194","2579","4943","true","809840586","false","false","false","","5186","Mary Dobrski",,"false","https://pbs.twimg.com/profile_images/605879341340188673/HermapW6_normal.png","","204548","https://twitter.com/margrazyna","user","https://x.com/margrazyna","margrazyna",,"HERE WE GO AGAIN: US Intel Chiefs Fan Russia Election-Meddling Scare https://t.co/EaAhjauNvN via @YouTube","Sat Aug 04 23:39:46 +0000 2018"
"false","false","https://pbs.twimg.com/profile_banners/274249510/1611517452","Wed Mar 30 01:00:31 +0000 2011","A Methodist and a son of a bitch.",,,,,,,,,,,,,,,,,,,,,"letterboxd.com/codywinfrey/","https://letterboxd.com/codywinfrey/","0","23","https://t.co/dDlCY29UWe","0","97196","227","998","true","274249510","false","false","false","Sophia, NC","1981","Temu CPAP machine",,"false","https://pbs.twimg.com/profile_images/1428140805135470592/dpMHVbvC_normal.jpg","","20162","https://twitter.com/codyfux","user","https://x.com/codyfux","codyfux",,"@BethLynch2020 Does this constitute election meddling?","Sat Aug 04 23:37:54 +0000 2018"
"false","true",,"Thu Jul 12 18:38:45 +0000 2018","News About Russia",,,,,,,,,,,,,,,,,,,,,,,,,,"0","0","80","0","false","1017478382962008065","false","false","false","Moscow, Russia","473","Russia Insight",,"false","https://pbs.twimg.com/profile_images/1017478923897245697/eFZJewBc_normal.jpg","","473","https://twitter.com/russia_insight","user","https://x.com/russia_insight","russia_insight",,"HERE WE GO AGAIN: US Intel Chiefs Fan Russia Election-Meddling Scare: https://t.co/agpJ4QBPhI via @YouTube","Sat Aug 04 23:33:48 +0000 2018"
"false","true",,"Thu Dec 02 07:13:11 +0000 2010","From Neptune, NJ, but now live in Los Angeles. Am a courier, ex-Angel writer PA. I either know you, worked with/for you, drank w/you, and/or am a fan of you.",,,,,,,,,,,,,,,,,,,,,,,,,,"0","24468","581","558","true","222021574","false","false","false","Van Nuys ","1268","John Campbell",,"false","https://pbs.twimg.com/profile_images/1181180507/2010-12-02_14.41.09-1_normal.jpg","","60159","https://twitter.com/John_AKA_Becker","user","https://x.com/John_AKA_Becker","John_AKA_Becker",,"@MegaGame1 @terriarduini @votevets Obama did not lie. Obama told Trump not to hire Glynn. Trump did. Guilty plea. Trump's the only person who refuses to accept that the Russians are behind the election meddling. He stood next to Putin and took his word. He later fake recanted. Fake as he added ""it could be anyone.","Sat Aug 04 23:32:43 +0000 2018"
"false","true",,"Tue Aug 16 17:52:30 +0000 2016","",,,,,,,,,,,,,,,,,,,,,,,,,,"0","1022","4","41","false","765607177335603200","false","false","false","United States","50","Nancy",,"false","https://abs.twimg.com/sticky/default_profile_images/default_profile_normal.png","","3887","https://twitter.com/Nancy62112120","user","https://x.com/Nancy62112120","Nancy62112120",,"@realDonaldTrump @nytimes The original intent of the investigation was Russia meddling in our election. Everyone in your administration but you have acknowledged that. They are not after you. But obviously you have something to hide. Otherwise why suck up to Putin. ?????","Sat Aug 04 23:24:20 +0000 2018"
"false","true","https://pbs.twimg.com/profile_banners/547570544/1486333204","Sat Apr 07 12:34:04 +0000 2012","Navy Veteran, Politically Independent, Grateful Dead fan, huge music lover, lover of psychedelics and free thought. Disrespect will be blocked. #Resist",,,,,,,,,,,,,,,,,,,,,,,,,,"0","9102","241","646","false","547570544","false","false","false","North Carolina","68","Bruce Lewis",,"false","https://pbs.twimg.com/profile_images/677265980045717504/n9MykmmU_normal.jpg","","9218","https://twitter.com/BruceLewis4","user","https://x.com/BruceLewis4","BruceLewis4",,"@GOP @realDonaldTrump @realDonaldTrump is a racist and a xenophobe. Also an admitted sexual predator. And he took Putin's word over America's intelligence services in regards to election meddling.

I don't support that. It's a shame that you do.","Sat Aug 04 23:19:56 +0000 2018"
"false","true","https://pbs.twimg.com/profile_banners/4415859081/1539449256","Tue Dec 08 13:04:26 +0000 2015","Retired Police Officer. US army Vet. 
Proud Patroit. MAGA nuff said.",,,,,,,,,,,,,,,,,,,,,,,,,,"0","12995","2945","4781","false","4415859081","false","false","false","Omro, WI","174","Edward Clements",,"false","https://pbs.twimg.com/profile_images/1727497463919984640/JpGL2qai_normal.jpg","","2452","https://twitter.com/EdwardClement13","user","https://x.com/EdwardClement13","EdwardClement13",,"@1ClickBiz @jimdwrench This is a question that should never be asked. This is foreigners meddling in our election.","Sat Aug 04 23:19:19 +0000 2018"
"false","true","https://pbs.twimg.com/profile_banners/857691094208966657/1493325220","Thu Apr 27 20:21:06 +0000 2017","",,,,,,,,,,,,,,,,,,,,,,,,,,"0","136","5","40","false","857691094208966657","false","false","false","Here","393","Lighten Up",,"false","https://pbs.twimg.com/profile_images/857693254040653824/sAeX1To__normal.jpg","","17225","https://twitter.com/YourLifesShort","user","https://x.com/YourLifesShort","YourLifesShort",,"@MSNBC I know its hard 4 misinformed leftist resisters 2 understand but let me explain it in simple words. The terms “Russian hoax” n “witch hunt” refer to the false charge that the Trump campaign colluded with Russia. It is separate from Russian meddling in the election, which happened","Sat Aug 04 23:06:24 +0000 2018"
"true","false","https://pbs.twimg.com/profile_banners/328572979/1692965128","Sun Jul 03 16:46:07 +0000 2011","'As long as you are going to be thinking anyway, think big.' -Donald Trump. Proud Mom of 3x-deployed ANG veteran daughter.
#TrumpWon #MAGA",,,,,,,,,,,,,,,,,,,,,,,,,,"0","690","8604","8261","true","328572979","false","false","false","America the Beautiful","7620","Nancy Chapman","1854884823468310568","false","https://pbs.twimg.com/profile_images/813826972430143489/hkXhhFB3_normal.jpg","","157283","https://twitter.com/ChapmanNancy","user","https://x.com/ChapmanNancy","ChapmanNancy",,"Trump sounds call for voter ID laws to fix ‘rigged’ system, after disbanding fraud panel https://t.co/Y5tELqj0lI #FoxNews Remember this article? Well, @POTUS has made election meddling a national security issue. Corrupt Dems are losing on all fronts. And Patriots are #Winning!","Sat Aug 04 23:05:14 +0000 2018"
"false","true",,"Wed Nov 04 03:02:29 +0000 2015","",,,,,,,,,,,,,,,,,,,,,,,,,,"0","118948","360","525","true","4108983501","false","false","false","","4788","M Susan",,"false","https://abs.twimg.com/sticky/default_profile_images/default_profile_normal.png","","84982","https://twitter.com/MSmeowsie","user","https://x.com/MSmeowsie","MSmeowsie",,"He became a Russian citizen in 2016?!? He defended Putin's election meddling?!? WTAF. DECADES of US Fan glory from his movies. #youBUM 👎 Actor Steven Seagal appointed Russian ministry's 'special representative'

https://t.co/CDo4M5aiCa","Sat Aug 04 22:50:24 +0000 2018"
"true","true","https://pbs.twimg.com/profile_banners/1019273767225212928/1536190490","Tue Jul 17 17:32:58 +0000 2018","#VoteRed",,,,,,,,,,,,,,,,,,,,,,,,,,"0","9137","2106","633","false","1019273767225212928","false","false","false","","1446","Rose","1056243803722579968","false","https://pbs.twimg.com/profile_images/1055999358209060864/toxoz_04_normal.jpg","","10827","https://twitter.com/StopMediaHate","user","https://x.com/StopMediaHate","StopMediaHate",,"Tell me how the QFD ban is any different than so-called ""Russian meddling?""
The only difference is, this is real and it's worse.
This is election rigging in its most shameless and cowardly form - thru silencing.
Read this thread and start fighting back, ffs","Sat Aug 04 22:48:20 +0000 2018"
