"author/canDm","author/canMediaTag","author/coverPicture","author/createdAt","author/description","author/entities/url/urls/0/display_url","author/entities/url/urls/0/expanded_url","author/entities/url/urls/0/indices/0","author/entities/url/urls/0/indices/1","author/entities/url/urls/0/url","author/fastFollowersCount","author/favouritesCount","author/followers","author/following","author/hasCustomTimelines","author/id","author/isBlueVerified","author/isTranslator","author/isVerified","author/location","author/mediaCount","author/name","author/pinnedTweetIds/0","author/possiblySensitive","author/profilePicture","author/status","author/statusesCount","author/twitterUrl","author/type","author/url","author/userName","fullText","createdAt","likeCount","viewCount","retweetCount","replyCount","quoteCount","bookmarkCount","media/0","media/1","quoteId","isReply","id","isRetweet","isQuote","inReplyToUserId"
"true","false","https://pbs.twimg.com/profile_banners/1082197856/1726711977","Sat Jan 12 07:47:51 +0000 2013","Follower of Christ. Wife to Jeff. Mother to Ruby & Leo. A Nightmare for the Fake News. Trump-Endorsed Nominee for U.S. Senate in Arizona. #AmericaFirst","KariLake.com","http://KariLake.com","0","23","https://t.co/EmzgOS1TsY","0","37857","2416942","1046","true","1082197856","true","false","false","Arizona","9162","Kari Lake","1856869659783352689","false","https://pbs.twimg.com/profile_images/1600623137300750336/JAUThK8o_normal.jpg","","39424","https://twitter.com/KariLake","user","https://x.com/KariLake","KariLake","Biden/Harris and Gallego allowed our country to be invaded.

I want to go to Washington, DC, and I want to help President Trump secure our border.

I want to put the American People First.

And in January of 25, that's exactly what we're going to do. https://t.co/mQI3xUgjMX","Tue Nov 05 02:50:16 +0000 2024","3589","76781","794","63","9","35","https://pbs.twimg.com/amplify_video_thumb/1853630777725943808/img/SiUTshG8DUKKbszy.jpg",,,"false","1853630884458442918","false","false",
"true","false","https://pbs.twimg.com/profile_banners/1082197856/1726711977","Sat Jan 12 07:47:51 +0000 2013","Follower of Christ. Wife to Jeff. Mother to Ruby & Leo. A Nightmare for the Fake News. Trump-Endorsed Nominee for U.S. Senate in Arizona. #AmericaFirst","KariLake.com","http://KariLake.com","0","23","https://t.co/EmzgOS1TsY","0","37857","2416942","1046","true","1082197856","true","false","false","Arizona","9162","Kari Lake","1856869659783352689","false","https://pbs.twimg.com/profile_images/1600623137300750336/JAUThK8o_normal.jpg","","39424","https://twitter.com/KariLake","user","https://x.com/KariLake","KariLake","The media told us the MAGA movement is dead.

From where I'm standing, it's alive and well.

We're going to show the world tomorrow,

It's time for the silent majority tp step forward, go into the voting booth, and cast their vote for Donald J. Trump for President and Kari Lake https://t.co/wXhP6kJJjz","Tue Nov 05 02:43:15 +0000 2024","2701","45667","580","46","9","22","https://pbs.twimg.com/amplify_video_thumb/1853629044471771136/img/0b-RP9kaLTnecrRO.jpg",,,"false","1853629119293960670","false","false",
"true","false","https://pbs.twimg.com/profile_banners/1082197856/1726711977","Sat Jan 12 07:47:51 +0000 2013","Follower of Christ. Wife to Jeff. Mother to Ruby & Leo. A Nightmare for the Fake News. Trump-Endorsed Nominee for U.S. Senate in Arizona. #AmericaFirst","KariLake.com","http://KariLake.com","0","23","https://t.co/EmzgOS1TsY","0","37857","2416942","1046","true","1082197856","true","false","false","Arizona","9162","Kari Lake","1856869659783352689","false","https://pbs.twimg.com/profile_images/1600623137300750336/JAUThK8o_normal.jpg","","39424","https://twitter.com/KariLake","user","https://x.com/KariLake","KariLake","President Trump calls @RubenGallego an ""Open-Borders Zealot,' and that's EXACTLY what Ruben is.

Gallego has empowered the cartels. 

I want to confront them and bring an end to their reign of terror. https://t.co/D940qVKl8E","Mon Nov 04 21:32:51 +0000 2024","1616","54853","508","64","11","6","https://pbs.twimg.com/amplify_video_thumb/1853550862423007232/img/XjpIZWUHVvCWrK0J.jpg",,,"false","1853551004895043936","false","false",
"true","false","https://pbs.twimg.com/profile_banners/1082197856/1726711977","Sat Jan 12 07:47:51 +0000 2013","Follower of Christ. Wife to Jeff. Mother to Ruby & Leo. A Nightmare for the Fake News. Trump-Endorsed Nominee for U.S. Senate in Arizona. #AmericaFirst","KariLake.com","http://KariLake.com","0","23","https://t.co/EmzgOS1TsY","0","37857","2416942","1046","true","1082197856","true","false","false","Arizona","9162","Kari Lake","1856869659783352689","false","https://pbs.twimg.com/profile_images/1600623137300750336/JAUThK8o_normal.jpg","","39424","https://twitter.com/KariLake","user","https://x.com/KariLake","KariLake","If YOU vote, President Trump and I will win, &amp; we're going to do great things for Arizona. 

We will secure our southern border.

We will restore that strong Trump economy.

We will make sure our kids are getting a world-class education.

We will end these endless wars &amp; bring https://t.co/ab1lkIpNyp","Mon Nov 04 20:27:14 +0000 2024","4868","55544","1328","111","12","24","https://pbs.twimg.com/amplify_video_thumb/1853533997344718848/img/LKJitvBSZ9YJcoEA.jpg",,,"false","1853534489751777700","false","false",
"true","false","https://pbs.twimg.com/profile_banners/1082197856/1726711977","Sat Jan 12 07:47:51 +0000 2013","Follower of Christ. Wife to Jeff. Mother to Ruby & Leo. A Nightmare for the Fake News. Trump-Endorsed Nominee for U.S. Senate in Arizona. #AmericaFirst","KariLake.com","http://KariLake.com","0","23","https://t.co/EmzgOS1TsY","0","37857","2416942","1046","true","1082197856","true","false","false","Arizona","9162","Kari Lake","1856869659783352689","false","https://pbs.twimg.com/profile_images/1600623137300750336/JAUThK8o_normal.jpg","","39424","https://twitter.com/KariLake","user","https://x.com/KariLake","KariLake","Biden/Harris &amp; @RubenGallego Delivered More Migrants than Jobs to America in October.

We can’t go on like this.

A vote for Trump for President &amp; @KariLake for Senate is a vote to stop this madness, bring back jobs, and put Americans First. https://t.co/Ng4QULjvcs","Mon Nov 04 18:00:58 +0000 2024","1191","55281","475","56","15","9",,,,"false","1853497683681677612","false","false",
"true","false","https://pbs.twimg.com/profile_banners/1082197856/1726711977","Sat Jan 12 07:47:51 +0000 2013","Follower of Christ. Wife to Jeff. Mother to Ruby & Leo. A Nightmare for the Fake News. Trump-Endorsed Nominee for U.S. Senate in Arizona. #AmericaFirst","KariLake.com","http://KariLake.com","0","23","https://t.co/EmzgOS1TsY","0","37857","2416942","1046","true","1082197856","true","false","false","Arizona","9162","Kari Lake","1856869659783352689","false","https://pbs.twimg.com/profile_images/1600623137300750336/JAUThK8o_normal.jpg","","39424","https://twitter.com/KariLake","user","https://x.com/KariLake","KariLake","Arizona has been hit hard by Biden/Harris &amp; Gallego's two biggest crises': the open border &amp; record inflation.

The people understand there's no way to stop this unless we get President Trump in the White House &amp; @KariLake in the Senate.

The people are motivated.

We're at a https://t.co/7azKTawsi7","Mon Nov 04 01:52:10 +0000 2024","4220","69553","1122","96","9","16","https://pbs.twimg.com/amplify_video_thumb/1853253272154640385/img/CAOsK3M-2SDnRn-h.jpg",,,"false","1853253876201447819","false","false",
"true","false","https://pbs.twimg.com/profile_banners/1082197856/1726711977","Sat Jan 12 07:47:51 +0000 2013","Follower of Christ. Wife to Jeff. Mother to Ruby & Leo. A Nightmare for the Fake News. Trump-Endorsed Nominee for U.S. Senate in Arizona. #AmericaFirst","KariLake.com","http://KariLake.com","0","23","https://t.co/EmzgOS1TsY","0","37857","2416942","1046","true","1082197856","true","false","false","Arizona","9162","Kari Lake","1856869659783352689","false","https://pbs.twimg.com/profile_images/1600623137300750336/JAUThK8o_normal.jpg","","39424","https://twitter.com/KariLake","user","https://x.com/KariLake","KariLake","This is a tight race, but I believe the people will vote to return to the America First policies that worked.

We're seeing it everywhere we go, people saying, ""We're voting for Trump. We're voting for you. We've got to turn this around. We can't take it anymore with the border https://t.co/NO5Zy6uZmd","Sun Nov 03 21:04:44 +0000 2024","1788","59222","466","69","9","10","https://pbs.twimg.com/amplify_video_thumb/1853181349588606977/img/_0k4c1qMVV2HF73-.jpg",,,"false","1853181539355693458","false","false",
"true","false","https://pbs.twimg.com/profile_banners/1082197856/1726711977","Sat Jan 12 07:47:51 +0000 2013","Follower of Christ. Wife to Jeff. Mother to Ruby & Leo. A Nightmare for the Fake News. Trump-Endorsed Nominee for U.S. Senate in Arizona. #AmericaFirst","KariLake.com","http://KariLake.com","0","23","https://t.co/EmzgOS1TsY","0","37857","2416942","1046","true","1082197856","true","false","false","Arizona","9162","Kari Lake","1856869659783352689","false","https://pbs.twimg.com/profile_images/1600623137300750336/JAUThK8o_normal.jpg","","39424","https://twitter.com/KariLake","user","https://x.com/KariLake","KariLake",".@RubenGallego thinks that ALL Trump supporters are ""dumb"" and the ""worst people in the world.""

Well, I have a message for Ruben.

You can't lead Arizona if you don't love Arizonans. https://t.co/dm9NCn9v61","Sat Nov 02 23:10:01 +0000 2024","7207","160434","2355","192","37","39","https://pbs.twimg.com/amplify_video_thumb/1852849397119455232/img/UkgrtFX8oNwumbqv.jpg","https://pbs.twimg.com/amplify_video_thumb/1852849397169790976/img/dYLxBcH2X8CRU8Cr.jpg",,"false","1852850682295939169","false","false",
"true","false","https://pbs.twimg.com/profile_banners/1082197856/1726711977","Sat Jan 12 07:47:51 +0000 2013","Follower of Christ. Wife to Jeff. Mother to Ruby & Leo. A Nightmare for the Fake News. Trump-Endorsed Nominee for U.S. Senate in Arizona. #AmericaFirst","KariLake.com","http://KariLake.com","0","23","https://t.co/EmzgOS1TsY","0","37857","2416942","1046","true","1082197856","true","false","false","Arizona","9162","Kari Lake","1856869659783352689","false","https://pbs.twimg.com/profile_images/1600623137300750336/JAUThK8o_normal.jpg","","39424","https://twitter.com/KariLake","user","https://x.com/KariLake","KariLake","When Trump wanted a border wall, Ruben Gallego chose to be Trump's biggest obstacle.

When Biden took over, Ruben helped him turn a secure border into a crisis.

Gallego even called border security ""dumb and stupid.""

Securing that border is my priority.
https://t.co/Mn7xmLpzAm","Sat Nov 02 22:02:31 +0000 2024","1919","62513","710","88","9","7",,,,"false","1852833696333598948","false","false",
"true","false","https://pbs.twimg.com/profile_banners/1082197856/1726711977","Sat Jan 12 07:47:51 +0000 2013","Follower of Christ. Wife to Jeff. Mother to Ruby & Leo. A Nightmare for the Fake News. Trump-Endorsed Nominee for U.S. Senate in Arizona. #AmericaFirst","KariLake.com","http://KariLake.com","0","23","https://t.co/EmzgOS1TsY","0","37857","2416942","1046","true","1082197856","true","false","false","Arizona","9162","Kari Lake","1856869659783352689","false","https://pbs.twimg.com/profile_images/1600623137300750336/JAUThK8o_normal.jpg","","39424","https://twitter.com/KariLake","user","https://x.com/KariLake","KariLake","Long lines, broken machines, whatever happens on election day, DO NOT get out of line (unless it’s to go to another place to vote!)

We have a country to save. 

President Trump and I need you to Vote, Vote, VOTE!

Find your nearest polling location:
https://t.co/BAJemhfhTR","Sat Nov 02 14:20:41 +0000 2024","6714","60643","2441","166","33","18",,,,"false","1852717472652087689","false","false",
"true","false","https://pbs.twimg.com/profile_banners/1082197856/1726711977","Sat Jan 12 07:47:51 +0000 2013","Follower of Christ. Wife to Jeff. Mother to Ruby & Leo. A Nightmare for the Fake News. Trump-Endorsed Nominee for U.S. Senate in Arizona. #AmericaFirst","KariLake.com","http://KariLake.com","0","23","https://t.co/EmzgOS1TsY","0","37857","2416942","1046","true","1082197856","true","false","false","Arizona","9162","Kari Lake","1856869659783352689","false","https://pbs.twimg.com/profile_images/1600623137300750336/JAUThK8o_normal.jpg","","39424","https://twitter.com/KariLake","user","https://x.com/KariLake","KariLake","This race is going to go down to the wire, but I like our chances

If YOU show up, WE win

President Trump &amp; I need you to SWAMP THE VOTE

On Election Day, make a plan to vote, be prepared to wait in line &amp; cast the most important votes of your lifetime.
https://t.co/JisAi7aFq9 https://t.co/4razsyA2WO","Sat Nov 02 03:10:07 +0000 2024","5985","129231","1733","140","22","24","https://pbs.twimg.com/media/GbWTPYOXkAAigm1.jpg",,,"false","1852548717934490035","false","false",
"true","false","https://pbs.twimg.com/profile_banners/1082197856/1726711977","Sat Jan 12 07:47:51 +0000 2013","Follower of Christ. Wife to Jeff. Mother to Ruby & Leo. A Nightmare for the Fake News. Trump-Endorsed Nominee for U.S. Senate in Arizona. #AmericaFirst","KariLake.com","http://KariLake.com","0","23","https://t.co/EmzgOS1TsY","0","37857","2416942","1046","true","1082197856","true","false","false","Arizona","9162","Kari Lake","1856869659783352689","false","https://pbs.twimg.com/profile_images/1600623137300750336/JAUThK8o_normal.jpg","","39424","https://twitter.com/KariLake","user","https://x.com/KariLake","KariLake","Monday, we continue one of Arizona's finest traditions.

An Election Eve Rally on the steps of the Yavapai County Courthouse.

Join us at 6 PM in Prescott and cheer on President Trump, @KariLake, and the entire @AZGOP Ticket to victory. 

Free RSVP⤵️
https://t.co/DEa1Cs9Tuf https://t.co/ELZA4tI9CA","Fri Nov 01 23:30:14 +0000 2024","630","110529","180","28","4","3","https://pbs.twimg.com/media/GbVg6fcW0AEKJay.jpg",,,"false","1852493383559770585","false","false",
"true","false","https://pbs.twimg.com/profile_banners/1082197856/1726711977","Sat Jan 12 07:47:51 +0000 2013","Follower of Christ. Wife to Jeff. Mother to Ruby & Leo. A Nightmare for the Fake News. Trump-Endorsed Nominee for U.S. Senate in Arizona. #AmericaFirst","KariLake.com","http://KariLake.com","0","23","https://t.co/EmzgOS1TsY","0","37857","2416942","1046","true","1082197856","true","false","false","Arizona","9162","Kari Lake","1856869659783352689","false","https://pbs.twimg.com/profile_images/1600623137300750336/JAUThK8o_normal.jpg","","39424","https://twitter.com/KariLake","user","https://x.com/KariLake","KariLake","Hey @mcuban,

My name is Kari Lake.

I'm a strong, intelligent woman, and I support President Trump.

And there are millions just like me all across this great country.

#WomenForTrump https://t.co/Zb6v4DUwIB","Thu Oct 31 22:38:53 +0000 2024","77006","651003","17786","3358","378","550","https://pbs.twimg.com/amplify_video_thumb/1852118013526347776/img/cOy23uuWk3OhKbhx.jpg",,,"false","1852118069138853982","false","false",
"true","false","https://pbs.twimg.com/profile_banners/1082197856/1726711977","Sat Jan 12 07:47:51 +0000 2013","Follower of Christ. Wife to Jeff. Mother to Ruby & Leo. A Nightmare for the Fake News. Trump-Endorsed Nominee for U.S. Senate in Arizona. #AmericaFirst","KariLake.com","http://KariLake.com","0","23","https://t.co/EmzgOS1TsY","0","37857","2416942","1046","true","1082197856","true","false","false","Arizona","9162","Kari Lake","1856869659783352689","false","https://pbs.twimg.com/profile_images/1600623137300750336/JAUThK8o_normal.jpg","","39424","https://twitter.com/KariLake","user","https://x.com/KariLake","KariLake","I raised a strong, intelligent woman—and she supports Donald J Trump.","Thu Oct 31 21:38:10 +0000 2024","6055","100450","905","78","3","15",,,"1852097614831116418","false","1852102789566025823","false","true",
"true","false","https://pbs.twimg.com/profile_banners/1082197856/1726711977","Sat Jan 12 07:47:51 +0000 2013","Follower of Christ. Wife to Jeff. Mother to Ruby & Leo. A Nightmare for the Fake News. Trump-Endorsed Nominee for U.S. Senate in Arizona. #AmericaFirst","KariLake.com","http://KariLake.com","0","23","https://t.co/EmzgOS1TsY","0","37857","2416942","1046","true","1082197856","true","false","false","Arizona","9162","Kari Lake","1856869659783352689","false","https://pbs.twimg.com/profile_images/1600623137300750336/JAUThK8o_normal.jpg","","39424","https://twitter.com/KariLake","user","https://x.com/KariLake","KariLake","Hey Mark Cuban,
Strong, intelligent women everywhere are supporting President Trump. 

Smart women want a secure border, safe streets, a strong economy, world peace, and great schools. 

We want an America First Agenda. https://t.co/Ggy8EOm0vB","Thu Oct 31 20:00:26 +0000 2024","43943","360150","9174","1261","171","194","https://pbs.twimg.com/media/GbPnTauXUAAZCmK.jpg",,,"false","1852078195702395209","false","false",
"true","false","https://pbs.twimg.com/profile_banners/1082197856/1726711977","Sat Jan 12 07:47:51 +0000 2013","Follower of Christ. Wife to Jeff. Mother to Ruby & Leo. A Nightmare for the Fake News. Trump-Endorsed Nominee for U.S. Senate in Arizona. #AmericaFirst","KariLake.com","http://KariLake.com","0","23","https://t.co/EmzgOS1TsY","0","37857","2416942","1046","true","1082197856","true","false","false","Arizona","9162","Kari Lake","1856869659783352689","false","https://pbs.twimg.com/profile_images/1600623137300750336/JAUThK8o_normal.jpg","","39424","https://twitter.com/KariLake","user","https://x.com/KariLake","KariLake","To make matters worse, Radical @RubenGallego also called Trump supporters ""dumb.""

He throws that word around a lot. He called the border wall ""dumb &amp; stupid,"" too.

Ruben isn't smart enough to recognize that he has no business representing a country that he hates half of. https://t.co/wkUABMNdYv","Thu Oct 31 16:02:40 +0000 2024","1032","82196","441","80","14","16","https://pbs.twimg.com/amplify_video_thumb/1852017932366176256/img/Rma6qqEBzOV9n6gY.jpg",,,"true","1852018357907632346","false","false","1082197856"
"true","false","https://pbs.twimg.com/profile_banners/1082197856/1726711977","Sat Jan 12 07:47:51 +0000 2013","Follower of Christ. Wife to Jeff. Mother to Ruby & Leo. A Nightmare for the Fake News. Trump-Endorsed Nominee for U.S. Senate in Arizona. #AmericaFirst","KariLake.com","http://KariLake.com","0","23","https://t.co/EmzgOS1TsY","0","37857","2416942","1046","true","1082197856","true","false","false","Arizona","9162","Kari Lake","1856869659783352689","false","https://pbs.twimg.com/profile_images/1600623137300750336/JAUThK8o_normal.jpg","","39424","https://twitter.com/KariLake","user","https://x.com/KariLake","KariLake","🚨Watch And Share🚨

It's one thing for you to read that @RubenGallego called Trump supporters ""the worst people in the world.""

It's another thing to hear it from the man himself.

Radical Ruben Gallego hates us, and a man who hates us can NEVER represent us.

#MAGA
#Trump https://t.co/5W9GvrtAfZ","Thu Oct 31 16:00:58 +0000 2024","2505","113173","1380","134","51","41","https://pbs.twimg.com/amplify_video_thumb/1852017831300288512/img/jBVNMuqHPSW5eIWm.jpg",,,"false","1852017930273214528","false","false",
"true","false","https://pbs.twimg.com/profile_banners/1082197856/1726711977","Sat Jan 12 07:47:51 +0000 2013","Follower of Christ. Wife to Jeff. Mother to Ruby & Leo. A Nightmare for the Fake News. Trump-Endorsed Nominee for U.S. Senate in Arizona. #AmericaFirst","KariLake.com","http://KariLake.com","0","23","https://t.co/EmzgOS1TsY","0","37857","2416942","1046","true","1082197856","true","false","false","Arizona","9162","Kari Lake","1856869659783352689","false","https://pbs.twimg.com/profile_images/1600623137300750336/JAUThK8o_normal.jpg","","39424","https://twitter.com/KariLake","user","https://x.com/KariLake","KariLake","President Trump needs backup in Washington DC.

While he's in the White House, Making America Great Again🇺🇸

I will be hard at work in the Senate Making Arizona Grand Again!🌵

Every Vote Counts!

Find your nearest polling place: https://t.co/BAJemhfhTR https://t.co/GZK1rGZvbK","Thu Oct 31 04:30:23 +0000 2024","2107","84383","514","54","7","13","https://pbs.twimg.com/amplify_video_thumb/1851842329126014977/img/pofZonvYtLAZkat8.jpg",,,"false","1851844140272673095","false","false",
"true","false","https://pbs.twimg.com/profile_banners/1082197856/1726711977","Sat Jan 12 07:47:51 +0000 2013","Follower of Christ. Wife to Jeff. Mother to Ruby & Leo. A Nightmare for the Fake News. Trump-Endorsed Nominee for U.S. Senate in Arizona. #AmericaFirst","KariLake.com","http://KariLake.com","0","23","https://t.co/EmzgOS1TsY","0","37857","2416942","1046","true","1082197856","true","false","false","Arizona","9162","Kari Lake","1856869659783352689","false","https://pbs.twimg.com/profile_images/1600623137300750336/JAUThK8o_normal.jpg","","39424","https://twitter.com/KariLake","user","https://x.com/KariLake","KariLake","The guy that said Trump supporters are “dumb” and “the worst people” refuses to disavow calling them “garbage” 

Color me shocked… 
@RubenGallego https://t.co/EPVR0RU83L","Thu Oct 31 01:34:46 +0000 2024","1179","75542","287","45","4","6","https://pbs.twimg.com/media/GbLqPPJWYAAr-HQ.jpg",,,"false","1851799947537969400","false","false",
"true","false","https://pbs.twimg.com/profile_banners/1082197856/1726711977","Sat Jan 12 07:47:51 +0000 2013","Follower of Christ. Wife to Jeff. Mother to Ruby & Leo. A Nightmare for the Fake News. Trump-Endorsed Nominee for U.S. Senate in Arizona. #AmericaFirst","KariLake.com","http://KariLake.com","0","23","https://t.co/EmzgOS1TsY","0","37857","2416942","1046","true","1082197856","true","false","false","Arizona","9162","Kari Lake","1856869659783352689","false","https://pbs.twimg.com/profile_images/1600623137300750336/JAUThK8o_normal.jpg","","39424","https://twitter.com/KariLake","user","https://x.com/KariLake","KariLake","Classic Trump!","Wed Oct 30 22:51:12 +0000 2024","6660","94498","1088","182","13","36",,,"1851753216934903956","false","1851758784722669836","false","true",
"true","false","https://pbs.twimg.com/profile_banners/1082197856/1726711977","Sat Jan 12 07:47:51 +0000 2013","Follower of Christ. Wife to Jeff. Mother to Ruby & Leo. A Nightmare for the Fake News. Trump-Endorsed Nominee for U.S. Senate in Arizona. #AmericaFirst","KariLake.com","http://KariLake.com","0","23","https://t.co/EmzgOS1TsY","0","37857","2416942","1046","true","1082197856","true","false","false","Arizona","9162","Kari Lake","1856869659783352689","false","https://pbs.twimg.com/profile_images/1600623137300750336/JAUThK8o_normal.jpg","","39424","https://twitter.com/KariLake","user","https://x.com/KariLake","KariLake","Ruben Gallego hopes that a bunch of phony ads &amp; an extreme makeover will make half the country forget the contempt he has for them.

Ruben said Donald Trump ""drew out the worst people in the world.”

Gallego is just like Joe Biden. He thinks we're garbage.
https://t.co/Et0ni6zkcr","Wed Oct 30 20:00:55 +0000 2024","1264","66787","447","93","4","8",,,,"false","1851715929589321815","false","false",
"true","false","https://pbs.twimg.com/profile_banners/1082197856/1726711977","Sat Jan 12 07:47:51 +0000 2013","Follower of Christ. Wife to Jeff. Mother to Ruby & Leo. A Nightmare for the Fake News. Trump-Endorsed Nominee for U.S. Senate in Arizona. #AmericaFirst","KariLake.com","http://KariLake.com","0","23","https://t.co/EmzgOS1TsY","0","37857","2416942","1046","true","1082197856","true","false","false","Arizona","9162","Kari Lake","1856869659783352689","false","https://pbs.twimg.com/profile_images/1600623137300750336/JAUThK8o_normal.jpg","","39424","https://twitter.com/KariLake","user","https://x.com/KariLake","KariLake","Will @RubenGallego denounce Joe Biden calling President Trump supporters garbage? 

Probably not since Ruben called us “the worst people in the world.”","Wed Oct 30 12:43:25 +0000 2024","1917","46601","456","103","10","12",,,,"false","1851605830317076523","false","false",
"true","false","https://pbs.twimg.com/profile_banners/1082197856/1726711977","Sat Jan 12 07:47:51 +0000 2013","Follower of Christ. Wife to Jeff. Mother to Ruby & Leo. A Nightmare for the Fake News. Trump-Endorsed Nominee for U.S. Senate in Arizona. #AmericaFirst","KariLake.com","http://KariLake.com","0","23","https://t.co/EmzgOS1TsY","0","37857","2416942","1046","true","1082197856","true","false","false","Arizona","9162","Kari Lake","1856869659783352689","false","https://pbs.twimg.com/profile_images/1600623137300750336/JAUThK8o_normal.jpg","","39424","https://twitter.com/KariLake","user","https://x.com/KariLake","KariLake","The biggest lie the media tries to sell us is that we're divided.

We agree on FAR more than we disagree about.

A secure border, a strong economy, &amp; a solid education. These things are common sense.

That's why the vast majority are going to vote Trump for President &amp; Kari Lake https://t.co/xKWzForOMR","Tue Oct 29 01:01:46 +0000 2024","2460","69203","582","158","9","18","https://pbs.twimg.com/amplify_video_thumb/1851066790945660929/img/jm8-DqtkFZjIvL4E.jpg",,,"false","1851066866132988070","false","false",
