"author/canDm","author/canMediaTag","author/coverPicture","author/createdAt","author/description","author/entities/url/urls/0/display_url","author/entities/url/urls/0/expanded_url","author/entities/url/urls/0/indices/0","author/entities/url/urls/0/indices/1","author/entities/url/urls/0/url","author/fastFollowersCount","author/favouritesCount","author/followers","author/following","author/hasCustomTimelines","author/id","author/isBlueVerified","author/isTranslator","author/isVerified","author/location","author/mediaCount","author/name","author/pinnedTweetIds/0","author/possiblySensitive","author/profilePicture","author/status","author/statusesCount","author/twitterUrl","author/type","author/url","author/userName","fullText","createdAt","likeCount","viewCount","retweetCount","replyCount","quoteCount","bookmarkCount","media/0","media/1","quoteId","isReply","id","isRetweet","isQuote","inReplyToUserId"
"true","false","https://pbs.twimg.com/profile_banners/1082197856/1726711977","Sat Jan 12 07:47:51 +0000 2013","Follower of Christ. Wife to Jeff. Mother to Ruby & Leo. A Nightmare for the Fake News. Trump-Endorsed Nominee for U.S. Senate in Arizona. #AmericaFirst","KariLake.com","http://KariLake.com","0","23","https://t.co/EmzgOS1TsY","0","37857","2416942","1046","true","1082197856","true","false","false","Arizona","9162","Kari Lake","1856869659783352689","false","https://pbs.twimg.com/profile_images/1600623137300750336/JAUThK8o_normal.jpg","","39424","https://twitter.com/KariLake","user","https://x.com/KariLake","KariLake","We are on the verge of accomplishing great things for America. President Trump &amp; I need your VOTE to do it.

It's not enough to win the White House.

Trump needs the Senate. He needs Congress to help him deliver us a secure border. A strong economy &amp; bring back an American spirit https://t.co/fLLJ6rqCUm","Tue Oct 29 00:04:56 +0000 2024","7938","110759","2033","171","23","51","https://pbs.twimg.com/amplify_video_thumb/1851052496136851456/img/m2JcUCDi0bM4U7d3.jpg",,,"false","1851052564537917793","false","false",
"true","false","https://pbs.twimg.com/profile_banners/1082197856/1726711977","Sat Jan 12 07:47:51 +0000 2013","Follower of Christ. Wife to Jeff. Mother to Ruby & Leo. A Nightmare for the Fake News. Trump-Endorsed Nominee for U.S. Senate in Arizona. #AmericaFirst","KariLake.com","http://KariLake.com","0","23","https://t.co/EmzgOS1TsY","0","37857","2416942","1046","true","1082197856","true","false","false","Arizona","9162","Kari Lake","1856869659783352689","false","https://pbs.twimg.com/profile_images/1600623137300750336/JAUThK8o_normal.jpg","","39424","https://twitter.com/KariLake","user","https://x.com/KariLake","KariLake","@elonmusk @Rach_IC Vote early!

Vote Trump for President and @KariLake for Senate!

https://t.co/Nc4tCQby7d","Mon Oct 28 23:13:47 +0000 2024","1227","75937","217","68","7","6",,,,"true","1851039690360504531","false","false","44196397"
"true","false","https://pbs.twimg.com/profile_banners/1082197856/1726711977","Sat Jan 12 07:47:51 +0000 2013","Follower of Christ. Wife to Jeff. Mother to Ruby & Leo. A Nightmare for the Fake News. Trump-Endorsed Nominee for U.S. Senate in Arizona. #AmericaFirst","KariLake.com","http://KariLake.com","0","23","https://t.co/EmzgOS1TsY","0","37857","2416942","1046","true","1082197856","true","false","false","Arizona","9162","Kari Lake","1856869659783352689","false","https://pbs.twimg.com/profile_images/1600623137300750336/JAUThK8o_normal.jpg","","39424","https://twitter.com/KariLake","user","https://x.com/KariLake","KariLake","Biden/Harris &amp; Gallego inherited a secure border &amp; a prosperous economy &amp; ripped them wide open.

They've never acted in our best interest, Ruben said, ""Trump voters are the worst people in the world.""

People who hate us can't represent us.

President Trump &amp; I want to put https://t.co/glxmeyYrpA","Mon Oct 28 23:03:59 +0000 2024","1600","58261","552","50","7","13","https://pbs.twimg.com/amplify_video_thumb/1851037145491726336/img/jad46n8Y8IpA2N4m.jpg",,,"false","1851037225909383599","false","false",
"true","false","https://pbs.twimg.com/profile_banners/1082197856/1726711977","Sat Jan 12 07:47:51 +0000 2013","Follower of Christ. Wife to Jeff. Mother to Ruby & Leo. A Nightmare for the Fake News. Trump-Endorsed Nominee for U.S. Senate in Arizona. #AmericaFirst","KariLake.com","http://KariLake.com","0","23","https://t.co/EmzgOS1TsY","0","37857","2416942","1046","true","1082197856","true","false","false","Arizona","9162","Kari Lake","1856869659783352689","false","https://pbs.twimg.com/profile_images/1600623137300750336/JAUThK8o_normal.jpg","","39424","https://twitter.com/KariLake","user","https://x.com/KariLake","KariLake","President Trump's rally in Madison Square Garden was something special.

I've always said New York is much more #MAGA than anyone would believe.

Yesterday, The America First Movement proved it. https://t.co/mMrBB8glLR","Mon Oct 28 22:01:39 +0000 2024","1664","57267","340","47","4","8","https://pbs.twimg.com/amplify_video_thumb/1851021480412196864/img/NdZLUNU3LCeh8XYK.jpg",,,"false","1851021539019247883","false","false",
"true","false","https://pbs.twimg.com/profile_banners/1082197856/1726711977","Sat Jan 12 07:47:51 +0000 2013","Follower of Christ. Wife to Jeff. Mother to Ruby & Leo. A Nightmare for the Fake News. Trump-Endorsed Nominee for U.S. Senate in Arizona. #AmericaFirst","KariLake.com","http://KariLake.com","0","23","https://t.co/EmzgOS1TsY","0","37857","2416942","1046","true","1082197856","true","false","false","Arizona","9162","Kari Lake","1856869659783352689","false","https://pbs.twimg.com/profile_images/1600623137300750336/JAUThK8o_normal.jpg","","39424","https://twitter.com/KariLake","user","https://x.com/KariLake","KariLake","I'm just a fed-up middle-aged mom.

I REFUSE to watch as my children's future &amp; the state I love are destroyed by the policies of Kamala &amp; Ruben Gallego.

When you vote Trump for President &amp; @KariLake for Senate, we're going to get tough &amp; Save Arizona.

https://t.co/rND7Gz3z4l https://t.co/0tcNeIcHyY","Mon Oct 28 20:31:45 +0000 2024","1500","43613","383","45","6","8","https://pbs.twimg.com/media/GbARsphWgAARAyK.jpg",,,"false","1850998912670126576","false","false",
"true","false","https://pbs.twimg.com/profile_banners/1082197856/1726711977","Sat Jan 12 07:47:51 +0000 2013","Follower of Christ. Wife to Jeff. Mother to Ruby & Leo. A Nightmare for the Fake News. Trump-Endorsed Nominee for U.S. Senate in Arizona. #AmericaFirst","KariLake.com","http://KariLake.com","0","23","https://t.co/EmzgOS1TsY","0","37857","2416942","1046","true","1082197856","true","false","false","Arizona","9162","Kari Lake","1856869659783352689","false","https://pbs.twimg.com/profile_images/1600623137300750336/JAUThK8o_normal.jpg","","39424","https://twitter.com/KariLake","user","https://x.com/KariLake","KariLake","A few years ago, President Trump went to Ruben Gallego &amp; the Democrats &amp; said, ""Let's make a deal.""

“Let's take these #DACA recipients, &amp; make them citizens in exchange for building the border wall.”

The Democrats said no. 

Gallego &amp; his fellow radicals don't want to secure https://t.co/YvpeyI5n7M","Mon Oct 28 03:00:16 +0000 2024","5013","117775","1624","49","13","71","https://pbs.twimg.com/amplify_video_thumb/1850734210178326528/img/pZrmX0bVc8gy2HXv.jpg",,,"false","1850734297524658637","false","false",
"true","false","https://pbs.twimg.com/profile_banners/1082197856/1726711977","Sat Jan 12 07:47:51 +0000 2013","Follower of Christ. Wife to Jeff. Mother to Ruby & Leo. A Nightmare for the Fake News. Trump-Endorsed Nominee for U.S. Senate in Arizona. #AmericaFirst","KariLake.com","http://KariLake.com","0","23","https://t.co/EmzgOS1TsY","0","37857","2416942","1046","true","1082197856","true","false","false","Arizona","9162","Kari Lake","1856869659783352689","false","https://pbs.twimg.com/profile_images/1600623137300750336/JAUThK8o_normal.jpg","","39424","https://twitter.com/KariLake","user","https://x.com/KariLake","KariLake","Donald J. Trump is the man who will bring back STRENGTH to America!

📷: @EricTrump https://t.co/SnRu2FpRjI","Sun Oct 27 22:52:48 +0000 2024","2662","52323","422","95","9","26","https://pbs.twimg.com/media/Ga7oZQyXEAA9XF4.jpg",,,"false","1850672021857878439","false","false",
"true","false","https://pbs.twimg.com/profile_banners/1082197856/1726711977","Sat Jan 12 07:47:51 +0000 2013","Follower of Christ. Wife to Jeff. Mother to Ruby & Leo. A Nightmare for the Fake News. Trump-Endorsed Nominee for U.S. Senate in Arizona. #AmericaFirst","KariLake.com","http://KariLake.com","0","23","https://t.co/EmzgOS1TsY","0","37857","2416942","1046","true","1082197856","true","false","false","Arizona","9162","Kari Lake","1856869659783352689","false","https://pbs.twimg.com/profile_images/1600623137300750336/JAUThK8o_normal.jpg","","39424","https://twitter.com/KariLake","user","https://x.com/KariLake","KariLake","I imagine the media is sick of covering the open border, but that's nothing compared to how the people of Arizona feel about experiencing the consequences of it.

That's why, starting in January 2025, I will work with President Trump to complete the wall from the Gulf Coast to https://t.co/D3n6JOrXtY","Sun Oct 27 22:07:42 +0000 2024","6311","74147","1660","65","12","31","https://pbs.twimg.com/amplify_video_thumb/1850660588277686272/img/WWrzOYTGcGJ_S5Bo.jpg",,,"false","1850660672449003886","false","false",
"true","false","https://pbs.twimg.com/profile_banners/1082197856/1726711977","Sat Jan 12 07:47:51 +0000 2013","Follower of Christ. Wife to Jeff. Mother to Ruby & Leo. A Nightmare for the Fake News. Trump-Endorsed Nominee for U.S. Senate in Arizona. #AmericaFirst","KariLake.com","http://KariLake.com","0","23","https://t.co/EmzgOS1TsY","0","37857","2416942","1046","true","1082197856","true","false","false","Arizona","9162","Kari Lake","1856869659783352689","false","https://pbs.twimg.com/profile_images/1600623137300750336/JAUThK8o_normal.jpg","","39424","https://twitter.com/KariLake","user","https://x.com/KariLake","KariLake","The media makes me out to be a monster. If I'm a monster, then I'm a monster fighting for my kids, fighting for the next generation. 

This has always been about securing a better future for America.

If we don't get out &amp; vote for Donald Trump &amp; Patriots like Kari Lake for https://t.co/WitrxV2VFt","Sun Oct 27 18:50:23 +0000 2024","1962","36068","591","63","9","16","https://pbs.twimg.com/amplify_video_thumb/1850598479422181376/img/wmTM9rK2wbCgufr3.jpg",,,"false","1850611016280994215","false","false",
"true","false","https://pbs.twimg.com/profile_banners/1082197856/1726711977","Sat Jan 12 07:47:51 +0000 2013","Follower of Christ. Wife to Jeff. Mother to Ruby & Leo. A Nightmare for the Fake News. Trump-Endorsed Nominee for U.S. Senate in Arizona. #AmericaFirst","KariLake.com","http://KariLake.com","0","23","https://t.co/EmzgOS1TsY","0","37857","2416942","1046","true","1082197856","true","false","false","Arizona","9162","Kari Lake","1856869659783352689","false","https://pbs.twimg.com/profile_images/1600623137300750336/JAUThK8o_normal.jpg","","39424","https://twitter.com/KariLake","user","https://x.com/KariLake","KariLake","🚨New Ad🚨

Gallego is ""An Open Borders, Defund the Police Maniac”

President Trump knows EXACTLY how Radical Ruben really is

Trump needs @KariLake to be his backup in Washington D.C., &amp; help him secure our border

With Trump AND Lake: Arizona Can Vote For The Trump Agenda Twice https://t.co/OwcXZikuPD","Sat Oct 26 18:03:12 +0000 2024","2902","222111","1069","119","18","28","https://pbs.twimg.com/amplify_video_thumb/1850236662309072896/img/ZUz6YRNwK8UgE1Yw.jpg",,,"false","1850236752352497859","false","false",
"true","false","https://pbs.twimg.com/profile_banners/1082197856/1726711977","Sat Jan 12 07:47:51 +0000 2013","Follower of Christ. Wife to Jeff. Mother to Ruby & Leo. A Nightmare for the Fake News. Trump-Endorsed Nominee for U.S. Senate in Arizona. #AmericaFirst","KariLake.com","http://KariLake.com","0","23","https://t.co/EmzgOS1TsY","0","37857","2416942","1046","true","1082197856","true","false","false","Arizona","9162","Kari Lake","1856869659783352689","false","https://pbs.twimg.com/profile_images/1600623137300750336/JAUThK8o_normal.jpg","","39424","https://twitter.com/KariLake","user","https://x.com/KariLake","KariLake","This guy is a machine! Go Trump!!","Sat Oct 26 16:04:38 +0000 2024","3844","76195","696","100","14","41",,,"1849823498413494730","false","1850206913725612299","false","true",
"true","false","https://pbs.twimg.com/profile_banners/1082197856/1726711977","Sat Jan 12 07:47:51 +0000 2013","Follower of Christ. Wife to Jeff. Mother to Ruby & Leo. A Nightmare for the Fake News. Trump-Endorsed Nominee for U.S. Senate in Arizona. #AmericaFirst","KariLake.com","http://KariLake.com","0","23","https://t.co/EmzgOS1TsY","0","37857","2416942","1046","true","1082197856","true","false","false","Arizona","9162","Kari Lake","1856869659783352689","false","https://pbs.twimg.com/profile_images/1600623137300750336/JAUThK8o_normal.jpg","","39424","https://twitter.com/KariLake","user","https://x.com/KariLake","KariLake","I believe America's brightest days are ahead.

That's why I want our young Americans to dream BIG.

When you get out &amp; vote to return President Trump to the White House &amp; send Kari Lake to the Senate, we're going to get to work saving our country &amp; making those BIG dreams a https://t.co/wyArC2cmI6","Sat Oct 26 03:38:30 +0000 2024","1484","75445","290","43","4","10","https://pbs.twimg.com/amplify_video_thumb/1850018652533260288/img/pSJQIuU2zOMhccjE.jpg",,,"false","1850019143837417571","false","false",
"true","false","https://pbs.twimg.com/profile_banners/1082197856/1726711977","Sat Jan 12 07:47:51 +0000 2013","Follower of Christ. Wife to Jeff. Mother to Ruby & Leo. A Nightmare for the Fake News. Trump-Endorsed Nominee for U.S. Senate in Arizona. #AmericaFirst","KariLake.com","http://KariLake.com","0","23","https://t.co/EmzgOS1TsY","0","37857","2416942","1046","true","1082197856","true","false","false","Arizona","9162","Kari Lake","1856869659783352689","false","https://pbs.twimg.com/profile_images/1600623137300750336/JAUThK8o_normal.jpg","","39424","https://twitter.com/KariLake","user","https://x.com/KariLake","KariLake","Biden/Harris &amp; Gallego have ceded control of our southern border to the cartels &amp; created an environment where the cartels can exploit &amp; endanger Americans,

On Day 1 in the Senate, I will work with President Trump to stop the cartels &amp; secure our border.
https://t.co/zxtfQFRYdo","Sat Oct 26 01:27:44 +0000 2024","1133","62892","311","40","3","11",,,,"false","1849986236708159625","false","false",
"true","false","https://pbs.twimg.com/profile_banners/1082197856/1726711977","Sat Jan 12 07:47:51 +0000 2013","Follower of Christ. Wife to Jeff. Mother to Ruby & Leo. A Nightmare for the Fake News. Trump-Endorsed Nominee for U.S. Senate in Arizona. #AmericaFirst","KariLake.com","http://KariLake.com","0","23","https://t.co/EmzgOS1TsY","0","37857","2416942","1046","true","1082197856","true","false","false","Arizona","9162","Kari Lake","1856869659783352689","false","https://pbs.twimg.com/profile_images/1600623137300750336/JAUThK8o_normal.jpg","","39424","https://twitter.com/KariLake","user","https://x.com/KariLake","KariLake","Arizona—
President Trump will bring back a strong economy and a secure border and I will work for those same goals in the US Senate. 

We both love America and we will work tirelessly to make our country great!

We need you to vote early.  If you don’t have your mail-in ballot https://t.co/NDFvaErfs9","Fri Oct 25 17:45:53 +0000 2024","4951","49977","1239","132","20","19","https://pbs.twimg.com/media/GawO9LLbAAAIwqZ.jpg","https://pbs.twimg.com/media/GawO9LYaAAAKgkY.jpg",,"false","1849870006273835433","false","false",
"true","false","https://pbs.twimg.com/profile_banners/1082197856/1726711977","Sat Jan 12 07:47:51 +0000 2013","Follower of Christ. Wife to Jeff. Mother to Ruby & Leo. A Nightmare for the Fake News. Trump-Endorsed Nominee for U.S. Senate in Arizona. #AmericaFirst","KariLake.com","http://KariLake.com","0","23","https://t.co/EmzgOS1TsY","0","37857","2416942","1046","true","1082197856","true","false","false","Arizona","9162","Kari Lake","1856869659783352689","false","https://pbs.twimg.com/profile_images/1600623137300750336/JAUThK8o_normal.jpg","","39424","https://twitter.com/KariLake","user","https://x.com/KariLake","KariLake","Watch: @KariLake Delivers Hilarious Speech At Trump’s Tempe Rally! 😆 https://t.co/rJDJPxKEUJ","Fri Oct 25 04:27:43 +0000 2024","2014","50554","476","48","9","53","https://pbs.twimg.com/amplify_video_thumb/1849668900482342912/img/2P-uH_-w7nD4SrY7.jpg",,,"false","1849669142401487148","false","false",
"true","false","https://pbs.twimg.com/profile_banners/1082197856/1726711977","Sat Jan 12 07:47:51 +0000 2013","Follower of Christ. Wife to Jeff. Mother to Ruby & Leo. A Nightmare for the Fake News. Trump-Endorsed Nominee for U.S. Senate in Arizona. #AmericaFirst","KariLake.com","http://KariLake.com","0","23","https://t.co/EmzgOS1TsY","0","37857","2416942","1046","true","1082197856","true","false","false","Arizona","9162","Kari Lake","1856869659783352689","false","https://pbs.twimg.com/profile_images/1600623137300750336/JAUThK8o_normal.jpg","","39424","https://twitter.com/KariLake","user","https://x.com/KariLake","KariLake","WATCH: Crowd ERUPTS When President Trump Gives @KariLake A Shoutout! 

DONATE: https://t.co/J8QRdfEEhR https://t.co/7kgqrrlSeI","Fri Oct 25 02:30:00 +0000 2024","6085","93102","1326","95","19","44","https://pbs.twimg.com/media/Gas7Y0-WoAAJ_Qd.jpg",,,"false","1849639519164956802","false","false",
