"author/canDm","author/canMediaTag","author/coverPicture","author/createdAt","author/description","author/entities/description/urls/0/display_url","author/entities/description/urls/0/expanded_url","author/entities/description/urls/0/indices/0","author/entities/description/urls/0/indices/1","author/entities/description/urls/0/url","author/entities/url/urls/0/display_url","author/entities/url/urls/0/expanded_url","author/entities/url/urls/0/indices/0","author/entities/url/urls/0/indices/1","author/entities/url/urls/0/url","author/fastFollowersCount","author/favouritesCount","author/followers","author/following","author/hasCustomTimelines","author/id","author/isBlueVerified","author/isTranslator","author/isVerified","author/location","author/mediaCount","author/name","author/pinnedTweetIds/0","author/possiblySensitive","author/profilePicture","author/status","author/statusesCount","author/twitterUrl","author/type","author/url","author/userName","text","createdAt"
"false","true","https://pbs.twimg.com/profile_banners/289118612/1611463502","Thu Apr 28 01:56:15 +0000 2011","Tomthunkit's Mind Diner is open 24/7. All-you-can-eat smorgasbord of hand-picked deliciously sweet tweets for your political palate. Invest ($) in your future",,,,,,"gofund.me/f87dee82","https://gofund.me/f87dee82","0","23","https://t.co/9hCbcig3Ri","0","31137","82553","60914","true","289118612","true","false","false","In Your Mind Now","3121081","Tomthunkit™","1852345066439995428","false","https://pbs.twimg.com/profile_images/1621261829417717760/hOeHkGJk_normal.jpg","","3557450","https://twitter.com/TomthunkitsMind","user","https://x.com/TomthunkitsMind","TomthunkitsMind","The Useful Idiot Is No Longer Useful To trump. Therefore, Devin Nunes Steps Aside From House Investigation on Russia https://t.co/WDKF4AYJBD https://t.co/Gjuu7zkDo3","Sun Apr 16 23:45:25 +0000 2017"
"false","false","https://pbs.twimg.com/profile_banners/71651549/1457587077","Fri Sep 04 22:00:37 +0000 2009","Virgo With Libra Rising. INFJ. Gratitude + Karma Is The Path. Obsessed With Interior Design. Impressed By Humility. Opinions are mine only. ☮️☯️🕉️
🇮🇱 🇺🇦",,,,,,,,,,,"0","56343","989","896","true","71651549","false","false","false","Las Vegas","396","Akiko ♍","851199033259380736","false","https://pbs.twimg.com/profile_images/1490251318501380100/xWc5tbtH_normal.jpg","","43152","https://twitter.com/Autumnchild68","user","https://x.com/Autumnchild68","Autumnchild68","@PodSaveAmerica @jonfavs @TVietor08 @jonlovett Q: Do you think the Trump-Russia investigation will implicate Trump and if yes to what end?","Sun Apr 16 22:51:56 +0000 2017"
"false","true","https://pbs.twimg.com/profile_banners/289118612/1611463502","Thu Apr 28 01:56:15 +0000 2011","Tomthunkit's Mind Diner is open 24/7. All-you-can-eat smorgasbord of hand-picked deliciously sweet tweets for your political palate. Invest ($) in your future",,,,,,"gofund.me/f87dee82","https://gofund.me/f87dee82","0","23","https://t.co/9hCbcig3Ri","0","31137","82553","60914","true","289118612","true","false","false","In Your Mind Now","3121081","Tomthunkit™","1852345066439995428","false","https://pbs.twimg.com/profile_images/1621261829417717760/hOeHkGJk_normal.jpg","","3557450","https://twitter.com/TomthunkitsMind","user","https://x.com/TomthunkitsMind","TomthunkitsMind","The Useful Idiot Is No Longer Useful To trump. Therefore, Devin Nunes Steps Aside From House Investigation on Russia https://t.co/WDKF4AYJBD https://t.co/ECIyE4Ls3I","Sun Apr 16 22:45:23 +0000 2017"
"true","false","https://pbs.twimg.com/profile_banners/796784197507518464/1515277700","Thu Nov 10 18:38:51 +0000 2016","Combat Vet-Backing Trump-Famous Blackjack Team Leader. a.k.a. Doug Grant.  Genius level IQ. ""Professor with pinky ring"" (Newsday). ""Brilliant"" (Phil Inquirer)",,,,,,,,,,,"0","1170","12216","12433","true","796784197507518464","true","false","false","Washington, USA","108","Douglas Reimann",,"false","https://pbs.twimg.com/profile_images/949769084136128512/iv99J4ot_normal.jpg","","124956","https://twitter.com/dgvreiman","user","https://x.com/dgvreiman","dgvreiman","@nytimes Explosive investigation? BWHAHAHA - nothing there! No evidence! No connection of Trump to Russia! None. Nada, never was, zip, nope.","Sun Apr 16 22:33:00 +0000 2017"
"false","true","https://pbs.twimg.com/profile_banners/1375054758/1493159118","Tue Apr 23 17:27:19 +0000 2013","Hall of Fame recipient. Sons of Anarchy adult casting S 7. Core background seasons 1-4 resist trump the liar. follow me to stop Trump I will follow back #FBR #",,,,,,,,,,,"0","10707","2057","3560","false","1375054758","false","false","false","Los Angeles, CA","120","Howard resist Trump",,"false","https://pbs.twimg.com/profile_images/3565366091/4f11708b71bf3782218e1e4b18ff1eb8_normal.jpeg","","12230","https://twitter.com/Happyspal","user","https://x.com/Happyspal","Happyspal","@CassieCasanova @Juleskathond @brotha_clark @MSNBC Btw trump is under FBI investigation. Should we lock him up? He has nine members of administration tied to Russia.","Sun Apr 16 22:20:57 +0000 2017"
"true","true","https://pbs.twimg.com/profile_banners/243510590/1591242707","Thu Jan 27 05:56:55 +0000 2011","Progressive Democrat. WorkedCongress,Wall Street, now garden designer& sales #BlueWave2022 Biden is the right man for this time. Thank God he was elected",,,,,,,,,,,"0","52352","1530","1717","true","243510590","false","false","false","Huntington, NY","1268","Betsy OShea/Trump 4 Prison 2023","1120493418847920129","false","https://pbs.twimg.com/profile_images/1278152043174207490/fq89iHPd_normal.jpg","","83819","https://twitter.com/BetsyOShea","user","https://x.com/BetsyOShea","BetsyOShea","@cgnitmar1 Last but not least: first President since Nixon to be under FBI criminal investigation for collusion w Russia.They call it TREASON","Sun Apr 16 22:19:09 +0000 2017"
"false","true","https://pbs.twimg.com/profile_banners/3298561295/1478187824","Mon May 25 23:14:59 +0000 2015","#MOT Atheist LEEDS LEEDS LEEDS

Socialist",,,,,,,,,,,"0","4902","3025","2527","true","3298561295","false","false","false","Sheffield, England","4179","Paul Fell","1289150700258172928","false","https://pbs.twimg.com/profile_images/1551857123025354753/VgCQ7iYF_normal.jpg","","27700","https://twitter.com/fellspeaks","user","https://x.com/fellspeaks","fellspeaks","@patriotinfidel8 So now there's an investigation into Trump &amp; Russia ties. No doubt in a few weeks time they'll be people posting Trump has been let off.","Sun Apr 16 22:04:12 +0000 2017"
"false","true","https://pbs.twimg.com/profile_banners/289118612/1611463502","Thu Apr 28 01:56:15 +0000 2011","Tomthunkit's Mind Diner is open 24/7. All-you-can-eat smorgasbord of hand-picked deliciously sweet tweets for your political palate. Invest ($) in your future",,,,,,"gofund.me/f87dee82","https://gofund.me/f87dee82","0","23","https://t.co/9hCbcig3Ri","0","31137","82553","60914","true","289118612","true","false","false","In Your Mind Now","3121081","Tomthunkit™","1852345066439995428","false","https://pbs.twimg.com/profile_images/1621261829417717760/hOeHkGJk_normal.jpg","","3557450","https://twitter.com/TomthunkitsMind","user","https://x.com/TomthunkitsMind","TomthunkitsMind","The Useful Idiot Is No Longer Useful To trump. Therefore, Devin Nunes Steps Aside From House Investigation on Russia https://t.co/WDKF4AYJBD https://t.co/ghG2hnfh7T","Sun Apr 16 21:45:18 +0000 2017"
"false","false","https://pbs.twimg.com/profile_banners/25341604/1631901879","Thu Mar 19 17:18:58 +0000 2009","Official account dedicated to the life and work of the late Anne Rice. Maintained by her son @chrisricewriter and her social media team.",,,,,,"bit.ly/3kfXMwQ","https://bit.ly/3kfXMwQ","0","23","https://t.co/JSZwnxq8SV","0","661","182649","425","true","25341604","false","false","false","","308","Anne Rice","1649128598211821568","false","https://pbs.twimg.com/profile_images/1498126667025321985/ORFkTQi5_normal.jpg","","40236","https://twitter.com/AnneRiceAuthor","user","https://x.com/AnneRiceAuthor","AnneRiceAuthor","Let's stay on the Russia-Trump question. Let's keep demanding answers, demanding investigation, demanding truth!","Sun Apr 16 21:44:40 +0000 2017"
"false","false","https://pbs.twimg.com/profile_banners/734086795743350784/1601690408","Sat May 21 18:21:45 +0000 2016","adding bio info as kids got irate that I had not 😊 Dem because I believe in Secular Democracy, NEVER trust a President
without a dog.",,,,,,,,,,,"0","82004","298","250","true","734086795743350784","false","false","false","","13","s sloan",,"false","https://pbs.twimg.com/profile_images/1312212904817692672/nWdsIB3Z_normal.jpg","","28214","https://twitter.com/scsloan1313","user","https://x.com/scsloan1313","scsloan1313","@nytpolitics Pro Trump trolls are clearly Russian or bots. Senate investigation on Russia will require his taxes. Trump hiding something or wouldn't care","Sun Apr 16 21:34:46 +0000 2017"
"false","false","https://pbs.twimg.com/profile_banners/394437733/1490873129","Thu Oct 20 02:21:23 +0000 2011","My location doesn't matter; my experiences do! Proudly American, you'd feel the same with a passport and travel. 🇺🇸✈️",,,,,,,,,,,"0","2249","2168","176","true","394437733","false","false","false","None Ya","3611","Curt",,"false","https://pbs.twimg.com/profile_images/845446388980756481/N98ZwWU1_normal.jpg","","15478","https://twitter.com/noneya2001","user","https://x.com/noneya2001","noneya2001","Warner takes Trump-Russia investigation to the masses via @POLITICO https://t.co/kKNseUGgkF https://t.co/f56Mojqxsy","Sun Apr 16 21:27:36 +0000 2017"
"true","true","https://pbs.twimg.com/profile_banners/891289026/1681141301","Fri Oct 19 16:13:39 +0000 2012","Programming, Penetration testing,Encryption,A I Fond Machine Learning&Adaptative Intel ,Hacking Human,Cyber Risk& Vulnerability Management, IT Ethics & Law",,,,,,,,,,,"0","4947","16137","2903","true","891289026","false","false","false","Glasgow/Pretoria.","9896","MSc Applied AI for Cyber-Security","1090222969257975808","false","https://pbs.twimg.com/profile_images/1664313669805547520/wQJ-3zKk_normal.jpg","","245920","https://twitter.com/Joaobap57934294","user","https://x.com/Joaobap57934294","Joaobap57934294","'Concrete evidence of collusion between Trump team and Russia' handed to official investigation https://t.co/bSxkggYFrP","Sun Apr 16 21:04:22 +0000 2017"
"true","true","https://pbs.twimg.com/profile_banners/366374544/1385337769","Fri Sep 02 02:05:49 +0000 2011","Retired, liberal progressive since Bush years. Big fan: Emily'sList, Elizabeth Warren, PPFA, NARAL, Rachel Maddow, Jon Stewart& blueCA #UniteBlue #TheResistance",,,,,,,,,,,"0","401793","10243","8343","true","366374544","false","false","false","Redwood City, CA","2162","Reevyn Aronson",,"false","https://pbs.twimg.com/profile_images/475895373890740224/c1dFiNS-_normal.png","","585022","https://twitter.com/reevynap","user","https://x.com/reevynap","reevynap","Sign Sen. @Jeffmerkley's petition: Demand an independent investigation of Trump's collusion with Russia https://t.co/aEbfTBj1yJ","Sun Apr 16 21:04:20 +0000 2017"
"true","true","https://pbs.twimg.com/profile_banners/366374544/1385337769","Fri Sep 02 02:05:49 +0000 2011","Retired, liberal progressive since Bush years. Big fan: Emily'sList, Elizabeth Warren, PPFA, NARAL, Rachel Maddow, Jon Stewart& blueCA #UniteBlue #TheResistance",,,,,,,,,,,"0","401793","10243","8343","true","366374544","false","false","false","Redwood City, CA","2162","Reevyn Aronson",,"false","https://pbs.twimg.com/profile_images/475895373890740224/c1dFiNS-_normal.png","","585022","https://twitter.com/reevynap","user","https://x.com/reevynap","reevynap","Demand an independent investigation of the Trump administration’s collusion with Russia | CREDO Mobilize https://t.co/qlTd5Dfia7","Sun Apr 16 21:04:07 +0000 2017"
"false","true","https://pbs.twimg.com/profile_banners/289118612/1611463502","Thu Apr 28 01:56:15 +0000 2011","Tomthunkit's Mind Diner is open 24/7. All-you-can-eat smorgasbord of hand-picked deliciously sweet tweets for your political palate. Invest ($) in your future",,,,,,"gofund.me/f87dee82","https://gofund.me/f87dee82","0","23","https://t.co/9hCbcig3Ri","0","31137","82553","60914","true","289118612","true","false","false","In Your Mind Now","3121081","Tomthunkit™","1852345066439995428","false","https://pbs.twimg.com/profile_images/1621261829417717760/hOeHkGJk_normal.jpg","","3557450","https://twitter.com/TomthunkitsMind","user","https://x.com/TomthunkitsMind","TomthunkitsMind","The Useful Idiot Is No Longer Useful To trump. Therefore, Devin Nunes Steps Aside From House Investigation on Russia https://t.co/WDKF4AYJBD https://t.co/W7t2jtZG0U","Sun Apr 16 20:45:17 +0000 2017"
"false","true","https://pbs.twimg.com/profile_banners/2314329638/1484761745","Mon Jan 27 21:17:16 +0000 2014","I am #TheResistance #district8mo #StandandResistHC #Trumprussia #ProtectOurCar #resist #russiagate #SoCalledPOTUS #savetheACA #Allin4America #MedicareForAll",,,,,,,,,,,"0","10513","315","443","true","2314329638","false","false","false","","49","The Blue Jay",,"false","https://pbs.twimg.com/profile_images/856893157908377601/c8mtLgj__normal.jpg","","9015","https://twitter.com/ositoraul1","user","https://x.com/ositoraul1","ositoraul1","@SenateDems @SenateGOP @HouseDemocrats. @HouseGOP We the people DEMAND INVESTIGATION into TRUMP/RUSSIA relationship #TheResistance","Sun Apr 16 20:42:31 +0000 2017"
"true","true",,"Mon Aug 16 00:55:49 +0000 2010","We are all mortals aren't we? At any moment this could go.",,,,,,,,,,,"0","8452","274","405","true","178910345","false","false","false","Laredo, Texas","238","Richard Esparza",,"false","https://pbs.twimg.com/profile_images/1108884402283704321/lWGdOYHt_normal.jpg","","34129","https://twitter.com/rae8060","user","https://x.com/rae8060","rae8060","@UwantSomaThis @ShillForHillary @88ejr88 But it's relevant. Cause trump people are there talking to Russians &amp;Trump is under investigation over alleged ties to Russia.","Sun Apr 16 20:39:57 +0000 2017"
"false","false","https://pbs.twimg.com/profile_banners/1852224667/1596134765","Tue Sep 10 18:31:25 +0000 2013","Never stop fighting!! Every Vote Counts! Prosecute DeJoy!   #BLM #Resist  #emptythepews #impeachtrump #metoo #FBR #boycottNRA🌊",,,,,,,,,,,"0","29128","3750","3687","true","1852224667","false","false","false","United States","77","VOTE BLUE in 22 🌊🌊🌊🌊🌊",,"false","https://pbs.twimg.com/profile_images/1368674080166133765/rmt80mLK_normal.jpg","","15988","https://twitter.com/Robbinsnest56","user","https://x.com/Robbinsnest56","Robbinsnest56","'Concrete evidence of collusion between Trump team and Russia' handed to official investigation https://t.co/5Xi1HqbGPz","Sun Apr 16 20:29:11 +0000 2017"
"true","false","https://pbs.twimg.com/profile_banners/25532854/1533943607","Fri Mar 20 16:47:57 +0000 2009","Retired MSW, genealogy geek 🇨🇮☘️and political junkie. I have a special family;creative, kind and blue voters. Hug your animals. 🐈‍⬛And no DM’s",,,,,,,,,,,"0","372296","2445","2371","true","25532854","false","false","false","Wisconsin, USA","102","Patty Sullivan 🇺🇦🇮🇪",,"false","https://pbs.twimg.com/profile_images/1569818883883687936/Lv69KXYK_normal.jpg","","8504","https://twitter.com/changeisgood129","user","https://x.com/changeisgood129","changeisgood129","@AriMelber Is there any way that you can give a timeline of Watergate and contrast that with Trump/Russia investigation? #The Point","Sun Apr 16 20:18:11 +0000 2017"
"false","true",,"Thu Jan 23 20:15:46 +0000 2014","Marimbist Composer Educator Ithaca",,,,,,"gordonstout.net","http://www.gordonstout.net","0","23","https://t.co/rQxqDGa9bS","0","4014","855","392","false","2307181585","false","false","false","Spencer, New York","67","gordon stout",,"false","https://pbs.twimg.com/profile_images/606111507571724288/-FJh77AZ_normal.jpg","","14438","https://twitter.com/StoutGordon","user","https://x.com/StoutGordon","StoutGordon","'Concrete evidence of collusion between Trump team and Russia' handed to official investigation https://t.co/Awv9GCcuyp","Sun Apr 16 20:03:30 +0000 2017"
"false","false","https://pbs.twimg.com/profile_banners/19441006/1721660706","Sat Jan 24 10:33:38 +0000 2009","A new future is always possible",,,,,,"londonyc.com","https://www.londonyc.com","0","23","https://t.co/9rJtqp6n9P","0","55933","2981","2020","false","19441006","false","false","false","London 🚓 New York 🚕","17780","londonyc","1335568299200045056","false","https://pbs.twimg.com/profile_images/1815404844523401216/uGGAwcOF_normal.jpg","","373230","https://twitter.com/londonyc","user","https://x.com/londonyc","londonyc","'Concrete evidence of collusion between Trump team and Russia' handed to official investigation https://t.co/CTwtklklxb
#StopTrumpBrexit https://t.co/sHIOOvG4ZH","Sun Apr 16 19:47:12 +0000 2017"
"false","true","https://pbs.twimg.com/profile_banners/289118612/1611463502","Thu Apr 28 01:56:15 +0000 2011","Tomthunkit's Mind Diner is open 24/7. All-you-can-eat smorgasbord of hand-picked deliciously sweet tweets for your political palate. Invest ($) in your future",,,,,,"gofund.me/f87dee82","https://gofund.me/f87dee82","0","23","https://t.co/9hCbcig3Ri","0","31137","82553","60914","true","289118612","true","false","false","In Your Mind Now","3121081","Tomthunkit™","1852345066439995428","false","https://pbs.twimg.com/profile_images/1621261829417717760/hOeHkGJk_normal.jpg","","3557450","https://twitter.com/TomthunkitsMind","user","https://x.com/TomthunkitsMind","TomthunkitsMind","The Useful Idiot Is No Longer Useful To trump. Therefore, Devin Nunes Steps Aside From House Investigation on Russia https://t.co/WDKF4AYJBD https://t.co/3JDQTNDJsi","Sun Apr 16 19:45:24 +0000 2017"
"false","true",,"Thu Aug 04 02:41:17 +0000 2016","",,,,,,,,,,,"0","38","3","94","false","761029209124802560","false","false","false","","0","Clyde Thomas",,"false","https://abs.twimg.com/sticky/default_profile_images/default_profile_normal.png","","183","https://twitter.com/mrfassen","user","https://x.com/mrfassen","mrfassen","Rachel Maddow let's keep up on the Russia investigation let's not get distracted because we know this is something Trump doesn't like.","Sun Apr 16 19:44:11 +0000 2017"
"false","true","https://pbs.twimg.com/profile_banners/346210879/1497585303","Sun Jul 31 22:28:07 +0000 2011","",,,,,,,,,,,"0","605","8","106","false","346210879","false","false","false","","0","Inoverurhead",,"false","https://abs.twimg.com/sticky/default_profile_images/default_profile_normal.png","","392","https://twitter.com/mindymeyers1","user","https://x.com/mindymeyers1","mindymeyers1","@thehill @RoyalFamily @realDonaldTrump Please DO NOT CONSIDER TRUMP'S request.  Trump is under INVESTIGATION FOR COLLUSION WITH RUSSIA...","Sun Apr 16 19:39:54 +0000 2017"
"false","false","https://pbs.twimg.com/profile_banners/839420851099471873/1651101124","Wed Mar 08 10:21:41 +0000 2017","Guardian of the Republic. Keeper of American Exceptionalism. Counterchekist.",,,,,,,,,,,"0","51520","88066","43","true","839420851099471873","false","false","false","USA","1523","Counterchekist #StandWithUkraine","1495957107799175171","false","https://pbs.twimg.com/profile_images/990936688036929536/-QoIb4uc_normal.jpg","","31641","https://twitter.com/counterchekist","user","https://x.com/counterchekist","counterchekist","@CHamptonGray @LouiseMensch @GuardianRover @TheRickWilson @mindyfinn @Evan_McMullin So? What does that have to do with his support for Trump-Russia investigation?","Sun Apr 16 19:27:02 +0000 2017"
"false","true",,"Sat Nov 19 19:28:54 +0000 2016","",,,,,,,,,,,"0","221","3","7","false","800058285420199936","false","false","false","","11","Joan Cathy",,"false","https://abs.twimg.com/sticky/default_profile_images/default_profile_normal.png","","1354","https://twitter.com/joan_cathy3","user","https://x.com/joan_cathy3","joan_cathy3","@SenDeanHeller @united Pursue independent investigation of trump -Russia ties. Pursue real health care for all","Sun Apr 16 19:06:38 +0000 2017"
"false","true","https://pbs.twimg.com/profile_banners/289118612/1611463502","Thu Apr 28 01:56:15 +0000 2011","Tomthunkit's Mind Diner is open 24/7. All-you-can-eat smorgasbord of hand-picked deliciously sweet tweets for your political palate. Invest ($) in your future",,,,,,"gofund.me/f87dee82","https://gofund.me/f87dee82","0","23","https://t.co/9hCbcig3Ri","0","31137","82553","60914","true","289118612","true","false","false","In Your Mind Now","3121081","Tomthunkit™","1852345066439995428","false","https://pbs.twimg.com/profile_images/1621261829417717760/hOeHkGJk_normal.jpg","","3557450","https://twitter.com/TomthunkitsMind","user","https://x.com/TomthunkitsMind","TomthunkitsMind","The Useful Idiot Is No Longer Useful To trump. Therefore, Devin Nunes Steps Aside From House Investigation on Russia https://t.co/WDKF4AYJBD https://t.co/qXvG2tyH1Y","Sun Apr 16 18:45:36 +0000 2017"
"true","false",,"Thu Jul 17 23:55:58 +0000 2014","Love y respect all animals.Believe they have right to live in environment free from cruelty y abuse. Want elected officials to enforce animal cruelty laws .",,,,,,,,,,,"0","152905","2660","3341","true","2655203862","false","false","false","","6","Bella Dawn",,"false","https://pbs.twimg.com/profile_images/570364071578447872/53qLfv7u_normal.jpeg","","254551","https://twitter.com/BellaDawn01527","user","https://x.com/BellaDawn01527","BellaDawn01527","@SenWarren Protect our democracy. Keep defending our healthcare! We must have an independent investigation of Trump/Russia! Massive lies !","Sun Apr 16 18:36:05 +0000 2017"
"false","true","https://pbs.twimg.com/profile_banners/301091461/1505929891","Wed May 18 21:26:14 +0000 2011","Luv Bruno Nickelback BSEGER Daughtry Pink Xtina Boyce Avenue, Darren Hayes/Savage Garden=optimistic opinionated re art/music/flowers/choc foodie/interior design",,,,,,,,,,,"0","2243","4551","4627","false","301091461","false","false","false","USA America","11027","Jc2009USA",,"false","https://pbs.twimg.com/profile_images/1525887577/Sunset_normal.jpg","","169492","https://twitter.com/JC2009USA","user","https://x.com/JC2009USA","JC2009USA","It's all from the Trump/Putin playbook...diversion from the Russia investigation...act like enemies...fool the fools - we still buddies tho. https://t.co/s7C0lueaUv","Sun Apr 16 18:25:08 +0000 2017"
"false","true",,"Mon Oct 26 20:26:13 +0000 2009","Born in a crossfire hurricane. Provides a home to 3 Bichons. Graduate in Economics @ IO U",,,,,,,,,,,"0","129","24","106","false","85405824","false","false","false","Secret Air Base in Shangri la","75","Salty Jamie",,"false","https://abs.twimg.com/sticky/default_profile_images/default_profile_normal.png","","12816","https://twitter.com/SaltyJamie","user","https://x.com/SaltyJamie","SaltyJamie","Counterintelligence investigation of possible Trump campaign collusion with Russia began last July https://t.co/qGNEbT2K02","Sun Apr 16 17:48:28 +0000 2017"
"false","true","https://pbs.twimg.com/profile_banners/289118612/1611463502","Thu Apr 28 01:56:15 +0000 2011","Tomthunkit's Mind Diner is open 24/7. All-you-can-eat smorgasbord of hand-picked deliciously sweet tweets for your political palate. Invest ($) in your future",,,,,,"gofund.me/f87dee82","https://gofund.me/f87dee82","0","23","https://t.co/9hCbcig3Ri","0","31137","82553","60914","true","289118612","true","false","false","In Your Mind Now","3121081","Tomthunkit™","1852345066439995428","false","https://pbs.twimg.com/profile_images/1621261829417717760/hOeHkGJk_normal.jpg","","3557450","https://twitter.com/TomthunkitsMind","user","https://x.com/TomthunkitsMind","TomthunkitsMind","The Useful Idiot Is No Longer Useful To trump. Therefore, Devin Nunes Steps Aside From House Investigation on Russia https://t.co/WDKF4AYJBD https://t.co/W5MCmNZAan","Sun Apr 16 17:45:17 +0000 2017"
"true","true","https://pbs.twimg.com/profile_banners/22094374/1398695166","Fri Feb 27 02:01:12 +0000 2009","Following your passion is easy ... discovering your passion is the hard part.",,,,,,,,,,,"0","5921","151","372","true","22094374","false","false","false","","923","Emergency back-up Pope","440138678594457600","false","https://pbs.twimg.com/profile_images/460850554357284866/A76Nbguu_normal.jpeg","","29716","https://twitter.com/CockRobin","user","https://x.com/CockRobin","CockRobin","'Concrete evidence of collusion between Trump team and Russia' handed to official investigation https://t.co/iOtMwRBr4m","Sun Apr 16 17:42:18 +0000 2017"
"false","true","https://pbs.twimg.com/profile_banners/840931405173542914/1489368617","Sun Mar 12 14:24:05 +0000 2017","Automatically generated tweets based on Trump murmurs. My hands are huge.",,,,,,,,,,,"0","0","8","0","false","840931405173542914","false","false","false","Washington, DC","0","Prez Donald Trump",,"false","https://pbs.twimg.com/profile_images/840933943750864896/lC4h_iHr_normal.jpg","","50154","https://twitter.com/TrumpAuto","user","https://x.com/TrumpAuto","TrumpAuto","Had a great Justice. Very proud of the so-called Russia as an almost an immediate investigation into is so many roles they","Sun Apr 16 17:11:00 +0000 2017"
