"author/canDm","author/canMediaTag","author/coverPicture","author/createdAt","author/description","author/entities/description/urls/0/display_url","author/entities/description/urls/0/expanded_url","author/entities/description/urls/0/indices/0","author/entities/description/urls/0/indices/1","author/entities/description/urls/0/url","author/entities/description/urls/1/display_url","author/entities/description/urls/1/expanded_url","author/entities/description/urls/1/indices/0","author/entities/description/urls/1/indices/1","author/entities/description/urls/1/url","author/entities/url/urls/0/display_url","author/entities/url/urls/0/expanded_url","author/entities/url/urls/0/indices/0","author/entities/url/urls/0/indices/1","author/entities/url/urls/0/url","author/fastFollowersCount","author/favouritesCount","author/followers","author/following","author/hasCustomTimelines","author/id","author/isBlueVerified","author/isTranslator","author/isVerified","author/location","author/mediaCount","author/name","author/pinnedTweetIds/0","author/possiblySensitive","author/profilePicture","author/status","author/statusesCount","author/twitterUrl","author/type","author/url","author/userName","text","createdAt"
"false","true","https://pbs.twimg.com/profile_banners/33313552/1395080332","Sun Apr 19 21:11:45 +0000 2009","Retired whining dinosaur. Interests in education, the arts, and scientific research. Taught at Carleton, St Catherine, & U Minnesota, made traffic signs at 3M.",,,,,,,,,,,"ptable.blogspot.com","http://ptable.blogspot.com/","0","22","http://t.co/gF8cHfHWV2","0","52085","1604","2385","true","33313552","false","false","false","Minneapolis","1656","Bill Gleason",,"false","https://pbs.twimg.com/profile_images/2267231728/q0k3cg1xqs5tmry7kdt2_normal.jpeg","","83339","https://twitter.com/wbgleason","user","https://x.com/wbgleason","wbgleason","‘Fake news’? The Russia investigation is getting very, very real.
https://t.co/ZZvVEu73l2
#stribpol #mngop
Trump wishes it were fake.","Mon Aug 07 23:52:20 +0000 2017"
"false","true","https://pbs.twimg.com/profile_banners/169063212/1510834348","Wed Jul 21 13:10:51 +0000 2010","🇺🇸 For every action, there's an equal and opposite reaction. Free press is vital to democracy. May a government of, by and for the people not perish. ⚖️✌️",,,,,,,,,,,,,,,,"0","99443","1093","3207","true","169063212","false","false","false","Washington, DC","2673","Melo B. Times 🥥🌴","1355173339564826628","false","https://pbs.twimg.com/profile_images/965949877380263937/4yzJ5Hos_normal.jpg","","139103","https://twitter.com/MeloBTimes","user","https://x.com/MeloBTimes","MeloBTimes","@SteveKornacki @hardball @SenBlumenthal @MSNBC @FoxNews @KellyannePolls @hughhewitt hear of the #Russia investigation. We were HACKED nothing to do with Trump or Clinton! 78k votes, 3 states +1% in most counties","Mon Aug 07 23:41:59 +0000 2017"
"true","true","https://pbs.twimg.com/profile_banners/2173135652/1401667376","Mon Nov 04 01:56:58 +0000 2013","Nothing to see here: Old Guy that express's his opinion on Politics and Scoundrels; they go together so well! #BlackLivesMatter #SFGIANTS US Navy Vet",,,,,,,,,,,,,,,,"0","85118","6400","6110","false","2173135652","false","false","false","Sonoma County, Ca.","531","PapaESoCo","1854408370717139389","false","https://pbs.twimg.com/profile_images/451517548635254785/ajQqLB6m_normal.jpeg","","480576","https://twitter.com/PapaESoCo","user","https://x.com/PapaESoCo","PapaESoCo","‘I will not be bullied’: Dem. lawmaker doubles down on Russia investigation after Trump’s Vietnam ‘slurs’ https://t.co/jLOZU2c363","Mon Aug 07 23:41:09 +0000 2017"
"false","true",,"Mon Apr 28 14:19:57 +0000 2008","Conservative first.  #MAGA Will not suffer fools that believe socialism, communist structures are the direction for America.",,,,,,,,,,,,,,,,"0","3648","1182","1966","true","14569753","false","false","false","","968","BioBusDevGuy",,"false","https://pbs.twimg.com/profile_images/1020077001170825216/N1QDtzAH_normal.jpg","","18188","https://twitter.com/BIOBDGUY","user","https://x.com/BIOBDGUY","BIOBDGUY","@SecretsBedard @hardball @BrentHBaker @dcexaminer No Trump-Russia news because their is none. 1st Headline: there is an investigation.  Until there is evidence, not a news story #Fakenews","Mon Aug 07 23:30:48 +0000 2017"
"false","false","https://pbs.twimg.com/profile_banners/87977606/1690357668","Fri Nov 06 16:36:36 +0000 2009","Author, Editor, Journalist, Public Speaker, Member FBI-CAAA, Dog Lover, Book Hoarder, Chocolate Addict My author acct: @AuthorFairchild",,,,,,,,,,,"beachreadauthors.blogspot.com/p/christine-m-…","http://beachreadauthors.blogspot.com/p/christine-m-fairchild.html","0","23","https://t.co/1rJvNjKcTW","0","55415","5247","5846","true","87977606","false","false","false","","3532","The Editor Devil","1270760953290915841","false","https://pbs.twimg.com/profile_images/1638752548759957504/mAwwX7Gq_normal.jpg","","75910","https://twitter.com/fairchild01","user","https://x.com/fairchild01","fairchild01","Example of trump team creating distraction from Russia investigation. Trumps attys had no biz accessing or releasing those docs https://t.co/VQqzt5lBbi","Mon Aug 07 23:28:01 +0000 2017"
"false","true","https://pbs.twimg.com/profile_banners/2968472037/1431631038","Thu Jan 08 20:29:16 +0000 2015","""RT is not endorsement"" - No room here for trolls.",,,,,,,,,,,,,,,,"0","93229","1782","1081","false","2968472037","false","false","false","","9761","Tamil Male","1259089608895279105","false","https://pbs.twimg.com/profile_images/1738735744225566720/Pz27tcYk_normal.jpg","","188158","https://twitter.com/notomarriage","user","https://x.com/notomarriage","notomarriage","#GameOfThrones #DonaldTrump #Trump #Fake news’? @realDonaldTrump  The #Russia investigation is getting very real. https://t.co/BFjUBCtT9P","Mon Aug 07 23:25:06 +0000 2017"
"false","true",,"Mon Feb 27 20:03:34 +0000 2017","Outside Philly, college grad, retired",,,,,,,,,,,,,,,,"0","13","11","96","false","836305797495816192","false","false","false","","0","Andrew Weitzenkorn",,"false","https://abs.twimg.com/sticky/default_profile_images/default_profile_normal.png","","8678","https://twitter.com/AndrewWeitzenk1","user","https://x.com/AndrewWeitzenk1","AndrewWeitzenk1","Trump blames Dems 4 Russia investigation. He created the problem, keeps tweeting about it every day. Just stop tweeting.","Mon Aug 07 23:24:30 +0000 2017"
"false","true",,"Wed May 10 23:21:23 +0000 2017","",,,,,,,,,,,,,,,,"0","193","5","72","false","862447505132457984","false","false","false","","2","Shut Up Trump",,"false","https://abs.twimg.com/sticky/default_profile_images/default_profile_normal.png","","1127","https://twitter.com/JustShutUpTrump","user","https://x.com/JustShutUpTrump","JustShutUpTrump","@realDonaldTrump I now get it, you bash anyone who talks about the Russia investigation. Its called deflection Donny you old cheese puff.","Mon Aug 07 23:12:59 +0000 2017"
"false","true",,"Wed Mar 07 10:15:27 +0000 2007","An auto-generated summary of the stories that US political commentators are discussing online right now.
Not human-edited, unlike @Techmeme or @mediagazer.",,,,,,,,,,,"memeorandum.com","http://memeorandum.com/","0","22","http://t.co/ENJ5G0TQjS","0","1","10174","4","false","817652","false","false","false","United States","343","memeorandum",,"false","https://pbs.twimg.com/profile_images/696565962309382144/pMo4sXjK_normal.png","","469088","https://twitter.com/memeorandum","user","https://x.com/memeorandum","memeorandum","'I will not be bullied': Dem. lawmaker doubles down on Russia investigation after Trump's… https://t.co/X8uWq7LRgE https://t.co/iFMPZBmzgZ","Mon Aug 07 23:10:57 +0000 2017"
"false","false","https://pbs.twimg.com/profile_banners/610919499/1553116202","Sun Jun 17 14:07:22 +0000 2012","Sociologist & commentator. I study politics, power & inequality. You may have caught me on TV or radio or read my work. Views mine. @dashannestokes.bsky.social",,,,,,,,,,,"dashannestokes.com","http://www.dashannestokes.com","0","23","https://t.co/BV0elmN1uA","0","2387","28550","1548","false","610919499","true","false","false","Lexington, KY","1179","Dr. DaShanne Stokes","1857969690900877364","false","https://pbs.twimg.com/profile_images/876115337858752512/4OvP8lx2_normal.jpg","","63424","https://twitter.com/DaShanneStokes","user","https://x.com/DaShanneStokes","DaShanneStokes","Trump is turning America more into Russia every day. 

Fun fact: Trump is under investigation for possibly colluding with Russia.

#resist","Mon Aug 07 23:00:31 +0000 2017"
"false","true","https://pbs.twimg.com/profile_banners/2768501/1724034623","Thu Mar 29 02:15:36 +0000 2007","Latest news updates from the Australian Broadcasting Corp. This is an official @abcaustralia account.",,,,,,,,,,,"abc.net.au/news","http://www.abc.net.au/news","0","23","https://t.co/LeSPrKTqbF","0","2577","2562353","1118","true","2768501","true","false","false","Australia","45271","ABC News","1691953985203388521","false","https://pbs.twimg.com/profile_images/1825279678493638656/GFFzYuW0_normal.png","","397325","https://twitter.com/abcnews","user","https://x.com/abcnews","abcnews","Donald Trump lashes out at 'phony con artist' Senator Richard Blumenthal's war record over Russia investigation push https://t.co/lmwPUnTTET","Mon Aug 07 22:58:26 +0000 2017"
"true","true",,"Wed May 27 18:13:51 +0000 2009","News from WCMU Public Media - central and northern Michigan's NPR and PBS station.",,,,,,,,,,,"wcmu.org","http://www.wcmu.org","0","23","https://t.co/PJMGEMoXEX","0","211","2782","812","false","42940605","false","false","false","Central and Northern Michigan","103959","WCMU News",,"false","https://pbs.twimg.com/profile_images/1059815722497523712/Qi5J5NA-_normal.jpg","","172705","https://twitter.com/WCMUNews","user","https://x.com/WCMUNews","WCMUNews","The Trump-Russia investigation: A timeline https://t.co/NsHfgJKgYx https://t.co/iqvLPvuCQK","Mon Aug 07 22:56:05 +0000 2017"
"false","true",,"Wed Jan 22 19:44:37 +0000 2014","",,,,,,,,,,,,,,,,"0","121","2","50","true","2305368032","false","false","false","","16","C P",,"false","https://abs.twimg.com/sticky/default_profile_images/default_profile_normal.png","","3161","https://twitter.com/151177pp","user","https://x.com/151177pp","151177pp","The Russia investigation will end with Trump being Impeached, removed from office, and convicted of Treason!!!!!","Mon Aug 07 22:52:17 +0000 2017"
"false","true",,"Mon Mar 09 15:41:23 +0000 2009","Proud to be everything decent the right-wing hates. #RESIST.  MAGAts automatically blocked.",,,,,,,,,,,,,,,,"0","140684","2747","3488","true","23449235","false","false","false","","0","Emily",,"false","https://pbs.twimg.com/profile_images/838893881294991362/BGowyyxb_normal.jpg","","43608","https://twitter.com/Emmietheimp","user","https://x.com/Emmietheimp","Emmietheimp","@realDonaldTrump Like most of your Twitter followers, this one is fake, don. BTW, the tRump/Russia collusion investigation continues.","Mon Aug 07 22:35:24 +0000 2017"
"false","true","https://pbs.twimg.com/profile_banners/841861508942450688/1489550508","Wed Mar 15 03:59:59 +0000 2017","Get the updated FREE App! @ https://t.co/FGRUJZuOk9 Articles from outlets of the full political spectrum.","goo.gl/Y1u8mS","https://goo.gl/Y1u8mS","28","51","https://t.co/FGRUJZuOk9",,,,,,"politiciandirect.com","https://politiciandirect.com","0","23","https://t.co/Y7JHiwGSji","0","4311","7698","7254","true","841861508942450688","false","false","false","United States","201388","No Fake News! App","976023354711797760","false","https://pbs.twimg.com/profile_images/841862006357536768/KclU0juo_normal.jpg","","324266","https://twitter.com/politiciandirec","user","https://x.com/politiciandirec","politiciandirec","One year into the FBI’s Russia investigation, Mueller is on the Trump money trail https://t.co/AFZTLhA7Xl","Mon Aug 07 22:28:33 +0000 2017"
"false","false","https://pbs.twimg.com/profile_banners/351013056/1723252307","Mon Aug 08 17:18:40 +0000 2011","Americanism not Globalism ~ America First ~ Christ is King",,,,,,,,,,,,,,,,"0","18912","675","1637","true","351013056","false","false","false","CT","2088","Dowo",,"false","https://pbs.twimg.com/profile_images/1823535242180780032/ng8xjBJP_normal.jpg","","26321","https://twitter.com/theonlydowo","user","https://x.com/theonlydowo","theonlydowo","Russia didnt +/- 1 vote. Here's the real election meddling. And this doesn't include NY and IL #ElectionFraud  https://t.co/Mx8XIO6oeW","Mon Aug 07 23:41:06 +0000 2017"
"false","true","https://pbs.twimg.com/profile_banners/379383555/1664929429","Sat Sep 24 21:28:56 +0000 2011","Why is he still alive?
He is 60 years old.
How much more does he want from God?
                                            - lines from an Iranian movie",,,,,,,,,,,,,,,,"0","150700","1210","553","true","379383555","false","false","false","Salish Sea","89","Dave's a real name",,"false","https://pbs.twimg.com/profile_images/1840543365638856704/fp03pNhg_normal.jpg","","60678","https://twitter.com/davidconstable6","user","https://x.com/davidconstable6","davidconstable6","@thehill @Garossino Hope they don't show foreign 'meddling' in an American election. That kind stuff drains a lot of resources out of America.","Mon Aug 07 23:36:49 +0000 2017"
"false","true","https://pbs.twimg.com/profile_banners/881564484967550976/1548658045","Sun Jul 02 17:25:26 +0000 2017","Gouvernement & Politiques",,,,,,,,,,,,,,,,"0","3740","17","48","false","881564484967550976","false","false","false","Littoral, Cameroon","19","Paul Pascal Mbeleck",,"false","https://pbs.twimg.com/profile_images/1287641168789090304/g36DTjb2_normal.jpg","","3994","https://twitter.com/PMbeleck","user","https://x.com/PMbeleck","PMbeleck","@mitchellvii Its attimes its surprising election meddling and collision is fake now they go into a fishing expedition......shame dems and MSM","Mon Aug 07 23:18:27 +0000 2017"
"false","false","https://pbs.twimg.com/profile_banners/3239443772/1524571455","Mon Jun 08 03:30:23 +0000 2015","Liberal Democrat Retired L.P.N. 
We are now on Earth II",,,,,,,,,,,,,,,,"0","167008","10382","11177","true","3239443772","false","false","false","Michigan ","137","Mrs Hoffman It's a blue🌍#FBR","1477304287646687237","false","https://pbs.twimg.com/profile_images/1145055064203116545/jbGi9MSA_normal.jpg","","130681","https://twitter.com/pamelasummer57","user","https://x.com/pamelasummer57","pamelasummer57","@NewDay I will be glad when the rest of the country learns Trump won the election through Russian meddling&amp;he was a active participant.","Mon Aug 07 23:08:38 +0000 2017"
"false","true","https://pbs.twimg.com/profile_banners/4179829648/1447430293","Fri Nov 13 15:54:07 +0000 2015","",,,,,,,,,,,,,,,,"0","5","252","202","false","4179829648","false","false","false","","0","John Keys",,"false","https://pbs.twimg.com/profile_images/665196805685145600/aySLQycx_normal.png","","5397","https://twitter.com/Keyzmax","user","https://x.com/Keyzmax","Keyzmax","US Secretary of State Tillerson: Russian election meddling 'created serious mistrust': The… https://t.co/lu7MqKOADq","Mon Aug 07 23:03:25 +0000 2017"
"true","false","https://pbs.twimg.com/profile_banners/788154243157004289/1730876330","Mon Oct 17 23:06:29 +0000 2016","Sons of Liberty DNA. Originalist. Imperfect Christian- I'm a Sailor, & can cuss like one. Submariner. Levity, Music, Politics, Sports, Flirt. ASCAP.",,,,,,,,,,,,,,,,"0","113663","1833","1318","true","788154243157004289","true","false","false","Last Howard Johnsons w/no pool","1159","George III","1461613101355253765","false","https://pbs.twimg.com/profile_images/1568925554924986368/N9sFnKWU_normal.jpg","","140236","https://twitter.com/TreySetzer","user","https://x.com/TreySetzer","TreySetzer","@thehill How bout Israel nvestigate who was n cahoots w/@BarackObama , 2 help beat @Netanyahu n their last election? Talk about ""foreign"" meddling...","Mon Aug 07 23:01:27 +0000 2017"
"false","false","https://pbs.twimg.com/profile_banners/570816898/1355351090","Fri May 04 13:03:36 +0000 2012","other",,,,,,,,,,,,,,,,"0","122210","8864","9704","true","570816898","true","false","false","MN","20951","Diane Lange",,"false","https://pbs.twimg.com/profile_images/2886678780/b8535cce4d90dc5b927ba96c7d5e7c79_normal.jpeg","","1096682","https://twitter.com/DclareDiane","user","https://x.com/DclareDiane","DclareDiane","@TruthinGov2016 @JulianAssange Mueller stepping over the line of ethical behavior? Anything outside of Russia election meddling must be turned over to AG Sessions.","Mon Aug 07 22:57:54 +0000 2017"
"false","true",,"Thu Jun 04 02:43:03 +0000 2009","Handyman",,,,,,,,,,,,,,,,"0","314","831","2183","false","44526609","false","false","false","","4","Handyman",,"false","https://pbs.twimg.com/profile_images/848649220936486914/tBPNBpdF_normal.jpg","","85012","https://twitter.com/handeman420","user","https://x.com/handeman420","handeman420","@funder No wonder why they are doing everything to protect UN-PATRIOT cooperators of RUSSIA  election meddling. MUELLER must investigate them also.","Mon Aug 07 22:50:32 +0000 2017"
"true","false","https://pbs.twimg.com/profile_banners/2998864022/1708908151","Wed Jan 28 01:42:25 +0000 2015","Follow me at https://t.co/3B0poObkG7","essenviews.bsky.social","http://essenviews.bsky.social","13","36","https://t.co/3B0poObkG7",,,,,,,,,,,"0","155801","158093","79041","true","2998864022","true","false","false","Global Watch ","3678","EssenViews","1858364122636718266","false","https://pbs.twimg.com/profile_images/1626283290184544259/KAsi0yi2_normal.jpg","","114895","https://twitter.com/essenviews","user","https://x.com/essenviews","essenviews","The attack came ""after Blumenthal  support on CNN for continuing the investigation into alleged Russian meddling in last year election""","Mon Aug 07 22:49:09 +0000 2017"
"false","false","https://pbs.twimg.com/profile_banners/133923294/1691785291","Sat Apr 17 00:49:08 +0000 2010","Favourite colour green🍃Support democracy & sharing. Beauty saves me from despair. “If the world were only pain & logic, who would want it?”~Mary Oliver♡",,,,,,,,,,,"moreofpeepsqueak.wordpress.com","http://moreofpeepsqueak.wordpress.com","0","23","https://t.co/uHe1p3K0tL","0","9481","20839","7756","true","133923294","false","false","false","West Vancouver Canada","57378","Connie Handscomb",,"false","https://pbs.twimg.com/profile_images/727529929986863105/hIi-n5vk_normal.jpg","","286676","https://twitter.com/Peepsqueak","user","https://x.com/Peepsqueak","Peepsqueak","South Korean Spy Agency Admits to Meddling in 2012 Election ~&gt; https://t.co/8qRmcO9Kls https://t.co/b50W2oKc1Q","Mon Aug 07 22:11:25 +0000 2017"
"false","true","https://pbs.twimg.com/profile_banners/1091216816/1367379811","Tue Jan 15 06:27:44 +0000 2013","Media Consultant, Lakers Fan, Vegas Expert/Dodger Fan/Radio/TV Producer/ News Junky/ Creator of Products/Proud Military Supporter/support Israel/",,,,,,,,,,,,,,,,"0","539855","104080","103941","true","1091216816","true","false","false","Las Vegas, Nevada","2512","David  Benjamin","1348768997739700225","false","https://pbs.twimg.com/profile_images/744313147335446535/RhmMmBSj_normal.jpg","","860310","https://twitter.com/thetoyman1","user","https://x.com/thetoyman1","thetoyman1","#SpecialReport @JamesRosenTV reporting on Russian Meddling in U.S. Presidential Election. @FoxNews","Mon Aug 07 22:11:13 +0000 2017"
"false","false","https://pbs.twimg.com/profile_banners/544735156/1690217677","Wed Apr 04 01:20:57 +0000 2012","",,,,,,,,,,,,,,,,"0","25506","365","128","false","544735156","false","false","false","","1583","Anna Maria",,"false","https://pbs.twimg.com/profile_images/1788962686803312640/RY8EHiYP_normal.jpg","","38014","https://twitter.com/AnnaMariaMari10","user","https://x.com/AnnaMariaMari10","AnnaMariaMari10","Sec of State condemns Russians meddling in the US election,blaming them for putting a wedge in US/Rus relationship.Trump blames Congress 😂","Mon Aug 07 22:10:31 +0000 2017"
"false","false","https://pbs.twimg.com/profile_banners/1019060826/1720920034","Tue Dec 18 05:30:38 +0000 2012","Born in Eastern Europe behind the Iron Curtain.  U.S. citizen in 2004.  Freelance cover artist, love the high seas, books & rabbit holes
 Blue Check in the mail",,,,,,,,,,,,,,,,"0","100557","11254","9238","true","1019060826","false","false","false","Chicago, IL","4212","Deplorable Garbage Petr@Painting Pink Tanks","1862475902195835212","false","https://pbs.twimg.com/profile_images/378800000681193148/000127e2f3442c85c587cfb00b5a4864_normal.jpeg","","146385","https://twitter.com/PragueArtist","user","https://x.com/PragueArtist","PragueArtist","Look who's meddling in someone else's election👇 https://t.co/e0f18CahWK","Mon Aug 07 21:53:06 +0000 2017"
"false","true","https://pbs.twimg.com/profile_banners/48029066/1724940493","Wed Jun 17 16:58:41 +0000 2009","Married @DurkinSara | WH @NEWSMAX | Author, SCALIA: RISE TO GREATNESS | Speaker | Beatles freak | jamesrosentv@protonmail.com",,,,,,,,,,,,,,,,"0","29337","271100","68752","true","48029066","true","false","false","Washington, D.C.","2255","James Rosen","1862186751558611421","false","https://pbs.twimg.com/profile_images/1843744272098426880/udkVG5ZR_normal.jpg","","35958","https://twitter.com/JamesRosenTV","user","https://x.com/JamesRosenTV","JamesRosenTV","On #SpecialReport @BretBaier @ 6p: Secretary of State Tillerson relates what he told the Russians about their meddling in our 2016 election.","Mon Aug 07 21:47:26 +0000 2017"
"false","true","https://pbs.twimg.com/profile_banners/41147623/1650120241","Tue May 19 16:18:31 +0000 2009","I. I Obtained Unity in yoga on 7/20/80. 3 of my incarnations: Thomas Jefferson; Jacob (Israel); Caliph Umar. II. Prophet Muhammad is the reincarnation of Moses.",,,,,,,,,,,"sunracommunications.com","http://sunracommunications.com","0","23","https://t.co/jgiphbWbEP","0","24459","36079","38117","true","41147623","false","false","false","Chicago, Lansing, Illinois","34746","James L. Robinson",,"false","https://pbs.twimg.com/profile_images/1643054804229406720/3FeukaHw_normal.jpg","","444426","https://twitter.com/ykhalim","user","https://x.com/ykhalim","ykhalim","How can @realDonaldTrump confront Vladimir Putin about Russia’s meddling in the 2016 USA election – when both were in on it?","Mon Aug 07 21:24:41 +0000 2017"
"false","true","https://pbs.twimg.com/profile_banners/41147623/1650120241","Tue May 19 16:18:31 +0000 2009","I. I Obtained Unity in yoga on 7/20/80. 3 of my incarnations: Thomas Jefferson; Jacob (Israel); Caliph Umar. II. Prophet Muhammad is the reincarnation of Moses.",,,,,,,,,,,"sunracommunications.com","http://sunracommunications.com","0","23","https://t.co/jgiphbWbEP","0","24459","36079","38117","true","41147623","false","false","false","Chicago, Lansing, Illinois","34746","James L. Robinson",,"false","https://pbs.twimg.com/profile_images/1643054804229406720/3FeukaHw_normal.jpg","","444426","https://twitter.com/ykhalim","user","https://x.com/ykhalim","ykhalim","Retweet if you think @realDonaldTrump &amp; Vladimir Putin were both in on the 2016 USA election meddling.","Mon Aug 07 21:23:13 +0000 2017"
"false","true","https://pbs.twimg.com/profile_banners/832915853712695296/1604775587","Sat Feb 18 11:33:09 +0000 2017","America will never be destroyed from the outside. If we falter and lose our freedoms, it will be because we destroyed ourselves.  Abraham Lincoln #TheResistance",,,,,,,,,,,,,,,,"0","27492","123","15","false","832915853712695296","false","false","false","","1003","Aby is watching you","1581546944014737409","false","https://pbs.twimg.com/profile_images/832921897088217089/3S_XUHXz_normal.jpg","","45099","https://twitter.com/AbyLincoln1","user","https://x.com/AbyLincoln1","AbyLincoln1","@FoxNews @HeyTammyBruce @FoxNewsOpinion Tillerson: Russia meddling in US election is serious.
When will CROOKED Trump admit it?","Mon Aug 07 20:05:06 +0000 2017"
"false","true","https://pbs.twimg.com/profile_banners/2742156026/1408373054","Mon Aug 18 14:24:19 +0000 2014","The International Association of Political Consultants is a professional group of political experts dedicated to fostering democracy throughout the world.",,,,,,,,,,,"iapc.org","http://iapc.org/","0","22","http://t.co/p24BTQ4zi8","0","33","2180","1494","false","2742156026","false","false","false","Global","4","IAPC",,"false","https://pbs.twimg.com/profile_images/501379087491817474/8hflLPIC_normal.jpeg","","8433","https://twitter.com/IAPC_ORG","user","https://x.com/IAPC_ORG","IAPC_ORG","Tillerson: Russian election meddling 'created serious mistrust' - https://t.co/fAUtC1nEu8","Mon Aug 07 20:00:04 +0000 2017"
"false","false","https://pbs.twimg.com/profile_banners/3304282897/1652335971","Sun Aug 02 12:14:36 +0000 2015","Love is Everything Nothing Else Matters
Couldn't be much more from the heart
Forever trusting who we are
No, nothing else matters",,,,,,,,,,,,,,,,"0","289995","1595","1880","true","3304282897","true","false","false","","8697","Booh -- The Truth Shall set us Free..","1262366663258693632","false","https://pbs.twimg.com/profile_images/1715031889982238720/LVs0qEdP_normal.jpg","","162962","https://twitter.com/mikes_booh","user","https://x.com/mikes_booh","mikes_booh","@Oytaki @dsimons1 @Jacqboo @TrueFactsStated @elccollins 3/
Russia into:
Loans
money-laundering
bribes,
election meddling
Blood Diamonds
Art

America doesn't forget our Friends and Allies.","Mon Aug 07 19:57:52 +0000 2017"
