"author/canDm","author/canMediaTag","author/coverPicture","author/createdAt","author/description","author/entities/description/urls/0/display_url","author/entities/description/urls/0/expanded_url","author/entities/description/urls/0/indices/0","author/entities/description/urls/0/indices/1","author/entities/description/urls/0/url","author/entities/description/urls/1/display_url","author/entities/description/urls/1/expanded_url","author/entities/description/urls/1/indices/0","author/entities/description/urls/1/indices/1","author/entities/description/urls/1/url","author/entities/url/urls/0/display_url","author/entities/url/urls/0/expanded_url","author/entities/url/urls/0/indices/0","author/entities/url/urls/0/indices/1","author/entities/url/urls/0/url","author/fastFollowersCount","author/favouritesCount","author/followers","author/following","author/hasCustomTimelines","author/id","author/isBlueVerified","author/isTranslator","author/isVerified","author/location","author/mediaCount","author/name","author/pinnedTweetIds/0","author/possiblySensitive","author/profilePicture","author/status","author/statusesCount","author/twitterUrl","author/type","author/url","author/userName","text","createdAt"
"false","true","https://pbs.twimg.com/profile_banners/5972162/1656365304","Fri May 11 19:25:20 +0000 2007","https://t.co/T6MdEZDVRa
https://t.co/4l1DEX1SW5","flickr.com/photos/shankar…","http://flickr.com/photos/shankargallery","0","23","https://t.co/T6MdEZDVRa","shankargallery.smugmug.com","http://shankargallery.smugmug.com","24","47","https://t.co/4l1DEX1SW5","shankar-gallery.com","http://www.shankar-gallery.com","0","23","https://t.co/xKpZpjthgi","0","4274","6158","7051","true","5972162","false","false","false","Boulder,Colorado.USA.","25343","Richard Lazzara",,"false","https://pbs.twimg.com/profile_images/476104395847790592/nQaMS96N_normal.jpeg","","488361","https://twitter.com/shankargallery","user","https://x.com/shankargallery","shankargallery","The Russia Investigation Is Getting Dangerously Close to Trump | Vanity Fair https://t.co/f17xMoNgQK","Fri Aug 11 23:53:55 +0000 2017"
"false","true","https://pbs.twimg.com/profile_banners/19346615/1637846903","Thu Jan 22 16:39:19 +0000 2009","The March For Justice,Chair-US Commission on Civil Rights,Advisor-ACLU, B/Directors, Activist, Arab Spring Mentor",,,,,,,,,,,"nidalsakr.com","http://www.nidalsakr.com","0","23","https://t.co/ijnIYpZ27H","0","14538","16157","2986","false","19346615","false","false","false","Miami, Florida","4303","October 7","1786421076341440741","false","https://pbs.twimg.com/profile_images/1552967452551630849/dCR5maoz_normal.jpg","","89376","https://twitter.com/NidalSakr","user","https://x.com/NidalSakr","NidalSakr","MARK MY WORDS
EVERY Investigation into Global Crime, Russia/Trump, Breach of Sanctions Iran/N Korea,ISIS Funding'll ALL Lead 2 Abu Dhabi/MBZ","Fri Aug 11 23:52:05 +0000 2017"
"false","true","https://pbs.twimg.com/profile_banners/829775430051889154/1495394228","Thu Feb 09 19:34:13 +0000 2017","Constant Gardener.  News junkie.  Twitter feed = My notes.",,,,,,,,,,,,,,,,"0","3397","53","129","false","829775430051889154","false","false","false","","208","Lnn",,"false","https://pbs.twimg.com/profile_images/829780410414411776/IsN5nPFN_normal.jpg","","25875","https://twitter.com/vrtnr","user","https://x.com/vrtnr","vrtnr","The Russia Investigation Is Getting Dangerously Close to Trump https://t.co/knpmN6I0vZ","Fri Aug 11 23:50:56 +0000 2017"
"true","true","https://pbs.twimg.com/profile_banners/3822178574/1721762825","Thu Oct 08 05:48:44 +0000 2015","RETWEETS best
#TheResistance #SocialJustice #Woke
Followed by @DevinCow @TeaPainUSA @funder @mmpadellan @Barbiewithatude @TheRickyDavila @TheAmerican22",,,,,,,,,,,,,,,,"0","32564","1508","4875","true","3822178574","true","false","false","","3047","TheDudeSeesAll","1451977009387622405","false","https://pbs.twimg.com/profile_images/757969690513641472/MZe-n0HF_normal.jpg","","147746","https://twitter.com/TheDudeSeesAll","user","https://x.com/TheDudeSeesAll","TheDudeSeesAll","Massive Trump Debts Uncovered By Deutsche Bank Investigation; Dirty Connect From Russia https://t.co/jlJasPn2Mi","Fri Aug 11 23:38:24 +0000 2017"
"false","true",,"Mon Mar 21 16:58:35 +0000 2011","",,,,,,,,,,,,,,,,"0","498","54","366","false","269894344","false","false","false","","3","Vladimir NT",,"false","https://abs.twimg.com/sticky/default_profile_images/default_profile_normal.png","","12586","https://twitter.com/RuTiVlad","user","https://x.com/RuTiVlad","RuTiVlad","@cnni Trump found a good way to distract public  from the Russia meddling investigation by militarist foreign policies. It's like Syria for Putin.","Fri Aug 11 23:38:15 +0000 2017"
"false","true","https://pbs.twimg.com/profile_banners/65747107/1714784697","Fri Aug 14 21:58:39 +0000 2009","Student. Historian. Educator. Philosopher. I tweet about politics and other topics. #BlackLivesMatter",,,,,,,,,,,,,,,,"0","58623","1588","1997","true","65747107","false","false","false","Michigan ","6160","Parkstorm","1406565359440826371","false","https://pbs.twimg.com/profile_images/1854049569262493697/btXY2x8s_normal.jpg","","139735","https://twitter.com/parkstorm","user","https://x.com/parkstorm","parkstorm","Great! Trump's considering a second war to divert attention away from the Russia investigation. @cspanwj  https://t.co/yvH3KELS7D","Fri Aug 11 23:34:18 +0000 2017"
"true","false","https://pbs.twimg.com/profile_banners/491614500/1561484506","Mon Feb 13 20:42:42 +0000 2012","",,,,,,,,,,,,,,,,"0","126","71","217","false","491614500","false","false","false","Tuscaloosa, AL","102","BamaGrad",,"false","https://pbs.twimg.com/profile_images/1580338766887227392/KSxUOMZB_normal.jpg","","9092","https://twitter.com/bamadavis14","user","https://x.com/bamadavis14","bamadavis14","@MerrillLynched @KatyTurNBC If our investigation reveals it was RUSSIA who attacked our Cuban diplomats with sonic weapons, Trump will send Putin a dozen roses.","Fri Aug 11 23:28:50 +0000 2017"
"false","true","https://pbs.twimg.com/profile_banners/3276714942/1561006168","Sat Jul 11 23:24:44 +0000 2015","Built LA Tough. Long Love Nip!! #TMC 🏁 #FDT",,,,,,,,,,,,,,,,"0","2300","241","869","true","3276714942","false","false","false","Los Angeles, CA","424","Crazy Mitch Asian 🥶","1186348196282265602","false","https://pbs.twimg.com/profile_images/1173889644607332353/NP-cnu5z_normal.jpg","","4906","https://twitter.com/LAsportsCRITIC","user","https://x.com/LAsportsCRITIC","LAsportsCRITIC","Does anyone else realize that the longer Donald Trump keeps fucking around w/ this Nuke talk, the Russia investigation takes a back-seat? 🤔","Fri Aug 11 23:23:15 +0000 2017"
"false","true","https://pbs.twimg.com/profile_banners/740602687729831936/1730903451","Wed Jun 08 17:53:35 +0000 2016","A proud Canadian who despises that ugly orange felon & the toothless brain dead magat hillbillies. 🇨🇦 🇺🇸 *NO DM’s* I BLOCK MAGATS,BOTS,PORN GIRLS & ASSHOLES",,,,,,,,,,,,,,,,"0","15624","2490","3222","true","740602687729831936","false","false","false","FUCK DONALD TRUMP!!!","186","Rabid Dog 🇨🇦",,"false","https://pbs.twimg.com/profile_images/1708913887607681025/xmnXxqD9_normal.jpg","","8304","https://twitter.com/rabid_dog1960","user","https://x.com/rabid_dog1960","rabid_dog1960","@CNN All Trump is doing is taking the attention off the russia investigation. He will do anything to stop it, including getting us all killed.","Fri Aug 11 23:20:00 +0000 2017"
"false","true","https://pbs.twimg.com/profile_banners/805443838299033600/1669507613","Sun Dec 04 16:09:10 +0000 2016","I can never forget 01/06/21, #StopTrump Biden saved US
 Sometimes I say things others won't.  #GodSaveUkraine NO DMs! I won't respond.#BBN UK fan.",,,,,,,,,,,"facebook.com","https://www.facebook.com/","0","23","https://t.co/rgHBJKG0CO","0","40731","2929","4572","true","805443838299033600","false","false","false","Lexington, KY","920","JustMikeCrowe",,"false","https://pbs.twimg.com/profile_images/1700180533551026176/whck2ocV_normal.jpg","","64874","https://twitter.com/GeneralLiberal","user","https://x.com/GeneralLiberal","GeneralLiberal","The Russia Investigation is still on.  Do not let Trump's gunslinger rhetoric fool you. It is just dangerous diversion.","Fri Aug 11 23:18:39 +0000 2017"
"false","true","https://pbs.twimg.com/profile_banners/403795697/1641075850","Thu Nov 03 00:48:52 +0000 2011","this used to be the future. i see the world wildly and in wild ways.",,,,,,,,,,,,,,,,"0","40100","346","751","true","403795697","false","false","false","Truth or Consequences, NM","406","Steffen","1394954171997204485","false","https://pbs.twimg.com/profile_images/1477404947885010953/s9FQ0UKd_normal.jpg","","9359","https://twitter.com/At_DoctorEw","user","https://x.com/At_DoctorEw","At_DoctorEw","@Breaking911 We will continue to threaten more countries the closer we get to trump getting taken down by the Russia investigation","Fri Aug 11 23:18:25 +0000 2017"
"false","false","https://pbs.twimg.com/profile_banners/4488233199/1472953383","Tue Dec 15 04:24:33 +0000 2015","Reader, gardener, animal lover, vegetarian, DIY, political junky. Ally 2 LGBT & POC. TrueBlueDem ImStillWithHer",,,,,,,,,,,,,,,,"0","38075","586","1024","false","4488233199","false","false","false","United States","220","Tory","794382037046231040","false","https://pbs.twimg.com/profile_images/1107406106211561475/VZTzve-F_normal.jpg","","15294","https://twitter.com/chickat234","user","https://x.com/chickat234","chickat234","We know Trump is nervous about Russia investigation when threatening one war isn't enough of a distraction. Now North Korea and Venezuela.","Fri Aug 11 23:17:58 +0000 2017"
"false","true","https://pbs.twimg.com/profile_banners/740602687729831936/1730903451","Wed Jun 08 17:53:35 +0000 2016","A proud Canadian who despises that ugly orange felon & the toothless brain dead magat hillbillies. 🇨🇦 🇺🇸 *NO DM’s* I BLOCK MAGATS,BOTS,PORN GIRLS & ASSHOLES",,,,,,,,,,,,,,,,"0","15624","2490","3222","true","740602687729831936","false","false","false","FUCK DONALD TRUMP!!!","186","Rabid Dog 🇨🇦",,"false","https://pbs.twimg.com/profile_images/1708913887607681025/xmnXxqD9_normal.jpg","","8304","https://twitter.com/rabid_dog1960","user","https://x.com/rabid_dog1960","rabid_dog1960","@CNN All Trump is doing is taking the attention off the russia investigation. He will do anything to stop it, including getting us all killed.","Fri Aug 11 23:16:55 +0000 2017"
"false","false","https://pbs.twimg.com/profile_banners/823577726070194177/1486496475","Mon Jan 23 17:06:46 +0000 2017","",,,,,,,,,,,,,,,,"0","370560","1811","1517","true","823577726070194177","false","false","false","","2","Estelle Levendal",,"false","https://pbs.twimg.com/profile_images/829051607438471168/LGJlYqcd_normal.jpg","","162976","https://twitter.com/estellelevenda1","user","https://x.com/estellelevenda1","estellelevenda1","@JuddLegum All depends on how the Trump/Russia investigation goes.","Fri Aug 11 23:16:44 +0000 2017"
"true","true","https://pbs.twimg.com/profile_banners/472516044/1607707678","Tue Jan 24 01:18:08 +0000 2012","#TeamPelosi  #ImStillWithHer #Resist #BLM #NoDMS",,,,,,,,,,,,,,,,"0","508077","9461","10203","true","472516044","false","false","false","SoCal","415","SoCalJoy","1859382475317039112","false","https://pbs.twimg.com/profile_images/1500974211367456769/wlAk77iY_normal.jpg","","314162","https://twitter.com/SoCalJoy","user","https://x.com/SoCalJoy","SoCalJoy","@RandallVC @EricBoehlert @ezlusztig The Trump/Russia investigation.","Fri Aug 11 23:15:40 +0000 2017"
"false","false","https://pbs.twimg.com/profile_banners/380608558/1662914693","Mon Sep 26 23:00:42 +0000 2011","Catholic Democrat. Red Sox fan. I worked for a long time. Former vodka enthusiast. Tuxedo cat lover. INFJ. Live for March Madness!",,,,,,,,,,,"twitter.com/search?q=from%…","https://twitter.com/search?q=from%3Ajohnbechard%20exclude%3Areplies&s=09","0","23","https://t.co/TmWjKvmsoX","0","337777","21777","21371","true","380608558","false","false","false","Portland, Maine","1386","John Bechard","678018386677379073","false","https://pbs.twimg.com/profile_images/1505510767281557506/rqyZru5I_normal.jpg","","213889","https://twitter.com/JohnBechard","user","https://x.com/JohnBechard","JohnBechard","This Russia investigation is in the bag.  Trump's secretary is involved.

*See Watergate","Fri Aug 11 23:14:17 +0000 2017"
"false","true","https://pbs.twimg.com/profile_banners/257741292/1361209337","Sat Feb 26 02:26:59 +0000 2011","Realtor, D/M/V. Love travel; adore art, entertain, music, cooking, eating out, movies & TV, reading. Human Rights, environment, women & children's rights huge!",,,,,,,,,,,"Naila.com","http://Naila.com","0","23","https://t.co/upWS9hx1SN","0","1372","380","229","true","257741292","false","false","false","Virginia","437","Naila Aziz Ahmed",,"false","https://pbs.twimg.com/profile_images/941123979254775808/3XN3hlI8_normal.jpg","","26485","https://twitter.com/Lady_Nyla","user","https://x.com/Lady_Nyla","Lady_Nyla","@washingtonpost Utterly illiterate comment! But #Trump will not talk against #Putin and that is serious! Let's get to the bottom of #Russia #investigation","Fri Aug 11 23:13:20 +0000 2017"
"true","true","https://pbs.twimg.com/profile_banners/893511902554226688/1501942899","Fri Aug 04 16:40:13 +0000 2017","Psychotherapist, artist,  lover of everything honest and natural.",,,,,,,,,,,,,,,,"0","5093","153","409","false","893511902554226688","false","false","false","","0","Dr.Rob",,"false","https://pbs.twimg.com/profile_images/893839399699402753/JR0lYAJV_normal.jpg","","3882","https://twitter.com/Dr42282466","user","https://x.com/Dr42282466","Dr42282466","@PalmerReport More distraction from the Trump Russia Investigation.","Fri Aug 11 23:12:54 +0000 2017"
"false","false","https://pbs.twimg.com/profile_banners/845388938311217152/1493497494","Fri Mar 24 21:36:44 +0000 2017","Progressive, Patriot, Social & Behavioral Sciences ,Medicine/Law Enforcement, Advocate, LGBTQ ally, Proud Democrat #RESIST 🇺🇸 NO DMs",,,,,,,,,,,,,,,,"0","22817","7878","7959","true","845388938311217152","false","false","false","North Bay, California","38","Xander","974484504667611136","false","https://pbs.twimg.com/profile_images/845429604105924608/8eD2K5MO_normal.jpg","","19740","https://twitter.com/xander1963","user","https://x.com/xander1963","xander1963","We need to get the attention off of this smokescreen NK crap and back on the Trump/Russia investigation. https://t.co/VwRTiRSKVM","Fri Aug 11 23:11:56 +0000 2017"
"true","false","https://pbs.twimg.com/profile_banners/23939887/1600346855","Thu Mar 12 12:40:51 +0000 2009","🇺🇸 #VoteBlue 🌈🌊🌈 LGBT supporter🏳️‍🌈 #BLM *Vaxxed & Boosted & Masked*  Every Dem Must VOTE every election & bring a friend.",,,,,,,,,,,,,,,,"0","154020","2804","3690","true","23939887","false","false","false","Virginia, USA","466","Jo",,"false","https://pbs.twimg.com/profile_images/966108179464704001/JPysDZKE_normal.jpg","","43333","https://twitter.com/kainapoint","user","https://x.com/kainapoint","kainapoint","@Amy_Siskind Far from forgetting about the investigation.  We're hoping Mueller can get something out there before trump starts a war.","Fri Aug 11 23:59:35 +0000 2017"
"false","true","https://pbs.twimg.com/profile_banners/4394257761/1503145306","Sun Dec 06 13:31:09 +0000 2015","Professional coffee lover. Hardcore Kingaholic. Animal lover. The truth always rises to the top. Never give up. #TheResistance #HarrisWalz2024 🪷",,,,,,,,,,,,,,,,"0","258912","1028","1477","true","4394257761","false","false","false","North Carolina, USA","106","Terri J 🪷",,"false","https://pbs.twimg.com/profile_images/1296969308522905601/XNlGB888_normal.jpg","","14247","https://twitter.com/TerriJJenk","user","https://x.com/TerriJJenk","TerriJJenk","@Amy_Siskind Hopefully Mueller will be able to keep on with the investigation while trump is distracted.","Fri Aug 11 23:59:27 +0000 2017"
"true","false","https://pbs.twimg.com/profile_banners/16315015/1580579136","Tue Sep 16 18:47:29 +0000 2008","I love AMERICA, and my flag flies to the left! #SaveAmerica #SaveDemocracy 
.
Here to help others towards a healthy lifestyle with USANA!!",,,,,,,,,,,"michelleprovencio.usana.com","http://michelleprovencio.usana.com","0","23","https://t.co/CAy4hQZPHG","0","25834","629","699","false","16315015","false","false","false","United States... and beyond!","956","Michelle Provencio","962875317575561216","false","https://pbs.twimg.com/profile_images/1139936424143097856/AsZ-dKwX_normal.jpg","","23647","https://twitter.com/healthyfreedom","user","https://x.com/healthyfreedom","healthyfreedom","@Santuitis Good point... at the very least he thinks it will help him in the polls and distract us from the #Mueller investigation!","Fri Aug 11 23:59:21 +0000 2017"
"true","true",,"Mon Apr 11 00:04:44 +0000 2016","",,,,,,,,,,,,,,,,"0","11501","197","68","false","719315208808759296","true","false","false","Oceanside ca","49","Robert alexander",,"false","https://pbs.twimg.com/profile_images/1860094732246089729/6EUQOLZ4_normal.jpg","","6632","https://twitter.com/Roberta64651101","user","https://x.com/Roberta64651101","Roberta64651101","@28Pages ""Government lied Swamp Knew the Truth"" Bandar threw the best party's in DC cash flowed Mueller why no investigation Saudi financing 9/11 ?","Fri Aug 11 23:57:13 +0000 2017"
"true","false","https://pbs.twimg.com/profile_banners/1102368558/1620712336","Sat Jan 19 00:25:39 +0000 2013","#Resister 💙Love it when folks vett and follow back. Retired teacher. No DMs please. Snider@erintruth.bsky.social 🦋",,,,,,,,,,,,,,,,"0","349575","20487","22533","true","1102368558","false","false","false","NorCal, USA","4113","Erin Snider🆘️ 🇺🇸 🐦🌍🌊",,"false","https://pbs.twimg.com/profile_images/1377708632851161090/fpyfCdsX_normal.jpg","","308535","https://twitter.com/ErinSnider10","user","https://x.com/ErinSnider10","ErinSnider10","@joncoopertweets @ManMet80 @realDonaldTrump 2nd choice is Mueller investigation. That will provide justification for him to resign. #DumpTrump","Fri Aug 11 23:55:09 +0000 2017"
"false","true",,"Sat Oct 20 00:52:22 +0000 2012","I'm a Christian American who has seen our American society go from helping the least among us to oppressing them. Through God's Word I hope to enlighten them.",,,,,,,,,,,,,,,,"0","13394","129","268","false","892160066","false","false","false","","37","Bob Dillashaw",,"false","https://pbs.twimg.com/profile_images/2739470066/a7a8c6098b866af977a429402fded967_normal.jpeg","","8380","https://twitter.com/Christianncal","user","https://x.com/Christianncal","Christianncal","@JoyAnnReid With the grace of God, and Mr. Mueller's investigation results, we &amp; the world should all know.👍","Fri Aug 11 23:54:32 +0000 2017"
"false","true",,"Mon Feb 06 00:21:04 +0000 2017","A real person",,,,,,,,,,,,,,,,"0","1785","8","55","true","828398064356388864","false","false","false","Western Edge, USA","28","lusi",,"false","https://pbs.twimg.com/profile_images/828406637400428544/r7fEhqZ3_normal.jpg","","8318","https://twitter.com/resistiam","user","https://x.com/resistiam","resistiam","@politico Trying to turn attention away from the Mueller investigation.","Fri Aug 11 23:54:02 +0000 2017"
"false","true",,"Sun Nov 27 15:35:48 +0000 2016","",,,,,,,,,,,,,,,,"0","17542","219","245","false","802898727836983296","false","false","false","","1","Pierrel@yahoo.com",,"false","https://abs.twimg.com/sticky/default_profile_images/default_profile_normal.png","","34203","https://twitter.com/Pierrelyahooco1","user","https://x.com/Pierrelyahooco1","Pierrelyahooco1","Trump's administration operates like
"" la cosa nostra""
War or no war,Mueller investigation will continue
Lock him up
Lock him up
Lock him up","Fri Aug 11 23:51:49 +0000 2017"
"true","false","https://pbs.twimg.com/profile_banners/412613191/1684782893","Mon Nov 14 23:12:52 +0000 2011","editor @gamespot ✨ inactive account | find me on bluesky, discord, and instagram",,,,,,,,,,,,,,,,"0","43382","4257","2011","true","412613191","false","false","false","","6735","Mark Ⴟ Ⓥ Delaney","1755668735120339185","false","https://pbs.twimg.com/profile_images/1612199140397813760/zckB55-L_normal.jpg","","47221","https://twitter.com/markdelaneysays","user","https://x.com/markdelaneysays","markdelaneysays","@colincirca Are you following @SethAbramson? His Mueller investigation tweet threads are remarkably informative.","Fri Aug 11 23:51:32 +0000 2017"
"false","false","https://pbs.twimg.com/profile_banners/48756390/1505736540","Fri Jun 19 16:47:19 +0000 2009","“If you’re not outraged, you’re not paying attention” ~ Heather Heyer ❗️Not My GOP❗️Country Over Party❗️",,,,,,,,,,,,,,,,"0","151086","369","732","true","48756390","false","false","false","","3767","🚁dlc🇺🇸",,"false","https://pbs.twimg.com/profile_images/810293219535847428/9TgZdDGt_normal.jpg","","54076","https://twitter.com/TGAND4","user","https://x.com/TGAND4","TGAND4","Hey @DonaldJTrumpJr what's up? How's the Mueller investigation going? Haven't heard from you in days! Are you worried? https://t.co/Bx4OJ4sA5O","Fri Aug 11 23:50:38 +0000 2017"
"false","true",,"Sun Jul 30 02:54:21 +0000 2017","From Windsor Ontario, working in Detroit MI.",,,,,,,,,,,,,,,,"0","8254","15","42","false","891492127087218688","false","false","false","Windsor, Ontario","0","KanadianGirl",,"false","https://pbs.twimg.com/profile_images/891716514868604928/UEyNLui1_normal.jpg","","1611","https://twitter.com/KanadianGrl","user","https://x.com/KanadianGrl","KanadianGrl","@PersianCeltic @ananavarro Right on ... slight of hand ... hoping to overshadow mueller investigation","Fri Aug 11 23:50:07 +0000 2017"
"false","true","https://pbs.twimg.com/profile_banners/276580437/1502321990","Sun Apr 03 17:09:11 +0000 2011","Model, musician, animal rights activist. Let me take your soul. #ClimateChange Sibling to @staceyb_ny & @rachelbrowne_ny #MasksSaveLives #NYStrong",,,,,,,,,,,,,,,,"0","11846","806","1967","false","276580437","false","false","false","New York, NY","142","Jason Browne 🌊","860222151638609920","false","https://pbs.twimg.com/profile_images/895431278559772672/edwhwG8-_normal.jpg","","13387","https://twitter.com/JasonB_ny","user","https://x.com/JasonB_ny","JasonB_ny","@olgaNYC1211 Distract us all you want Trump, the Robert Mueller's investigation's still on","Fri Aug 11 23:48:39 +0000 2017"
"false","false","https://pbs.twimg.com/profile_banners/823577726070194177/1486496475","Mon Jan 23 17:06:46 +0000 2017","",,,,,,,,,,,,,,,,"0","370560","1811","1517","true","823577726070194177","false","false","false","","2","Estelle Levendal",,"false","https://pbs.twimg.com/profile_images/829051607438471168/LGJlYqcd_normal.jpg","","162976","https://twitter.com/estellelevenda1","user","https://x.com/estellelevenda1","estellelevenda1","@kylegriffin1 Just droning out the sound of Mueller's investigation.","Fri Aug 11 23:48:16 +0000 2017"
"true","false","https://pbs.twimg.com/profile_banners/2697912192/1669249795","Fri Aug 01 10:28:45 +0000 2014","Journalism, data. Archaeologist. 

Opinions mine

RusticGorilla on /r/Keep_Track",,,,,,,,,,,"reddit.com/r/Keep_Track/","https://www.reddit.com/r/Keep_Track/","0","23","https://t.co/sojHKeANGe","0","10070","4455","1146","true","2697912192","false","false","false","Seattle, WA","1989","rusticgorilla","1858912777488011283","false","https://pbs.twimg.com/profile_images/1547793885241282563/cfTQuKAr_normal.jpg","","30816","https://twitter.com/ImagineWorldas1","user","https://x.com/ImagineWorldas1","ImagineWorldas1","@MalcolmNance Trump threats are mainly a distraction. A war with Venezuela to distract from the war with Korea to distract from Mueller's investigation.","Fri Aug 11 23:48:09 +0000 2017"
"false","true","https://pbs.twimg.com/profile_banners/887514338516500480/1612358296","Wed Jul 19 03:28:02 +0000 2017","Carries a lamp looking for an honest man. Criticizer of a confused and corrupt society. Often found asleep in a large pithos. Created the Middle Finger Insult.",,,,,,,,,,,"basicincome.stanford.edu/about/what-is-…","https://basicincome.stanford.edu/about/what-is-ubi/","0","23","https://t.co/DZpFveGio1","0","1925","152","286","true","887514338516500480","false","false","false","Directly under the Sun","1670","Diogenes' Philosophical Stunt",,"false","https://pbs.twimg.com/profile_images/1353152730865541121/nTDytstT_normal.jpg","","22719","https://twitter.com/troopermarkle","user","https://x.com/troopermarkle","troopermarkle","@M22Hilary @FoxBusiness @replouiegohmert Ok, so they are all involved with the Russians. Let's all root them out together starting with the Mueller investigation. Investigate all.","Fri Aug 11 23:47:22 +0000 2017"
"true","false","https://pbs.twimg.com/profile_banners/15584936/1652617692","Thu Jul 24 17:08:43 +0000 2008","Navy Vet. Served to protect America from external & internal threats. 
#FuckPutin #WhiteTerrorismIsReal.
I'm also on Threads!",,,,,,,,,,,,,,,,"0","32169","2292","4352","true","15584936","false","false","false","Earth","858","N_Dis_Life🇺🇲🇺🇦🇮🇱🇯🇴",,"false","https://pbs.twimg.com/profile_images/1525815308191158272/mvHG4Vqh_normal.jpg","","62814","https://twitter.com/trywait4me","user","https://x.com/trywait4me","trywait4me","@ElleEmEyeTee @realDonaldTrump Don't you worry,  Donald. Mueller will continue the Russian investigation no matter the distraction you conjure up.","Fri Aug 11 23:47:21 +0000 2017"
