"author/canDm","author/canMediaTag","author/coverPicture","author/createdAt","author/description","author/entities/description/urls/0/display_url","author/entities/description/urls/0/expanded_url","author/entities/description/urls/0/indices/0","author/entities/description/urls/0/indices/1","author/entities/description/urls/0/url","author/entities/description/urls/1/display_url","author/entities/description/urls/1/expanded_url","author/entities/description/urls/1/indices/0","author/entities/description/urls/1/indices/1","author/entities/description/urls/1/url","author/entities/url/urls/0/display_url","author/entities/url/urls/0/expanded_url","author/entities/url/urls/0/indices/0","author/entities/url/urls/0/indices/1","author/entities/url/urls/0/url","author/fastFollowersCount","author/favouritesCount","author/followers","author/following","author/hasCustomTimelines","author/id","author/isBlueVerified","author/isTranslator","author/isVerified","author/location","author/mediaCount","author/name","author/pinnedTweetIds/0","author/possiblySensitive","author/profilePicture","author/status","author/statusesCount","author/twitterUrl","author/type","author/url","author/userName","text","createdAt"
"false","true","https://pbs.twimg.com/profile_banners/349803020/1446148252","Sat Aug 06 18:34:39 +0000 2011","Singer-songwriter/musician: Here for social/climate justice, fintwit and preventing a Trump dictatorship. Spotify https://t.co/sNSO5ATqRP Buy https://t.co/oLxzwnZc73","rb.gy/jm7b2","http://rb.gy/jm7b2","114","137","https://t.co/sNSO5ATqRP","bit.ly/2kJwUoL","http://bit.ly/2kJwUoL","142","165","https://t.co/oLxzwnZc73","about.me/bill.madden","http://about.me/bill.madden","0","23","https://t.co/2VhIVMu7IL","0","4490","269718","52900","false","349803020","true","false","false","Lower East Side/Chinatown, NYC","5444","Bill Madden","1802401009026715870","false","https://pbs.twimg.com/profile_images/1527075304887525377/5_myTcv8_normal.jpg","","66114","https://twitter.com/maddenifico","user","https://x.com/maddenifico","maddenifico","Trump is going down: Senior Trump campaign adviser Rick Gates is finalizing a plea deal with special counsel Robert Mueller — signaling he’s poised to cooperate in the investigation of criminal con-man Trump and Russia https://t.co/SDt8FaCs8H","Thu Feb 15 23:59:50 +0000 2018"
"false","true","https://pbs.twimg.com/profile_banners/287300543/1637339960","Sun Apr 24 18:29:59 +0000 2011","Feminist, Activist #resist;  Author 'Abigail Reluctant Activist'. YA https://t.co/p8pCp0SUIb   A book for our times!!","tinyurl.com/2sm73cwh","http://tinyurl.com/2sm73cwh","69","92","https://t.co/p8pCp0SUIb",,,,,,,,,,,"0","99580","9285","9404","true","287300543","false","false","false","Glen Cove, New York","748","Pink pussy hat wearer who is ANGRY",,"false","https://pbs.twimg.com/profile_images/1795164093776596992/TWa9Znyf_normal.jpg","","163545","https://twitter.com/laurasessions10","user","https://x.com/laurasessions10","laurasessions10","AND if trump dares to go after mueller it will be the AG'S who continue the investigation and prosecution AND he can't fire them!!!! They are elected. https://t.co/hUrJDuMZuD","Thu Feb 15 23:59:27 +0000 2018"
"true","false","https://pbs.twimg.com/profile_banners/2528368718/1724398549","Tue May 27 22:04:17 +0000 2014","“Actus me invito factus, non est meus actus. ~ An act done by me against my will, is not my act. “Investigator, Analyst, OSINT, HUMINT,Consult, LEO, US Marine",,,,,,,,,,,,,,,,"0","9670","269","1356","true","2528368718","false","false","false","FEMA X","51","Espiare Group","1826829129704243667","false","https://pbs.twimg.com/profile_images/1826885993431269376/0zD46gXr_normal.jpg","","20809","https://twitter.com/acme_subrosea","user","https://x.com/acme_subrosea","acme_subrosea","@CNN The Mueller Investigation is an abortion of justice. It looses more credibility nearly every day as more evidence is brought forward implicating DNC, Top feds, and HRC campaign colluding with Russia to get dirt on Trump.","Thu Feb 15 23:58:52 +0000 2018"
"false","true",,"Tue Jun 02 18:34:34 +0000 2009","",,,,,,,,,,,,,,,,"0","164710","898","1109","true","44175599","false","false","false","Chicago","8969","Beatrice Westrate. 🟧",,"false","https://abs.twimg.com/sticky/default_profile_images/default_profile_normal.png","","294805","https://twitter.com/beeinchicago","user","https://x.com/beeinchicago","beeinchicago","Bannon interviewed in Mueller's Russia investigation https://t.co/zz0DVSyaQv via @YahooFinance","Thu Feb 15 23:57:50 +0000 2018"
"false","true","https://pbs.twimg.com/profile_banners/34383891/1513405481","Wed Apr 22 20:17:58 +0000 2009","Retiree advocating for common sense gun regulations. All posts and opinions are my own.",,,,,,,,,,,,,,,,"0","64389","64431","68817","true","34383891","true","false","false","Heath, TX","7280","Linda Hill","1853088701238190591","false","https://pbs.twimg.com/profile_images/941919381700853760/POQcf923_normal.jpg","","506140","https://twitter.com/bulldoghill","user","https://x.com/bulldoghill","bulldoghill","Former Trump campaign adviser Rick Gates is finalizing a plea deal with special counsel Robert Mueller's office, indicating he's poised to cooperate in the investigation, according to sources familiar with the case. https://t.co/lnMa0TLRdO","Thu Feb 15 23:56:47 +0000 2018"
"false","true","https://pbs.twimg.com/profile_banners/1028762646/1419733828","Sat Dec 22 16:01:34 +0000 2012","Prolific writer of letters to the editor. Dabbles in puns, Low tolerance 4 twittiots, DBs & Trumplodytes",,,,,,,,,,,,,,,,"0","16479","230","565","false","1028762646","false","false","false","","531","bruce ellers","1615768118340501518","false","https://pbs.twimg.com/profile_images/584065096718163969/XSqKFZk1_normal.jpg","","52043","https://twitter.com/bereasonable2","user","https://x.com/bereasonable2","bereasonable2","@thehill #Mueller has the power to exculpate Trump - provided he's done nothing wrong. Contact your elected reps and demand they protect Mueller's investigation: https://t.co/VvC4X106gT  https://t.co/S7Oq3oSN0O","Thu Feb 15 23:55:53 +0000 2018"
"false","true",,"Fri Apr 17 03:51:41 +0000 2009","Live, eat and sleep Soccer........",,,,,,,,,,,"twitter.com/GitongaN","https://twitter.com/GitongaN","0","23","https://t.co/py0mjPL08Q","0","999","208","286","true","32294490","false","false","false","Washington, DC","48","Paddy4Fingers",,"false","https://pbs.twimg.com/profile_images/1489098141970305025/OXicHlGa_normal.jpg","","4819","https://twitter.com/Gitonga_N","user","https://x.com/Gitonga_N","Gitonga_N","It's no longer a matter of, ""will he?"" but ""when"" he gets rid of Mueller. The Nunez FBI Memo did little, if anything, to water down the heat off the investigation. #TrumpRussiaCollusion  . https://t.co/AWLrz8dc3t","Thu Feb 15 23:55:43 +0000 2018"
"false","true","https://pbs.twimg.com/profile_banners/1028762646/1419733828","Sat Dec 22 16:01:34 +0000 2012","Prolific writer of letters to the editor. Dabbles in puns, Low tolerance 4 twittiots, DBs & Trumplodytes",,,,,,,,,,,,,,,,"0","16479","230","565","false","1028762646","false","false","false","","531","bruce ellers","1615768118340501518","false","https://pbs.twimg.com/profile_images/584065096718163969/XSqKFZk1_normal.jpg","","52043","https://twitter.com/bereasonable2","user","https://x.com/bereasonable2","bereasonable2","@tedlieu @realDonaldTrump #Mueller has the power to exculpate Trump - provided he's done nothing wrong. Contact your elected reps and demand they protect Mueller's investigation: https://t.co/VvC4X106gT  https://t.co/S7Oq3oSN0O","Thu Feb 15 23:55:39 +0000 2018"
"false","true","https://pbs.twimg.com/profile_banners/1626904404/1497724105","Sun Jul 28 03:29:03 +0000 2013","President of Citizens for Responsibility and Ethics in Washington (@CREWcrew). Former federal corruption prosecutor. Fighting for an ethical democracy.",,,,,,,,,,,"citizensforethics.org","http://www.citizensforethics.org","0","22","http://t.co/nuxd81lWVV","0","1772","71427","1495","false","1626904404","false","false","false","Washington, DC","111","Noah Bookbinder","1857090121935315078","false","https://pbs.twimg.com/profile_images/1049716354746654722/j0mPBr_V_normal.jpg","","14348","https://twitter.com/NoahBookbinder","user","https://x.com/NoahBookbinder","NoahBookbinder","Looks like another significant former Trump campaign official, Rick Gates, will be pleading guilty &amp; cooperating with Special Counsel Mueller's investigation. Clear that Mueller is building this case &amp; moving slowly upward through the organization. https://t.co/p4PXwFTREr","Thu Feb 15 23:54:29 +0000 2018"
"false","true","https://pbs.twimg.com/profile_banners/1158286658/1462666844","Thu Feb 07 21:12:25 +0000 2013","https://t.co/9ngijSHRTT everything news, training, and entertainment for a trucker's mobile lifestyle in one convenient place.","iTRUCK.NEWS","http://iTRUCK.NEWS","0","23","https://t.co/9ngijSHRTT",,,,,,"iTRUCK.NEWS","http://www.iTRUCK.NEWS","0","23","https://t.co/23H5GGAAru","0","737","3946","1567","false","1158286658","false","false","false","Chattanooga, TN","288575","iTruck NEWS",,"false","https://pbs.twimg.com/profile_images/729820162615037953/yZpZ8Wzj_normal.jpg","","652299","https://twitter.com/iTruck_NEWS","user","https://x.com/iTruck_NEWS","iTruck_NEWS","Bannon interviewed in Mueller’s Russia investigation https://t.co/8ih35jSSdh","Thu Feb 15 23:54:12 +0000 2018"
"true","true",,"Fri Feb 03 23:22:11 +0000 2017","",,,,,,,,,,,,,,,,"0","1213","55125","13523","true","827658471000600576","false","false","false","","426","Hi","1325117962055938048","false","https://pbs.twimg.com/profile_images/1854162405892456448/X37V0QGo_normal.jpg","","13663","https://twitter.com/FIRE_THE_FOOL","user","https://x.com/FIRE_THE_FOOL","FIRE_THE_FOOL","Another plea coming in the total witch hunt #RussiaGate investigation. Trump campaign Senior advisor Gates finalizing plea deal w/ Mueller. https://t.co/idesnbv50R","Thu Feb 15 23:54:09 +0000 2018"
"false","false","https://pbs.twimg.com/profile_banners/22502126/1440266398","Mon Mar 02 16:40:38 +0000 2009","retired and aging...what can I say! Liberal;animal lover;all around nice person...retired caseworker..#TheResistance",,,,,,,,,,,,,,,,"0","44006","1012","4008","false","22502126","false","false","false","Fairfax Virginia","5546","Dee",,"false","https://pbs.twimg.com/profile_images/978746514871914498/Mh90dof7_normal.jpg","","72702","https://twitter.com/deebelle3","user","https://x.com/deebelle3","deebelle3","Bannon interviewed in Mueller's Russia investigation https://t.co/MFSMleEc0R via @YahooFinance","Thu Feb 15 23:53:25 +0000 2018"
"false","true",,"Fri Mar 13 19:30:38 +0000 2009","",,,,,,,,,,,,,,,,"0","1609","625","1436","false","24234505","false","false","false","","914","Jim Combs","1409701304616689666","false","https://pbs.twimg.com/profile_images/392058418/JC609_normal.bmp","","75346","https://twitter.com/jimcombs","user","https://x.com/jimcombs","jimcombs","Bannon interviewed in Mueller's Russia investigation https://t.co/FpdEoT8sWi","Thu Feb 15 23:52:45 +0000 2018"
"false","true","https://pbs.twimg.com/profile_banners/845104221028540417/1490323679","Fri Mar 24 02:45:22 +0000 2017","Strive not to be a success, but rather to be of value.",,,,,,,,,,,,,,,,"0","0","7","26","false","845104221028540417","false","false","false","","64","iowabrandy50",,"false","https://pbs.twimg.com/profile_images/845104725636861953/tdRq33gm_normal.jpg","","23298","https://twitter.com/iowabrandy502","user","https://x.com/iowabrandy502","iowabrandy502","Senior Trump campaign adviser Rick Gates is finalizing a plea deal with special counsel Robert Mueller’s office, indicating he’s poised to cooperate in the investigation https://t.co/JlG2pbDoIZ https://t.co/WJgflvRZQn cnnbrk","Thu Feb 15 23:52:24 +0000 2018"
"false","false","https://pbs.twimg.com/profile_banners/220823461/1551995837","Sun Nov 28 23:06:11 +0000 2010","Liberal Politics • Science • Fact • Funny. SUBSCRIBE NOW for Exclusive Investigations and Reporting. ⬇️⬇️⬇️",,,,,,,,,,,"youtube.com/belessstupid","http://youtube.com/belessstupid","0","23","https://t.co/oqy7gMQt3n","0","256","1312","1678","false","220823461","false","false","false","Hollywood, CA","4780","Be Less Stupid",,"false","https://pbs.twimg.com/profile_images/1103777298329722880/cLhaf2mg_normal.png","","23163","https://twitter.com/BeLessStupid2","user","https://x.com/BeLessStupid2","BeLessStupid2","Steve Bannon Faces Contempt of Congress Charge After 20+ Hours Of Testimony To Robert Mueller's Investigation. https://t.co/jQ3PUkbo1k","Thu Feb 15 23:52:22 +0000 2018"
"true","false","https://pbs.twimg.com/profile_banners/884224110414381056/1682373757","Mon Jul 10 01:33:50 +0000 2017","** On BSky, handle CrazySaguaro. ** Your Mental health is important (#FuckAnxiety). Love my #ChiBears 🐻 #DaBears. Have gratitude. Love Mexico 🇲🇽",,,,,,,,,,,,,,,,"0","343585","5006","5017","true","884224110414381056","false","false","false","Chandler, AZ","10235","CrazySaguaro 💙🌵 🐻⬇️","1656037930228432900","false","https://pbs.twimg.com/profile_images/1607985641782140929/IcWJV3UY_normal.jpg","","74112","https://twitter.com/TheCrazySaguaro","user","https://x.com/TheCrazySaguaro","TheCrazySaguaro","""Former Trump campaign adviser Rick Gates is finalizing a plea deal with special counsel Robert Mueller's office, indicating he's poised to cooperate in the investigation, according to sources familiar with the case."" https://t.co/Dfv2Boxrth","Thu Feb 15 23:52:20 +0000 2018"
"false","true",,"Mon Aug 28 20:37:26 +0000 2017","Critical Thinker",,,,,,,,,,,,,,,,"0","4","4","1","false","902268912657715200","false","false","false","East of the Rockies","735","Horatio Cacles",,"false","https://pbs.twimg.com/profile_images/1281268064366071810/TB-KgNMY_normal.jpg","","2064","https://twitter.com/HThx1362","user","https://x.com/HThx1362","HThx1362","Had the FBI not been so busy meddling in the U.S. elections, and then extremely busy again covering their own butts about said election meddling, maybe they might have followed up a little better to see what Cruz's social media activity included!
#Parkland#FBIMemo","Thu Feb 15 23:58:35 +0000 2018"
"false","true",,"Mon Aug 28 20:37:26 +0000 2017","Critical Thinker",,,,,,,,,,,,,,,,"0","4","4","1","false","902268912657715200","false","false","false","East of the Rockies","735","Horatio Cacles",,"false","https://pbs.twimg.com/profile_images/1281268064366071810/TB-KgNMY_normal.jpg","","2064","https://twitter.com/HThx1362","user","https://x.com/HThx1362","HThx1362","Had the FBI not been so busy meddling in the U.S. elections, and then extremely busy again covering their own butts about said election meddling, maybe they might have followed up a little better to see that Cruz's social media activity included!
#Parkland","Thu Feb 15 23:57:27 +0000 2018"
"false","true","https://pbs.twimg.com/profile_banners/21421372/1689391928","Fri Feb 20 18:46:44 +0000 2009","Life is Short, Break the rules! I'm a LIBERAL Democrat #LockUpTrump",,,,,,,,,,,"youravon.com/pbartch","http://www.youravon.com/pbartch","0","23","https://t.co/fNYwIfPKuA","0","35329","2046","4601","true","21421372","false","false","false","USA","4419","PatriciaBLovesUSA",,"false","https://pbs.twimg.com/profile_images/1682693605360832513/Aoo__Twu_normal.jpg","","29209","https://twitter.com/patriciab123","user","https://x.com/patriciab123","patriciab123","Pence says U.S. intelligence agencies found no impact from Russian  meddling in the 2016 election. But a report from these agencies  contradicts him. @VP YOU ARE A LIAR AND A TRAITOR https://t.co/Cwrxvz8fEr https://t.co/bPzQRLnR7n","Thu Feb 15 23:46:33 +0000 2018"
"false","true","https://pbs.twimg.com/profile_banners/836623284192096256/1563393522","Tue Feb 28 17:05:09 +0000 2017","WE make our communities and our democracy strong, together! #CitizensRevival",,,,,,,,,,,"citizensrevival.com","https://citizensrevival.com/","0","23","https://t.co/KLvQSWaBAV","0","17365","5196","5639","true","836623284192096256","false","false","false","Nashville, TN","5805","BriteHeart","1860698611585040867","false","https://pbs.twimg.com/profile_images/883425989757255681/xHjCsoJ1_normal.jpg","","22890","https://twitter.com/BriteHeartNow","user","https://x.com/BriteHeartNow","BriteHeartNow","@CREWcrew If it wasn't for Russian meddling in our election, Pence would probably still be a governor. #RussianBots","Thu Feb 15 23:39:51 +0000 2018"
"false","true",,"Fri Nov 27 18:38:30 +0000 2015","Nullius in verba (Latin for ""on the word of no one"" or ""take nobody's word for it"") is my motto",,,,,,,,,,,,,,,,"0","11230","314","656","true","4380232213","false","false","false","","962","Tony",,"false","https://pbs.twimg.com/profile_images/1078037291002744834/Y4i0gZHT_normal.jpg","","16616","https://twitter.com/tloretdemola","user","https://x.com/tloretdemola","tloretdemola","@CREWcrew .@MikePenceVP wouldn’t know anything about no Russians meddling in our election cause they told him so.","Thu Feb 15 23:37:21 +0000 2018"
"false","true","https://pbs.twimg.com/profile_banners/921842109082083328/1508642760","Sat Oct 21 20:54:20 +0000 2017","All Breaking News Alerts Around World from The Trusted Sources or NOT.",,,,,,,,,,,,,,,,"0","0","807","0","false","921842109082083328","false","false","false","Seattle, WA","3","All Breaking News",,"false","https://pbs.twimg.com/profile_images/924789195155021824/WS9biEN4_normal.jpg","","91556","https://twitter.com/AllBRKNews","user","https://x.com/AllBRKNews","AllBRKNews","Former Trump senior strategist Steve Bannon interviewed for 20 hours over 2 days as part of Robert Mueller's Russian election meddling probe https://t.co/wsHAKcU1iN","Thu Feb 15 23:36:43 +0000 2018"
"false","true",,"Thu Feb 24 17:55:33 +0000 2011","Dog Dad. Coffee Lover. Democrat. Rotarian. 
Total Mortgage Services, LLC 
Mortgage Banker
NMLS #108809 
Equal Housing Lender",,,,,,,,,,,"totalmortgage.com/bankers/bob-za…","http://totalmortgage.com/bankers/bob-zanlungo","0","23","https://t.co/N4loo4gyTz","0","91560","583","1069","true","257082496","false","false","false","Glastonbury, CT","92","Bob Zanlungo",,"false","https://pbs.twimg.com/profile_images/1330675325546729472/luzhzFeS_normal.jpg","","3952","https://twitter.com/BobZanlungo","user","https://x.com/BobZanlungo","BobZanlungo","But don’t worry, they definitely weren’t meddling in the election. SMDH  https://t.co/S5b1DguAih","Thu Feb 15 23:12:22 +0000 2018"
"true","false","https://pbs.twimg.com/profile_banners/702643881054089216/1645907046","Wed Feb 24 23:58:50 +0000 2016","Retired CIA. CNN contributor. Watching Russia. Trying to be anti-racist. Loving sunflowers.",,,,,,,,,,,,,,,,"0","5171","54511","408","true","702643881054089216","false","false","false","","34","Steven L. Hall",,"false","https://pbs.twimg.com/profile_images/920322599736840192/iOC3Zcrq_normal.jpg","","17029","https://twitter.com/StevenLHall1","user","https://x.com/StevenLHall1","StevenLHall1","Lordy, I hope so.  Moscow says has evidence of Western meddling in Russian election https://t.co/TsxEo3E6ki","Thu Feb 15 23:10:54 +0000 2018"
"false","true","https://pbs.twimg.com/profile_banners/781380018173652992/1475757689","Thu Sep 29 06:28:08 +0000 2016","",,,,,,,,,,,,,,,,"0","0","19","36","false","781380018173652992","false","false","false","","5484","American Downfall",,"false","https://pbs.twimg.com/profile_images/784011008746463232/FrYYqMmR_normal.jpg","","5852","https://twitter.com/MericanDownfall","user","https://x.com/MericanDownfall","MericanDownfall","Steve Bannon Stonewalls Investigators Question On Russian Election Meddling - https://t.co/MYPpDCDck4 #russia #trump #putin #maga #collusion https://t.co/ON7e3EYOdr","Thu Feb 15 23:04:27 +0000 2018"
"false","true","https://pbs.twimg.com/profile_banners/553102260/1644183430","Fri Apr 13 21:24:53 +0000 2012","Intelligence & National Security Reporter, @CBSNews | olivia@cbsnews.com",,,,,,,,,,,,,,,,"0","3293","18654","2282","true","553102260","false","false","false","Washington, DC","893","Olivia Gazis","1859595192698876126","false","https://pbs.twimg.com/profile_images/1678952553558540289/S3ImWmcS_normal.jpg","","15491","https://twitter.com/Olivia_Gazis","user","https://x.com/Olivia_Gazis","Olivia_Gazis","Speaking of election security (and how Russian meddling has already begun)

ODNI, DHS and FBI to hold a ‘national-level classified dialogue’ with state election officials “to ensure the sharing of timely, substantive information on threats to our nation’s critical infrastructure” https://t.co/qKxuSJGKbT","Thu Feb 15 23:03:55 +0000 2018"
"true","false","https://pbs.twimg.com/profile_banners/66351565/1647997761","Mon Aug 17 13:18:49 +0000 2009","Lucky moron. Nuclear is for electricity and space propulsion. Anti-NeoLiberal. (he/him)",,,,,,,,,,,"twitter.com/DanielOCL","https://twitter.com/DanielOCL","0","23","https://t.co/bsR2M81qQF","0","500424","1140","2097","true","66351565","false","false","false","Former Portuguese Colony","37089","Alienígena do Futuro | Daniel | 🇵🇸🫒🪁","1823631433337909613","false","https://pbs.twimg.com/profile_images/1420469670839259149/PsUXXR2M_normal.jpg","","539025","https://twitter.com/DanielOCL","user","https://x.com/DanielOCL","DanielOCL","Russian election meddling equivalent to ‘attack on US’ with ‘bombs &amp; bullets’— US lawmaker https://t.co/hux1Vl0SA8","Thu Feb 15 22:45:15 +0000 2018"
"true","false","https://pbs.twimg.com/profile_banners/23111022/1514962342","Fri Mar 06 20:06:08 +0000 2009","Mathematician / Scientist / Philosopher / Theologian / Engineer / Technician / Poet / Scholar / Writer / Philanthropist",,,,,,,,,,,"syssecserv.com","http://syssecserv.com","0","23","https://t.co/LQpCQwSTTI","0","626","4890","5427","true","23111022","false","false","false","San Antonio, TX","6069","Matthew Boicourt","1862720745916244450","false","https://pbs.twimg.com/profile_images/948447547751915521/uqrg5NpN_normal.jpg","","1012281","https://twitter.com/syssecserv","user","https://x.com/syssecserv","syssecserv","I'm attempting to be UNBIASED in regard to this particular subject.  Allegations of Russia meddling in the 2016 U.S. Presidential election, and allegations of @POTUS @realDonaldTrump and members of his cabinet collaborating with Russia, isn't what concerns me right now.","Thu Feb 15 22:42:54 +0000 2018"
"false","false","https://pbs.twimg.com/profile_banners/23255709/1422441356","Sun Mar 08 00:33:50 +0000 2009","hyperbolic text markup language",,,,,,,,,,,,,,,,"0","23672","294","3730","true","23255709","false","false","false","Location","3","jadamantium",,"false","https://pbs.twimg.com/profile_images/1202436476811612160/w5OM9-is_normal.jpg","","147","https://twitter.com/jadamantium","user","https://x.com/jadamantium","jadamantium","@samesmail Mr. Robot had a high ground in its fiction of the individual vs deep state machinations, until u dated the show with the real world election meddling narrative. A litmus test for useful idiots. Chose a side, when both sides need erasing. As years go by, its going to look moronic.","Thu Feb 15 22:36:31 +0000 2018"
"false","true","https://pbs.twimg.com/profile_banners/22187085/1602184450","Fri Feb 27 20:40:27 +0000 2009","CREW uses high-impact legal actions to target government officials who sacrifice the common good to special interests.",,,,,,,,,,,"citizensforethics.org","http://www.citizensforethics.org","0","22","http://t.co/VSJXQLgpKY","0","1792","473435","1561","true","22187085","true","false","false","Washington, D.C.","3463","Citizens for Ethics","1854579332103963039","false","https://pbs.twimg.com/profile_images/1314282774493356032/U05fnjcs_normal.jpg","","115986","https://twitter.com/CREWcrew","user","https://x.com/CREWcrew","CREWcrew","Mike Pence: Intelligence officials said that Russian interference had no effect on the election.
Director of National Intelligence: Russia considered its meddling to be successful.
https://t.co/nmmDNwJvY1","Thu Feb 15 22:30:20 +0000 2018"
"false","true","https://pbs.twimg.com/profile_banners/25708904/1412843451","Sat Mar 21 18:36:15 +0000 2009","If you throw out the voodoo, you will become vague.
Bookings/ DJ  at DJ MOJO presents",,,,,,,,,,,"facebook.com/djmojo2000dj/","http://www.facebook.com/djmojo2000dj/","0","23","https://t.co/Lce625jpYc","0","5310","775","1459","true","25708904","false","false","false","Brooklyn, NY","1261","DJ MOJO",,"false","https://pbs.twimg.com/profile_images/1301970629885931522/P9f2ZaOT_normal.jpg","","55814","https://twitter.com/DJMOJO2000","user","https://x.com/DJMOJO2000","DJMOJO2000","The nation's intelligence chiefs say Trump has not directed them to stop Russian election meddling https://t.co/CjLtK15nUf","Thu Feb 15 22:29:22 +0000 2018"
